no,text
1,"What is the Youth Guarantee?
The Youth Guarantee is a commitment by all Member States to ensure that all young people under the age of 25 years receive a good quality offer of

employment,
continued education,
apprenticeship,
traineeship
within a period of four months of becoming unemployed or leaving formal education.

All EU countries have committed to the implementation of the Youth Guarantee in a Council Recommendation of April 2013.

Memo - Communication on the Youth Guarantee and Youth Employment Initiative: Questions and Answers (October 2016)

What has been achieved so far?
The Youth Guarantee has become a reality across the EU and has helped to improve the lives of millions of young Europeans.

More than 5 million young people have registered in YG schemes each year since 2014.
Since 2014, each year more than 3.5 million young people registered in the YG took up an offer of employment, continued education, a traineeship or an apprenticeship. 
More than two thirds of young people who left the Youth Guarantee in 2016 took up an offer of employment, education, traineeship or apprenticeship.
The Youth Employment Initiative has provided direct support to over 1.7 million young people across the EU.
Videos: Youth Guarantee / YEI testimonials and projects

Four years on from when the Youth Guarantee took off, young people¡¯s labour market performance has improved significantly:

There are almost 2 million fewer young unemployed in the EU and 1 million less young people not in employment, education or training (NEETs).
Youth unemployment has dropped from a peak of 23.7% in 2013 to 18.7% in 2016.
The share of 15-24 year olds not in employment, education or training (NEETs) has fallen from 13.2% in 2012 to 11.5% in 2016.
Even if such trends should be seen in the context of cyclical factors, the Youth Guarantee accelerates progress by increasing opportunities for young people.

Communication: The Youth Guarantee and Youth Employment Initiative three years on

EU factsheet on the Youth Guarantee and Youth Employment Initiative ? three years on

Success stories
The Youth Guarantee has significantly facilitated structural reforms and innovation in policy design across EU Member States. In 2013-2015, Member States adopted a total of 132 labour market measures targeting young people, highlighting a strong focus on youth employment policies. Member States can be divided into three groups according to the degree to which the Youth Guarantee has acted as a driver for reform.

Image showing which country belongs to which group. The first group, which contains the countries where there is accelerated reform consists of the following countries: Belgium, Bulgaria, France, Croatia, Hungary, Italy, Lithuania, Latvia, Poloand, Portugal and Slovenia. The countries belonging to the group 

Significant reforms and innovative measures have been introduced within the framework of national Youth Guarantee schemes.

For instance, in Bulgaria, a network of youth mediators was put in place in 2015 to reach out to non-registered NEETs in their direct environment and activate them. Youth mediators act as intermediaries with public institutions that provide social, health, educational and other services.
The apprenticeship system in Spain has undergone significant structural reforms, leading to an increase in the number of apprentices from 4 000 to 15 000 in just three years (between 2013 and 2016). During the same period, the number of enterprises participating in apprenticeship training grew from barely 500 to 5 660.
In 2015, Finland launched one-stop guidance centres for youth, which aim to strengthen and simplify services for young people and to eliminate the duplication of activities. Located in 35 municipalities so far, they provide low-threshold support to all young people below the age of 30, including personal advice and guidance, support in life management, career planning, social skills, as well as education and employment support.
In the Commission Staff Working Document on the implementation of the Youth Guarantee and the operation of the Youth Employment Initiative you can find an overview of further national reforms and measures.

How have Youth Guarantee schemes been set up?
Developing and delivering a Youth Guarantee scheme requires strong partnerships between all the key stakeholders: public authorities, employment services, career guidance providers, education & training institutions, youth support services, business, employers, trade unions, etc.

Early intervention and fast-acting measures to support young people's activation are essential and, in many cases, structural reforms are needed, such as improving vocational education and training systems and strengthening the public employment service's (PES) capacity to implement the Youth Guarantee.

The EU has supported Member States in establishing their national Youth Guarantee schemes through substantial financial as well as policy support and mutual learning activities. In particular, the European Commission has helped each Member State to develop and deliver its own national Youth Guarantee Implementation Plan. Further, the Commission also facilitates the sharing of best practices between governments, in particular through the European Employment Strategy Mutual Learning Programme.

Cost-benefits of a Youth Guarantee
Recent research estimates the benefits of establishing a national Youth Guarantee scheme much higher than the costs. The total estimated cost of establishing Youth Guarantee schemes in all Member States of the European Union is around 50 bn a year, or around 0.39% of GDP (Source: EUROFOUND - Social Inclusion of Young People).

However, inaction would be much more costly. Young people not in employment, education or training are estimated to cost the EU ¢æ162bn (1.21% of GDP) a year ? in benefits and foregone earnings and taxes (Source: Eurofound - Mapping youth transitions in Europe).

Not all Youth Guarantee measures are expensive. For example, a strengthened partnership between stakeholders is effective without requiring large budgets.

Funding
To make the Youth Guarantee a reality, national budgets should prioritise youth employment to avoid higher costs in the future. The EU will add to national spending on these schemes through the European Social Fund and the Youth Employment Initiative."
2,"The Youth Guarantee country by country
The implementation of the Youth Guarantee has started in all EU countries and is already bringing results. Compared to other structural reforms in Europe, the Youth Guarantee is probably one of the most rapidly implemented.
What are EU countries doing?
All EU countries have presented comprehensive Youth Guarantee Implementation Plans, complying with the deadlines set by the European Council.
The plans identify precisely the measures to be taken to implement the Youth Guarantee. They outline the timeframe for youth employment reforms and measures, the roles of public authorities and other organisations, and how it will be financed.
Use the drop-down menu or the map above to get the plan for a specific country, when published. All plans are published under the responsibility of the corresponding Member State.
Some Member States have also set up national Youth Guarantee websites, with regular updates and/or the possibility for young people to register online. Use the drop-down menu or the map above to get to these websites, when they exist.
The implementation of national plans is now underway. EU countries are making substantial efforts to implement the Youth Guarantee, which has proven to be a driver for structural reforms. The Joint Employment Reports 2017 and 2018 list promising steps with concrete examples in many countries."
3,"What is the Youth Guarantee?
The Youth Guarantee is an action taken by the Council of the European Union aiming to fight unemployment among young people.
In Luxembourg, the Youth Guarantee is implemented by ADEM, the Local Action for Youth (ALJ), and the National Youth Service (SNJ). The three organisations work closely together to help you determine the right pathway to your future working life. Their common challenge is to offer you, within 4 months after your formal registration to the Youth Guarantee, a real perspective and added value concerning your professional future. This might be a job, an apprenticeship, a training measure, further education or practical experience during a voluntary service.
The Guarantee for Youth does not guarantee a job! But it guarantees individual, tailor-made support adapted to your personal situation, putting you on the right track to succeed in your professional future."
4,"A European Youth Guarantee will help young people
28. 02. 2013
Brussels, 28 February 2013 // The European Youth Forum welcomes the Employment and Social Policy Council recommendation on establishing a Youth Guarantee in Europe adopted today.

The European Youth Forum promoted today, in cooperation with Eurofound and the Youth Intergroup of the European Parliament, an event to discuss the costs and remedies of youth unemployment and youth disengagement. The high participation of youth organisations, Members of the European Parliament, representatives from the European Commission and the European Economic and Social Committee shows that is high time for the implementation of a European Youth Guarantee.

¡°What we need is a Youth Guarantee that is not just words to ¡®label¡¯ existing policy or funds, but a substantial investment in upskilling and bringing young people in the labour market,¡± says Peter Matja?i?, President of the European Youth Forum.

The Youth Guarantee is not policy that has come out of thin air. Youth unemployment is a huge cost to Europe, and in more ways than one. The European Youth Forum and youth organisations have been highlighting for years that unemployment when young not only hinders personal development and lowers life chances, exposing youth to poverty and social exclusion, but also prevents young Europeans from contributing to the overall development of their local community, their country and Europe as a whole. The Eurofound report presented today calculates the yearly cost of young NEETs (Not in Employment, Education or Training) reaching ¢æ 153 billion in 2011.

¡°Today is a turning point, after the European Parliament, the European Commission and the European Council recommendations, we regret the reservations of so many Member States and hope all reluctant Member States will now start really investing in young people,¡± added Matja?i?.

The European Youth Forum particularly welcomes the need of ensuring the consultation or involvement of young people and youth organisations in designing and further developing the Youth Guarantee scheme, as a positive best practice to tailor services to the real needs young people.

However, the amounts and the targets foreseen in the 2014-2020 cycle as a follow-up to the Commission¡¯s Youth Employment package risk being insufficient and unable to make any real impact. The ¢æ6 billion allocated is not sufficient in order to bring in an EU-wide Youth Guarantee and is unlikely to even be sufficient to tackle youth unemployment in the regions identified as having a youth unemployment rate that is higher than the EU average."
5,"Towards a real and effective youth guarantee in Europe

Brussels, 20 June 2016

To the members of the Executive Committee


Towards a real and effective Youth Guarantee in Europe

Adopted at the Executive Committee of June

BACKGROUND

Youth unemployment and precariousness are still at unacceptable levels in Europe. As unemployment rates for young people in Europe were already significantly higher (if not double) to those of the total workforce before the crisis, the situation skyrocketed once the world economy collapsed and the European governments and institutions opted for facing the situation by austerity policies.

Statistics show a recent modest decrease of youth unemployment, remaining above 20% at European level, with important divergences between European countries. Intra-categorical analysis shows that young women and migrant workers have been even more hit by unemployment and the degradation of the labour market. The inactive population and young people who are neither in employment nor in education or training (NEETs) increased, as well as the number of young EU migrants to other EU countries or abroad.

When it comes to analysing the quality of the jobs available for young people, underemployment is growing, considered as involuntary part-time and fixed term work or working below the qualification levels of the workers. Many youngsters are in precarious jobs: zero-hour contracts, bogus self-employment and undeclared work are becoming the negative features of the labour market for the European youth. When it comes to wages, young people are overrepresented among workers earning a minimum wage or even below minimum wages, because of derogations mainly affecting youngsters. They have been particularly affected in those countries where decision has been take to cut or to freeze these wages. Behind quantitative figures that show a relative decrease of unemployment, precariousness is growing with young people at the forefront.

Improving the labour market opportunities for young people has been high on the ETUC agenda for many years so far. The need to boost quality jobs for young people is included in the Congress resolutions of Paris and the ETUC plan for investment ¡°A New path for Europe¡±. In July 2013 the European social partners adopted the Framework of Actions on Youth Employment, and the ETUC and its national affiliates are working now in the third year of follow-up of this agreement. The ETUC is currently undertaking negotiations towards a framework agreement on inter-generational solidarity and active ageing, in which activation measures for young people into the labour market are understood as a pre-requisite for the European trade union movement.

The ETUC ? Youth Committee has been defending quality measures for young workers in Europe, denouncing the precarious working conditions for young people, and identifying and sharing best practices in organizing and representing young workers.

The ETUC acknowledges that initiatives have been put forward by the European Commission to try to find solutions to the situation of young workers in the labour market.

The ¡°flagship initiative¡± on youth named ¡°Youth on the move¡±, included in the Europe 2020 strategy already included some interesting measures like the initiative ¡°Your First Eures Job¡± and paved the way for upcoming policy packages such as the Youth Opportunities Initiative (2011) and the Youth Employment Package (2012). The first one put forward a set of measures to boost youth employment by preventing early school-leaving, developing skills, and other offer-oriented measures. The Youth Employment Package comprised a range of different measures from which some are clearly inspired by ETUC demands, like the Youth Guarantee or the Quality Framework for Traineeships, or projects initiated by European social partners like the European Alliance for Apprenticeships (EAfA). The Council of the European Union adopted on April 2013 a Recommendation on establishing a Youth Guarantee which was followed by an endorsement at the June 2013 European Council, and financial mechanism of ¢æ6bn was made available for regions at NUTS 2 (Nomenclature of Territorial Units for Statistics) level suffering youth unemployment rates above 25%. The European Social Fund continued providing support for every member states on fostering youth employment initiatives also including the Youth Guarantee.

The ETUC pushed EU institutions for the launch of the Youth Guarantee and welcomed its implementation. The establishment of such a guarantee in Europe was advocated by the ETUC and the ETUC Youth Committee as early as 2009 in its call ¡°Towards a new social deal in Europe: Fight the crisis, put people first¡±.

The ETUC proposals for a Youth Guarantee calls for a strong partnership approach, where social partners, youth organisations, schools and training institutions, private employment providers and third sector organisations, who are involved in the design, implementation, delivering and monitoring of the Youth Guarantee. A recent study published by the ETUC[1] revealed that this partnership approach took place unevenly across Europe and that the involvement of social partners was often not sufficient.

Concerning the effective mobilisation of the EU dedicated funds for the Youth Guarantee, the European Commission made public in December 2015 that only 2/3 of the allocated budget had been used by Member states. Taking into consideration the precarious situation of young people in the European labour market and their inactivity and unemployment rates, especially in Southern and Eastern European countries, the ETUC finds unacceptable that some national governments are not making use of the resources available.

The Commission will decide whether or not to extend the funding for this initiative into 2016 based on the member states¡¯ reports on the implementation and impact of the Youth Employment Initiative, which are both due for submission at the end of this year. Due to the lack of mobilisation of member states, the budget allocated to the Youth Employment Initiative (that covers the Youth Guarantee) is threatened and risks being put into question in the debate on the midterm review of the multiannual financial framework (MFF) for the EU.

ETUC DEMANDS

The ETUC is determined to not let this measure being abandoned or downgraded. A real and effective Youth Guarantee is still needed, as a right for all young Europeans to be guaranteed strong career guidance and counselling while they are entering the job market. Such a right could not be effective for young people within two years and must be at the core of a long-term strategy. It is not acceptable that the YG (as it happened in some countries) only delivers internships or low-quality short term jobs. The focus must be put again on quality jobs.
Therefore, the ETUC calls the European Commission and the national governments to:
a)   Fully implement the core principles of the European Youth Guarantee: a guaranteed offer and intervention within four months after leaving education system and/or unemployment. Implemented, in the long term as a universal guarantee.
b)   Ensure full participation of social partners, civil society and young people in the design and the assessment of the measure.
c)   Include clear requirement for an appropriate social protection in the youth guarantee schemes, in order to combat the risk of poverty and precariousness.
d)   Guarantee high quality standards of job offers, trainings, traineeships and apprenticeships, particularly in sectors where job creation will be important in the future.
e)   Encouraging synergies between programmes and institutions (public employment services, local authorities, etc.) in order to better fulfil the goals of the Youth Guarantee.
f)    Improving trust in institutions and increase the institutional capacity for delivering services. Crucial aspects are adequate financing and human resources ensuring a high quality guidance service for young people.
g)   Carefully design the target population and provide tailored approaches in order to respond to the heterogeneity of the youth population. This is particularly important if we take into account the future envisaged actions on young refugees and their access to the labour market.
h)   Invest in more ambitious and long-term funding so as to guarantee effective outcomes from the implementation of the measure. The ETUC calls for the continuation of the budgetary lines beyond 2016. Our benchmark in terms of appropriate funding of the Youth Guarantee is the estimation of 21bn¢æ per year made by the ILO.
The ETUC and its Youth committee will campaign in the coming months for this real and effective Youth Guarantee to becoming a reality in Europe. The main action undertaken will be:
a)   June 23rd: In an event jointly organized with Group II of the European Economic and Social Committee and the European Youth Forum, the ETUC Youth Committee will present the preliminary results of its research on the implementation of the Youth Guarantee at national level, with a focus on the partnership.
b)   October 2016: Photo action during the Executive Committee. Reinforcing the call to mobilizing in support of the Youth Guarantees.
c)   November 2016: Presentation of the results of the ETUC ? Youth research in parallel to those of the European Commission."
6,"¡°Youth Guarantee to ACTIVate and EmpowerYOUTH in Cyprus: an integrated communications campaign¡± (Project Acronym: ¡°Active Youth¡±)

¡°Active Youth¡± aims to inform and activate young people (mainly NEETs, i.e Not in Education, Employment or Training) on ?? available employment plans which fall under the Youth Guarantee Initiative. The programme also aims to encourage young people to join the Public Employment Service in order to help them in their search for employment, education or training. The ultimate goal of the program is to combat youth unemployment and to educate both young people and other stakeholders involved in youth issues through their participation in educational workshops and seminars.

The ¡°Youth Guarantee¡± Recommendation was established by the EU to ensure that all young people under the age of 25 are offered employment, continuous training, apprenticeship or work within a period of 4 months from the moment they become unemployed or exit formal education.

In the context of the implementation of the programme, two major surveys and 10 focus groups will be conducted in order to trace the current situation and the level of young people¡¯s knowledge of the Youth Guarantee. Upon completion of these, a major media campaign will be carried out. Five young people will be selected as youth guarantee ambassadors and will actively participate in this media campaign through spots, but also in TV shows etc.

The partners of Youth Board of Cyprus for the implementation of the Active Youth Programme are the Department of Labor ? the Ministry of Labor and Social Insurance, the Youth Council of Cyprus and the Cyprus Youth Organization.

The program is co-funded by the European Commission¡¯s Directorate-General for Employment, Social Affairs and Social Inclusion.
"
