no,text
7,"Why 2018 is key to the EU¡¯s Youth Guarantee

If 2018 is officially the European Year of Cultural Heritage according to the European Commission, it should also be the Year of Youth. Unemployment for people younger than 25 years old remains high.


The youth needs to be empowered for the future, and this implies making sure young people don¡¯t fall into a never-ending series of job-looking search or unpaid internships and precarious jobs after they have finished their scholarship. To tackle this issue, the European Commission has set up the Youth Guarantee in 2013 in order to get young people back on their feet and stay out-of-work less long. What are the strengths and weaknesses of this Youth Guarantee, and how could 2018 be a key year to improve it? Find out more below.

How does the Youth Guarantee work?

The Youth Guarantee is a Council recommendation that aims at ensuring that all ¡°young people under the age of 25 years receive a good quality offer of employment, continued education, apprenticeship or traineeship within a period of four months of becoming unemployed or leaving formal education¡± (Council, 2013). Since it is a recommendation, it is not legally binding. The Youth Guarantee also contributes to three of the ¡®Europe 2020¡¯ strategy targets, namely the increase in employment, the decrease in early school leavers, and the fight against poverty and social exclusion. The Youth Guarantee costs ¢æ21 billion a year and is funded at the European level, primarily by the Youth Employment Initiative ? which is for the regions where youth unemployment is above 25% -, and by the European Social Fund, for a total of ¢æ12,7 billion for the 2014-2020 budget (Barbi?re, 2014). It is an example of informal europeanisation: non-mandatory decisions are taken at the EU level, the funding at both the EU and national levels, and the implementation at the national and regional/local levels. The EU hopes that this initiative will help foster national reforms, diffuse informal rules and strategies, as well as having more policy harmonisation in the EU. The Guarantee is meant to help, not to replace, national social policies and instruments.

Assessment of the Youth Guarantee

If we simply look at a graph showing unemployment figures in the EU over time, one can directly notice that starting from 2013, when the Youth Guarantee was created, the youth unemployment rate was at at an all time high of 24%, and then has kept decreasing annually, down to almost 16% in December 2017, 18% for in the Euro area (Eurostat, 2017). Nonetheless, is it really thanks to the Youth Guarantee, or simply just because of the economic cyclical context? Or both? According to the European Commission, the Youth Guarantee has been quite effective in decreasing the youth unemployment rate, by facilitating ¡°structural reforms and innovation in policy design¡± across EU Member States (European Commission, 2016). The Guarantee did help transferring some of the best European models, for example in school-to-work transition (mainly from Finland or Norway) to other EU Member States (Andor, 2016). For instance, this led to a recent positive  shake-up of the traineeship program in Spain.

But on the other hand, critics almost unanimously agree that the Youth Guarantee has had disappointing results. Although the Youth Guarantee may have accelerated the process of increased employment, almost 6 million young people in working age remain without any jobs, and according to scholars, most of the drop in youth unemployment, and unemployment in general, is caused by the independent cyclical recovery of the economy (Barslund and Gros, 2017). Furthermore, the EU Court of Auditor itself stated in a special report last year that the Guarantee had a limited and slow impact and failed to meet the initial predictions (European Court of Auditors, 2017). The person in charge of the report, Iliana Ivanova criticized that ¡°policymakers should ensure that programs designed to help young people do not raise expectations which cannot be fulfilled¡± (ZAVR?NIK, 2017). Finally, some EU Member States seem to have been short in their commitment in implementing some new reforms or listening to EU¡¯s recommendations, such as Romania or Czechia.

2018, a pivotal year

According to Luis Alvarado Martinez, President of the European Youth Forum, young Europeans are ¡°the generation who has had to bear the highest cost of the economic crisis and the group in society most at risk of poverty and social exclusion¡±(Martinez, 2018). The future of the European society should be based on sustainable living, quality jobs, and equality of opportunity for all. For this, we would need to invest in youth. The time is now.

Following a 2017 EU survey, 31% of EU population cited ¡°combating youth unemployment¡± as what should be a top priority for the European Parliament (European Parliament). Moreover, according to a new World Economic Forum survey, entrepreneurship and youth empowerment should be the top priorities of European millennials (WEF, 2017). This is only possible by decreasing youth joblessness and by investing in youth. Not doing what is needed, some scholars say, could lead to a ¡°lost generation incapable of catching up later in life¡± (Cahuc et al., 2013). It¡¯s not yet the case today: macroeconomic aggregate data shows that there are still no lost generation (Barslund and Gros, ibid), but we must act quickly if we want to keep it that way. In addition to this, there is a link between youth unemployment and the increase of euroscepticism in those young people (Ellinger, 2015). The EU certainly doesn¡¯t need any more euroscepticism this year.

2018 is also key, because it is this year, in May, that the Multiannual Financial Framework (MFF) will be released. It will directly impact the entire budget of the EU from 2020 to 2027. During the last years, the budget of the EU kept rising. It is therefore a good opportunity for the EU Member States to focus on youth and increase the maximum budget of the Youth Employment Initiative, the ESF, and other social funds. It is their opportunity to invest more in youth.

However, with Brexit, the budget could actually shrink in this field, and not increase. But we know from Commissioner Oettinger that Member States will prioritise education and that there won¡¯t be any cuts in the Erasmus+ program so that¡¯s a good sign for youth at least (Valero, 2018).

This is why, in addition to the new funds at disposal through the next MFF, the Youth Guarantee should also be improved. This can be done in several ways, such as giving the strategy a more prominent place in the European semester (K?chel, 2018), or to have the Guarantee acquire real working schemes and methods. Another solution would be to increase Member States compliance by having the Commission review and monitor annually the progress, following by a naming and shaming of the ¡°bad¡± countries. Finally, for youth unemployment in general, a good multidimensional macroeconomic policies or a reform of the EMU would be necessary (Andor, ibid.); the Youth Guarantee is not a substitute to difficult reforms, it is just a non-binding instrument which probably alleviates Member States¡¯ lack of willingness to integrate further in social policies.

Conclusion

With the youth unemployment rate remaining above 30% in many European countries still today, we can see that the impacts of the financial crisis are still present. This could induce more euroscepticism in teens. Young people want more empowerment and finding good jobs faster. To tackle this problem, the Youth Guarantee that we have aforementioned seen is part of the solution. It won¡¯t fix the situation of course, but it can help, and hence the Youth Guarantee should be enhanced. More funds, more monitoring and more internal ambitious-but-realistic strategies are needed. 2018 can make this happen. We rarely needed it this much. The future of Europe¡¯s economy will be in the hands of the now-young population. Which kind of future? This depends on young people finding, or making, jobs. This depends on investing in youth.

Robin Vanholme is a Master student at the Institute for European Studies (ULB)"
8,"The Irish Youth Guarante

In 2013 the EU adopted a Council Recommendation to member states on a Youth Guarantee. The aim of the EU-wide Youth Guarantee, supported by central EU funding of ¢æ6 billion, is to provide young people under the age of 25 with a good quality offer of employment, continued education, an apprenticeship or a traineeship within a short time of becoming unemployed.

Pilot schemes took place across Europe in 2013 including one in Ballymun, Dublin that was one of the first to receive EU funding. 

In 2014 the Irish Government expects to provide a Youth Guarantee to around 30,000 young people who are at a very high risk of long-term unemployment.It is an ambitious programme that will take time to fully implement and will require ongoing investment and sustained effort by Government, employers and jobseekers alike.  

The Department of Employment Affairs and Social Protection coordinates the implementation of the Youth Guarantee and has many initiatives to tackle youth unemployment."
9,"Briefing paper on Youth Guarantee
The Youth Guarantee
Around 7.5 million young Europeans aged 15 to 24 years old are currently neither in employment nor in education or training (the so-called NEETs). In order to help Member States tackle these unacceptable levels of youth unemployment and social exclusion, the Commission included in its ""Youth Employment Package"", was adopted in December 2012, a proposal for a Recommendation to Member States on the introduction of a Youth Guarantee.

The Youth Guarantee aims to ensure that all young people up to the age of 25 ? whether registered with employment services or not ? receive a quality offer for a job, continued education, an apprenticeship or a traineeship within four months of leaving formal education or becoming unemployed.

The agreement urges Member States to:

establish strong partnerships with stakeholders,
ensure early intervention by employment services and other partners supporting young people,
take supportive measures to enable labour integration,
make full use of the European Social Fund (ESF) and other structural funds to that end,
assess and continuously improve the Youth Guarantee schemes and
rapidly implement these schemes.
The Commission will support Member States through EU funding, by promoting exchanges of good practices, monitoring the implementation of the Youth Guarantee in the European Semester, and by raising awareness. EU countries are currently developing national Youth Guarantee Implementation Strategies.

To facilitate school-to-work-transitions, the package also launches a consultation of European social partners on a Quality Framework for Traineeships so as to enable young people to acquire high-quality service and work experience under safe conditions. Furthermore, it announces a European Alliance for Apprenticeships to improve the quality and supply of apprenticeships available by spreading successful apprenticeship schemes across the Member States and outlining ways to reduce obstacles to mobility for young people.

Our position
EASPD welcomes and fully supports the engagement in this field shown by the European Commission and EPSCO. Deeply concerned with the promotion of equal opportunities in the educational context and with labour market accessibility for people with disabilities, EASPD aims to improve employability and work inclusion for people with disabilities. One of our main goals is also to implement Article 27 of the United Nations Convention on the Rights of Persons with Disabilities (UNCRPD), which includes the right to the opportunity to gain a living by work freely chosen or accepted, and equally remunerated in a labour market and work environment that is open, inclusive and accessible to all.

However, EASPD would like to express its concern over some key issues regarding the Youth Guarantee:

Young people with disabilities tend to be left behind as clear policies to help their transition from education to the labour market are absent. In addition to this, young persons with disabilities are also less likely to advance or stay in education as long as the non-disabled, leading to further structural inequalities. We expect that all programmes developed under this guarantee make provision for the real and active participation of school leavers and young people with disabilities.

Furthermore, young people with disabilities are disadvantaged by virtue of both their age and their disability: they are very likely to continue to live lives framed by structural inequality and social exclusion, unless appropriate attention and resources are focused on active inclusion. This is why it is extremely important to support them into the open labour market, also through their active inclusion in mainstream programmes such as the Youth Guarantee, Erasmus+ or Eures, if they are to contribute to the global economy.

Also, the ¢æ6 billion allocated for the programme seems largely insufficient in order to succeed in tackling youth unemployment in the EU area and is well below the ¢æ21 billion per year required for an effective Youth Guarantee according to the International Labour Organisation. The Commission and the member states should further invest in the Youth Guarantee, also by using means such as the European social fund (ESF). The current guidelines and provisions for the ESF and other structural funds and programmes should be reviewed to ensure that young persons with disabilities, including persons with intellectual/learning disabilities and mental health disorders, are not excluded and can benefit from measures aimed at their further education and inclusion in the open labour market.

European policy makers should also invest in the development of high-quality vocational education and training systems, with highly qualified teachers and trainers, innovative learning methods, high-quality infrastructure and facilities and a high labour market relevance. In addition to this, accessibility and inclusion of the education and training systems for persons with disabilities should be improved and appropriate policies and measures undertaken, as stated by Articles 24 and 27 of the UNCRPD. The Commission and the Member States must also guarantee the necessary support for young people with disabilities for the transition phase from fulltime education into work and, in case of unemployment, tailored reintegration measures should be adopted.

Moreover, European authorities and EU Member states must take into consideration a wide range of support programmes to ensure the accessibility of the Youth Guarantee for all persons with disabilities. The programme should provide equity of access for the disabled young people, guarantee an adequate income and set specific programmes in order to match the individual¡¯s needs and their type of disability. In this sense, EASPD regrets that EU programmes such as ¡®Erasmus+¡¯ and ¡®EuresJob¡¯ either do not grant extra provisions for persons with disabilities or only accord very limited ones. It is of great importance to address these issues in order to successfully guarantee equality of opportunity for young persons with disabilities.

Finally, EASPD recommends that EU Member States and regional and local authorities set up integrated territorial development strategies, including training and employment components and involve all relevant stakeholders in the design and implementation of the national, regional and local action plans, including employment services, training and education authorities, service providers, NGOs and DPOs, and student and youth organisations. The Commission and the Member States should also develop an action plan together with all relevant stakeholders, defining short-, medium and long-term measures, in order to promote sustainable and high quality youth employment, including for young people with disabilities."
