no,text
10,"The implementation of the youth guarantee scheme: an employment booster for young Europeans?

3 June 2016

 

Speakers:

Ulrike Storost

Team Leader, Youth employment team, European Commission (DG EMPL)

 

Ignacio Doreste

Youth Officer, ETUC

 

Moderator:

Nicolas Vincent

 

In April 2013, EU Member States made a commitment to ensure young people's successful transition into work by establishing the Youth Guarantee scheme. 

 

The Youth Guarantee is both a structural reform to drastically improve school-to-work transitions and a measure to immediately support jobs for young people.

 

In practice, it seeks to ensure that all young people under 25 have access to a good-quality and concrete offer of employment, continued education, apprenticeship or traineeship within a period of four months of becoming unemployed or leaving formal education.

 

The 14th session of Policies & Practices looked into the Youth Guarantee more than three years after the EU recommendations, with the setting-up of a new Commission team and new challenges upfront.

 

THE YOUTH GUARANTEE RATIONALE

Ulrike Storost, team leader of the Youth Employment team at DG EMPL, opened the discussion. Ms Storost presented the rationale behind the programme: ¡°the initial idea¡±, she said, ¡°was to look beyond this traditional group of those who actually register as unemployed¡±. Embracing a wider population than the unemployed youth who officially registered was a key element of the Youth Guarantee: ¡°those who are not registered should also not be left alone for longer than four months¡±, said Ms Storost. ¡°It was and still is a major challenge.¡±

 

In a second step, the young people should be offered quality opportunities and this is where the Youth Guarantee is broader than a job scheme. Ms Storost explained the scheme provides ¡°a range of different offers that are in a way on equal footing and what is considered ¡®quality¡¯ then depends also very much on the individual.¡± Depending on the young people¡¯s profiles, it can be an offer of education for those who need to improve their skill in the first place, or an offer for a traineeship or an apprenticeship. 

 

THREE YEARS INTO THE YOUTH GUARANTEE

Ms Storost stressed the high political commitment the Youth Guarantee received right from the start. ¡°In the first years¡±, she added, ¡°there were three conferences at the level of heads of state and government really focusing on youth unemployment and on the Youth Guarantee.¡±

 

Ms Storost also highlighted the importance of key performance indicators to monitor the scheme. 

 

A second reason Ms Storost attributed to the Youth Guarantee success was the learning exchanges at the European level. 

 

As for one of the greatest challenge the Youth Guarantee faces, it is a question of funding and sustainability, particularly in 2016. ¡°It goes hand in hand with continuous political commitment¡±, noticed Ms Storost. As youth unemployment remains high in the EU, Ms Storost added that there was a 1.4 million drop in the number of unemployed youth since the Youth Guarantee recommendation¡¯s adoption. 

 

However, there still are major differences between Member States: from around 7% in Germany of youth unemployment to several countries with more than 35%?40% of youth unemployment. ¡°The figures are still too high in many countries¡±, Ms Storost acknowledged. ¡°This is the context in which we now need to keep up the political commitment and I think that's really crucial.¡±

 

POSITIVE SIDES OF THE YOUTH GUARANTEE AND POSSIBLE IMPROVEMENTS, AS SEEN BY ETUC

Youth Officer at ETUC, Ignacio Doreste was the second panelist of the session. The trade union welcomed the initiative, recalled Mr Doreste, while remaining critical. First, funding is considered by the union as being insufficient, especially ¡°in a broader framework of austerity measures, of reduction of the public deficit and of labour reforms¡±, added Mr Doreste. Knowing that only one third of the funding available has been used¡±, Mr Doreste added, reallocation of the funding, he fears, is likely to go to other initiatives that have no connection with youth employment.

 

¡°We believe¡±, Mr Doreste said, ¡°that a proper implementation and effective implementation of the Youth Guarantee should be funded by ¢æ21 billion per year¡± as recommended by the International Labour Organisation.

 

¡°It was also included in the Council recommendation¡±, Mr Doreste added, ¡°that this scheme should be designed, implemented and assessed through a partnership approach¡±, where employers, youth organisations and trade unions should be collaborating on the design and implementation of the measures. ¡°Unfortunately,¡± Mr Doreste regretted, ¡°since the moment Member States were submitting proposals to the European Commission, this partnership approach was not respected.¡±

 

ETUC wants to be considered as an ally to the European Commission: by putting pressure on governments together in order to obtain a more effective and qualitative Youth Guarantee. 

 

Mr Doreste added the Youth Guarantee does not constitute a substitute to macroeconomic instruments. The Youth Guarantee was meant to present a large array of skills whilst addressing the structural issues of the labor market. 

 

On the positive side, Mr Doreste mentioned encouraging figures: 1.3 million young people actually benefited from actions by the Youth Guarantee, with a ¢æ6.4 billion spending that is too say 2/3 (between actual expenditure and allocation of funds).. Mr Doreste noticed also that implementation was now pacing up nicely.

 

BEST PRACTICES AND INDICATORS

From the floor, Dora Husz, Team Leader at DG JUST, asked what best practices could come to the panelists¡¯ mind, especially on the issue of reaching out to specific targets usually hard to aim. Ms Storost replied that a cornerstone to success was to work with youth organisations. They help avoid the dropouts through additional mentoring and provide a longer-term follow-up. 

 

Furthermore, Ms Storost explained that there were macroeconomic indicators on youth employment and other metrics showing the participation of young people in the scheme: ¡°there are also indicators on how many of them got an offer after four months, which kind of offer, and how many actually then followed up.¡± 

 

Mr Doreste added ¡°we could share some good practices in reaching those who are more vulnerable in the labour market.¡± Mr Doreste added it is also important to identify good practices also from a qualitative point of view. 

 

PARTNERSHIP APPROACH AND THE MEMBER STATES

Bodil Agas©ªster, Director of the South Norway European Office, asked the panelists to explain the hesitation of Member States in taking forward the partnership approach. ¡°Was it because of lack of understanding of what was needed?¡±, asked Mr Agas©ªster. Mr Doreste replied that, in his view, one could put this down to limited industrial relations all across the EU, including in Member States with reputation for a constructive social dialogue.

 

QUALITY OPPORTUNITIES OF THE YOUTH GUARANTEE

Frank Dieter Fischbach, Executive Secretary of the Conference of European Churches, asked if the panelists could develop on the question of quality of employment and the type of contracts that are offered and if they could look into the question of precarious work and the working poor. ¡°To which extend this type of questions is monitored by the Commission?¡±, asked Mr Fischbach. Youth employment is more volatile, Ms Storost agreed, and some countries are overrepresented in temporary employment contracts. ¡°We look very closely at the issue¡±, Ms Storost added, such as the transition rates from temporary to permanent employment. A high dropout rate or a high rate of people coming back after a while should give an idea of what is or is not a stable employment, stable apprenticeships and this defines the quality of all these offers.

 

Ms Storost described what was considered a quality offer: ¡°if young people don't return to unemployment or inactivity six months to twelve months after¡±. Ms Storost added: ¡°An EU study of 2013 shows that there is a high rate of transitions in apprenticeships, meaning many young apprentices are taken over even by their own hosting company after finishing their apprenticeship.¡±

 

Mr Doreste praised the focus of the Commission on quality opportunities. ¡°What do we refer to when talking about a quality offer in the framework of the Youth Guarantee?¡±, he asked. Mr Doreste said it should entail the contract, a decent salary, social protection, health and safety in the workplace. 

 

Regarding traineeships, Mr Doreste praised the assessment of the European Commission regarding the quality framework for a traineeships in December 2013. ¡°It was proven that in many countries, unfortunately, traineeship are misused by companies, where they take over a real employment position¡±. Although, ¡°when it came to offer proposals in order to set into motion a framework, the proposal was rather weak¡±, Mr Doreste regretted, before adding some Member States had lobbied hard against it.

 

In the Commission¡¯s view, said Mr Doreste, ¡°any traineeship is valid as far as there is a written contract.¡± For ETUC, it is only a prerequisite to which should be added: ¡°not replacing a job, having a mentor, receiving a fee, even having social protection during that period, delivery of a training certificate.¡±

 

Dasha Bespyatova, Policy Analyst at Edenred and co-founder of InternsGoPro, asked Ms Storost what was the Commission¡¯s approach to the indicators of the skills young people have or might acquire through these opportunities. ¡°We believe that policies tackling skills are more than needed¡±, the panelist replied. The trade union movement is very involved in designing skills in the vocational school system. The Youth Guarantee includes also measures promoting skills and tackling the supply side of labour¡±, Ms Storost added.

 

Mr Doreste underlined that the current focus on reducing public expenditures was going against creating opportunities for young people. As a conclusion to the session, the ETUC representative said they were looking forward to the publication of the Commission¡¯s report on the Youth Guarantee to be published in October."
11,"Youth Guarantee: Europe Needs More Investment In Its Young People

The European Commission¡¯s decision to maintain the Youth Guarantee, the scheme launched in 2013 to offer every young person a place of education, training or employment within four months of leaving formal education or being out of work, is going in the right direction but too slowly.

The Youth Guarantee (YG) needs more funding to scale it up, better implementation to ensure high quality job and training offers, and stronger liaison with social partners, especially trade unions. The European Trade Union Confederation was alarmed to learn that out of the ¢æ6.4 billion originally invested in the Youth Employment Initiative (YEI), one third has not been spent, and, according to estimates, the YG has reached only about 40% of its target group. The Commission admits that programmes started too slowly. And take-up and impact vary enormously between Member States.

In June, the ETUC demanded ¡°a strong partnership approach¡±, to involve trade unions in the development of national YG measures. According to EU Employment Commissioner Marianne Thyssen, effective partnerships are ¡°the strongest factors of success¡±, but stakeholders have been left out and consultation with unions has been the exception, not the rule.

The Commission¡¯s meagre offer of an extra ¢æ1bn for 2017-2020, supplemented by ¢æ1bn from European Social Funds, is inadequate. According to the International Labour Organization, an effective long-term response to youth unemployment in Europe would require an investment of ¢æ21bn a year. If that seems unaffordable, just compare the cost of not acting, estimated by Eurofound as a loss to European society of ¢æ153bn in a single year, or 1.2% of EU GDP.

From a peak of 24.4% in 2013, the EU youth unemployment rate fell to 18.9% in mid-2016. The Commission celebrates the claim that over the last three years, 14 million young people have entered national YG schemes, with 1.4m fewer young unemployed and 900,000 fewer young people not in employment, education or training (NEETs). [clickToTweet tweet=¡± if there are still 18.9% of young people without work, is that the best Europe can do?¡± quote=¡±But wait: if there are still 18.9% of young people without work, and thus unable to fulfil their professional and social potential, is that the best Europe can do?¡±]

Commission President Jean-Claude Juncker in his State of the Union address declared that in three years the YG has brought 9m young people into work, training or an apprenticeship. But unions report that too many of these offers are short-term or unpaid internships or precarious jobs providing no security or career development. Only a few Member States have set quality criteria, and these are urgently needed. Underemployment is growing, together with bogus self-employment, zero-hours and fixed-term contracts; in countries such as Greece and the Netherlands young people are excluded from minimum wage legislation. YG schemes should be backed up by good social protection and social benefits to prevent poverty and social exclusion.

In many countries the Guarantee has been tacked onto a range of existing measures, making for uneven implementation and assessment. The commitment from employers is described by the Commission as ¡°rather limited¡±, even though the Framework of Actions on Youth Employment, adopted in June 2013 by the ETUC and employers¡¯ organisations BusinessEurope, UEAPME and CEEP, commits the parties to support the YG. They cannot complain about ¡®skills mismatches¡¯ while failing to make an effort to hire and train young people. Employer involvement is vital to matching young people¡¯s skills to labour market vacancies.

Helping NEETs should remain a YG priority. The NEET rate has fallen by just 1.2% since 2012, and remains well above the pre-crisis 2008 level of 10.9%. Only 57% of NEETs are registered with public employment services ? a key access point to the YG ? and young women are especially vulnerable. NEET populations vary greatly in different Member States. All this requires complex policy responses tailored to specific needs.

Our findings are backed up by the European Policy Centre. In a report published in September, it compared YG schemes in five different EU regions in Belgium, Slovakia, Italy and the UK. It found ¡°undeniable weaknesses¡±, including ¡°insufficient efforts to reach out to the non-registered NEETs¡±, and urged more support for the most vulnerable such as young migrants.

There is no ¡°magic formula¡± for integrating young people into the labour market overnight. The YG alone cannot solve the whole problem of youth unemployment in Europe. But with the objective of guaranteeing every young European the right to guidance when becoming unemployed or entering the labour market, the EU should play its part in fighting unemployment. This requires time, commitment and genuine investment in Europe¡¯s future: exactly what the Youth Guarantee needs too."
12,"Youth Guarantee

NYCI Policy Position

NYCI calls on Government to review current implementation of the Youth Guarantee and set out ambitious targets for delivery of the initiative from 2016-2020
NYCI was among the first organisations to call for the introduction of a Youth Guarantee in Ireland in 2011.  We welcomed the decision of Government to support a Youth Guarantee and their leadership during the Irish EU Presidency in delivering an EU Council recommendation. This recommended that member states guarantee a quality offer of an education, training and/or work experience opportunity to young people who were unemployed for four months or more. We also supported the delivery of the Ballymun Youth Guarantee pilot which ended in December 2014 and which has been positively evaluated. In January 2014 the Government published a National Implementation Plan in order to draw down EU funds for 2014 and 2015.

While we accept the initiative would be phased in over time we are disappointed with the pace of implementation to date. According to the plan the Government was supposed to deliver 28,500 education, training and work experience places in 2014. However, the most recent data from May 2015 https://www.kildarestreet.com/wrans/?id=2015-05-28a.174&s=%22pilot+scheme%22+section%3Awrans#g175.q

 indicates that only 23,313 places were provided.

Also we are concerned that only 9,073 young jobseekers https://www.kildarestreet.com/wrans/?id=2015-07-07a.189&s=%22personal+progression+plan%22+section%3Awrans%20-%20g190.q have completed a personal progression plan which is an integral part of the Youth Guarantee.

We are concerned that there is a view that a recovering economy will by itself solve this problem. Some young people will not be able to access the employment available without the education and training promised under the Youth Guarantee. However it is not simply an issue of quantity, the education and training must be of good quality, appropriate to the jobseeker and relevant to the labour market. Too often in the past jobseekers were sent on training courses solely to meet the needs of training providers to fill places. These practices demoralize jobseekers and are a waste of time and money. We need to provide high quality training that responds to the needs of both the jobseekers and the local employers. 

Therefore we are calling on the next Government to review the implementation of the Youth Guarantee and to set out ambitious targets for the delivery of the Youth Guarantee from 2016-2020."
13,"New Youth Guarantee report on innovative approaches to reach out to young people

The European Commission has recently released the new Youth Guarantee report,  highlighting concrete practices to improve the outreach to young people not in employment, education or training (NEETs). The report is aimed at drawing out lessons learned and challenges starting from the first five years of implementation of the EC Youth Guarantee programme.

The report ? titled ¡°Effective outreach to NEETs: Experience from the ground¡± -identifies three main key success factors:

having a strategic approach and flexibility in implementation;
taking a preventative approach and thus early intervention;
tailoring strategies and services to young people¡¯s needs.
The Youth Guarantee is a commitment by all Member States to ensure that all young people under the age of 25 years receive a good quality offer of employment, continued education, apprenticeship and traineeship within a period of four months of becoming unemployed or leaving formal education, proving to be a well-established tool to fight youth unemployment in Europe.

Despite the good results of the framework, many Member States still struggle to reach out to all young people needing support: currently, fewer than 40% of NEETs in the EU are registered with their national Youth Guarantee provider. In particular, young people with disadvantaged backgrounds, such as migrants, young people with disabilities, or those with caring responsibilities, are underrepresented among Youth Guarantee beneficiaries.

Additionally, from 2016 to 2018 the Commission financed nine projects on information sharing and outreach activities to young people about Youth Guarantee offers. The projects have led to nation-wide outreach campaigns, outreach events as well as websites and mobile applications to register for the Youth Guarantee online.

Eurodiaconia is also active on training opportunities for young people: over the last one year and a half, our network has led an Erasmus+ project ? ¡°Empower You(the)!¡± ? focused on sharing innovative youth methods and models implemented by six members of our network. An Online Toolkit containing the project¡¯s most innovative findings was published as the main outcome and was also included in the SALTO-YOUTH Toolbox, a collection of European youth work materials selected by a network of six Resource Centres working under the Erasmus+ programme. "
14,"The European Youth Guarantee ? lessons learned and future
The third session will discuss the European Youth Guarantee ? Lessons learned and future. Irene Dingeldey, University of Bremen (Germany) will discuss how the EU could ensure continuity into youth unemployment policies in times of ongoing changing labour market.

Addressed in the NEGOTIATE policy brief on the ¡®Coordination of European strategies to tackle early job insecurity and youth unemployment: Lessons from a comparative study¡¯, the situation of the young unemployed has become an increasing concern of national governments and the European Union (EU) after the financial crisis. Hence, in 2013 the Council launched the Recommendation on the Youth Guarantee (YG) and the Member States made a commitment to ensure that young people under 25 years ¡°receive a good quality offer of employment, continued education, apprenticeship or traineeship within a period of four months of becoming unemployed or leaving formal education¡±. NEGOTIATE has been researching the implementation of this guarantee as a policy strategy because it is innovative due to its clear objective and provides dedicated financial resources for youth employment policy through the European Social Fund (ESF) and the Youth Employment Initiative (YEI).

According to the researchers it is paramount for Member States to facilitate their national institutions to better support their young people systematically during their transition into the labour market. Especially the national capacity of the public employment services with regards to its financing and human resources is in need of strengthening by also offering a more qualitative support to youth in local employment offices. Hence, further (financial) support and guidance is required at national level, to implement measures such as one-stop shops or work experience placements. Social partners and other stakeholder need to be included in the design and monitoring of the youth employment measures. Additionally, Vocational Education and Training (VET) systems play an important role to bring together the demands of employers and the needs of young apprentices while safeguarding the quality of both work and education, as well as fair wages. Thus, efforts of member states to build such institutions are appreciated.

The EU should aim at facilitating the exchange of ideas on youth employment policy at Member State level and remove bureaucratic obstacles. As for the European Semester, it should monitor the progress made on national level through the Youth Guarantee Implementation Plans (YGIP) and its country specific goal-setting on a more qualitative basis and enhancing models of good practice.

Here you can find the latest programme of the conference."
15,"What is the Youth Guarantee?

The objective of the youth guarantee is to help young people gain access to education and employment. Successful execution of the youth guarantee requires cooperation among national and municipal authorities, the business sector and organisations.

Methods of implementing the guarantee include measures related to the educational guarantee, the skills programme for young adults, employment and economic development services for youth (PES) and rehabilitation services, including municipal social and health care services and other individual services for young people, such as youth outreach work and youth workshop activities.

One of the principles of the youth guarantee is that young people are heard and allowed to influence the course of their life. The youth guarantee supports growth, emancipation and life management of young people.

The objective of the youth guarantee is to support young people in gain in a place in education and employment, to prevent prolonged youth unemployment, to identify factors contributing to the risk of social exclusion and to offer support at an early stage, in order to prevent social exclusion and marginalisation of young people."
