"title","press","body"
"[매경의 창] 일본은 교육혁명 시작했는데 한국은 구한말인가","매일경제","지난 3월 29~31일 일본 요코하마에서 일본 교육혁명의 서막을 알리는 국제학술대회가 열렸다. 전 세계 명문대들이 선호하는 인터내셔널 바칼로레아(IB)의 세계학회를 일본에서 개최한 것이다. 33개국 1500여 명이 참여했다. IB는 1968년부터 스위스에 본사를 둔 비영리기관에서 주관하고 영국에 채점센터가 있으며 세계 각지의 지역별 거점 센터가 관리·지원하는 교육과정(시험 포함)이다. 초등과정, 중등과정, 대입과정, 직업과정 등 다양한 교육과정이 있는데, 특히 대입과정인 디플로마 프로그램이 전 세계 모든 명문대 입시에서 인정받고 선호되고 있다. 일본이 이러한 IB 교육과정을 국가가 나서서 공교육에 도입했다. 문부과학성에서 2013년에 처음 IB의 공교육 도입을 선언했고, IB 교육과정 및 시험 전 과정을 일본어로 번역했으며, 2016년 11월에 첫 IB 대입시험을 치렀고, 2018년까지 200개 공립학교에 IB 교육과정을 도입하겠다고 결정했다. 이미 일본 모든 대학에 국가 교육과정 및 국가 대입시험인 센터시험을 거치지 않고 IB 교육과정을 거친 학생들의 대입 허용을 지시했고, 일본 정부는 교사 교육과 채점관 양성에 주력하고 있다. 일본에서 개최되는 국제학술대회에 수차례 참석했지만, 왕실에서 나와 축사를 하는 경우를 처음 봤다. 아키시노 왕자가 미래 세대 역량과 전인적 교육을 구현하는 세계적 수준의 IB 교육과정에 대한 신뢰와 일본에서의 도입에 대한 기대를 강조했고, 문부과학성에서는 IB의 공교육 도입을 200개 학교를 넘어 지속적으로 확산할 것을 선언했으며, 주최 지역 도지사는 저출산, 고령화, 4차 산업혁명 시대에 대응할 인재 양성을 위해 IB 교육과정이 일본 국가 교육혁명의 초석이 될 것임을 역설했다. 일본 문부성 관계자들은 연간 수천만 원의 학비를 내야 하는 국제학교에서나 받을 수 있었던 이 우수한 교육과정을 국가가 나서서 공립학교 학생들이 무료로 교육받게 한 것을 매우 자랑스러워했다. 경제 격차가 교육 격차로 귀결되지 않게 해야 한다는 신념과 4차 산업혁명 시대에 세계적인 경쟁력을 갖출 나라의 인재를 길러야 한다는 절박함이 교육혁명의 서막을 올리게 했다고 한다. 기조강연을 한 아라이 노리코 교수는 인공지능 로봇이 도쿄대 입시에 도전하는 프로젝트로 널리 알려진 수학자다. 그는 2010년 컴퓨터가 인간의 직업을 빼앗아갈 것임을 예언하는 책을 냈는데, 출간 직후 서점에서 자신의 책이 비즈니스 섹션이나 IT 섹션이 아닌, SF 섹션에 있는 걸 보고 공포를 느꼈다고 한다. 4차 산업혁명의 거대한 쓰나미는 몰려오는데 그 엄연한 '현실'을 'SF'로 바라보는 국민의 인식이 너무 걱정돼서 이들을 자각시키기 위해 2011년부터 도쿄대 로봇 프로젝트를 시작했다고 한다. 처음부터 도쿄대 입시 통과가 목적이 아니라 일본 국민에게 인공지능에 대한 경각심과 인공지능에 백전백패할 교육을 혁명해야 한다는 인식을 확산시키는 게 목표였다. 프로젝트 시작 후 해마다 로봇의 합격 대학 수준을 높여가면서 국민의 눈을 뜨게 해주고 싶었단다. 이제는 향후 10~20년 이내에 인공지능 로봇이 도쿄대, 베이징대, 아이비리그 등 세계적인 명문대에 합격하겠느냐는 질문에 일본 국민 80% 이상이 '그렇다'고 답할 만큼 인식이 확산됐기 때문에 아라이 교수는 얼마 전 로봇이 일본 전체 대입생의 상위 25% 실력을 갖춘 상태에서 프로젝트를 멈췄다. 이미 목적을 달성했기 때문이다. 일본의 교육혁명은 이미 시작됐는데, 우리는 무엇을 하고 있나? 대선주자들의 교육공약에서 아무도 '교육 내용의 방향'을 말하지 않는다. 구한말 일본은 메이지유신을 할 때 젊은이들을 뽑아 선진 문물을 배워오게 했고, 그렇게 시대를 읽는 눈으로 근대화를 우리보다 먼저 했다. 거대한 시대의 변화를 '늦게' 읽어 나라를 빼앗겨야 했던 역사의 우를 반복할 것인가?[이혜정 교육과혁신연구소장][매일경제 공식 페이스북] [오늘의 인기뉴스] [매경 프리미엄][ⓒ 매일경제 & mk.co.kr, 무단전재 및 재배포 금지]"
"[fn사설] 美 법인세율 15% … 후보들 현실을 보라","파이낸셜뉴스","기업 투자 빨아들일 듯.. 우리도 더 내려야 할 판        미국 트럼프 행정부가 현행 35%에 이르는 법인세율을 15%로 대폭 낮추는 내용의 대대적인 세제개편안을 26일(현지시간) 발표했다. 이는 대규모 감세와 인프라 투자를 통해 미국 경제성장을 이끌겠다는 트럼프 대통령의 공약을 실행하기 위한 조치다. 스티브 므누신 재무장관은 ""이번 세제개편안은 미국 역사상 최대의 감세이자 세금 개혁""이라고 강조했다. 세율을 이만큼 인하하면 10년간 2조2000억달러의 세수감소가 우려된다고 하는데 트럼프 대통령은 이를 감수하고 과감한 선택을 했다.의회를 거치면서 세율이 다소 조정될 여지는 있지만 미국의 법인세가 세계 최고에서 일거에 최저 수준으로 낮아지는 것은 기정사실이 됐다. 법인세율 15%는 프랑스(33%), 일본(30%), 독일(30%), 영국(20%) 등 주요 선진국은 물론 한국(22%)보다도 한참 낮은 수준이다. 법인세 조세피난처로 불리는 아일랜드(12.5%)와도 불과 2.5%포인트 차로 근접한 것이다. 게다가 미국은 세계 최대의 시장이다. 기업 활동과 투자를 부추기기에 충분한 조건이 된다. 경제성장과 일자리 창출은 덤이다. 글로벌 기업들이 미국으로 몰려갈 만하다.미국의 감세조치로 인해 세계적인 법인세 인하 경쟁은 더욱 치열해질 가능성이 크다. 2008년 글로벌 금융위기 이후 경제협력개발기구(OECD) 34개 회원국 중 19개국이 법인세를 인하했다. OECD 국가의 평균 법인세율은 2000년 34%에서 지난해 22.5%까지 낮아졌다. 기업 투자를 자국으로 끌어들여 침체된 경제를 살리기 위해서였다. 주요국들은 미국에 기업을 뺏기지 않기 위해 기존 감세 계획을 재검토해야 할 처지에 놓였다.우리나라 상황은 세계적 추세와 정반대다. 한국의 세수에서 법인세가 차지하는 비중은 12.8%(2015년 기준)로 OECD 3위다. 불황에도 지난해 법인세수는 52조원으로 사상 최대였다. 우리 기업들의 세부담이 결코 가볍지 않다. 그런데도 대선 후보들은 퍼주기 복지공약의 재원 마련을 위해 법인세 인상을 주장하고 있다. 홍준표 자유한국당 후보만이 감세를 말했을 뿐이다. 투자를 하고 일자리를 만들어 경제를 살려야 할 기업을 그저 옭아매고 털어낼 궁리만 한다.여러 후보들 주장대로 법인세율이 22%에서 25%로 인상되면 미국보다 10%포인트나 높아지는 결과가 된다. 기업 환경 면에서 양국은 비교가 안된다. 투자 의욕이 꺾인 우리 기업의 해외 이전이 가속될 것이 뻔하다. 기업 없이 어떻게 경기를 살리고 일자리를 만들 수 있겠나. 대선후보들은 제발 세계의 흐름을 읽어주기 바란다. 이대로 가면 우리나라는 서서히 끓는 '냄비 속의 개구리' 신세가 될까 걱정이다.      ▶ 세상의 모든 골 때리는 이야기 'fn파스'▶ 속보이는 연예뉴스 fn스타 ※ 저작권자 ⓒ  파이낸셜뉴스. 무단 전재-재배포 금지"
"[기자수첩] 부실한 통신요금 인하 공약","파이낸셜뉴스","바야흐로 선거의 계절이다. 대통령 후보들이 앞다퉈 장밋빛 공약을 내놓는 걸 보니 때 이른 선거가 실감이 난다. 그러나 이번 대통령 선거의 경우 예정에 없이 일찍 진행된 탓에 대부분의 후보들이 내거는 공약은 치밀함이 부족하고, 공약에 대한 검증도 쉽지 않은 것이 사실이다. 기자가 취재하는 분야에서는 대통령 선거는 물론이고 국회의원 선거 등에서 단골로 등장하는 통신요금 인하 공약이 가장 큰 관심사다. 큰 기대를 갖고 있었던 것은 아니지만 이번에도 역시 대선주자들이 내세운 통신요금 인하 공약은 부실하기 짝이 없는 수준이다.문재인 더불어민주당 후보는 이동통신 요금 기본료 1만1000원 폐지 공약을, 안철수 국민의당 후보는 데이터 무제한 요금제 공약을 내세웠다. 홍준표 자유한국당 후보는 취약계층을 위한 추가 데이터 제공을, 유승민 바른정당 후보는 20만원 이하의 초저가 스마트폰 출시를, 심상정 정의당 후보는 누구나 2GB 데이터를 쓸 수 있게 하는 보편요금제 도입을 내놨다.이번 선거에서 대선후보들이 내세운 통신요금 인하 공약은 짧은 시간에 유권자를 현혹하기 위해 급조했다는 느낌을 지울 수 없다. 기본적으로 통신요금이라는 것이 세금이 아니라 이용자들이 민간 통신회사들에 쓴 만큼 치르는 비용이다. 따라서 정부가 나서서 이를 내려라 말라 하거나, 데이터를 더 줘라 주지 말라고 한다는 것 자체가 어불성설이다.그럼에도 불구하고 선거 때마다 통신요금 인하라는 이름하에 말도 안 되는 공약들이 등장하는 이유는 통신서비스가 의식주만큼 삶에 중요한 필수요소가 됐기 때문이다. 가정 구성원 대부분이 1대 이상의 스마트폰 등 휴대폰을 사용하게 되면서 몇 년 새 통신요금도 증가할 수밖에 없는 구조가 됐다.어떤 재화든 싸게 이용할 수 있다면 얼마나 좋겠는가. 복지나 안보 등 다수의 공약은 진영의 논리에 따라 유권자들도 찬반으로 나뉠 수 있지만 통신비 인하 공약은 대부분의 유권자가 '당연히' 내려주면 좋다는 입장일 수밖에 없기 때문일 거다. 그러나 현재 상태의 통신요금 인하 공약은 공염불에 그칠 가능성이 높다. 이제 와서 드는 단 한 가지 바람은 누가 대통령이 되든 '제대로 된' 통신 관련정책을 다시 만들었으면 한다는 것이다. 새 정부는 국민 개개인이 내는 통신요금이 아깝지 않다고 느껴질 만큼 통신서비스 품질을 높이도록 사업자를 독려하고, 필요한 정책을 가동해야 할 것이다.ronia@fnnews.com 이설영 기자      ▶ 세상의 모든 골 때리는 이야기 'fn파스'▶ 속보이는 연예뉴스 fn스타 ※ 저작권자 ⓒ  파이낸셜뉴스. 무단 전재-재배포 금지"
"[기자수첩] 삼성전자와 오너의 부재","파이낸셜뉴스","요즘 젊은층 사이에서 유행하는 말 중에 '역시는 역시'라는 말이 있다. 생각했던 것만큼 일을 잘해 결과가 좋거나 기대치를 만족시켰을 때 '역시'를 두번 강조해 쓰는 표현이다. 그런데 삼성전자를 두고도 이와 비슷한 말이 있다. '삼성은 삼성이다'가 그것이다. 27일 삼성전자는 1.4분기 실적을 내놨다. 10조원에 가까운 분기 영업이익을 올렸단다. 입이 떡 벌어지는 액수다. 이 소식을 들은 누리꾼들과 업계에선 '삼성은 삼성'이라고 입을 모았다.증권가에서는 한발 더 나아가 2.4분기부터는 삼성전자가 12조원을 벌 것으로 내다본다. 이렇게 장밋빛 전망 일색인데 정작 회사 내부는 축제 분위기가 아니다. 이재용 부회장의 앞날이 불투명해서다.많은 사람이 ""오너가 없어도 삼성은 실적이 좋네"" ""오너가 없으니까 삼성전자 주가가 더 오르네""라고 쉽게 말한다. 하지만 그건 몰라서 하는 얘기다.이번 실적의 면면을 보면 절반 이상은 반도체에서 나왔다. 메모리반도체 독주 체제를 굳힌 삼성전자가 유례없는 슈퍼호황을 맞아 잭팟을 터트린 것이다.반도체는 대표적인 투자산업이다. 보통 반도체 1만장을 만드는 데 약 1조원의 투자가 필요하다. 최근 신설된 공장에서는 보통 10만장 이상씩 생산되니 공장 하나를 짓는 데 10조원 넘는 돈이 드는 셈이다. 실제로 새로 건설 중인 삼성전자 경기 평택공장과 SK하이닉스 충북 청주공장에는 15조원을 웃도는 투자가 단행됐다.삼성 반도체의 성과는 투자의 열매다. 오늘의 결실이 있기까지 그동안 삼성은 매년 수조원의 투자를 집행하고 또 조율해왔다.임직원들은 단지 충성심으로 이 부회장을 걱정하는 게 아니다. '오너가 없는 오너 회사'를 걱정하고 있는 것이다. 조 단위의 투자는 오너가 아니면 책임질 수 없다. 전문경영인은 회사를 그만두면 끝이다. 그러나 남은 임직원과 국가 경제에 미치는 부작용은 오래간다.삼성전자의 한 고위 관계자는 ""지속적이고 유연한 투자가 멈추게 되면 '삼성의 신화'도 장담할 수 없다""며 ""어쨌건 삼성은 오너 회사다. 기업들이 4차 산업으로 '옷'을 갈아입고 있는 시기에 삼성도 오너의 의사결정이 절대적으로 필요하다""고 강조했다. 투자에 적기를 놓치지 않고 몇 년 뒤에도 삼성이 지금처럼 ""삼성은 삼성이다""라는 말을 들었으면 한다.km@fnnews.com 김경민 기자      ▶ 세상의 모든 골 때리는 이야기 'fn파스'▶ 속보이는 연예뉴스 fn스타 ※ 저작권자 ⓒ  파이낸셜뉴스. 무단 전재-재배포 금지"
"[필동정담] 크런치 모드","매일경제","국민학교(지금은 초등학교지만 1970년대엔 국민학교라고 불렀다) 시절이었다. 부친은 작은 공장을 운영했다. 직원은 열댓 명에 불과했다. 내겐 모두 형과 누나들이었다. 평화시장에 와이셔츠(드레스셔츠)를 납품했는데 마감일이 임박하면 일손이 모자랐다. 그럴 때면 나도 포장하는 일을 거들었다. 오전에 시작된 업무는 밤 12시를 훌쩍 넘겨 새벽까지 이어지기 일쑤였다. 작업이 끝나면 몸이 으스러질 것만 같다는 푸념이 들렸다. 이런 생활이 짧으면 2~3일, 길면 일주일 정도 계속됐다. 주말이고 휴일이고 없었다. 개발독재 시대였던 그땐 그게 당연하게 여겨졌다. 놀라운 건 이런 근로 현장이 아직도 있다는 사실이다. 게임업계 이야기다. 우리나라 대표 게임업체 중 하나인 위메이드아이오는 신작 출시를 앞두고 과도한 야근과 특근을 강요해 최근 구설에 올랐다. 평일은 물론 주말과 공휴일에도 10시간 이상 일을 시킨 것이다. 문제는 이런 관행이 만연해 있다는 점이다. 이를 지칭하는 '크런치 모드'라는 용어까지 생길 정도다. 게임업체들이 몰려 있는 지역과 연계돼 '구로의 등대' '판교의 등대'라는 말도 나온다. 24시간 불이 꺼지지 않는 등대와 같이 일한다는 의미일 것이다. 심상정 정의당 대선 후보가 TV토론에서 ""구로디지털단지에 오징어 배가 떠 있다""고 한 것도 이를 비판한 말이다.'크런치'의 본래 뜻은 땅콩이나 호두 같이 딱딱한 게 으스러지며 깨질 때 나는 소리다. 의미가 확대되며 야근과 특근을 해야 하는 중대한 상황을 일컬을 때도 쓰이게 됐다. 몸이 부서질 만큼 강도 높게 일하는 상황이 '크런치 모드'다. 극단적인 금융 긴축으로 금리를 아무리 높여도 자금을 모을 수 없는 신용위기를 '크레디트 크런치'라고 한다. 크런치라는 단어가 부정적으로만 사용되는 건 아니다. '크런치 초콜릿'은 바삭바삭한 맛으로 우리를 유혹하고, 복근 강화에 '크런치 자세'만큼 좋은 운동은 없다. 크런치 모드가 바람직하지 않지만 쉽게 없어질 것 같지는 않다. 글로벌 게임시장의 무한 경쟁 때문이다. 그렇다면 방법은 한 가지뿐이다. '빡세게' 일한 대가와 성과를 보상하면 된다. 그렇지 않으면 우수 인력을 모두 외국에 빼앗긴다. 생존을 위해서도 필요한 일이다. [장박원 논설위원][매일경제 공식 페이스북] [오늘의 인기뉴스] [매경 프리미엄][ⓒ 매일경제 & mk.co.kr, 무단전재 및 재배포 금지]"
"[기고] 다시 뜨는 브라질…FTA가 필요한 이유","매일경제","브라질은 유례없는 경제 침체를 겪고 있다. 지난해에는 경제성장률이 -3.6%를 기록했다. 100년 만에 최악이라는 말도 나온다. 실업률이 13%를 넘었고, 실업자가 1350만명에 달한다. 필자 역시 올해로 브라질 이민 생활 46년째를 맞지만, 이번처럼 불황이 오래 지속된 경우는 처음인 것 같다. 다행히 최근 들어 브라질 경제의 침체 국면이 끝나간다는 진단이 잇따르고 있다. 국제통화기금(IMF)은 브라질 경제가 올해 침체를 벗어날 것으로 예상하면서 올해와 내년 성장률을 각각 0.2%와 1.7%로 전망했다. 지난 1월 발표한 보고서와 비교하면 올해 성장률전망치는 변화가 없었고, 내년 전망치는 1.5%에서 1.7%로 0.2%포인트 높아졌다. 브라질 재무장관은 지난 2년간 위축됐던 국내외 투자가 서서히 회복되고 있다면서 올해 말부터는 3%대 성장을 위한 동력이 생길 것이라는 상당히 낙관적인 전망을 내놓았다.브라질 경제가 되살아날 조짐을 보이면서 그동안 수면 아래에 가라앉아 있던 한국·남미공동시장(메르코수르), 한국·브라질 간 자유무역협상이 새롭게 주목 받고 있다. 한국이 최대 수출시장이던 중국과 외교 문제로 갈등을 빚으면서 브라질과 남미를 새로운 수출시장으로 삼으려는 움직임이 나타나고 있는 것이다.이와 관련해 최근 브라질 언론은 상파울루 시장의 한국 방문 소식을 비중 있게 다루면서 한국에 대한 관심을 부쩍 높이고 있다. 주앙 도리아 시장은 서울의 대중교통과 공공보건, 환경보호, 정보기술(IT) 정책 등에 큰 관심을 나타냈다고 브라질 언론들이 보도했다. 상파울루시에서 진행되는 공공 인프라 사업과 민영화 추진 과정에 한국 기업의 참여를 유도해야 한다는 주장과 함께 한국과의 교역을 적극적으로 늘리는 문제도 '중요한 주제로 다뤄지고' 있다.브라질의 통상 전문가들은 한국·메르코수르 및 한국·브라질 간에 자유무역협정(FTA)이 체결되면 교역량이 획기적으로 늘어날 것이라고 입을 모은다. 특히 한국과 브라질은 '상호보완적 관계'라는 말처럼 서로 윈윈(win-win)이 가능한 분야가 많아 FTA를 체결하면 기대 이상의 효과를 거둘 것이라는 지적이다.브라질은 메르코수르와 유럽연합(EU) 간의 FTA 체결을 가장 우선하고 있다. 이후 미국 일본 중국과 함께 한국과도 협상을 추진할 계획을 세운 것으로 알려졌다. 브라질 정부가 자국 기업을 대상으로 한국과 FTA 체결에 대한 의견을 파악한 1차 설문조사를 끝냈다는 얘기도 들린다. 올해 하반기에는 상당수 한국 기업이 단체로 또는 개별적으로 브라질을 방문할 계획이라고 한다. 한국과 브라질 사이에 FTA 체결을 위한 공감대가 충분히 형성됐다고 할 수 있다.다만 한 가지 아쉬운 부분은 양국의 접촉이 대기업 위주로 이루어지고 있다는 점이다. 세계 최고 수준의 기술력과 제품을 보유한 한국의 중소·중견 기업들도 FTA 논의 과정에 적극적으로 참여할 수 있는 기회가 주어지기를 바란다. 이를 위해서는 정부의 각별한 관심과 정책적 지원이 필요할 것이다. 브라질은 먼 거리만큼이나 언어와 문화적 장벽이 크다. 이곳에 진출하는 많은 기업이 공통적으로 겪는 애로사항, 이른바 '브라질 코스트'를 최소화하는 노력이 절실하다.이 점에서 브라질·한국상공회의소(Kocham·코참)의 역할도 무시할 수 없다. 2012년11월에 출범한 코참은 브라질 진출 한국 기업과 한인동포 기업인 단체를 통합한 기구다. 현재 80여 개 업체가 회원사로 참여하고 있다. 코참은 브라질에 진출하는 우리 기업에 유용한 정보를 제공하고 현지 주요 인사들과의 네트워크 구축 등을 지원하는 역할을 한다.브라질은 내수시장 위주의 경제에서 벗어나 자유무역을 통해 글로벌 경제 체제에 참여하려는 의지를 드러내고 있다. 폐쇄적인 시장에서 개방적인 시장으로 변화하는 브라질에 주목해야 한다. 한국 정부와 기업, 브라질 현지에 구축된 한인 네트워크가 협력하면 좋은 결과를 낳을 것으로 확신한다.[최태훈 브라질 한국상공회의소 회장][매일경제 공식 페이스북] [오늘의 인기뉴스] [매경 프리미엄][ⓒ 매일경제 & mk.co.kr, 무단전재 및 재배포 금지]"
