"title","press","body"
"[매경데스크] SOC투자없이 성장·고용 모두 잡을 수 있나","매일경제","결국 다음 정권에서는 건설 분야에 대한 대규모 투자사업을 기대하기 어려운 모양새다. 유력 후보들이 제시하는 건설·부동산 분야 공약은 대부분 주거복지에 집중돼 있다. 주택 분야는 대출규제 강화, 전월세상한제 등 주택 보유에 대한 비용을 늘리는 대신 세입자를 보호하는 방향이다. 선거용으로 포퓰리즘 공약을 내놔야 하는 후보들 입장에서는 이쪽 방향에 집중할 수밖에 없으리란 예상은 어긋나지 않았다.문재인 더불어민주당 후보가 '도시재생 뉴딜정책'이란 이름의 정책을 내놨다. 명칭만 보면 개발사업에 대한 의지가 담기지 않았을까 기대를 갖게 하지만 실제 내용은 노후주택가 정비 수준이다.그러나 공약 전반을 훑어보면 큰 모순이 발견된다. 유력 후보들의 경제공약은 큰 줄기는 성장과 고용을 키워드로 내세운다. 과연 건설 투자에 대한 비중 확대 없이 가능한 일인지 의문이다. 우리나라 경제성장률에 대한 건설 투자 기여도는 2015년 2분기 9.1%에서 2015년 4분기 36.5%로 급등했다. 지난해 2분기에는 무려 51.5%까지 치솟았다. 올 1분기 경제성장률이 '어닝서프라이즈'를 기록한 데도 건설업이 큰 기여를 했다. 반도체, 화학 등 제조업 호조세로 설비 투자 증가율이 전기보다 4.3% 증가했고, 건설 투자는 당초 부진하리란 예상과 달리 1분기 증가율이 5.3%에 달했다.특히 후보들마다 핵심 어젠더로 내세우고 있는 고용 증대를 위해서는 더더욱 건설 투자를 외면해서는 안 된다. 산업별 취업자 수도 제조, 도소매, 숙박·음식점업에 이어 건설업이 네 번째로 많다. 건설업의 고용 효과에서 주목할 부분은 사회적 취약계층에 많은 일자리를 만들어줄 수 있다는 것이다. 건설산업연구원 분석에 따르면 향후 5년간 총 50조원의 인프라 투자를 할 경우 연평균 13만7000개의 일자리가 창출된다. 이 중 건설기술자가 4만1000개이고 이보다 배 이상 많은 9만6000개의 일자리가 건설 일용직이다. 지역별로도 수도권에서 2만9000개의 일자리가 나오지만 지방에서는 78%인 10만8000개의 고용 효과를 가져온다. 계층이나 지역별 격차를 해소하는 데 기여할 수 있다는 의미다. 제주, 강원은 지역내총생산 중 건설 비중이 9% 안팎에 이른다. 이런데도 후보들이 인프라 투자에 눈을 감은 이유는 '개발시대로의 회귀'라는 오명을 피하려는 의도로 짐작된다. 경제적 효과에도 불구하고 온갖 분란과 비리로 점철됐던 이명박정부의 '4대강 사업' 트라우마도 있다.하지만 이는 인프라 투자의 시대적 변화를 제대로 읽지 못한 결과다. 앞으로 인프라 투자는 노후 인프라 유지보수와 4차 산업혁명에 대비한 투자에 집중될 것이다. 전자가 국민 안전을 위한 것이라면 후자는 미래를 위한 대비다.국민안전처가 3월 말까지 전국 안전관리 대상 시설 36만1445곳을 점검한 결과 1만4533개 시설이 보수나 보강공사가 필요하다는 결론이 나왔다. 도로, 항만, 터널 등만이 아니라 전통시장, 대형 공사장도 상당수 포함됐다. 국민이 일상생활에서 수시로 노출되는 각종 시설물이다. 사회간접자본은 30~40년 전 개발시대 때 건설이 집중됐기 때문에 이제는 반드시 점검과 보강이 필요한 상황이다. 잇달아 발생하는 재래시장 화재도 시설 노후화를 방치한 데다 화재 예방을 위한 신규 투자가 부족했기 때문이다. 인류문명의 새로운 장을 열어줄 4차 산업혁명의 종합판이 스마트시티다. 자율주행차, 드론, 사물인터넷(IoT), 스마트홈 등 차세대 기술들은 개별적인 발전만으로는 의미가 없다. 융복합적으로 연결돼 가동될 때 진정한 4차 산업혁명이 완성된다. 그것을 담아낼 터전이 스마트시티다. 중국 인도 싱가포르 등 경쟁국들은 스마트시티를 구축하기 위해 대대적인 투자에 나서고 있다. 미래기술과 신산업을 선점하기 위해서다. 대선 기간 중 후보들은 당장 표를 얻는 데 혈안이 될 수밖에 없다. 하지만 실제 국가 운영을 맡아서도 인프라 투자의 중요성을 간과한다면 국민의 안전과 미래를 외면하는 지도자로 남을 수밖에 없다.[임상균 부동산부장][매일경제 공식 페이스북] [오늘의 인기뉴스] [매경 프리미엄][ⓒ 매일경제 & mk.co.kr, 무단전재 및 재배포 금지]"
"[살며 사랑하며-김서정] 1㎜ 차이","국민일보","목공수업에 덜컥 등록부터 하고 가보니 신나게 못질 탕탕 하는 일이 아니다. 주목장 기법이라고, 못을 쓰지 않고 홈을 내서 짜맞추는 일이다. 그러니까 나무판 끝에 손가락 마디 같은 것을 만들어 두 판을 맞물려 끼우는 것이다. 지금 한번 손가락을 구부려 양손을 맞물려 보시기를. 그렇다. 반듯하게 자르는 것도 아니고 그런 각도가 나오도록 세심하게 깎아내야 한다.  다른 학생 하나와 함께 작은 나무판을 가지고 연습을 했다. 1㎝, 2㎝ 너비로 번갈아 연필로 세심하게 표시를 한다. 연필심은 아주 가늘어야 한다. 시시때때 깎아줘야 한다. 나는 휴지를 깔고 아무리 심을 갈아도 뭉툭하기만 한데, 저 학생은 그냥 휴지통 위에서 칼을 휙휙 몇 번 휘두르니 마치 바늘처럼 날카로워진다(나도 이제부터 그렇게 깎기로 했다!). 나는 그렸다 지웠다, 직자 집었다 삼각자 집었다, 이 끌 대봤다 저 끌 대봤다, 아우성을 치면서 두 타임에 걸쳐 간신히, 그것도 선생님이 연성 도와준 덕분에 완성했는데 그 학생은 한 타임 만에 가뿐히 끝냈다. 두 작품을 나란히 놓고 보니, 이거야 원! 같은 나무 맞아? 싶다. 저기다 더 좋은 나무 주신 거 아니냐고 나는 선생님한테 트집을 잡았다.  뭐든 대충, 엄벙덤벙, 건성으로 해 넘기는 내가 제대로 걸렸다. 이걸 튼튼하고 예쁘게 맞추자면 아주아주 정밀하게, 섬세하게 해야 한다. 1㎜가 어마어마한 차이를 만든다. 1㎜가 뭐냐, 0.1㎜도 크다. 자를 똑바로 대고! 연필심은 수시로 바늘처럼 갈아야 하고! 선 한 번 그을 때마다 각도 확인하고! 시작은 그렇게 하지만 진도 나가다 보면 어느새 흐트러지니 계속 나를 추슬러야 한다. 눈이 빠질 지경이다.  밑그림이 이러니 톱질 끌질은 더 말해 뭐하겠는가. 좌탁 하나 만드는 일도 이럴진대 나라를 이끌어가는 일은 어떻겠는가. 요새 대선 주자들이 하는 말을 들으며 나는 1㎜를 재고 따지게 된다. 말로 큰그림 던지는 거야 누가 못하랴. 실물이 제대로 나오는지 뭉개져 나오는지는 1㎜에 좌우된다.김서정(동화작가·평론가), 그래픽=공희정 기자[국민일보 홈페이지] [페이스북] [트위터][취재대행소 왱!(클릭)]GoodNews paper ⓒ 국민일보(www.kmib.co.kr), 무단전재 및 재배포금지"
"[fn사설] 성장세 꿈틀 … 고용확대로 이어져야","파이낸셜뉴스","1분기 GDP 증가율 0.9% 서비스산업 혁신 서둘러야        우리 경제가 지난 1.4분기에 예상보다 좋은 성적표를 받았다. 한국은행은 27일 1.4분기 국내총생산(GDP)이 전분기 대비 0.9% 증가했다고 밝혔다. 이는 당초 예상(0.7~0.8%)을 다소 웃도는 수준이다. 전년 동기(0.5%)와 비교하면 0.4%포인트나 높아진 것이다. 유일호 경제부총리 겸 기획재정부 장관은 이를 ""긍정적 회복 신호""로 평가하면서 ""최근의 회복세가 경제 전반에 확산되도록 정책적 노력을 집중할 것""이라고 말했다.최근 우리 경제는 수출이 5개월 연속 높은 증가율을 보이면서 소비와 투자심리가 살아나고 있다. 한은의 4월 소비자심리지수(CCSI)는 101.2로 석달 연속 상승세다. 산업연구원(KIET)이 국내 645개 제조업체를 대상으로 기업 체감경기(기업경기실사지수·BSI)를 조사한 결과 2.4분기 매출전망 BSI가 105를 기록했다. 한은이 올해 예상 성장률을 2.5%에서 2.6%로 올린 것도 이런 분위기를 반영한 것이다. 국내외 민간 예측기관들도 성장률 전망치를 상향 조정하고 있다. 정부도 조만간 이 대열에 합류할 것으로 예상된다.1.4분기 GDP 실적은 내용 면에서도 양호한 모습이다. 수출과 투자, 소비가 모두 증가했다. 특히 설비투자 증가세(4.3%)가 뚜렷해진 것이 향후 전망을 밝게 한다. 주식시장도 26일 코스피가 6년 만에 2200선을 돌파하며 박스권에서 벗어났다. 주가 상승은 아직은 증가세가 미약한 민간소비(0.4%)를 촉진하는 촉매제가 될 것으로 기대된다.문제는 고용이다. 거의 모든 분야에서 회복세가 나타나고 있지만 유독 고용시장은 아직도 한겨울 냉기에 휩싸여 있다. 지난달 실업률은 4.2%, 청년실업률도 11.3%로 고공 행진을 계속하고 있다. 제조업 일자리는 9개월 연속 감소세를 벗어나지 못하고 있다. 한국경영자총협회에 따르면 올해 기업들의 신규인력 채용 규모는 지난해보다 6.6% 감소할 것으로 조사됐다.경제회복세가 안정적으로 지속되려면 고용확대가 뒷받침돼야 한다. 고용이 늘어야 소비가 늘어나 내수시장이 활기를 되찾을 수 있기 때문이다. 4차산업 시대에 새로운 일자리는 제조업보다는 서비스산업에서 나온다. 서비스산업의 고용유발계수는 제조업의 최고 8.7배에 이른다. 정부와 정치권은 서비스산업에 대한 규제를 대폭 풀고, 서비스산업기본법.규제프리존법 등을 서둘러 처리해주기 바란다.      ▶ 세상의 모든 골 때리는 이야기 'fn파스'▶ 속보이는 연예뉴스 fn스타 ※ 저작권자 ⓒ  파이낸셜뉴스. 무단 전재-재배포 금지"
"[기자 24시] 국민 안전 위협하는 교통마피아","매일경제","국토교통부는 지난 26일 항공기 엔진 결함을 그대로 둔 채 운항했다며 대한항공에 과징금 33억원을 부과했다. 하지만 국토부는 과징금 부과 결정을 정식으로 발표하지 않았다. 언론이 취재하자 그제서야 과징금 부과를 결정했다고 시인할 뿐이었다. 국토부의 업체 봐주기 사례는 이번이 처음은 아니다. 국토부는 지난 20일에도 현대 LF쏘나타의 브레이크 경고등 결함으로 리콜을 결정했지만 26일 언론 취재가 본격적으로 시작돼서야 공개했다. 마치 마지못해 징계한 것처럼 말이다. 안전만큼은 정부가 투명하게 공개해야 한다. 안전 문제 해결에는 비용이 드는 탓에 기업들은 이를 되도록 숨기려 하기 때문이다. 이는 한국뿐만이 아니다. 1978년 미국 포드사는 역사상 최악의 리콜 사태를 겪는다. 1971년 포드가 출시한 소형차 '핀토'의 연료탱크에 결함이 있는 것을 알고도 판매했기 때문이었다. 포드가 은폐한 이유는 간단했다. 연료탱크 교체 비용이 사고 피해자에게 물어줄 배상금보다 컸기 때문이다. 포드의 은폐 사실이 드러나면서 포드뿐만이 아니라 미국 교통부도 비난에 시달리고 홍역을 치러야 했다. 세월호 과적을 눈감던 '해피아'가 사고 후 철퇴를 맞았듯 말이다. 전 세계적으로 봐도 유독 교통 분야는 정경유착이 심하다. 한국에서도 철도공기업과 국회의원이 유착한 '철피아', 대한항공 전직 직원이 안전 감독관으로 꽂히는 '칼피아' 등 잡음이 끊이질 않는다. 그 이유는 안전 문제로 기업 비리가 적발돼도 공무원이 쉬쉬하면 기업은 비용을 크게 아낄 수 있기 때문이다. 국민 입장에선 이 같은 '교통 마피아'가 얼마나 똬리를 틀고 있는지 알 길이 없다. 국토부가 징계 안건 공개에 미온적인 이유도 같은 선상이 아닐까. 징계 위원회에 누가 참여하고 어떻게 결정하는지조차 국토부는 공개하지 않는다. 이래서야 세월호 참사와 같은 비극이 다시 일어나지 않게 정부가 노력하고 있다고 누가 믿을 수 있는지 의문이다.[경제부 = 김규식 기자 dorabono@mk.co.kr][매일경제 공식 페이스북] [오늘의 인기뉴스] [매경 프리미엄][ⓒ 매일경제 & mk.co.kr, 무단전재 및 재배포 금지]"
"[포토에세이] 어떤 곰을 그릴까 ","매일경제","구두 장인이 곰 그림을 그리고 있습니다. 이미 완성한  작품과 똑같은 곰을 그리려는 것 같습니다. 그런데 나중에 완성된 작품을 비교해 보면 어딘가 다른 구석이 있을 것만 같습니다. 노력한 결과가 매번 같지 않은 것이 인간의 매력일 테니까요.  [김호영 기자][매일경제 공식 페이스북] [오늘의 인기뉴스] [매경 프리미엄][ⓒ 매일경제 & mk.co.kr, 무단전재 및 재배포 금지]"
"[fn스트리트] '코리아 패싱' 시비","파이낸셜뉴스","'코리아 패싱(Korea Passing.한국 건너뛰기)'. 한반도를 둘러싼 이슈가 한국이 빠진 채 논의되는 현상을 가리키는 말로, 이를 둘러싼 논란이 뜨겁다. 대선후보 TV토론에서 ""코리아 패싱이 무엇인지 아느냐""라는 유승민 바른정당 후보의 물음에 문재인 더불어민주당 후보가 ""무슨 말인지 모른다""고 답하면서다. 이후 유권자들의 관심이 높아진 까닭일까. 26일 오전 한때 이 신조어가 네이버 실시간 검색어 1위에 올랐다.이후에도 여진은 이어지고 있다. 온.오프라인을 넘나들며 ""콩글리시""라는 시비까지 벌어지고 있다. 문 후보를 미는 것으로 알려진 조국 서울대 법학전문대학원 교수가 자신의 트위터 계정에 ""엉터리 영어실력 자랑한 유승민""이라고 언급한 게 그 일환이다. 유 후보가 미국 위스콘신대 박사 출신임을 감안하면 최악의 '디스'를 한 셈이다.그러나 코리아 패싱이란 말의 '출생의 비밀'을 들여다보라. 1998년 빌 클린턴 미국 대통령이 일본을 건너뛰고 곧장 중국만 방문하고 돌아간 사건 이후 생긴 '재팬 패싱(Japan Passing)'이란 말이 그 원조란 게 정설이다. 하긴 철학(philosophy)이란 말도 중국이 아니라, 서양 신문물을 먼저 받아들인 일본에서 처음 사용됐을 때는 낯선 신조어였다. 그렇다면 조 교수처럼 ""엉터리 영어""라고 폄하할 이유는 없다. 외교부의 설명처럼 아직 공식화된 용어가 아닐 뿐이다.도널드 트럼프 미국 대통령이 미.중 정상회담에서 시진핑 국가주석으로부터 중국의 대북제재 동참을 은밀히 약속받은 걸까. 26일 최고 수위의 압박.제재 속에 협상의 문도 열어놓는 것을 골자로 한 대북정책을 발표했다. 얼마 전까지 북핵 선제공격 카드를 흔들어 보이던 트럼프 정부의 외교적 스텝이 '현란해지고' 있는 형국이다.그래서 가치중립적 용어를 놓고 벌이는 정쟁이 부질없어 보인다. '한반도 문제를 논의하는 테이블에 우리의 의자가 없어진다'는 게 코리아 패싱의 본질이라면 마땅히 이를 걱정해야 한다. 미.중 간 북한의 핵.미사일 폐기를 겨냥한 '밀고 당기기'가 한창인 터에 우리끼리 가리키는 달은 보지 않고 손가락만 갖고 시비할 때가 아니다.kby777@fnnews.com 구본영 논설위원      ▶ 세상의 모든 골 때리는 이야기 'fn파스'▶ 속보이는 연예뉴스 fn스타 ※ 저작권자 ⓒ  파이낸셜뉴스. 무단 전재-재배포 금지"
"[데스크 칼럼] 경제 살리기, 정치권이 나설 때다","파이낸셜뉴스","선거분위기에 편승한 정치권의 반시장적 기업 때리기가 도를 넘고 있다. 대선후보들의 경제공약도 기업 때리기 일색이다. 정도의 차이는 있을 뿐 보수든, 중도든, 진보든 너나 할 것 없이 약속이나 한 듯 징벌적 손해배상제나 집단소송제 도입 등 기업활동을 옥죄는 반시장적 정책을 공약으로 내밀었다. 국회에서도 지역구 표심에 기댄 포퓰리즘 법안이 넘쳐나고 있다. 선거분위기로 정부 당국이나 업계의 목소리는 뒷전으로 밀린 상태다.유통산업 분야만 해도 국회에 발의된 법안만 20건이 넘는다. 말이 유통산업발전법이지 거의가 시장기능을 거스르고 기업의 정상적인 영업활동까지 옥죄는 규제에 초점을 맞춘 유통산업개악법 일색이다. 법안들은 거의가 골목상권과 전통시장 보호라는 명분을 달았다. 이들 법안 가운데는 효과보다 부작용이 더 커서 대다수 선진국에서도 도입하지 않은 징벌적 손해배상제도는 이미 국회를 통과해 시행을 앞두고 있다. 국회에 올라 있는 법안 가운데는 대형 유통기업에 대한 의무휴업일 확대도 모자라 새로 차리는 유통점에 대해서는 신설 때 아예 허가를 받도록 하는 내용도 담겼다. 대규모점포와 전통상업보존구역 내 준대규모점포 신설 때 현행 등록제를 허가제로 강화하고 의무휴업일을 월 2일에서 4일로 확대하는 내용이 들어 있다. 대형마트에 적용되는 영업시간 제한과 의무휴업일을 백화점에서 더 나아가 면세점까지 확대하자는 황당한 내용도 상정됐다.정치권은 반기업 또는 반시장적 입법으로 기업들이 하는 일에 사사건건 발목을 잡는 상황이다. 백화점의 출장세일을 금지하는 법안이 대표적이다. 출장세일은 백화점에 납품하는 중소 브랜드 업체들도 시즌아웃 제품 등에 대해 떨이를 통해 매출을 올리자는 게 근본 취지다. 그런 만큼 출장세일 금지는 또 다른 중소상인의 발등을 찍는 행위다.과도한 시장규제가 내수 침제를 부추기고 유통산업 전체의 경쟁력 약화로 이어진다는 것이 사실로 확인됐다. 실제로 영업시간 규제가 단행된 후 지난 5년간 대형마트의 매출은 21% 줄었다. 그런데 대형마트의 매출 감소분이 전통시장 매출 증가로 이어진 것은 아니다. 온라인몰이 어부지리를 취했다. 최근 온라인몰의 상품거래액은 45조3000억원에서 65조6200억원으로 45%나 늘었다. 쇼핑 트렌드 변화에 따른 효과를 반영하더라도 영업규제의 반사익을 챙겼다. 영업규제가 '생사람 잡은 격'이 됐다.세계 각국은 지금 경제활성화와 일자리창출을 위해 기업 기살리기에 온 힘을 쏟고 있다. 도널드 트럼프 미국 대통령은 기업에 활력을 불어넣기 위해 파격적인 법인세율 인하를 발표했다. 그런데 우리 대권주자들은 법인세 인상을 주장하고 있다. 더구나 지구촌의 차세대 성장동력인 4차 산업혁명의 물꼬를 트는 일도 발등의 불이다. 4차 산업혁명에서 규제프리존법과 서비스산업발전법은 4차산업을 이끌 핵심 사안이다. 그런데도 정치권은 이를 외면하고 되레 거꾸로 가고 있다.1·4분기 실질 국내총생산(GDP) 성장률이 3분기 만에 최고치를 보이고 제조업 성장률은 6년 전의 최고치를 경신했다. 주식시장과 수출, 내수 등도 호조를 보이며 모처럼만에 한국 경제에 훈풍이 불고 있다. 가까스로 살아난 '불씨'를 이제 '들불'로 피워내야 한다. 이 일에는 정치권이 화답해야 한다.poongnue@fnnews.com 정훈식 생활경제부장      ▶ 세상의 모든 골 때리는 이야기 'fn파스'▶ 속보이는 연예뉴스 fn스타 ※ 저작권자 ⓒ  파이낸셜뉴스. 무단 전재-재배포 금지"
"[여의나루] 이런 후보를 지지합니다","파이낸셜뉴스","대선이 얼마 남지 않았다. 사람들과 대화하면 대선에 관한 이야기를 자연스럽게 나누게 된다. 대선 이야기는 주로 당선자를 예측하는 것이 대부분이다. 하지만 당선자 예측보다 더 중요한 것은 후보자를 잘 평가해 올바른 투표를 하는 것이다. 필자는 선거는 시민의 의무라고 생각하기에 역대 대통령선거에 반드시 참여했다. 그리고 선출된 대통령이 국정을 수행하는 것을 지켜보았다. 그동안의 경험과 고민 끝에 대통령선거에서 투표할 후보자를 선정하는 세 가지 기준을 가지게 되었다.첫 번째 기준은 사회적 약자와 소외계층을 위한 정책을 누가 더 잘 실행할 수 있느냐이다. 치열한 경쟁이 이루어지는 사회구조 속에서 필연적으로 경쟁에서 밀려난 약자가 생겨날 수밖에 없다. 장애인처럼 애시당초 경쟁 자체가 어렵거나 불가능한 경우도 있다. 이러한 사회적 약자와 소외계층을 보살피는 것은 국가의 중요한 책무이자 대통령이 반드시 해야 할 일이다. 과거에도 어진 왕들은 홀몸노인, 미망인, 고아를 우선적으로 챙겼다고 한다.우리 현실을 보면 65세 이상 노인의 빈곤율이 49.5%로 경제협력개발기구(OECD) 평균의 4배가 넘는 압도적 1위이다. 청년실업률도 9.8%로 사상 최고치이다. 수십만명의 공무원시험 준비생과 같이 구직활동을 하지 않는 청년들까지 고려하는 청년 체감실업률은 무려 34.2%에 이른다. 장애인 복지 예산도 OECD 국가 중 최하위이다. 사회적 약자를 충분히 보호하지 못한 결과 우리나라는 12년 연속 OECD 국가 중 자살률 1위라는 불명예를 가지게 되었다. 이러한 현실은 참으로 비극적이다.사회적 약자를 위한 정책이 무엇인지, 정책이 치밀하게 설계돼 있는지, 재원 마련 방안이 합리적이고 가능한지, 포퓰리즘으로 국민을 현혹하는 것인지, 후보자 개인이 사회적 약자를 위하는 철학과 삶의 이력을 가지고 있는지, 실제로 기부를 정기적으로 하는지 면밀히 살펴볼 필요가 있다.두 번째 기준은 국가와 사회에 대한 강한 책임감이다. 독일의 사상가인 막스 베버는 '직업으로서의 정치'에서 지도자에게 막중한 책임감이 요구된다고 했다. 옛 중국 북송의 명재상인 범중엄도 '국민이 근심하기에 앞서 근심하고, 국민이 즐긴 후에 즐기는' 것이 지도자라고 말했다. 책임감 있는 사람은 최선을 다한다. 대통령직에 대해 막중한 책임감을 가지고 있다면 권력을 남용하거나 비리를 저지르지 않고 주위 사람들에 대한 단속도 철저하게 할 것이다. 중요한 의사결정을 남에게 맡기거나 독선적으로 하지 않고 중지를 모아 합리적 결정을 할 것이다. 비선실세가 발붙일 여지도 없을 것이다. 어느 후보가 삶의 이력에서 책임감 있는 자세를 보여왔는지를 따질 필요가 있다.세 번째 기준은 경청하는 자세다. 고 박세일 서울대 교수는 '지도자의 길'에서 현명한 인재들을 모으는 구현(求賢)과 인재들의 말을 경청하는 선청(善聽)을 지도자의 자질로 제시했다. 대통령이 모든 분야를 잘 알 수는 없다. 널리 인재를 구하고 이들의 말을 경청하는 자세가 중요하다. 우리 역사상 최고의 성군 세종대왕도 현명한 인재를 모아 이들의 말을 경청하는 집현전을 운영했으며, 집현전에서 양성한 동량들이 조선 초기 전성시대를 열어갔음을 기억할 필요가 있다.필자는 세 가지 기준으로 이번 대통령선거에서 투표할 것이다. 이번 선거가 어느 때보다 중요하기에 후보들과 정책에 대해 면밀한 검토와 많은 고민을 해 투표할 후보자를 정할 생각이다. 이번 대선에서 훌륭한 대통령이 선출되기를 간절히 바란다.김 현 대한변호사협회장      ▶ 세상의 모든 골 때리는 이야기 'fn파스'▶ 속보이는 연예뉴스 fn스타 ※ 저작권자 ⓒ  파이낸셜뉴스. 무단 전재-재배포 금지"
