"title","press","body"
"[아침을 열며] ‘문재인 대통령’이 걱정되는 네 가지 이유","한국일보","안보 쟁점이 대선정국을 휩쓸고 있다. 지난 대선과 달리 이념ㆍ지역 요인이 약화하고, 세대별 투표율이 핵심변수가 되리란 전망이 무색하다. ‘송민순 회고록’의 진위 여부, 북한을 ‘주적’으로 볼 것인지, ‘햇볕정책’을 계승할 것인지 등이 부각됐다. 그러나 충성도 높은 지지자를 토대로 한 ‘문재인 대세론’은 굳건하다.인권변호사로서 명성이 높았던 문 후보는 참여정부의 민정수석과 비서실장을 지내면서 노무현 전 대통령을 도와 우리 사회의 공정성을 위해, 기득권 타파를 위해 노력했다. 참여정부는 정치개혁, 지역주의 타파, 원포인트 권력구조 개헌 등 개혁의 화두를 던졌다. 이처럼 문 후보는 3김 정치로 대표되는 기성정치와의 단절과 기득권 타파를 위한 정치 실험을 계속해 왔다.선거를 2주 정도 남긴 현재, 문 후보가 대통령이 될 가능성이 상대적으로 높다는 데는 이견이 없다. 그래도 ‘문재인 정치’의 성공을 위해, 실패하는 대통령을 막기 위해, 국민들이 걱정하는 몇 가지를 따져본다.첫째, 소통과 포용의 리더십 부재에 대한 우려이다. 문 후보는 안철수 전 대표를 비롯해 비노ㆍ비문 그룹과 4ㆍ13 총선을 승리로 이끈 김종인 전 비대위원장의 탈당을 막지 못했다. 그들의 탈당 과정에서 문 후보는 양보하고 타협하는 포용력을 가진 지도자의 모습이 아니었다. 벌써부터 소수 측근의 ‘인의 장막’에 둘러싸여 소위 ‘친문 패권주의’를 우려하는 국민 절반의 목소리에 귀를 닫은 게 아닌지 우려된다.둘째, 적폐 청산의 방식에 대한 의문이다. ‘최순실 게이트’로 인해 촉발된 촛불혁명은 박근혜 대통령의 파면과 구속은 물론 정권교체를 주도하고 있다. 그런데도 문 후보는 부역자에 대한 대청소를 내세우며 대선 이후 또 다른 갈등을 예고하고 있다. 여소야대 정국을 돌파해야 하는 새 정부가 적폐 청산을 국정운영의 우선순위에 두어서는 안 된다. 물론 문 후보가 최근에는 통합을 역설하고 있지만, 인적 청산에 집착해 또 다른 패권주의에 매몰되어 국정운영의 동력을 잃을까 우려된다. 촛불 민심은 승자독식, 계파주의, 기득권 정치에 대한 경고였고, 이들의 청산은 문 후보가 미온적이었던 개헌을 통한 권력구조 개편에서 출발해야 한다.셋째, 문 후보의 안보의식에 대한 우려이다. 사드 배치에 대한 전략적 모호성은 심상정 후보조차 당혹스럽다고 지적했다. 사드 배치 결정을 차기 정부에 넘기자고 했다가 북한 핵 개발이 계속된다면 사드 배치가 가능하다는 입장 변화는 유력 대통령 후보로서 적절하지 못하다. 북한의 미사일과 핵 위협에 처한 한반도 상황을 고려할 때, 지도자의 안보의식이 표심 때문에 흔들리고 모호하다면 주변 강대국의 간섭과 개입을 초래하는 빌미가 될 것이다. 진보 후보가 햇볕정책을 계승하면서 사드 배치에 반대하고 북한 정권을 대화의 파트너로 인정하는 것은 당연한 일인데 표를 의식한 모호한 입장은 이해되지 않는다.넷째, 공약에 따르는 재원조달 방법의 모호성이다. 이번 대선에 ‘수도 이전’ ‘4대강 사업’처럼 국론분열과 예산폭탄을 유발하는 대형 공약이 없는 것은 다행이다. 그러나 문 후보가 국민연금 소득대체율 인상, 기초연금 인상, 노인 일자리수당 인상, 아동수당 도입 등의 공약을 지키기 위해 증세가 필요하다면 숨기지 말고 솔직히 말해야 한다. 일부 표가 빠질 수도 있지만 집권한다면 공약 이행에 따르는 비용과 갈등이 한층 줄어들 것이다. 단기적으로는 정부 부처가 추경예산과 내년도 예산안을 준비하는 데 혼선이 없도록 좀 더 치밀하고 구체적인 재원 조달방안을 제시해야 한다.우리 정치의 가장 큰 문제는 ‘승자독식’이다. 누가 집권해도 갈등이 반복돼 국정운영이 순탄하지 않을 것이다. 문 후보가 표심을 지나치게 의식하지 말고, 성공적 대통령이 되기 위해 지금이라도 포용력, 패권주의 및 안보의식에 대한 국민 우려를 해소해야 한다.윤종빈 명지대 정치외교학과 교수ㆍ미래정치연구소장▶한국일보 [페이스북] [카카오 친구맺기]▶자동차의 모든 것! [모클][ⓒ 한국일보(hankookilbo.com), 무단 전재 및 재배포 금지]"
"<포럼>기업 氣살리기 공약이 절실한 이유","문화일보","박영렬 연세대 교수 경영학세계 경제 회복에 힘입어 수출이 늘어나고 설비투자가 늘고 있다. 한국은행도 최근 우리 경제성장률을 2.6%로 상향 조정했다. 경제가 이제 바닥을 찍고 일어나는 게 아닌가 하는 조심스러운 예측도 나오고 있다. 그러나 여전히 조선업을 비롯한 전통 산업들은 구조조정의 어려움을 겪고 있고, 꽉 막힌 집단대출로 건설사는 줄도산 공포에 시달리고 있다. 중소기업 역시 근로시간 단축 공약으로 과연 경쟁에서 살아남을 수 있을지에 대한 걱정으로 하루하루 살얼음판을 걷고 있다.최근 나타나고 있는 우리 경제의 호조세는 삼성·SK·롯데 등 대기업들의 반도체와 전자 및 화학 산업의 경쟁력에 힘입은 것으로 해석할 수밖에 없다. 국가 리더십의 부재, 북한의 핵(核) 도발 위협, 미국과 중국 및 일본의 패권주의로 6·25동란 이후 최대 위기를 맞고 있는 한반도 정세로 비춰볼 때 그래도 몇몇 대기업이 우리의 경제 성장을 견인해 줄 수 있다는 것은 참으로 다행스러운 일이다.그러나 최순실 국정농단 사건으로 대기업들은 리더십의 불안정으로 지속적인 성장을 위한 과감한 투자는 물론 4차 산업혁명에 대비한 미래를 위한 준비도 체계적으로 하지 못하고 있다. 또한, 대선 후보들은 그나마 우리 경제의 성장 버팀목인 대기업들을 향한 각종 규제 공약을 쏟아내고 있다. 대선 이후 경제민주화를 빌미로 쏟아낸 공약들이 기업에 대한 규제로 바뀐다면 글로벌 경쟁을 하고 있는 대기업마저 성장을 멈추게 될 것이고, 결국 우리 경제는 총체적인 위기에 빠지게 될 것이다. 설상가상(雪上加霜)으로 미·중의 자국 우선 패권주의에 국가는 물론 기업도 짓눌려 그동안 글로벌 시장에서 쌓았던 리더십마저 잃게 될 것이다.경제 성장 없이 청년실업, 고령화, 빈부 격차 등 우리 사회가 안고 있는 문제들을 어떻게 해결할 것인가? 경제 성장을 정부가 주도할 수 있는가? 정치도 사회단체도 할 수 없다. 아무리 미워도 경제 발전의 엔진은 역시 기업이다. 그렇다면 기업들이 급변하는 글로벌 환경에서 경쟁력을 제고할 수 있도록 지원은 못 해줄망정 발목은 잡지 말아야 한다. 미국 기업의 경쟁력 회복을 위해 세계를 호령하고 있는 도널드 트럼프 정부, 잃어버린 20년을 만회하기 위해 일본 기업의 재기 발판을 마련하고 있는 아베 신조 정부, 그리고 글로벌 시장의 후발 주자에서 리더로 중국 기업을 우뚝 세우기 위해 과감한 지원을 하고 있는 시진핑 정부를 보라. 세계 각국은 기업의 성장 없이는 경제 발전이 어렵다는 사실을 절실히 느끼고 있다.기업도 이제는 투명성을 바탕으로 진정성 있는 성장을 해야 한다. 그리고 우리 사회도 기업의 투명성을 지켜줘야 한다. 김우중 전 대우그룹 회장은 글로벌 기업가로 도전하려는 청년들에게 “조국은 무한경쟁이 펼쳐지는 글로벌 현장에서 힘들고 고달플 때 기댈 수 있는 고향 같은 곳이고, 조국이 잘돼야 글로벌 비즈니스도 힘을 얻는다”고 했다. 4차 산업혁명 시대에 기업도 환골탈태해야 하고, 우리도 글로벌 시장에서 외롭게 경쟁하고 있는 우리 기업을 정말 사랑했으면 한다.2008년 글로벌 금융위기 이후 10년 만에 세계 경제가 살아나고 있는 것은 분명하다. 1997년 아시아 금융위기 이후 10년 동안 세계 경제가 호황이었음에도 우리 경제는 그 기회를 제대로 살리지 못했다. 이번에 다시 살아나는 세계 경제에 편승하기 위해서는 대선 후보들이 ‘기업 때리기’보다는 ‘기업 기(氣) 살리기’를 위한 다양한 공약을 내놨으면 한다.[ 문화닷컴 바로가기 | 소설 서유기 | 모바일 웹 ][Copyrightⓒmunhwa.com '대한민국 오후를 여는 유일석간 문화일보' 무단 전재 및 재배포 금지(구독신청:02)3701-5555)]"
"<사설>中 묵인 시사한 ‘美의 북핵 타격’…한국은 준비돼 있나","문화일보","중국이 미국의 북핵 시설 타격을 묵인할 수 있다는 중국 측 보도가 나왔다. 중국 공산당 강경파의 ‘속내’ 대변지인 환추스바오(環球時報)가 22일 사설을 통해 ‘북한 핵시설에 대한 미국의 외과수술식 타격에 중국은 군사적으로 대응할 필요 없다’고 주장한 것이다. 물론 지나치게 호들갑 떨 필요는 없다. 중국 당국의 공식 입장 발표도 아니고, 한국·미국 및 북한 등을 겨냥한 ‘탐색’ 수준이기 때문이다. 또, “미국과 한국군이 38선을 넘어 북한에 대한 침략을 전개해 북한 정권 전복에 나서면 중국은 즉각 군사적 개입에 나서야 한다”며 북한 레짐체인지에 반대하고 있다.북핵 타격에 대한 이런 식의 중국 불개입론은 다음의 두 측면에서 결코 가볍게 넘길 문제가 아니다. 우선, 중국 내부에서 그런 목소리가 커지는 것은 분명하다. 홍콩의 사우스차이나모닝포스트는 지난 13일 중국 외교관과 군사전문가들을 인용하는 형태로, 핵무기 개발로 인해 북한이 외부 공격을 받더라도 ‘조·중 우호협력 및 상호원조 조약’상의 의무는 없어졌다고 보도했다. 둘째, 이런 변화가 한국 측과의 협의나 교감 없이, 미국 등 강대국과의 관계 속에서 일어나고 있을 가능성이다. 도널드 트럼프 미국 대통령은 지난 20일 ‘특이한 움직임’ 발언을 했다. 미국 언론들은 중국 폭격기의 경계 태세를 가리킨 것이라고 보도했는데, 정작 트럼프 대통령은 “시진핑 중국 국가주석이 아주아주 노력하고 있다”고 언급했다. 18일 중국 이지스 구축함 시닝(西寧)이 실탄 훈련, 20일엔 초음속 공격기가 타격 훈련을 벌였다. 미국 대통령이 중국 군사훈련을 긍정 평가한 셈이다. 23일 트럼프 대통령은 시 주석과 아베 신조 일본 총리와 전화통화를 통해 한반도 정세를 논의했으나 한국은 배제됐다.북한군 창건일(25일)을 계기로 다시 긴장이 고조되고 있다. 한국도 모든 옵션을 준비해야 한다. 북한이 6차 핵실험을 강행한다면, 미국은 시리아와 아프가니스탄 사례처럼 ‘외과수술식 타격’을 할 수도 있다. 이 경우 북은 한국을 향해 보복하려 들 것이다. 강력한 한·미 동맹과 순식간에 북한 지도부를 궤멸할 억지력으로 야욕을 꺾어야 한다. 대선과 무관하게 대한민국이 결연한 안보태세를 갖춰야 하는 이유다.[ 문화닷컴 바로가기 | 소설 서유기 | 모바일 웹 ][Copyrightⓒmunhwa.com '대한민국 오후를 여는 유일석간 문화일보' 무단 전재 및 재배포 금지(구독신청:02)3701-5555)]"
"<뉴스와 시각>너무 부실한 文·安 경제공약","문화일보","조해동 경제산업부 차장올 1월 23일 자 칼럼(‘公共 일자리라는 신기루’)을 통해 문재인 더불어민주당 대선후보의 일자리 공약을 비판한 적이 있다. 요지는 간단했다. 당시 문 후보가 “국가 예산 22조 원이면, 공공부문 2200만 원짜리 일자리 100만 개를 만든다”고 주장한 것에 대해 계산은 정확히 해야 한다고 지적한 것이다. 공공부문 일자리 중에서 정규직에 대해서는 정년(停年)을 보장해야 하고, 부대 비용도 고려해야 하기 때문이다. 칼럼이 나간 뒤에도 문 후보는 일자리 공약을 철회하지 않았다. 중앙선거관리위원회에 제출된 문 후보의 공약 순위 1번은 ‘공공부문을 중심으로 일자리 81만 개 창출’을 포함한 일자리 공약이다. 기간은 2017년부터 2022년까지, 재원은 5년간 21조 원(연평균 4조2000억 원)이 소요된다고 추정하고 있다.개인적으로, 만약 문 후보가 대통령에 당선된다면 앞으로 일자리 공약이 문 후보를 괴롭히는 가장 큰 부담이 될 것이라는 생각에 변함이 없다. 대통령이 되기까지가 정치의 영역이라면, 일단 된 순간부터는 경제와 정책이 대통령직 수행의 성공 여부를 판단하는 핵심 잣대가 된다. 경제에 허언(虛言)이 있을 수 없고, 한 번 공약을 뱉으면 정권이 끝나는 마지막 날까지 검증의 칼날을 피할 수 없다.1월 칼럼에서 문 후보의 일자리 공약을 살펴본 뒤 “대통령이 될 기본 자질이 부족하다”고까지 지적했기 때문에, 형평성 차원에서라도 현재 여론조사 지지율 2위인 안철수 국민의당 대선후보 등 다른 후보들의 경제 공약도 한 번 살펴보는 게 좋겠다고 생각해 왔다. 중앙선관위에 제출된 안 후보의 ‘10대 공약’을 경제 분야를 중심으로 살펴본 결과를 요약하면, ‘마이크로(微視) 대책은 많지만, 매크로(巨視) 공약은 눈에 잘 띄지 않는다’는 것이다. 안 후보 경제 공약의 핵심은 “교육 혁명을 통한 창의교육 실현으로 4차 산업혁명 시대의 토대를 만들겠다”는 것이다. △정경유착 근절과 재벌개혁 △중소기업에 취업한 청년들에게 2년간 1200만 원 지급 △구직 청년들에게 6개월간 180만 원 훈련수당 지급 △아동수당 지급 등도 포함돼 있다. 그러나 안 후보의 경제 공약 중에서 전체를 조망할 수 있는 내용은 찾기 어렵다. 구체적으로 안 후보의 공약에는 재정정책이나 통화정책, 가계부채 대책 등 국민경제에 큰 영향을 미치는 중요 사안들에 관한 내용이 없다.누가 대통령에 당선되든 당장 5월에 차기 정부가 출범한 뒤 6월쯤에는 새 정부의 경제정책 방향과 경제개혁 프로그램을 발표해야 할 것이다. 그때 재정정책은 어떤 방향으로 이끌어나갈 것인지, 구조개혁 또는 구조조정은 어떻게 추진할 것인지, 가계부채는 어떻게 줄여나갈 것인지 등에 대한 청사진을 내놔야 할 텐데 대부분 후보의 경우 공약만 봐서는 오리무중이다.미국의 도널드 트럼프 행정부가 한·미 자유무역협정(FTA)의 개정 가능성을 시사하고, 중국은 고고도미사일방어체계(THAAD·사드)를 들여와 한반도에 배치하려고 한다는 이유로 우리나라에 대한 경제 보복을 일삼고 있는데, 대선후보 중에서 누구도 대외경제 분야에 대한 공약을 내놓지 않고 있는 것도 아쉬운 대목이다.haedong@[ 문화닷컴 바로가기 | 소설 서유기 | 모바일 웹 ][Copyrightⓒmunhwa.com '대한민국 오후를 여는 유일석간 문화일보' 무단 전재 및 재배포 금지(구독신청:02)3701-5555)]"
"[삶과 문화] 사(思)의 재발견","한국일보","논어( 語)에서 공자는 군자라면 구사(九思)가 있어야 한다고 했다. 이때 군자란 임금을 뜻한다. 구사(九思)라고 해서 아홉 가지 생각이 아니다. 그 첫째가 시사명(視思明)인데 엉터리 번역 수준으로 옮기면 “볼 때는 밝음을 생각하라”가 된다. 여기에 황당한 풀이, 즉 “사물을 볼 때는 밝게 보라는 말이다”가 더해지면 헤어날 길이 없다.이 때 본다는 것은 시사(視事), 즉 임금이 나라의 업무를 본다는 뜻이다. 그러면 명(明)에 관해 논어에 나오는 딱 한 번의 풀이와 부절처럼 맞아 떨어진다. 자장(子張)이라는 제자가 명(明)의 뜻을 묻자 공자는 이렇게 답한다. “서서히 젖어 드는 참소(讒訴)와 살갗을 파고드는 하소연이 행해지지 않는다면 그 정사는 밝다[明]고 할 수 있다.” 참소란 요즘 식으로 하면 동료나 라이벌에 대한 음해나 중상모략이다. 여기서 또 중요한 것은 “서서히 젖어 드는”이라는 표현이다. 그만큼 윗자리에 있는 사람이 밝지 못하면 쉽게 알아차리기 어렵다는 뜻이다. 가족이나 친족 혹은 총애하는 측근의 간절한 부탁을 뜻하는 하소연도 “살갗을 파고드는”이라고 했다. 끊어내기가 그만큼 쉽지 않다는 말이다. 이것을 단호히 끊어낼 때 명군(明君)이 되는 것이고 그것을 못하면 암군(暗君)이 된다.일을 살펴보는 데 있어서 가장 본질적인 것은 바로 이런 의미에서의 명(明)이다. 즉 사(思)는 그냥 생각하는 게 아니라 무엇을 행함에 있어서 가장 중요하고 본질적인 것을 놓치지 않는다는 뜻이다. 하긴 이런 생각이라야 문제를 해결할 수 있다. 그냥 잡생각만 해서는 문제가 풀리지 않는다.이제 우리는 자신 있게 나머지 팔사(八思)도 제대로 풀어낼 수 있는 길을 확보했다. 둘째는 청사총(聽思聰)이다. 청(聽) 또한 정치와 관련된다. 조선 시대 때는 정치라는 말 대신에 청정(聽政), 혹은 청단(聽斷)이란 말을 더 많이 썼다. 정사를 듣고서 결단한다는 말이다. 사실상 시사(視事)와 같은 말이다. 따라서 청사총(聽思聰)이란 정사를 듣고서 결단하는 데 가장 본질적인 것은 총(聰), 즉 귀 밝음이라는 뜻이다. 귀가 밝다는 것은 청력이 뛰어나다는 뜻이 아니다. 아랫사람이 무슨 말이나 보고를 할 때 그 자리에서 그 말이나 보고가 제대로 된 것인지를 알아차리는 것이다. 심지어 그 숨은 의도까지 읽어낸다면 지도자로서 더 할 나위 없는 자질이다.색사온(色思溫), 안색을 취할 때는 온화해야 하며 모사공(貌思恭), 몸가짐에서 가장 중요한 것은 공손함이며 언사충(言思忠), 말에는 진실함이 가장 본질적이며 사사경(事思敬), 일을 할 때는 삼가는 마음을 잃지 않는 것이 가장 중요하다. 공자는 줄곧 논어의 다른 데서도 경사(敬事)를 강조한다. 그런데 기존의 번역서들은 대부분 이를 “일을 공경하라”고 옮긴다. 공손[恭]과 삼감[敬]의 차이조차 무시한 엉터리 번역이다. 경사(敬事)에서는 경(敬)이 아니라 사(事)가 동사다. 삼가는 마음으로 일을 한다는 것은 일을 시작하기 전에 면밀하게 준비하라는 말이고, 처음부터 끝까지 일관되게 일을 끌고 나가 마침내 좋은 결과를 얻어낸다는 뜻이다.결국 여기서 사(思)는 ‘생각하다’보다는 ‘이렇게 하라’는 뜻이다. 의사문(疑思問), 의문이 나면 질문을 하고 분사난(忿思難), 화가 난다고 해서 마구 행동하지 말고 만일 그렇게 했을 때 닥쳐올 수 있는 어려움을 먼저 생각한 다음에 처신해야 하며 끝으로 견득사의(見得思義), 이득이 생겼을 때는 덥석 제 것으로 하지 말고 과연 그렇게 해도 마땅한지를 반드시 점검하라는 말이다. 이익을 버리고 의로움을 취하라는 식의 번역은 오역이다. 주말에 대선후보들의 TV토론을 보면서 구사(九思)는커녕 일사(一思)도 제대로 갖춘 사람을 찾을 수가 없었다. 어쩌면 내가 눈 밝지 못해서 그랬던 것일까?이한우 논어등반학교장▶한국일보 [페이스북] [카카오 친구맺기]▶자동차의 모든 것! [모클][ⓒ 한국일보(hankookilbo.com), 무단 전재 및 재배포 금지]"
