"title","press","body"
"< World & Idea >하이브리드 전쟁 시대가 도래했다","문화일보","황성준 논설위원러시아는 현재 ‘하이브리드 전쟁’의 최강국이다. 이에 맞서기 위해 미국·영국·프랑스·독일·폴란드·스웨덴·핀란드·라트비아·리투아니아 등 9개국은 ‘유럽 하이브리드 위협 대응센터’를 올 하반기에 핀란드 헬싱키에 개설하는 양해각서에 지난 11일 서명했다. 러시아의 군사적·비군사적 복합 위협에 공동 대응하기 위한 것이다. 네덜란드 군(軍) 정보기관인 MIVD는 24일 발간한 연례보고서를 통해 러시아 하이브리드전을 테러 다음으로 심각한 위협으로 규정했다. 가짜 정보 유포 등 사이버 전술로 서방 국가 정치에 영향력을 행사하고 있다는 것이다. 프랑스 선거관리위원회는 지난 2일 러시아가 친러 성향의 마린 르펜 후보 당선을 위해 가짜 뉴스를 보도했다고 지적했으며, 지난해 미국 대선에서도 러시아 개입 논란이 일어난 바 있다.하이브리드전이란 정규전과 비정규전 그리고 사이버전이 결합된 새로운 형태의 전쟁 개념이다. 또, 그 수행 주체가 국가를 넘어 반군(叛軍), 테러단, 심지어 범죄집단까지 확대된다는 점에서 기존 전쟁과 구별된다. 정규전과 비정규전이 배합된 전쟁은 새삼스러운 것이 아니다. 베트남 전쟁이 대표적이다. 그러나 대개 정규전 부대와 비정규전 부대가 분리돼 있었으며, 이들의 작전을 병행한 ‘복합전(compound war)’이었다. 그러나 하이브리드전은 정규전 부대와 비정규전 부대가 분리되지 않은 채 정규전과 비정규전을 함께 수행하는 새로운 형태다.서구의 하이브리드전 개념은 2006년 이스라엘-헤즈볼라 전쟁 경험에서 도출됐다. 정규전도 아닌 것이 그렇다고 과거의 게릴라전과도 다른 형태의 전쟁, 그리고 군사작전보다는 정치적 지지 동원과 국제 여론 영향력 행사에 더 큰 방점이 찍힌 전쟁 형태를 개념화한 것이다. 그러나 러시아에선 ‘게라시모프 독트린’이라 불리는 ‘선전포고 없이 정치·경제·정보 및 기타 다른 비군사적 조치를 현지 주민의 항의 잠재력과 결합시킨 비대칭적 군사행동 개념’이 별도로 발전해 왔다. 이 명칭은 2013년에 이 개념을 정리해서 발표한 발레리 게라시모프 러시아군 총참모장의 이름에서 따온 것이다.게라시모프 독트린의 맹아적 행태는 2007년 4월 에스토니아 사이버 전쟁에서 첫선을 보였다. 에스토니아 정부가 수도 탈린에서 소련군 동상을 철거하려 하자, 에스토니아 국민의 약 30%를 차지하는 러시아계 주민들이 강력히 항의하기 시작했으며, 이에 정국이 혼란해졌다. 바로 이를 틈타 러시아가 ‘애국 해커’를 동원, 에스토니아 인터넷망을 마비시켰던 것이다. 나토(NATO)는 이 사건을 계기로 ‘탈린 매뉴얼’이란 사이버전 교전수칙을 만들었다. 그 후 2008년 8월 러시아·조지아 전쟁에선 정규전과 사이버전이 배합된 형태로 진화했다. 그리고 마침내  2014년 3월 크림반도 합병과 그 후 지금까지 계속되고 있는 동우크라이나 내전에서, 분리주의 반군과 위장 침투한 러시아 정보·특수전 요원에 의한 정규전 및 비정규전, 그리고 여기에 정치·정보·심리전이 결합한 하이브리드 전쟁의 완성된 형태가 나타났다. 그밖에 러시아계 주민들이 몰도바로부터 분리 독립을 요구하고 있는 트란스니스트리아에서도 낮은 강도의 하이브리드 전쟁이 전개되고 있다.러시아 하이브리드전 개념에서 핵(核)은 주요 전제 조건이다. 핵은 사용하기 위한 것이 아니라, 미국이나 유럽 국가의 개입을 막기 위한 수단이다. 기존 개념으론 전쟁이 발발한 것인지 아닌지조차 애매한 하이브리드전에서 핵으로 무장한 러시아에 맞서 정면 개입하는 데 부담을 느낄 수밖에 없게 만드는 것이다. 그리고 사이버전의 경우 상대방의 인터넷망을 교란·마비시키는 사이버 공격, 그리고 해킹을 통한 정보 탈취 못지않게 거짓 정보 유포 등을 통한 정치 선동 및 심리전이 중요하다는 사실이 입증됐다. 따라서 군만이 아니라 정보기관도 전투 행위 주요 주체일 수밖에 없으며, 정보심리전을 위한 정치 이념과 콘텐츠가 매우 중요한 요소다.미국은 1991년 걸프전, 2001년 아프가니스탄전, 2003년 이라크전을 통해 첨단기술을 통한 ‘군사 혁신(Revolution In Military Affairs)’의 위력을 과시했다. 이에 맞서 러시아는 하이브리드 전쟁 개념을 발전시켜 왔다. 문제는 한반도다. 북한이 하이브리드전 개념을 적용하면 어떻게 될까. 핵 장착 대륙간탄도미사일(ICBM)의 완성을 통해 미국의 개입을 저지하고 종북세력과 결합한 사이버 정치 심리전을 통해 대한민국을 혼란에 빠뜨린다면, 한국군이 자랑하는 최신식 재래식 무기는 별로 쓸모없게 될 수도 있다. 여기다 하이브리드전에서 주요 역할을 해야 할 정보기관마저 무력화된다면 상황은 더욱 불리해진다. 이는 머지않아 현실로 닥칠 수 있다. 대선 후보들을 보면 이런 인식 조차 없는 것 같다.[ 문화닷컴 바로가기 | 소설 서유기 | 모바일 웹 ][Copyrightⓒmunhwa.com '대한민국 오후를 여는 유일석간 문화일보' 무단 전재 및 재배포 금지(구독신청:02)3701-5555)]"
"<포럼>‘의석 0, 1席 결선 대결’ 佛대선 교훈","문화일보","최진우 한양대 정치외교학과 교수기성 정치권의 몰락! 2017년 프랑스 대선 1차 투표 결과다. 전통의 양대 정당인 공화당과 사회당 후보가 나란히 결선투표 진출에 실패했다. 1958년 5공화국 출범 이후 처음 있는 일이다. 출범한 지 만 1년밖에 안 된, 정당이라기보다는 시민단체에 가까운 ‘전진’(EM)의 정치 신인 에마뉘엘 마크롱과 극우정당 국민전선(FN)의 마린 르펜이 예선 1, 2위를 차지해 오는 5월 7일 본선에서 맞붙는다. 이번 선거에서는 투표율도 80%를 웃돌 정도로 높았다. 민심의 바로미터로서 의심의 여지가 없다. 민심은 공화당과 사회당을 철저하게 외면한 것이다.왜 그랬는가? 사회당의 무능, 공화당의 부패 때문이었다. 5년 전 대선에서는 사회당의 프랑수아 올랑드 후보가 승리했다. 그러나 올랑드 집권 이후 프랑스는 나락으로 떨어졌다. 지난 5년간 경제는 악화 일로였고, 잇단 테러에 시달렸으며, 유럽 통합의 주도권도 상실했다. 실업률은 고공행진을 멈출 줄 몰랐고, 치안은 불안해졌으며, 독일과의 격차는 더 벌어졌다. 무능의 극치를 보인 사회당에 등을 돌린 민심은 싸늘했다. 이번 대선 1차 투표에서 좌파 사회당의 브누아 아몽 후보는 6.36%의 득표율로 5위에 그쳤다. 무능에 대한 유권자의 철저한 응징이었다.사회당 정부의 총체적 실정은 중도우파 공화당의 반사이익으로 귀결될 것이라는 게 불과 몇 달 전만 해도 정설이었다. 프랑수아 피용 전 총리가 대선 후보로 확정되면서 대통령은 거의 따 놓은 당상이었다. 그러나 피용은 가족을 국회의원 보좌진으로 허위 취업시켜 거액의 급여를 받도록 한 사실이 들통나면서 도덕적으로 치명상을 입고 만다. 지지율은 급전직하하고, 공화당은 급히 대안을 찾았으나 실패하고 말았다. 경쟁자였던 알랭 쥐페 전 총리와 사르코지 전 대통령도 부패의 오명으로부터 자유롭지 못했기 때문이다. 부패 스캔들로 얼룩진 우파 후보에 대해 프랑스 국민은 밀가루 세례와 함께 결선투표 진출 실패라는 선물을 안겨줬다.기성 정치권이 무능과 부패로 민심을 잃은 사이, 프랑스 대선은 정치적 아웃사이더들의 대결장이 됐다. 선출직 공무원 경험도 하원 의석(議席)도 전무한 39세의 중도 성향 마크롱 후보, 하원 의석 1석뿐이면서 거침없이 반(反)EU·반이민을 주장하는 극우 정당의 이단아 르펜 후보가 그들이다. 다행히 프랑스에는 결선투표제가 있어 극단적 정치세력이 선거에서 이기긴 지극히 어렵다. 결선에서는 중도 좌우파 성향의 유권자들이 표를 결집해 극단적 정치세력에 대항하는 전략적 투표 행태를 보이기 때문이다. 이번에도 이런 안전장치 덕에 중도파 마크롱 후보가 큰 표 차이로 극우파 르펜을 누르고 대통령에 당선될 것으로 예상된다. 정치 초년생 마크롱이 위기의 프랑스를 구해낼 수 있을지는 미지수지만, 6월로 예정된 총선에서 의회 안정 의석을 확보한다면 정치 개혁에 탄력을 받게 될 것이다.무능한 정권, 부패한 정치인에 대한 환멸은 프랑스만의 얘기가 아니다. 안보 위협, 청년실업, 경기 침체 등 우리가 맞닥뜨리고 있는 도전도 프랑스와 크게 다르지 않다. 그러나 전면적인 정치개혁이 절실한 이때, 능력과 품격과 비전을 갖춘 노련한 기성 정치인도 보이지 않고, 그렇다고 국민을 매료시키는 믿음직한 패기의 정치 신예도 보이지 않는다. 토론 방송은 볼수록 감동과 기대는커녕 실망과 우려만 더 커진다. 누가 대한민국을 구할 것인가. 어려운 시기, 든든한 지도자를 갖지 못한 우리의 미래를 걱정하는 이유다.[ 문화닷컴 바로가기 | 소설 서유기 | 모바일 웹 ][Copyrightⓒmunhwa.com '대한민국 오후를 여는 유일석간 문화일보' 무단 전재 및 재배포 금지(구독신청:02)3701-5555)]"
"<오후여담>스모그 프리 프로젝트","문화일보","박현수 조사팀장 미세먼지는 호흡기를 통해 사람의 폐에 침투하는 세계보건기구(WHO) 지정 1급 발암물질이다. 날씨보다 미세먼지 농도를 더 자주 확인하는 것은 이제 일상이 됐다. 미세먼지가 많은 날은 야외활동을 자제하게 된다. 미세먼지는 우리만의 문제가 아니다. 세계적으로도 재앙 수준이다. 1952년 영국 런던에서는 스모그로 인해 불과 나흘 새 4000명이 숨졌고 그 후유증으로 8000명이 더 희생돼 세계를 경악하게 했다. 대기오염 상태가 세계 최악으로 알려진 인도 델리는 매년 1만5000명 이상이 사망하는 죽음의 도시가 됐다. 중국에서는 한 해에만 67만여 명이 사망하는 것으로 알려진다. 대선 후보들이 미세먼지 해결사를 자처하고 나섰다. 한 후보는 임기 내 미세먼지 배출량을 30% 감축하겠다고 공약했다. 친환경차 보급을 확대하고 노후 경유차는 조기 폐차하거나 교체해 버리겠다고 한다. 또 다른 후보는 미세먼지의 주원인으로 꼽히는 중국발 미세먼지를 한·중 정상외교의 핵심의제로 다루겠다고도 밝혔다. 특히 주목받은 공약은 스모그 프리 타워(Smog Free Tower) 도입이다. 공기 중의 먼지를 빨아들이고, 무공해 공기를 방출해 사람들이 신선한 공기를 마실 수 있도록 하는 일종의 대형 공기 청정기다.스모그 프리 타워는 네덜란드 디자이너 단 로세하르데의 작품이다. 베이징(北京)의 스모그를 본 후 아이디어를 얻어 스모그 프리 프로젝트를 시작, 지난해 10월 베이징에 설치했다. 높이 7m의 이 구조물은 주변 3만㎥ 지역의 공기를 약 60%까지 정화할 수 있다고 한다. 그러나 실효성 논란 때문에 이를 얘기한 후보는 그 내용을 공약집에서 슬그머니 빼놓았다. 대선 후보들이 미세먼지 문제를 해결하겠다고 나섰지만, 재원조달 등 구체적인 실천방안이 부족해 공약(空約)으로 끝나지 않을까 우려된다.세계 각국이 미세먼지 해결을 위해 적극 나서고 있다. 미세먼지의 원인 중 하나인 석탄 화력발전소와 노후 경유차 등은 줄이고 신재생·친환경 에너지 사용을 확대하는 방향으로 관련 정책을 펼치는 노력이 진행되고 있다. 4차 산업혁명 시대를 맞아 인공지능과 로봇이 대중화된 세상이다. 실효성 있는 한국식 스모그 프리 프로젝트(Smog Free Project)를 조속히 추진해야 하지 않을까. 미세먼지 없는 깨끗한 공기는 국민의 생명과 안전의 문제다.[ 문화닷컴 바로가기 | 소설 서유기 | 모바일 웹 ][Copyrightⓒmunhwa.com '대한민국 오후를 여는 유일석간 문화일보' 무단 전재 및 재배포 금지(구독신청:02)3701-5555)]"
"<기고>모두가 즐겁고 안전한 봄 축제","문화일보","박인용 국민안전처 장관흔히 봄이면 사람들은 왠지 마음이 설레고 어디론가 떠나고 싶다는 생각을 많이 하게 된다. 특히, 전국 239곳에서 봄꽃 축제가 열리면서 축제 장소에 상춘객들이 인산인해를 이룬다. 하지만 이렇게 많은 사람이 한꺼번에 모이다 보면 사소한 부주의에도 대형 사고가 일어날 수 있다. 국민 안전을 책임지고 있는 장관이다 보니 요즘같이 축제가 많이 개최되는 시기에는 더 긴장하게 된다.일상으로 발생하는 안전사고 방지는 개인의 안전에서부터 비롯된다. 사고란 예고하고 일어나지도 않지만, 그렇다고 우발적으로 일어나는 것도 아니다. 사고의 원인을 분석해 보면 반드시 인과의 법칙에 따라 원인이 있게 마련이다. 그 원인이 대개 사람의 안전 의식 부재에서 생기는 ‘인재(人災)’라는 게 문제다. 그 인재는 설마 하는 안일한 생각과 안전 의식 결여에 따른 위기관리 시스템의 미비가 근본 원인임을 알아야 한다. 실제로 2005년 10월, 상주시민운동장에서는 가요 콘서트를 보기 위해 관람객이 일시에 출입문으로 몰리면서 162명이 다치고 11명이 숨지는 사고가 있었다. 이듬해 3월에는 놀이공원 무료 개방 행사에 인파가 몰리면서 35명이 다치기도 했다. 이에 정부는 ‘공연·행사장 안전 매뉴얼’을 개발, 관계 부처 합동으로 개선책을 마련해 안전사고 예방을 위해 노력해 왔다. 그러나 2014년 10월 성남 야외 공연장과 2016년 5월 부산의 한 대학 공연장에서 잇달아 유사한 사고가 또 발생했다.이후 정부에서는 축제 안전관리 과정에서의 문제점과 미흡한 점을 보완, 안전관리를 한 단계 높이고자 총력을 기울이고 있다. 우선, 안전사고를 예방하기 위해 축제를 주관하는 단체가 행사의 특성에 맞게 안전관리 계획을 세우도록 했다. 또한, 행사장 안에 비상 통로를 마련하고, 화재 같은 위험 요인을 사전에 점검하고 소화기를 비치토록 했으며, 안전관리 요원도 적재적소에 배치해 위급 사항에 대처할 수 있도록 했다.특히, 많은 사람이 참여하는 지역 축제의 경우 사전에 더 각별히 신경 쓰고 있다. 지역 축제의 안전관리 계획은 반드시 지역안전관리위원회의 심의를 거치도록 했다. 지자체 주관으로 소방서, 전기안전공사, 가스안전공사와 함께 안전 조치 사항을 현장에서 확인, 점검토록 했다. 또, 축제 중에는 안전관리자가 순찰하면서 현장 안전관리에 문제가 없는지 점검하고, 폭우 같은 돌발 상황이 발생했을 경우에는 경찰·소방과 협력해 신속하게 상황을 전파하고, 후속 대책을 마련토록 했다.정부의 이러한 노력과 더불어 안전한 축제를 즐기기 위해 국민이 축제나 행사장에서 지켜야 할 안전수칙 네 가지를 강조해 둔다.첫째, 축제장에서 이동할 때는 뛰거나 앞사람을 밀지 않도록 조심하면서 질서를 지켜 입장하고 퇴장한다. 둘째, 공연과 각종 체험에 참여할 때는 주최 측의 안내에 잘 따르고 출입이 금지된 구역에는 절대 들어가지 않는다. 셋째, 어린이는 보호자와 함께 참여하고 서로 헤어질 경우에 대비해 만날 장소와 연락 방법을 정한다. 끝으로, 비상대피 통로를 알아두고 위급한 상황이 목격되면 주변에 있는 안내요원 또는 119로 즉시 신고한다.이 같은 안전수칙은 언뜻 보기에 쉬운 것 같으나 막상 사고에 직면하면 당황해 잊어버린다. 평소 이런 안전수칙을 잘 염두에 두고 몸이 즉각 반응하도록 하여 만약의 사고에 대비해야 한다. 안전을 확보하기 위해서는 정부의 노력도 중요하지만, 각자 안전을 습관화해야 한다.봄꽃이 흐드러지게 피는 요즘 가까운 지역 축제장을 찾아 즐기면서 안전도 함께 되새기는 좋은 기회를 만들기를 권해 본다.[ 문화닷컴 바로가기 | 소설 서유기 | 모바일 웹 ][Copyrightⓒmunhwa.com '대한민국 오후를 여는 유일석간 문화일보' 무단 전재 및 재배포 금지(구독신청:02)3701-5555)]"
"[오후 한 詩]우리가 볼 수 있는 것/김행숙","아시아경제","하염없이 승강장 벤치에 앉아 있다. 스크린도어에 비친 내 얼굴이 터널 속에서 어른거렸다. 떠나지 못하고 같은 곳을 맴도는 지하철의 유령들과 섞여 있었다.밖에서 당신을 봤어. 어젯밤 남편이 말했다. 제발 아무 데서나 불행한 여자처럼 넋 놓고 앉아 있지 마. 그는 수치심을 느낀 것처럼 보였다.안내 방송이 흘러나온다. 승강장 안으로 열차가 들어오고 있으니 승객 여러분께서는 노란 안전선 밖으로 한 걸음 … …한 걸음 물러섰으면 좋겠다. 내가 당신을 조금 더 모르고, 당신이 나를 조금 더 모르면, 우리는 어쩌면 조금 더 좋은 사이일지도 … …정전이 돼도 지하철은 환하다. 한낮의 수면내시경 검사처럼 열차가 유령들을 관통했을까. 안개가 걷히는 하늘처럼 유령들이 열차를 통과했을까. 스크린도어에는 피 한 방울 튀지 않았다. 스크린도어가 열린다.나는 내가 볼 수 있는 것을 본다. 열차에서 내리는 사람들의 앞면과 열차에 올라타는 사람들의 뒷면. 나는 내가 볼 수 없는 것을 보지 않는다. 열차에서 내리는 사람들의 뒷면과 열차에 올라타는 사람들의 앞면.그리고 나는 당신을 보지 못한다.■흔히 우리는 인식의 최초이자 최종 심급으로 시각을 지목하곤 한다. 한마디로 '보았다'를 진리의 판단 근거로 삼는다는 말이다. 그런데 과연 그러한가? 물론 아니다. ""나는 내가 볼 수 있는 것을 본다""라는 문장은 ""나는 내가 볼 수 없는 것을 보지 않는다""가 아니라, 그래서 실은 나는 제대로 ""당신을 보지 못한다""라는 뜻인 셈이다. 그리고 ""노란 안전선 밖으로 한 걸음"" 물러선다면 그래서 나와 당신이 서로 ""조금 더 모르면, 우리는 어쩌면 조금 더 좋은 사이일지도""라는 가정은 ""밖에서 당신을 봤어""라는 남편의 목격담과 무관하지 않다. 쉽게 말해 우리는 보고자 하는 것만을 보고 그것을 진짜라고 믿는다. 진실은 저 너머에 있다. 아니 ""스크린도어에 비친 내 얼굴""처럼 바로 우리 곁에, ""떠나지 못하고 같은 곳을 맴도는 지하철의 유령들과 섞여 있""다. 채상우 시인▶ 뉴스가 재밌다! 세상의 모든 재미 [티잼]▶ 인기최신만화  ▶ 오늘의 띠별, 별자리 운세"
"<시론>‘폴리페서 프리존법’ 절실하다","문화일보","박학용 논설위원박근혜 전 대통령의 ‘교수 사랑’은 각별났다. 장차관급 고위 정무직의 20%가량을 교수로 충원했다. 관료 출신 다음으로 높은 비율이다. 그러나 박 정부는 ‘폴리페서의 무덤’이 됐다. 최순실 국정농단 사태 등에 연루돼 쇠고랑을 찬 전 청와대 정책조정수석과 전 문화체육관광부 장차관이 모두 교수 출신이다. 이들은 대통령에게 책임을 떠넘기는 배신의 본색(本色)도 드러냈다.그 폐해를 목도한 19대 대선장(場)에서도 후보·교수 간 ‘정학(政學)유착’은 여전하다. 외려 그 정도는 더 심하다. 이번 조기 대선에선 후보 캠프가 사실상 대통령직 인수위 역할을 한다. 그러니 폴리페서들이 가성비 높은 호기를 놓칠 리 없다. 이번에 베팅한 ‘권력바라기’는 얼추 2200명, 전국 교수가 7만5000명쯤 된다니 전체의 3% 수준이다. 세계 기네스북에 오를 일이다. 문재인 더불어민주당 후보 측에는 1400여 명이 활약 또는 암약(暗躍) 중이다. 안철수 국민의당 후보 측에도 500여 명이 진을 쳤다. 먹을 게 많으면 그만큼 파리가 꼬인다는 말 그대로다.폴리페서의 현실정치 참여를 매도만 할 순 없다. 교수가 연구를 통해 얻은 지식을 세상에 전파함으로써 우리의 삶이 나아진다면 반길 일이다. ‘통섭·융합의 시대’에 교수라고 상아탑에만 갇혀 있으라고 할 수도 없는 노릇이다. 실제로 전문성과 정무감각으로 무장한 채 소신과 원칙을 견지하며 국가발전에 공헌한 폴리페서들도 더러 있다. 개발경제 시대 땐 정책 결정에 독보적인 역할도 했다. 폴리페서의 효시 격인 남덕우 전 경제부총리가 대표적 인물이다. 정책기반이 취약한 당시로선 새 정책도 만들고 외국 제도도 도입해야 하니 유학파 교수가 ‘좋은’ 정치행정가일 수 있었다. 권위주의 정권이라 갈등을 조정할 필요도 없을 때니 더더욱 그랬다. 하지만 이제 그런 시대는 지났다. 정치행정가는 시장·산업 수요에 맞춰 정책도 입안하고 이해당사자 간 갈등도 조율해야 한다. 교수직과 정치행정가 간 시너지가 없어졌다는 얘기다. 이런 마당에 폴리페서가 청 수석이나 장차관 자리를 노린다면 탐욕이다. 요즘 같은 복잡다단한 사회에서 ‘단선적’ 교수 역량만으로 그 직을 온전히 수행하기란 불가능하기 때문이다. 미국 등 선진국에 폴리페서가 거의 없는 것도 그런 이유다. 그래서인지 폴리페서의 패역(悖逆)만 도드라진다. 망국(亡國)·망학(亡學)이란 힐책까지 나온다. 정책 성과는커녕 국정에 누만 끼친다는 비난은 치명적이다. 교수는 학연 등 연고주의가 유독 강한 집단이다. 정권 요직에 입성한 교수는 ‘국정철학 공유’라는 미명 아래 ‘끼리끼리 철벽’부터 쌓으며 인재 영입을 원천 봉쇄한다. 박 정부 때 경제부총리, 정책조정수석, 경제수석직을 독차지한 ‘위스콘신 동문’이 단적인 예다. 학생에게 주는 악영향도 심각하다. 며칠 전 만난 한 교수와 대학생들의 전언을 옮겨본다. “학기 중에도 그들의 시선은 늘 여의도를 향한다. 엄격한 강의 평가와 연구업적 관리, 학생 감시 때문에 결강은 거의 없지만 강의는 건성이다. 학기 말엔 수업시간을 학생 발표로 때우기 일쑤다. 캠프 회동이 있는 날 즈음엔 스마트폰을 자주 기웃대는 바람에 수업 분위기가 산만해진다. 출석 체크도 대충하고 시험문제도 대강 낸다. 강의 중 특정 후보를 치켜세운 적도 있다.”교수의 본분은 연구와 교육이다. 교육은 가르치는 일(敎) 못잖게 기르는 일(育) 또한 중요하다. 하지만 폴리페서에겐 ‘교’만 있고 ‘육’은 없다. 학생은 교수를 ‘인생의 멘토’로 삼지만 그들은 학생을 ‘학원의 수강생’쯤으로 여기는 투다. 그들은 ‘미력하나마 국가를 위해 봉사한다는 마음’ 운운하며 유력 후보 캠프에 발을 담근다. 그러나 정작 제자들을 사회 변혁의 주역으로 키우는 일이 진정한 애국의 길임을 애써 외면한다. 폴리페서에 대한 사회적 인식을 재정립해야 할 때가 됐다. 교수가 한자리할 욕심으로 현실정치에 뛰어든다면 대학을 떠나야 한다. 청년실업난이 극심한 지금 대학을 폴리페서 프리존(청정지대)으로 만들어야 한다. ‘규제프리존법’처럼 ‘폴리페서 프리존법’을 제정해야 한다. 교수들이 정치활동을 하거나 정무직·선출직에 나서면 즉각 사표를 수리하도록 하는 법이다. ‘이생망(이번 생은 망했다)’이라고 절규하는 제자 취업엔 나 몰라라 하면서 자신의 취업에만 혈안이 돼 있는 교수는 스승 자격이 없다.[ 문화닷컴 바로가기 | 소설 서유기 | 모바일 웹 ][Copyrightⓒmunhwa.com '대한민국 오후를 여는 유일석간 문화일보' 무단 전재 및 재배포 금지(구독신청:02)3701-5555)]"
