"title","press","body"
"<여론마당>이달말까지 불법무기류 자진신고하면 출처불문·형사책임 면제","문화일보","불법무기류에 의한 범죄 및 테러 이용 가능성 차단이 요망됨에 따라 3부장관 합동으로 매년 불법무기류 자진신고기간을 설정·운영하여 불법무기류를 수거, 사회불안 요인을 제거함으로써 국민생활의 안전을 확보하고자 하니 적극 협조하기를 당부한다. 신고기간은 4월 3일부터 30일까지 1개월간이며, 대상은 권총·기관총·엽총·공기총 등 총기류, 폭약·화약·실탄·포탄·최루탄·지뢰 등 폭발물류, 도검·분사기·전자충격기·석궁·모의총포 등 무기류 일체, 무허가, 소지허가 취소 후 미반납 총포와 화약류이다. 또한 총기류 소지허가자 중 소지허가 미갱신자, 주소변경 미신고자도 기간 중 자진신고 시 행정처분 면제, 법에 따라 허가갱신 또는 재발급이 가능하다. 신고는 경찰관서 및 각급 군부대이며, 신고절차는 신고소에 직접, 대리제출도 가능하지만 익명신고, 구두, 전화, 우편신고로도 가능하며, 신고자는 불법무기류 출처를 불문하고 형사책임을 면제한다. 그러나 미신고자 적발 시는 총포·도검·화약류 등 단속법 제70조, 제71조에 의거, 조치하는 데 불법 총기 소지자는 10년 이하 징역 또는 2000만 원 이하의 벌금에 처하니 유의해야 한다.  진병진·전남 여수경찰서[ 문화닷컴 바로가기 | 소설 서유기 | 모바일 웹 ][Copyrightⓒmunhwa.com '대한민국 오후를 여는 유일석간 문화일보' 무단 전재 및 재배포 금지(구독신청:02)3701-5555)]"
"[아시아블로그] 차기정부엔 '중소기업' 이름도 바꾸자","아시아경제","[아시아경제 김대섭 기자] 최근 호텔 행사장에서 만난 중소기업의 한 대표는 직원 모집의 어려움을 토로했다. 지난해 2월 이 업체가 인수한 수도권 소재 자동선반 회사의 신규 인력 채용에 고민이 많다는 얘기였다. 인수한 회사를 크게 성장시키려면 우수 인력들을 계속 뽑아야 하는데 모집이 안 되고 있다는 것. 국내 시장점유율 2위의 우수 업체임에도 청년구직자들의 눈높이에는 부족한 면이 있었던 것 같다. 직원 모집의 애로사항은 인수한 자회사뿐만 아니라 모회사도 겪었던 일이다. 작년까지만 해도 직원 채용에 어려움이 많았다고 한다. 공고를 내도 지원하는 구직자들이 매우 적었기 때문이다. 하지만 올해부터 크게 변했다. 지난달 2명을 채용하려고 했는데 지원자가 800명이나 몰렸다. 작년부터 매스컴 등을 통해 회사명은 물론 글로벌 기술력과 지속성장 가능성, 직원들에 대한 과감한 인센티브 등 장점들을 널리 알려온 성과다. 이처럼 중소기업 스스로 근로조건 개선과 홍보 등을 통해 회사 이미지를 향상시키는 경우도 있다. 하지만 아직도 많은 중소기업들이 우수 인재를 구하지 못해 지속성장에 차질을 빚고 있다. 가장 큰 문제는 중소기업에 대한 인식이다. 중소기업중앙회의 설문조사에 따르면 대국민 중소기업 인식도는 100점 만점 기준으로 종합점수 54점에 그쳤다. 대기업은 71.3점으로 20점 가까이 차이가 난다. 중소기업에 대한 부정적인 선입견 등이 주된 이유다. 복리후생, 작업환경, 근로조건, 소속감, 안정성, 성장성, 사회적 위상, 자아실현 등에서 인식도가 낮았다. 특히 고학력, 전문직, 대도시거주, 젊은층 일수록 부정적 인식이 높다. 중소기업에 근무하는 자신의 모습이 남에게 어떻게 보여지는가에 대한 체면문화도 영향을 미쳤다. 정부가 중소기업의 경쟁력 강화를 위해 매년 정책자금 등을 쏟아붓고 있지만 중소기업에 대한 편견을 바로잡지 않고서는 우리 경제의 중심으로 우뚝 설 수 없다. 중소기업에 대한 인식이 바뀌어야 청년들의 일자리 문제도 해결될 수 있다. 중소기업 스스로의 노력도 필요하지만 정부가 앞장서서 중소기업에 대한 이미지를 고급화시키는 데 도움을 줄 필요가 있다.중소기업이란 명칭을 바꾸는 것도 하나의 방법이다. '중소기업 - 중견기업 - 대기업'이란 명칭 자체가 기업의 크기를 나누면서 이미지의 높낮이에도 영향을 주게 된다. 작은 기업은 복리후생, 작업환경, 근로조건, 안정성 등에서 열악하다는 인식을 가질 수 있다. 실제로도 그렇다. 중소기업 중에 근로환경 만족도나 성장성이 뛰어난 곳들도 있지만 대다수의 청년구직자들은 대기업 입사를 선호한다. 중소기업은 물론 중견기업에 대한 명칭도 고민해 봐야 한다. 그동안 우수 중소중견기업들을 대상으로 '스몰 자이언츠', '글로벌 강소기업', '월드클래스 300 기업', '글로벌 히든챔피언' 등 보다 특별한 명칭을 지정하고 지원해줬지만 현장에서 느끼는 채용 환경은 크게 나아지지 않았다. 대선이 보름 앞으로 다가왔다. 대선후보들이 다양한 정책 공약을 내세우며 막바지 총력전을 펼치고 있다. 이들 가운데 대국민 중소기업의 인식도를 크게 높여줄 바른 경제의 주인공이 누가 될지 궁금하다. 중소기업의 인력난과 청년실업 문제를 해결해 줄 '행복 주는 중기씨'에 투표하고 싶다. 김대섭 기자 joas11@asiae.co.kr▶ 뉴스가 재밌다! 세상의 모든 재미 [티잼]▶ 인기최신만화  ▶ 오늘의 띠별, 별자리 운세"
"<뉴스와 시각>‘부처님 오신 날’과 大選","문화일보","엄주엽 문화부 선임기자올해 부처님오신날은 5월 3일이다. 우리나라는 초파일(初八日)로 부르던 음력 4월 8일을 부처님오신날로 정했는데, 이게 나라마다 차이가 있다. 가까운 일본은 양력 4월 8일로 돼 있다. 서구를 지향해 메이지(明治)유신 이후 모두 양력으로 맞추면서 그렇게 됐지만, 지역에 따라 양력과 음력을 혼재해 부처님오신날 행사를 연다. 일제강점기 때 양력설을 쇠게 했지만, 민간에선 음력인 설날이 오래 유지된 것과 비슷하다. 스리랑카와 미얀마, 태국 등 불교가 국교인 나라에서는 음력 5월 보름달이 뜬 날을 ‘웨삭(Vesak)’이라 해서 부처님오신날로 모신다. 부처님이 보름날 수행을 하던 마야 부인에게서 탄생했다는 전설에 따른 것이다. 웨삭은 1998년 세계불교도회의에서 양력 5월 보름달이 뜬 날로 확정돼 세계적으로 ‘부처님오신날’로 통용된다. 초기 경론(經論)에 붓다가 태어난 날을 2월 8일 또는 4월 8일로 적고 있는데, 이는 당시 왕국마다 쓰는 달력의 차이 때문이라고 한다. 한국과 중국은 불교의 종주국인 인도에서 불교가 전해진 만큼 음력 4월 8일을 따르고 있다. 우리는 1975년 대통령령으로 음력 4월 초파일을 ‘석가탄신일’ 공휴일로 지정했다. 불교계에서 이날을 ‘부처님오신날’로 부를 것을 지속해 제안하고 있지만, 법령에 ‘석가탄신일’로 돼 있다 보니 달력이나 공문서에서는 잘 바뀌지 않는다. 예수님 생일인 크리스마스도 법령에는 ‘기독탄신일’로 돼 있다.2561년 전 싯다르타가 태어날 당시 인도 사회는 부족국 간 전쟁과 계급·남녀 차별이 극심했다. 그를 왕자라 하지만 카필라국은 극히 약소한 석가족의 부족국이었고, 외세인 코살라국과 마가다국 등으로부터 속박을 받고 있었다. 갈등과 분열의 양상이 현재 국제관계나 사회와 차이가 없었다. 태국의 불교학자 잠농 통프라스트는 싯다르타의 출가를 두 가지 측면에서 해석하는데, 첫째는 자신의 마음을 정복하는 것, 둘째는 자신의 왕국과 백성들을 평화적으로 독립시키는 것이었다고 주장하기도 한다. 붓다는 깨달음을 얻은 후 주변국까지 개종시킴으로써 정복자들의 정복자, 즉 절대적인 정복자가 되었다. 또 모든 존재가 평등하며 번뇌를 떨칠 수 있다는 가르침을 준 인류사적 존재가 됐다. 2600년 가까이 성인으로 추앙받는 이유이다.올해 부처님오신날이 대통령선거를 앞둬선지 예년과 다른 분위기다. 보통 크리스마스를 앞둔 12월 19일쯤 치르던 대선이 대통령 탄핵으로 ‘장미 대선’(5월 9일)이 되면서 예수님에서 부처님 분위기로 바뀐 격이라고 할까. 대선 후보들도 여느 때보다 사찰을 자주 찾는 듯하다. 속내는 ‘표심’에 있을 것이다. 엊그제 한국기독교언론포럼이 전국 개신교 유권자 1028명을 대상으로 조사한 데 따르면, 5명 중 4명(78%)은 대선 투표 시 목회자의 영향을 안 받는다고 답했다. 우리 유권자들의 종교 성향 ‘표심’은 극히 희미해졌다는 걸 보여준다. 무슨 일이 있을 때마다 종교지도자들을 찾아 조언을 구하는 듯 퍼포먼스를 하는 정치인들의 관행도 생각해 볼 일이다. 부처님오신날을 맞아 대선  후보들도 자기를 다스려 더 큰 정신적 승리를 거둔 붓다의 생애를 새겨봄 직하다. ejyeob@[ 문화닷컴 바로가기 | 소설 서유기 | 모바일 웹 ][Copyrightⓒmunhwa.com '대한민국 오후를 여는 유일석간 문화일보' 무단 전재 및 재배포 금지(구독신청:02)3701-5555)]"
"<사설>‘사드’ 한국 도착 51일 만의 현장 반입과 配置 완료 시급성","문화일보","주한미군이 26일 새벽 사드(THAAD) 발사대와 레이더 등 주요 장비의 일부를 경북 성주 롯데스카이힐골프장 부지로 옮겼다. 사드 장비들이 지난달 6일 오산 공군기지에 도착한 지 51일 만의 일이다. 일부 주민과 사드 반대 단체들은 반발하고 있다. 그러나 가중되는 북핵 위협과 중국의 보복 등을 고려할 때 더 이상 미룰 수 없는 불가피한 조치였다. 주한미군은 초기작전운용 능력 확보를 위한 장비 시험 가동에 곧 들어갈 것으로 보인다. 환경영향평가 등 필요한 절차가 남았다는 점에서 다소 서두른 감이 없지 않으나, 사드 배치(配置)는 양국 정부의 합의 사항이므로 구체적 시기와 방법은 군사·안보적 판단에 따라 정하는 것이 당연하다. 북한이 지난 15일 김일성 생일과 25일 북한군 창건일에 6차 핵실험이나 대륙간탄도미사일(ICBM) 발사와 같은 고강도 도발을 하지 못하면서 ‘4월 위기’는 일단 지나갔다. 도널드 트럼프 미국 대통령이 군사적 옵션을 배제하지 않겠다며 항공모함과 핵 추진 잠수함을 동원한 상황에서 고강도 도발을 자행하는 것은 무리수란 점은 북한 김정은에게도 명확했기 때문이다. 더욱이 중국이 ‘쌓인 폭약 앞에 성냥 긋지 말라’고 경고하고, 25일 북·중 접경지역에 1급 전투대비 태세가 발령됐다는 보도가 나오니 더욱 그러했을 것이다. 결국 4월 사태는 강력한 대북 압박만이 북한의 도발을 억제할 수 있으며, 이는 미국이 자신의 일처럼 적극적으로 나설 때 가능하고, 중국의 실질적 움직임 역시 미국의 압박이 있어야 가능하다는 사실을 재확인해 주고 있다. 그러나 ‘한반도 위기’는 오히려 더 깊어지고 있다. 김정은이 핵을 쉽게 포기할 리 없으며, 추가 핵실험도 언제든 가능하다. 트럼프 대통령은 결코 좌시하지 않을 것이다. 북한이 6∼7주에 핵폭탄을 1개씩 제작할 수 있는 수준에 도달했다는 것이 미국 정보 당국의 결론이며, 트럼프 대통령 임기 말에 핵탄두를 장착한 ICBM으로 미국을 위협할 수 있기 때문이다. 이런 상황에서 미국이 ‘한·미 동맹의 리트머스 시험지’로 여기는 사드 문제를 놓고 한·미가 갈등을 벌인다면, 자칫 한·미 동맹에 씻지 못할 앙금만 남길 뿐이다. 따라서 이미 시작된 사드 배치를 더이상 반대해선 안 된다. 그런데 문재인 후보 측이 “사드 반입에 강력한 유감을 표명한다”고 발표했다. 유력 후보의 이런 움직임은 안보 불안을 더 키울 뿐이다.[ 문화닷컴 바로가기 | 소설 서유기 | 모바일 웹 ][Copyrightⓒmunhwa.com '대한민국 오후를 여는 유일석간 문화일보' 무단 전재 및 재배포 금지(구독신청:02)3701-5555)]"
"<사설>대선 후보인지 ‘산타’인지 헷갈리게 하는 황당 公約들","문화일보","대선 후보들이 제시하는 공약(公約)은 대부분 막대한 재정을 필요로 한다. 최근 후보들이 쏟아내는 공약을 보면 ‘산타클로스’가 공짜로 선물을 나눠주는 것처럼 달콤하게 유권자들을 유혹한다. 그러나 국정(國政)에 그런 공짜 선물은 있을 수 없다. 결국은 국민의 혈세(血稅)를 선심 쓰듯 하겠다는 것이다. 정도가 심해지면 국민 경제를 왜곡하고, 국민 의식도 자립보다는 ‘의존증’ 쪽으로 병들게 한다. 그만큼 ‘공약 가계부’가 치밀해야 한다. 그런데 대선이 2주일도 남지 않았는데 안철수 국민의당 후보를 제외하곤 공약집조차 없고, 재정 계획은 더더욱 공허하다.한국매니페스토실천본부는 주요 5당 후보로부터 제출받은 대선 공약을 분석, 5년 재임기간에 들어갈 재정을 추계한 결과 ‘추가 비용’만 문재인 후보 178조 원, 안철수 후보 204조 원, 유승민 후보 208조 원, 심상정 후보 550조 원이라고 밝혔다. 이런데도 매일같이 수조 원, 심지어 수십조 원씩 들어가는 공약을 발표한다. 기초연금 인상은 모두 경쟁적으로 제시하고 있는데 문 후보는 노인 70%에 월 30만 원씩 지급해서 예산 4조4000억 원을 추가했고, 안 후보는 노인 50%에 월 30만 원 지급해서 3조3000억 원이 추가된다고 했다. 그러나 전문가들은 축소 추계된 수치들이며, 실제론 매년 5조 원 이상이 더 들어갈 것이란 분석을 내놓고 있다. 최저임금을 1만 원으로 올리면 연간 1조5193억 원이 들어가고, 사병 월급을 최저임금의 40∼50%까지 인상하면 최소 연 2조 원 이상 필요하다. 아동수당, 청년수당, 실업수당 인상 등에도 수조 원 이상 필요하다.연간 40조 원을 추가로 조성하려면 1700만 근로소득자가 평균 235만 원씩을 추가 부담해야 한다. 세출 조정이나 법인세 명목 세율 인상 등을 거론하고 있지만, 턱없이 부족하고 결국엔 근로소득자들이 창출해야 한다. 차라리 정직하게 증세를 호소하는 게 옳다. 물론 증세의 경제적 효과에 대한 논란은 별개의 문제다. 누가 국민에게 더 많은 복지 제공을 싫어하겠는가. 그러나 지금처럼 대책 없는 선심 경쟁은 결국 경제를 망치고, 복지도 망치게 된다. 어려울 때 국민에게 허리띠 졸라매자고 호소할 수 있는 후보가 진정한 지도자다.[ 문화닷컴 바로가기 | 소설 서유기 | 모바일 웹 ][Copyrightⓒmunhwa.com '대한민국 오후를 여는 유일석간 문화일보' 무단 전재 및 재배포 금지(구독신청:02)3701-5555)]"
"[기고]박정희·박근혜 체제의 유산 보안관찰, 이제는 끝내야","경향신문","환자진료를 마칠 때쯤이다. 두 남자가 병원에 들어선다. “보안관찰법 위반으로 긴급체포합니다!” 의사는 영장 제시를 요구했다. 사복 경찰 한명이 진료실을 지키고 다른 한명이 나가더니 팩스로 뽑은 체포영장을 제시한다. 민주주의 국가에서 법적 근거 없이 누군가의 신체의 자유를 제한하거나 체포할 수 없다. 사본인 팩스 영장으로 체포하는 것은 위법이다. 그럼에도 경찰은 그를 종로서로 데려가 5시간 조사했다. 2016년 12월에 벌어진 일이다. 전국의 광장에서 박근혜 퇴진과 민주주의가 한참 외쳐지던 때에 이런 일이 일어날 수 있냐고? 그전에도 경찰은 수시로 직장과 학교, 동네에 불쑥 찾아와서 그를 관찰하고 어떻게 지내는지 주변사람에게 물어봤다.그는 23세 때인 1985년 구미유학생간첩조작사건으로 14년간 억울한 옥살이를 한 강용주씨다. 현재 의사인 그는 보안관찰처분대상자이다. 사회안전법에 의해 ‘보안감호’와 ‘보호관찰’로 시행되다가 1989년 사회안전법이 폐지되고 보안관찰법이 대체 제정되면서 ‘보안관찰’로 바뀌었다. 국가보안법·군형법 위반 등의 혐의로 3년 이상 형을 받은 사람을 ‘보안관찰처분 대상’으로 규정하고 2년마다 갱신 여부를 결정한다. 보안관찰법의 뿌리는 일제다. 항일운동가를 잡아들이기 위해 요시찰인물을 감시하도록 규정한 ‘조선사상범보호관찰령’이 1936년 시행됐다. 박정희 정권은 이걸 바탕으로 1975년 사회안전법을 제정해 전향을 거부한 사상범들이 형기를 다 채운 뒤에도 수십 년 동안 ‘보안감호처분’을 내렸다. 1987년 민주항쟁 이후 인권침해적인 사회안전법은 폐지됐으나 이 법의 기능중 하나인 보안관찰은 유지되고 있다.보안관찰의 근거는 과거범죄에 대한 ‘재범 위험’ 예방인데 감시해서 ‘내심의 반사회성’을 추정·판단할 수 있다고 보는 것이다. ‘양심’을 외부에서 추정·판단하고 처벌하는 것은 헌법 19조에 명시된 양심의 자유를 침해하는 일이다. 보안관찰처분대상자가 실정법을 위반하지 않아도 경찰이 무슨 마음을 먹었는지 추정해서 벌금을 부과할 수 있다. 국가가 그의 내심을 추정하기 위해 보안관찰처분 대상자는 3개월마다 무슨 일을 했는지, 누구를 만났는지, 어디로 이사를 갔는지, 어디로 여행을 가는지 등 일거수일투족을 관할 경찰서에 신고해야 한다. 이는 개인의 프라이버시를 침해할 뿐 아니라 일상적 감시로서 주변의 동료나 이웃들에게 범죄자로 낙인찍히게 함으로써 창살 없는 감옥살이를 하게 하는 이중처벌이다. 게다가 보안관찰처분 결정과 집행 취소를 사법부가 아닌 행정기관이 담당하고 있으며, 기간제한 없이 갱신할 수 있다. 강씨는 18년째 보안관찰법에 저항 중이다.그런데 생각해보라. 그가 당한 조작간첩사건의 재범을 막으려면 피해자를 감시할 일이 아니라 국가정보원 등 공안기구의 권한남용을 통제해야 한다. 국가보안법은 1992년부터 유엔인권기구가 사상의 자유와 양심의 자유를 침해하므로 폐지하라고 수없이 권고한 법이다. 그는 억울한 옥살이를 할 때도 양심의 자유를 지키기 위해 전향제도를 거부한 사람이다. 그런 그가 인권침해적인 보안관찰의 신고의무를 불복종하는 건 자연스럽다. 게다가 그는 트라우마센터장 등 공개적이고 공식적인 활동을 하고 있다. 만약 그가 위법한 일을 한다면 그때 그 ‘행위’를 처벌하면 된다.헌법을 위반한 박근혜를 파면시키고 치러지는 대통령선거지만 불행히도 아직 우리 사회는 19세기에 머물러 있다. 일제시대 창안되고 박정희 독재시절 법으로 제정된 보안관찰이 아직도 유지되고 있다. 박근혜 체제를 넘어서자는 건 친일독재의 유산을 청산하고 반민주적인 제도와 관행을 없애는 일이다. 그럼에도 대통령 후보들은 국민의 인권을 보호하는 정책을 고민하기보다는 철지난 ‘안보장사’로 표를 얻기에 급급하다. 결국 믿을 것은 우리의 실천이다. 시민의 손으로 민주주의와 헌법을 유린한 대통령을 쫓아냈듯이 이번에도 시민들이 나섰다. 여기저기서 ‘내가 강용주다’라는 선언과 보안관찰법 위헌제청심판을 촉구하고 있다. 오는 28일 강씨의 보안관찰법 위반에 대한 재판이 열린다. 부디 재판부는 강씨 사건에 대한 위헌제청요구를 수용하길 바란다. 헌법재판소가 탄핵을 인용하여 민주주의와 인권의 편에 섰듯이!<명숙 인권운동사랑방 상임활동가>▶ 경향신문 SNS [트위터] [페이스북]▶ [인기 무료만화 보기]©경향신문(www.khan.co.kr), 무단전재 및 재배포 금지"
