"title","press","body"
"[기고]영혼 잃고 껍데기만 남은 ‘공각기동대’","경향신문","다시 영화란 무엇인가? 영화가 현실의 완전성을 복원하는 예술이라고 말한 사람은 1960년대의 앙드레 바쟁이었다. 하지만 2017년의 할리우드 영화 <공각기동대>는 화려한 컴퓨터 그래픽과 스펙터클 이미지를 앞세워 기계 인간 시대의 고통스러운 현실적 고민을 지운다. 남는 것은 영화의 존재론을 잃고 방황하는 테크놀로지의 환상과 생뚱맞은 휴머니즘일 뿐이다.이 영화는 1989년 시로 마사무네의 일본 망가 <공각기동대>가 원작이다. 다소 가벼운 분위기의 이 원작 만화를 토대로 1995년 오시이 마모루의 2D 애니메이션 <공각기동대>가 만들어진다. 애니메이션 <공각기동대>는 ‘기계도 영혼을 가질 수 있는가?’라는 철학적 질문을 던진다. 사이보그 구사나기는 강물을 따라 서서히 흘러가는 배 위에서 껍데기 육신에 깃든 인간적 영혼과 자신의 정체성을 회의한다. 이 장면은 가와이 겐지가 작곡한 음울한 일본 전통 음악의 곡조를 따라 기나긴 롱테이크의 느린 영상으로 흘러간다. 애니메이션 역사상 기계 인간의 실존적 고민을 묘사한 최고의 명장면일 듯하다. 또한, 구사나기와 인형사의 융복합 합체를 묘사하는 마지막 장면은 어떠한가. 구사나기와 인형사는 이제 인간도 기계도 여자도 남자도 아닌 새로운 존재로 태어난다. 인간과 기계의 대립을 넘어 ‘광대한 네트의 세계’ 속으로, 컴퓨터 네트워크 시대의 새로운 영혼으로 나아간다. 거기에는 차가운 물속을 낙하하는 기계 인간 구사나기의 실존적 선택이 숨쉬고 있다. 현실과 가상의 경계가 허물어진다. 인간적 독단을 넘어서는 포스트휴먼의 사이보그 세계관이 태어난다. 인간, 동물, 기계의 정체성을 절대적으로 단정짓지 않으려는 미래의 가치관이 꿈틀댄다. 이미 현대 과학은 인간과 생명체가 DNA 정보의 전기적 흐름일 뿐이라는 사실을 밝혀냈다. 포스트휴머니즘은 생물과 무생물, 인간과 기계, 생명과 정보 네트워크가 융합하는 새로운 미래적 가치관으로 나아간다.그러나 할리우드 블록버스터 <공각기동대>는 어떤 새로운 질문을 던졌는가? 그것은 질문의 영화라기보다는 상투적 답변의 영화라고 칭하는 것이 더 적절할 듯하다. 그 답변은 너무나 할리우드적이다. 원작 애니메이션과 달리 기계 인간 메이저 미라의 탄생 신화에 집중한다. 쥘리에트 비노슈가 연기한 오우예 박사는 마치 자신이 감당할 수 없는 괴물을 창조한 프랑켄슈타인처럼 보인다. 영화는 인간이 자신과 닮은 피조물을 창조하면서 비극에 빠진다는 서구의 익숙한 창조신화에 매달린다. 신이 인간을 창조하고, 인간은 신을 배신하고, 인간은 기계를 창조하고, 기계도 인간을 배반하고, 이 모든 혼란과 불안과 두려움으로부터 우리를 지켜줄 영웅이 나타나고, 이제 우리는 안전한 가족의 품과 사랑의 현실로 돌아가야 하고….하지만 정말로 중요한 점은 이러한 영웅주의 서사가 현란한 액션과 컴퓨터 그래픽을 동원한 ‘기술적 스펙터클’의 눈부신 전시를 통해 포장된다는 사실이다. 루퍼스 샌더스의 <공각기동대>는 현실을 지우는 할리우드 기술 미학을 충실히 계승한다. 여기에서 원작 애니메이션의 가장 중요한 철학적 메시지는 증발한다. 인형사와의 융합을 통해 만물이 뒤섞이는 네트워크의 신세계로 나아가는 원작과 달리, 실사판 영화는 가출소녀 구사나기 모토코의 무덤 앞에서 일본인 엄마를 만나는 과거로의 회귀를 보여준다. 전뇌와 의체로 무장한 사이보그 메이저는 자신의 정체성에 대해 고민하다가 결국은 어설픈 휴머니즘과 가족주의 이데올로기로 돌아간다. 인간과 기계가 하나 되는 ‘광대무변의 네트’로 나아가는 원작의 대담한 세계관은 사라진다. 기술적 카타르시스로 치장된 물신주의 영화의 막이 내리면, 홀로그램 네온사인이 번득이는 무국적 미래 도시 속에서 광학미체 슈트를 두른 육감적 사이보그 스칼렛 요한슨의 눈부신 낙하 장면만이 관객들의 뇌리에 남겨진다.다시 처음의 질문, 영화란 무엇인가? 현실과 가상, 인간과 기계의 경계가 무너지는 인공지능과 가상현실의 시대에 영화의 정체성은 새롭게 질문된다. 여기에서 할리우드 블록버스터 <공각기동대>는 하나의 역설적 답변을 제시하는 듯하다. 고스트(ghost)가 사라진 자리에 디지털 테크놀로지의 눈부신 특수효과만이 껍질(shell)로 남겨진다. 영혼을 잃고 껍데기만 남는다.<정헌 | 중부대 교수·영화평론가>▶ 경향신문 SNS [트위터] [페이스북]▶ [인기 무료만화 보기]©경향신문(www.khan.co.kr), 무단전재 및 재배포 금지"
"[김용민의 그림마당]2017년 4월 28일","경향신문","▶ 경향신문 SNS [트위터] [페이스북]▶ [인기 무료만화 보기]©경향신문(www.khan.co.kr), 무단전재 및 재배포 금지"
"[문화중독자의 야간비행]로웰 버그만과 손석희","경향신문","나는 로웰 버그만을 2000년도에 만났다. 영화 <인사이더>를 통해서였다. 알 파치노가 연기한 로웰 버그만의 직업은 방송국 피디. 그는 미국의 사회비리를 파헤치는 유명 방송인이다. 어느 날, 의심스러운 사건 하나를 접수한다. 담배회사 필립 모리스가 자체 연구한 논문을 입수한 거다.로웰 버그만은 전문용어로 가득한 논문의 해독을 위해 필립 모리스에서 일한다는 제프리 와이겐드 박사(러셀 크로)를 수소문한다. 하지만 박사는 의사소통 부적격이라는 모호한 사유로 담배회사에서 이미 해고된 상태였다. 동물적인 감각으로 해고원인이 담배제조의 비밀과 연관이 있다고 판단한 로웰 버그만. 그는 담배회사와 한통속인 방송사 대표의 지속적인 취재 중단 지시에도 불구하고 비리를 파헤치는 데 주력한다.영화를 다시 보면서 언론인 손석희가 떠오른 이유는 간단하다. 그가 대한민국 방송 역사와 함께한 복잡한 세월이 떠올랐기 때문이다. 2016년 10월24일. 손석희는 최순실 태블릿PC 사건을 특종보도한 JTBC 뉴스룸을 진행했다. 담배회사라는 기업자본과 진검승부를 펼친 로웰 버그만을 능가할 만한 시도였다. 정권의 나팔수로 기생하는 방송매체가 득실거리는 상황에서 손석희 앵커는 정치권력의 집요한 견제를 감수해야만 했다.진보세력도 보수세력도 모두 그에게 무거운 짐을 떠안으라고 목소리를 높였다. 권력기관이 상습적으로 자행하던 언론통제라는 커다란 산을 등지고 나무에만 공정방송을 강요하는 격이었다. 그는 취임 이후 종편 삼인방의 마지막 퍼즐이던 JTBC를 균형 있고 품위 있는 언론사로 탈바꿈시켜야만 했다.  실제 CBS 뉴스 <60분> 피디로 활약했던 로웰 버그만의 마지막 선택은 협업이었다. 보도를 포기하라는 내외부의 압박에 몰린 자의 외로운 승부수였다. 로웰 버그만은 직장을 그만둘 각오로 동료 신문사 언론인에게 해당 담배회사의 비리문건을 전달한다. 니코틴 효과를 극대화하는 인체 유해 물질인 암모니아 화합물을 담배에 넣었다는 내용이 문건의 핵심. 여기에 살해 협박에 시달리던 제프리 와이겐드의 소신 있는 폭로가 사건을 밝히는 단초로 작용한다.모르쇠로 일관하던 담배회사는 결국 백기를 든다. 필립 모리스를 포함한 담배회사들에 거액의 배상금을 내라는 판결이 내려진 것이다. 로웰 버그만은 인터뷰에서 탐사보도를 하는 기자란 편안한 이들을 불편하게 하는 사실을 찾아내고, 사회적으로 억압받는 이들을 도와주려고 노력해야 한다고 말한다. 탐사보도를 맡은 방송인의 어려움은 국내에서도 어렵지 않게 확인할 수 있다. 그들은 한직으로 발령 나거나 징계와 퇴사 압력을 받기도 한다.손석희는 2006년 성균관대학교 강연에서 이렇게 발언한다. 후회 없는 열정을 유지하기 위해 자신이 선택한 것이 옳았다는 것을 증명해 보여야 한다고. 무슨 일이 있더라도 최선을 다해 정당한 방법으로 증명해 보여야 한다고. 그는 누구보다도 길고 험난한 겨울을 보냈다. 앞으로도 연속성이 존재하지 않는 뉴스의 특성상 잠시도 긴장을 풀 수 없다. 신뢰받는 언론인이라는 기존의 명성이 족쇄로 작용할 수도 있다. 대선주자와 차기 대통령에 대해서도 정확한 보도를 해야 하는 과제가 남아 있다. 재벌을 향한 올곧은 비판 또한 중요하다.그는 4월19일 페이스북 ‘소셜스토리-JTBC 사회부’와의 인터뷰에서 언론은 어떤 정부와도 불편한 관계여야 한다는 말을 남겼다. 여기서 말하는 불편함이란 기호나 이해관계를 배제한 가치중립적인 시각이 전제되어야 함을 의미한다. 손석희의 방송은 지금부터가 본 게임에 속한다. 야구에 비하자면 초반 대량득점 후 경기를 운영해야 하는 상황이다. 어깨에 힘을 빼고 던지는 공이 포수가 원하는 위치로 향할 가능성이 높다. 완전무결한 언론이란 존재하지 않는다. 손석희의 변화구가 더 크고 정교한 궤적을 그리기를 바라면서 JTBC 뉴스룸의 배경음악을 신청한다. 제목은 전람회의 ‘10년의 약속’.<이봉호 | 대중문화평론가·<나쁜 생각> 저자>▶ 경향신문 SNS [트위터] [페이스북]▶ [인기 무료만화 보기]©경향신문(www.khan.co.kr), 무단전재 및 재배포 금지"
" [시론] 국방부의 사드 거짓말 / 하주희 ","한겨레","[한겨레]   하주희민주사회를위한변호사모임 미군문제연구위원회 위원장   26일 새벽 한·미 당국은 100여명도 안 되는 주민들을 대상으로 8000명의 경찰을 동원한 ‘군사작전’을 감행해 사드 장비 일부를 성주에 반입했다. ‘군사작전’이 끝난 뒤 국방부(대변인 문상균)는 “미군에 이미 부지가 공여되었기 때문에 국내법 적용을 받지 않으므로 법적으로는 환경영향평가를 할 필요가 없다”는 입장을 밝혔다.  그러나 국방부가 ‘주술’처럼 읊조리고 있는 “미군에게 공여된 부지에 국내법 적용 안 된다”는 주장은 새빨간 거짓말이다. 이미 우리 법원은 명확히 공여된 구역에서도 국내법을 적용하여야 한다고 밝힌 바가 있기 때문이다. 현재 사드를 배치하는 과정에서 적법 절차를 위반하고 주민의 기본권을 침해했다는 이유 등으로 법원에 계류 중인 소송이 다수다. 상황이 이런데도 국방부는 마구잡이로 장비 반입부터 했다. 법원의 판단은 개의치 않겠다는 점에서 보면 일관된다고 볼 수 있겠다.   2011년 서울행정법원은 이미 수십년 전에 공여된 평택 오산 미공군기지에 새로운 활주로를 만들기 위해서는 환경영향평가법에 의한 환경영향평가를 실시해야 한다고 판결했다(서울행정법원 2010구합19256). 법원은 시기와 관련해서도 적어도 사업을 하기로 결정하기 전, 즉 ‘사전’에 해야 하고 그렇지 않은 경우 위법하다고 판결했다. 그 근거는 주둔군지위협정(SOFA·소파)에 대한민국 환경 관련 법령을 명시적으로 배제하는 규정이 없는데다 오히려 ‘대한민국 정부와 합중국 정부가 환경보호의 중요성을 인식’하고 ‘대한민국 안에서 일반적으로 집행되고 적용되는 대한민국의 법령 중에서 보다 보호적인 기준’을 언급하고 있다는 것이었다. 따라서 이에 배치되지 않는 대한민국 환경 관련 법령이 당연히 적용된다는 것이었다.  ‘국방·군사시설 사업에 관한 법률’은 “국방·군사시설 사업”에 “대한민국에 주둔하는 외국군대의 부대시설(部隊施設)과 그 구성원·군무원·가족의 거주를 위한 주택시설 등 군사 목적을 위하여 필요한 시설”을 명확히 포함시키고 있다. ‘군사기지 및 군사시설 보호법’ 역시 “이 법은 헌법에 규정된 절차에 따라 대한민국에 주류(駐留)하는 외국군의 군사기지 및 군사시설에 대하여도 적용한다”고 규정하고 있다.   환경영향평가법의 목적은 “환경에 미치는 영향을 미리 예측·평가하고 환경보전 방안 등을 마련하도록 하여 친환경적이고 지속가능한 발전과 건강하고 쾌적한 국민생활을 도모함”이다. 국방부 역시 성주에 사드를 배치하겠다고 발표할 때 “지역주민 안전을 보장하면서 건강과 환경에 영향이 없는 최적의 배치 구조”라고 밝힌 바 있다.   국방부가 ‘법’상의 환경영향평가를 피할 방법은 없다. 우리 환경영향평가법 어디에도 사드를 배치할 때 ‘도의적인’ 소규모 환경영향평가로 족하다고 규정하고 있지 않다. 판결문 어디에도 “공여된 구역에 국내법 적용 안 된다”는 내용이 없는데, 무시하고 진행하는 것은 입법자와 사법부에 대한 도전이다.  올해로 소파가 시행된 지 50년이다. 소파가 시대에 맞게 개정되어야 함은 물론이지만, 소파 자체가 치외법권 지대를 설정한 것은 아니다. 오히려 ‘접수국’ 법령을 존중해야 한다는 명시의 규정을 두고 있다. 그런데 국방부는 스스로 나서서 국내법 적용을 배제해야 한다며 국민들의 주권을 갉아먹고 있다. 우리 국민 누구도 국방부에 주권을 처분할 권한을 준 적이 없다. 국방부는 ‘주권’을 유린당한 국민들의 분노가 아직 한창임을 잊지 말아야 할 것이다. 국방부와 한국 경찰이 보호해야 할 사람은 미군이 아니라 국민들, 성주와 김천의 주민들이다.   ▶ 한겨레 절친이 되어 주세요! [신문구독] [주주신청][▶ 대선 팩트체크] [페이스북] [카카오톡] [정치BAR][ⓒ한겨레신문 : 무단전재 및 재배포 금지]"
" [황현산 칼럼] 투표의 무의식 ","한겨레","[한겨레]   황현산 고려대 명예교수, 문학평론가   내가 5·18 기념재단을 찾아갔던 날, 재단 문화센터의 1층에서는 “일구구칠 망월”이라는 제목을 걸고 임무택씨의 사진전이 열리고 있었다. 1997년은 광주 사람들에게, 아니 더 넓게는 이 땅의 민주화를 열망했던 사람들에게 어떤 이정표가 세워진 해라고 말해야 한다. 김대중 전 대통령이 대통령에 당선되어 명실상부하게 정권교체가 이루어진 일을 이해에 일어난 가장 큰 사건으로 꼽을 수 있겠지만, 사람들에게 크게 알려지지 않은 자리에서 다른 일들도 진행되고 있었다. 1980년 5월, ‘폭도’라는 이름으로 학살당해 망월동 광주시립묘원 제3묘역에 묻혔던 고인들의 주검이 다시 수습되어 운정동 국립묘지로 이장하게 된 것도 1997년의 일이다.  임무택씨의 전시 사진은 그 이장의 과정을 필름에 담은 것이다. 그 사진들을 보고 있으면 슬픔이나 비애라고만 말하기 어려운 이상한 감정에 휩싸이게 된다. 청소차나 손수레에 실려와, 쓸모없어진 물건들이 처리되듯 함부로 묻혔던 사람들의 시신들이 백골이 되어 드러난다. 그 시신들이 온전할 리 없다. 총을 맞아 부서져 버린 뼈들, 열일곱 해 동안 풀뿌리에 얽혀 삭아 내려앉은 갈비뼈와 척추와 두개골들, 그 뼈를 바라보고 있는, 부모이기도 하고 형제이기도 하고, 때로는 자식이기도 한 흰옷 입은 사람들, 그것들은 슬픔이라기보다 차라리 슬픔의 저편 언덕처럼 보인다.  그해 5월 계엄군의 총칼에 그 많은 사람들이 원통하게 죽은 뒤, 이제는 사람들을 죽인 바로 그 총칼이 뒤에 남은 사람들의 입을 다물게 했다. 광주에 관해 숨죽이지 않고도 말할 수 있게 되기까지는 한 세월이 필요했지만, 그 세월을 보내고 나니 이제 바깥 사람들은 광주를 잊어가고 있었다. 그래서 광주는 ‘지루한 이야기’가 되었다. 그때 이후 가장 큰 슬픔을 지닌 사람들은 오히려 입을 다물었을지 모른다. 슬픔은 풀뿌리에 얽혀 삭아 내린 그 백골과 같았을지 모른다.  사진전을 주최한 5·18기념재단은 전시회의 팸플릿에 이렇게 썼다. “5·18 민주화운동 후 급하게 조성된 묘역, 옛 5·18묘지는 민주화운동의 원동력을 제공하며 회한의 터로 자리매김되었고 그 후, 17년 세월은 학살의 기억을 해원의 터로 승화시킨다. 그리고 국립5·18민주묘지로 이장함으로써 서러운 ‘학살’로부터 살아남은 자를 위한 씻김의 해원공간으로 발현되었다.” 이 ‘해원’이라는 말, 이 ‘씻김’이라는 말은 슬픔이 이제는 건너가 버린 저편 언덕처럼 들리고, 비애의 무의식처럼 들린다.  나는 ‘슬픔의 무의식’이라는 말을 문득 생각해 내고는 엉뚱하게도 내가 키우다 죽여 버린 난초 분들을 떠올렸다. 식물을 잘 키워 ‘푸른 손’이라는 별명을 가진 사람들이 있지만, 내 손은 거의 악마의 손에 가깝다. 난초는 늘 내 손에서 죽었다. 그러나 나도 난초를 키울 때 꽃 한 송이라도 더 피게 하고, 잎 하나라도 더 기운차게 만들겠다고 온갖 정성을 다 기울였던 것이 사실이다. 그러나 뒤를 돌아보면 바로 그 정성이 결국 난초를 죽였다. 난초를 죽인 것은 내가 준 물이었고, 내가 준 영양제였고, 난초 잎 반짝이게 하려고 잎을 닦아내던 내 붓질이었다. 나는 늘 정성을 쏟았지만, 그 정성은 난초에게 늘 독이 되었을 뿐이었다. 그것이 정성이라는 이름을 가진 욕심이었기 때문일지도 모르겠다.  난초가 아니라 자식을 키워본 부모들 가운데도 내 말에 동의할 사람이 적지 않을 것이다. 어느 부모가 자식을 잘 키우고 싶지 않을까. 그러나 부모가 쏟은 정성이 항상 자식의 살이 되고 피가 되는 것은 아니다. 때로는 칭찬도 독이 되고 꾸중도 독이 된다. 부모의 과도한 기대로 시든 아이들이 있고, 부모의 무관심 때문에 자신을 버림받은 아이라고 생각하고 모든 것을 포기해 버린 젊은이도 있다. 그렇다고 해서 애매한 중간에 기댈 수도 없다. 그것은 이중의 독이 될 수도 있기 때문이다.  아니, 난초를 죽이는 엉터리 원예가나, 자식을 병들게 하는 서툰 부모를 생각할 것까지도 없다. 저 자신이 어떻게 커서 어떻게 살아왔는가를 한번쯤 생각해보면 모든 것이 명백해진다. 저 자신을 망치고 싶은 사람이 어디 있겠는가. 그러나 저 자신을 망친 사람은 많다. 게을러서, 의지가 부족해서, 사회적 여건이 따라주지 않아서, 핑계를 댈 수 있는 말은 많다. 그리고 그 변명과 핑계들은 사실이기도 할 것이다. 따지고 보면, 게으름을 말할 때 늘 부지런함이 있었고, 부족한 의지를 말할 때 제 최선의 의지를 끌어내려고 애쓰지 않은 사람이 없다. 그러나 저를 바꾸지는 못했다. 저 자신을 제 마음대로 할 수 있었다면 성공하지 못할 사람이 어디 있겠는가. 그러나 성공하지 못한 사람들은 얼마나 많은가. 우리는 저 자신도 바꾸지 못한다. 저 혼자만의 터전이 마음속 깊은 곳일수록 더 그렇다.  난초는 내 마음속 깊은 곳, 다시 말해서 나의 무의식과 같다. 나의 무의식은 나이면서 내가 아니다. 그것은 내 의지에 따르지 않으며, 내 말을 듣지 않는다. 내 욕망이 난초를 꽃 피우게 할 수 없으며, 내 아이를 착한 아이가 되게 할 수 없다. 내 욕망이 항상 나 자신을 훌륭한 사람으로 만들어주는 것도 아니다. 불교의 선사들이 미망에서 벗어나라고 말할 때도 아마 이 정황을 염두에 둔 것이리라. 필경 의식과 무의식이 같은 것이 되게 하라는 말일진대, 그것은 하염없이 마음을 닦는 수고로만 이루어질 것이다. 어쩌면 너무나 하염없어서 그 수고로움이 수고로움인 것조차도 잊어버리면서 이루어질 것이다. 열일곱 해 동안 풀뿌리 속에 묻혀 있다가 마침내 “학살의 기억을 해원의 터로” 삼은 저 주검들, 그날의 분노와 애통한 마음을 씻김의 흙과 바람 속에 풀어놓는 저 백골들은 그래서 우리 슬픔의 무의식이 아닐 수 없고, 우리 열망의 무의식이 아닐 수 없다.  나는 지난겨울과 이 봄이 우리의 정치적 무의식을 바꾸는 어떤 계기를 나타낸다고 감히 생각한다. 우리 사회에서 그렇게 공고했던 박정희 신화가 그 딸의 손에 의해 무너진 것이 이 계절이었고, 회반죽처럼 단단한 수구세력이 궤멸 직전에 이른 것도 이 계절이었다. 역사의 간계와 의지 같은 것을 느끼게 한 것도 이 계절이다. 우리는 지금 그래서 이 계절의 마지막 눈을 그리기 위한 선거를 눈앞에 두고 있다.  내 주변에는 젊은 날에 혁명투사였으며 지금도 사실상 혁명투사로 살고 있는 사람들이 많다. 그런데 그 가운데는 대선에서건 총선에서건 투표 같은 것을 외면하고 사는 사람들이 적지 않다. 그 거대한 혁명이 투표 행위로 줄어든 것이 한심해서일까. 불타버린 노적가리에서 타다 남은 낟알이나 줍고 있을 수는 없다고 생각해서일까. 나는 그 친구들 옆에서 투표는 역사의 무의식 만들기라고 자주 되풀이 말하곤 한다.  내가 지지했던 후보가 당선되지 못했을 때, 이를테면 박근혜가 대통령으로 당선되었을 때, 나는 내가 죽인 난초 분들을 생각한다. 이 나라는 내 나라지만 내 의식과 같은 나라는 아니다. 이 나라는 지금도 살아 움직이는 어떤 역사를 살고 있지만, 모든 사람들의 마음이 그 역사의 의지와 같은 의지를 지닌 것이 아니다. 저 알 수 없는 사람들의 마음은 역사의 무의식과 같다. 그 무의식이 늘 투표를 통해 나타나니 어쩌면 행복한 일이기도 하다. 성급한 사람들에게는 투표가 ‘어느 세월에’라고 한탄하게 하는 영원히 가망 없는 일처럼 보일 수도 있다. 그러나 마침내 꽃 피는 난초 분들이 있고, 잘 자란 아이들이 있다. 마침내 깨어지는 벽이 있다. 그래서 투표는 역사적 무의식이자 그 거울이다. 한 사람 한 사람의 투표는 저 역사적 무의식의 세포를 바꾼다. 확실하다.   ▶ 한겨레 절친이 되어 주세요! [신문구독] [주주신청][▶ 대선 팩트체크] [페이스북] [카카오톡] [정치BAR][ⓒ한겨레신문 : 무단전재 및 재배포 금지]"
"[장도리]2017년 4월 28일","경향신문","▶ 경향신문 SNS [트위터] [페이스북]▶ [인기 무료만화 보기]©경향신문(www.khan.co.kr), 무단전재 및 재배포 금지"
"[생각그림]밤 이야기","경향신문","캔버스에 아크릴, 53×41㎝가끔 자기 전 딸들에게 이야기를 들려줍니다. 그리스 신화 속 이야기, 각종 괴물 이야기, 공주 이야기, 아빠 어렸을 때 이야기 등등. 요즘에는 제가 얼렁뚱땅 이야기를 만들어서 들려주고 있습니다. 근데 애들이 커갈수록 이야기를 해주기가 점점 더 부담스러워집니다. 너무 단순한 이야기를 해주면 시시해하고, 또 재미있게 이야기해주면 잠은 안 자고 눈이 말똥말똥해서 그다음은 어떻게 되는지 궁금해합니다. 그래서 요즘은 드라마처럼 “다음 이 시간에~” 하며 이야기 끝을 맺습니다. 오늘 밤에는 또 어떻게 이야기를 이어가야 할지 고민입니다.<김상민 기자 yellow@kyunghyang.com>▶ 경향신문 SNS [트위터] [페이스북]▶ [인기 무료만화 보기]©경향신문(www.khan.co.kr), 무단전재 및 재배포 금지"
