"title","press","body"
"[세상읽기] 처음 겪는 일들과 오래된 리더십","매일경제","우리는 지금껏 한 번도 경험해보지 못한 일들을 겪고 있다. 앞으로 더 그럴 것 같다. 먼저 북한이다. 안보위기야 늘 상존해왔지만 '북한이 6~7주마다 핵폭탄 1개씩 만들 수 있다'는 정보는 처음 나왔다. 북한의 대륙간탄도미사일(ICBM)이 '거대한 게임 체인저'로 거론되는 가운데 도널드 트럼프 미국 대통령은 유엔 안전보장이사회 대사들을 모두 불러 이를 '진짜 위협(real threat)'이자 '커다란 세계적 문제(big world problem)'로 규정했다. 한반도 문제가 미국 대통령의 가장 큰 의제가 된 것은 6·25전쟁 이후 처음인데 미국과 세계의 문제로 커진 게 좋은 건지 아닌지는 아직 알 수 없지만 하여간 처음이다. 중국은 또 어떤가? ""한국은 중국의 일부였다""고 시진핑 중국 국가주석이 말했다는 보도가 흘러나오는가 하면, '미국이 북핵 시설을 선제공격하더라도 중국의 군사적 개입은 불필요하다'는 중국 관영매체의 사설도 나왔다. 이런 초유의 일을 맞이한 한국에 대통령은 탄핵으로 없고 대행만 있는 것도 처음 겪는 일이다. 불과 몇 년 전만 해도 미·중의 '러브콜'을 동시에 받는다고 자랑하던 외교부는 한국을 건너뛰는 '코리아 패싱'에 말이 없다(19세기 구한말을 연상시키는 일이니 처음은 아니라고 위안해야 할까?). 먼지 문제에 불과해 보일지 모르지만 우리를 괴롭히는 초미세먼지 문제도 사실 '근대성(modernity)'의 위기를 알리는 징후다. 초미세먼지의 근본 원인은 석탄화력발전, 디젤자동차, 굴뚝형 산업과 건설 현장에 있다. 이른바 산업화의 산물로 이 시대 인류의 최대 리스크로 떠오른 기후변화의 원인과 일치한다. 경제협력개발기구(OECD) 최근 보고서에 따르면 회원국 중 한국이 대기오염으로 목숨을 잃을 확률이 가장 높은 나라가 될 것이며 이로 인한 국내총생산(GDP) 손실도 회원국 중 가장 높은 0.63%에 달할 것이라고 한다. 우리가 자랑해온 성장 방식이 앞으로는 오히려 성장을 훼손하게 되리라는 경고와 다름없다. 신흥 국가의 발전 모델로 손꼽히던 한국이 이제 구체제 경제에서 벗어나지 못하는 국가로 낙인찍히고 있으니 이 또한 처음 겪는 일이다. 인구 변화는 더더욱 그렇다. '인구절벽'의 저자 해리 덴트는 필자와 함께 진행한 세계지식포럼에서 ""한국은 세계에서 가장 빠른 속도로 저출산·고령화의 길로 빠져들고 있지만 더 큰 문제는 한국이 그만큼 부자 나라인가에 있다""고 말했다. 선진국도 아닌 한국이 인구절벽, 소비절벽, 일자리절벽, 재정절벽으로 연결되는 악순환을 견뎌내겠느냐는 우려다. '장수기술(longevity technology)'의 발전은 아찔하기까지 하다. 구글 비즈니스 X의 공동창업자 서배스천 스런은 서울디지털포럼에서 ""기술적 관점에서 인간수명을 120세까지 늘리는 일이 완성 단계에 있다""고 말했다. 국제응용시스템분석연구소(IIASA)라는 국제기구에서는 '노인'을 재정의하는 프로젝트를 진행 중이기도 하다. 60세까지 살면 드물게 오래 살았다며 환갑잔치를 하던 게 엊그제 일인데 이미 기대수명 80세를 넘어 100세 이후로까지 가는 '긴 현재(long-now)' 시대를 지금까지의 교육과 고용, 연금과 복지시스템이 과연 감당할 수 있을까? 이야말로 처음 겪는 일이다. 여기에 4차 산업혁명의 파고가 가세한다. 천재 미래학자 레이 커즈와일이 예고한 것처럼 인공지능의 비약적 발전으로 기계총지능이 인간총지능을 능가하는 '특이점'이 눈앞에 와 있다(이미 넘어섰는지도 사실 잘 모른다). 인간의 일자리가 전례 없는 범위와 속도로 기계에 의해 대체될 가능성에 대비해 '로봇세'와 '인간 기본 소득제'를 준비하는 움직임도 나타나고 있다. '무엇을 모르는지조차 모른다(unknown unknown)'는 말처럼 4차 산업혁명이 가져올 기회와 도전조차 아직 파악되지 못했다. 한 가지 분명한 점은 과거 연장선에서 종래의 방식으로 우리가 처음 겪는 일들을 풀어나갈 수 없다는 데 있다. 불연속적 변화가 가속화하는 '포스트 모던' 시대에 미래를 통찰하는 리더십이 그래서 중요하다. 너무도 구태의연한 대선후보 TV토론을 지켜보며 낡은 주제, 오래된 리더십에 낙심하게 되는 것은 필자뿐일까. 우리들의 미래는 우리 스스로 만들어 나갈 수밖에 없을 듯하다.[김상협 카이스트 초빙교수·우리들의 미래 이사장][매일경제 공식 페이스북] [오늘의 인기뉴스] [매경 프리미엄][ⓒ 매일경제 & mk.co.kr, 무단전재 및 재배포 금지]"
"[내일을 열며-김혜림] 블라인드 검증을 제안한다","국민일보","2014년 12월 9일자부터 국민일보에 ‘국민 컨슈머리포트’라는 타이틀의 기획기사를 격주로 연재하고 있다. 우리가 바르고 먹는 화장품과 가공식품 등 생활용품의 장단점을 톺아보기 위한 의도다. 매회 소비자들이 많이 쓰는 5개 브랜드 제품을 선정해 블라인드 테스트를 펼친다. 일회용 용기에 담은 제품을 평가자들이 발라보고 시식하면서 항목별로 철저하게 상대평가를 한다. 기능적인 평가가 끝난 다음 화장품은 성분, 가공식품은 원재료와 영양 구성을 공개하고 이에 대해 평가한다. 가격을 공개한 뒤 최종평가를 한다. 제품의 알맹이만을 비교, 상대평가하는 것이다. 가공식품은 호텔 셰프들이, 화장품은 피부과 전문의와 관련학과 교수 등 전문가들이 평가를 맡고 있다. 가공식품의 순위는 시장점유율과 비례하는 경우가 대부분이었다. 하지만 화장품은 의외의 결과가 속출해 놀랐다. 세계적인 유명 브랜드로 엄청나게 비싼 화장품들이 꼴찌를 도맡았다. 초기에는 좌불안석이었다. 일회용 용기에 제품을 담을 때 헷갈린 건 아닐까. 평가자들에게 받은 점수 합계를 잘못 낸 게 아닐까. 그러나 아니었다. 전문가들은 디올, 샤넬, 겔랑, 라메르, 에스티로더, 시슬리, 클라란스 등 내로라하는 글로벌 브랜드 제품에 낙제점을 주었다. 고가여서 감점을 받는 게 결코 아니다. 가격이 제시되지 않은 상태에서 진행되는 1차 평가에서도 글로벌 브랜드들의 성적은 신통치 못했다. 특히 문제 성분이 수두룩해 성분평가는 최저점을 경신하고 있다. 많은 글로벌 브랜드들이 상대적으로 떨어지는 기능과 좋지 않은 성분들을 ‘삐까뻔쩍’한 브랜드로 가리고 있었다. 국민 컨슈머리포트 평가방법을 이번 대통령 선거에도 활용해보는 것은 어떨까. ‘보수’ ‘진보’ 표찰을 떼고 오로지 후보들의 정책 공약과 리더십만 상대비교 평가해보자는 것이다. 유력 대선 후보 5명이 참여하는 TV토론에서 말싸움이나 하는 그들을 보면서 ‘뽑을 후보가 없다’고 볼멘소리를 하는 이들에게는 더욱 유용한 방법이 될 것이다.  경제, 통일, 복지, 교육, 외교, 저출산 극복 등 항목별로 후보들의 정책을 비교해보자. 각 후보의 항목별 정책에 1점부터 5점까지 주는 상대평가를 하다 보면 찍어야 할 후보의 윤곽이 잡힐 것이다. 그리고 공약을 실천할 만한 능력이 있는지를 판단해보자. 후보들이 그동안 어떤 자리에서 어떤 일을 누구와 어떻게 해왔는지를 꼼꼼히 살펴보면 가늠할 수 있을 것이다. 현직 대통령 탄핵이라는 치욕의 역사를 대한민국에 안긴 박근혜 전 대통령. 불가사의한 관계로 국민의 억장을 무너뜨린 최순실은 이미 영애 시절부터 그의 곁에 있었다. 국민의 소리에 눈과 귀를 막은 그의 ‘불통’은 한나라당 대표 시절부터 도마에 올랐었다. ‘이 땅에 배곯는 이들을 없앤 박정희 전 대통령의 딸’이라는 브랜드에 혹한 우리는 그런 사실을 외면, 5년 전 그를 우리의 대통령으로 뽑았었다. 화장품은 3∼4개월을 쓴다. 지금 우리가 뽑을 대통령의 임기는 2022년 5월까지다. 5월 연휴 휴가계획을 세울 때가 아니다. 5년간 이 나라를 이끌 대통령으로 누구를 뽑을지 심사숙고할 때다. ‘리더십 인사이트’ 저자 마이클 앤드루는 리더는 ‘머리’ ‘가슴’ ‘손’이 잘 맞물려 돌아가야 한다고 했다. 후보들의 공약이 구한말을 방불케 하는 열강 각축의 상황에서 4차 산업혁명의 파고를 넘어 ‘대한민국호’를 지켜낼 만한지, 정적과도 소통할 수 있는 열린 마음을 갖고 있는지, 추진력과 능력이 있는지 톺아보자.김혜림 논설위원 겸 산업부 선임기자 mskim@kmib.co.kr[국민일보 홈페이지] [페이스북] [트위터][취재대행소 왱!(클릭)]GoodNews paper ⓒ 국민일보(www.kmib.co.kr), 무단전재 및 재배포금지"
"[한줌뉴스] 19대 대선 투표, 누가 바쁘다 하나요","머니S","현대인은 바쁘다. 주변을 돌아볼 틈이 없다. 하지만 우리가 무심코 스쳐 지나가는 순간에도 한번쯤 우리를 돌아보게 하는(zoom) 무언가가 있다. ‘한줌뉴스’는 우리 주변에서 지나치기 쉬운 소소한 풍경을 담아(zoom) 독자에게 전달한다.  본문 이미지 영역26일 서울 시청 앞 도로에 세워진 투표독려 홍보물. /사진=최윤신 기자19대 대통령선거가 코앞으로 다가온 가운데 대선 투표율이 낮지 않을까 걱정하는 시각이 적지 않다. 뽑을 사람이 없다며 투표를 포기하겠다는 사람도 있고 5월 초 징검다리 연휴 끝자락이 대선투표일이어서 봄 나들이에 나서는 사람도 많을 것으로 예상되기 때문이다. 이 같은 상황에서 물 건너 재외국민의 험난한 투표과정이 여러 언론을 통해 공개됐다. 투표 첫날인 25일 전세계 재외 유권자의 8.4%가 투표에 참여한 것으로 집계됐다. 많은 재외국민은 머나먼 고국의 미래를 위해 인터넷으로 후보들의 공약을 면밀히 점검한 뒤 수시간 거리를 기차와 자동차로 달려 한표를 행사했다. 인도에서 수행중인 한국인 승려는 1박2일간 삼륜차, 버스, 비행기를 갈아타고 대사관에 도착해 투표한 것으로 전해져 감동을 안겼다.이들이 고생을 감수한 이유는 우리의 의사를 행사할 수 있는 유일한 창구가 투표이기 때문이다. 투표를 해야 우리의 삶을 바꿀 수 있다. 재외국민들의 험난한 여정에 비하면 우리에게 투표소는 너무나도 가깝다. 투표 당일 일이 있다면 사전투표도 할 수 있다. 바빠서 투표를 못한다는 말은 이제 핑계일 뿐이다.실시간 재테크 경제뉴스│창업정보의 모든 것최윤신 기자 chldbstls@mt.co.kr"
"[시사풍향계-정재흥] 한국 주도의 해결방안 고민할 때","국민일보","최근 한반도 정세가 급격하게 돌아가고 있다. 인민군 창건일인 25일 북한은 6차 핵실험을 하지는 않았지만 300∼400문의 장사정포를 비롯한 포병 전력을 동원해 대규모 화력훈련을 가졌고, 중국군은 2급 전비 태세를 발동하고 북·중 국경지역에 북부전구 소속 10만∼20만명을 긴급 배치했다. 기본적으로 중국군의 전비 태세는 3단계로 나뉘는데 2급 태세는 자국에 대한 직접적인 군사 위협이 있을 때 무기·장비준비, 병력이동 금지, 전쟁 충돌 대비, 당직 태세 강화 등의 조치가 이루어진다. 미국은 핵 추진항공모함 칼빈슨호를 비롯한 항모전단과 핵추진 잠수함 미시간호 등을 25일부터 한국 해역에 들여보내 고강도 한·미 연합훈련을 펼칠 계획이다.  이처럼 북한 핵·미사일 문제를 놓고 한반도 정세가 긴장되는 가운데 북·중 관계 역시 일부 언론 보도처럼 다소 충돌하는 모습을 보여주고는 있다. 그렇다고 중국의 대북정책 기조가 변화되었다고 보기에는 무리가 있다. 22일 중국 공산당 기관지 환구시보가 논평을 통해 북한이 6차 핵실험을 실시한다면 원유 공급을 대폭 축소할 것이며 미국이 고려하는 북한의 주요 핵·미사일 시설에 대한 외과수술식 공격(surgical strike)에 대해서도 일단 외교적인 수단으로 억제하겠지만 군사적 개입은 불필요하다고 역설했다. 물론 미국이 공격을 감행할 경우 북한이 한국에 대해 군사수단을 통한 보복타격 을 하거나 한·미 군대가 중국의 사전 동의 없이 38선을 넘어 북한 정권 전복을 시도한다면 즉시 군사적 개입에 나서겠다고 밝혔다. 이는 역으로 향후 미국의 대북 선제타격 시 북한의 보복과 확전이 불가피하다는 점에서 볼 때 대화와 협상 외에는 다른 해결방안이 없다는 논리로 귀결된다.    중국은 줄곧 무력수단을 통한 북한정권 붕괴와 한반도 통일을 반대해 왔으며 모든 수단을 동원해서라도 기존 대북정책 기조를 유지한다는 입장을 고수해 왔다. 이를 보여주듯 왕이 외교부장은 23일 기자회견에서 한반도 문제에 있어 중국은 일관되고 결연하며 결코 바뀌지 않을 것이라면서 한반도 비핵화 실현과 평화, 안정유지를 위해 평화적인 수단을 촉구했다. 이와 함께 쌍궤병행(雙軌竝行·비핵화 프로세스와 북·미 평화협정 협상)과 쌍중단(雙中斷·북한 핵·미사일 도발과 한·미 연합군사훈련 중단)을 촉구하였다. 여전히 중국에 있어 북한은 사회주의 정치이념을 공유하는 지정학적 완충지대다. 또 중국마저 북한을 포기한다면 북핵 문제 해결은 난망하고 북한 스스로 통제불능 상태에 빠져 중국뿐만 아니라 한반도 전체 안정과 평화가 파괴될 수밖에 없다는 생각을 확고히 갖고 있다.   지난 미·중 정상회담에서 시진핑 주석은 미국의 국익과 실질적 경제이득을 제일 우선시하는 도널드 트럼프 대통령에게 1조 달러 인프라 투자 참여, 미국 제품 대규모 구매, 일자리 창출 등에 적극 동참하겠다는 입장을 보이면서 실질적 양보가 어려운 북한 핵·미사일, 사드문제 등을 놓고서는 일정한 타협점 모색을 시도하였다. 더욱이 트럼프 대통령의 대북정책이 소위 최고의 압박과 관여라 밝히면서 북한 핵·미사일 문제에 대해선 압박 후 대화로 방향을 잡겠다는 입장이다.  향후 북한 핵·미사일 문제 해결을 놓고 미·중 간 다소 갈등이 예상된다. 하지만 미·중 모두 수용 가능한 합의점을 도출한다면 중국이 줄곧 주장한 대화와 협상을 통한 북한 핵·미사일 문제 해결 방식도 전혀 배제할 수 없는 상황이다. 따라서 향후 한반도 정세 추이를 우리의 희망적 사고에서 벗어나 보다 현실적 인식을 토대로 우리가 주도할 수 있는 전략적 해결 방안을 고민해야 할 시기이다. 정재흥 세종연구소 연구위원[국민일보 홈페이지] [페이스북] [트위터][취재대행소 왱!(클릭)]GoodNews paper ⓒ 국민일보(www.kmib.co.kr), 무단전재 및 재배포금지"
"[사설] 뒤늦게 불붙은 '대선공약 재원 논쟁' 더 치열하게 하라","서울경제","[서울경제] 25일 열린 대선후보 4차 TV 토론은 지난 세 차례의 토론과는 확연히 달랐다. 토론이란 이런 것이라는 말이 실감 날 정도다. 이전과 달리 네거티브는 줄고 정책·공약을 둘러싼 후보 간 토론이 뜨거웠기 때문이다. 특히 일자리 공약을 둘러싼 재원 공방은 신선하기까지 했다. 문재인 더불어민주당 후보의 ‘5년간 공공일자리 81만개’ 공약에 대한 유승민 바른정당 후보와 문 후보의 설전은 흥미진진했다.  유 후보가 “9급 공무원 초봉으로 계산해도 1년에 4조3,000억원이 들고 그것만 해도 21조원이 넘는데 4조원으로 공공기관 일자리 64만개를 만든다는 것은 황당하다”고 비판하자 격론이 벌어진 것이다. 문 후보가 “유 후보의 계산 방식이 잘못됐다”고 반박하자 유 후보가 “꼼꼼히 봤는데 계산이 안 맞다”고 재반박했다. 두 후보 간 일자리 재원 논쟁은 이튿날인 26일에도 이어졌다.   윤호중 문 후보 선대위 정책본부장이 이날 기자간담회를 자처해 직접 설명에 나섰다. 그는 “유 후보가 전날 토론회에서 소요재원이 과소책정됐다고 주장한 것은 사실 왜곡”이라고 주장했다. 여기에 안철수 국민의당 후보 진영까지 가세하면서 열기가 더해가는 양상이다. 안 후보 선대위의 김관영 정책본부장은 “문 후보의 소요재원  규모가 너무 비현실적이다. 조달 방안을 이른 시일 내 소상히 밝히고 검증받아야 한다”고 공세를 취했다.   홍준표 자유한국당 후보와 심상정 정의당 후보도 일자리와 노동정책 등을 두고 설전을 벌였다. 법인세·재벌개혁 등에 관한 후보 간 논쟁도 계속되고 있다. 여전히 인신공격, 말꼬리 잡기 등의 구태가 사라지지 않았지만 구체적인 재원 얘기가 오가는 것을 보면 고무적이다. 공약, 무엇보다 재원조달 논쟁은 아무리 많이 해도 지나치지 않다. 당연한 일이다. 10여일 남은 선거기간 동안, 특히 남은 TV 토론회에서는 더 치열한 공약 검증이 이뤄지기를 기대한다.          [서울경제 바로가기]'장미전쟁'의 승자는...5월 대선 실황중계 [바로가기]서울경제의 모든 연재물!... 서경Cube [바로가기▶]저작권자 ⓒ 서울경제, 무단 전재 및 재배포 금지"
"[만파식적] 고등어 보조금","서울경제","[서울경제] 고등어는 등이 높다고 붙여진 회유성 난대 어류다. 이른 봄 제주해역으로 몰려와 수온이 상승하면 서해와 동해로 이동하고 겨울철에는 남하한다. 동국여지승람에는 칼 모양 같다 해서 ‘고도어(高刀漁)’로 불렀고 자산어보를 쓴 정약전은 파란 무늬를 보고 ‘벽문어(碧紋漁)’로 적었다. 옛 문헌에 등장할 정도로 친숙한 고등어는 누가 뭐래도 국민 생선이다. 해양수산개발원이 지난달 실시한 설문조사에서 고등어는 우리 국민이 가장 즐겨 먹는 생선 1위를 차지했다. 무엇보다 가성비가 바다 생선 중 으뜸이다. 저렴한 가격에 식감도 좋고 영양 성분도 풍부하니 서민 밥상에 빠지지 않는다.국민 생선이라는 수식어에 걸맞게 대중가요와 시와 소설에도 곧잘 등장한다. 공지영의 장편 소설 ‘고등어’에서 이 등 푸른 생선은 과거와 현재를 투영하는 매개물이다. 소금에 절여져 좌판에 드러누운 고등어가 현재라면 푸른 바다를 헤엄친 자유와 이상, 뜨거운 신념은 과거다. 그러나 왜 그렇게 힘들게 헤엄쳐 다녔을까 하는 작가의 질문은 열정이 사라진 영혼에 대한 자괴심과 회한의 역설적 표현이다. 국산 고등어를 그물코에 걸어 밥상에 올리기가 갈수록 어려워지는 모양이다. 중국의 남획 탓도 있지만 지구온난화로 고등어 회유 해역이 세계적으로 확산되면서 우리 바다의 어획량이 줄었다. 1998년 45만 톤에 달했던 어획량은 지난해 13만 톤으로 뚝 떨어졌다. 이 틈을 타 몇 년 전부터 값싼 수입산 고등어가 대형마트 좌판에 배를 깔고 드러누웠다. 지난해 수입물량 4만여 톤 가운데 열에 아홉은 노르웨이산이다. 해양수산부가 그제 고등어와 복어 등 10개 수산물에 대해 보조금 지급 공고를 냈다. 자유무역협정(FTA) 체결에 따른 피해보전금이다. 이러다가 고등어마저 추억의 국민 생선 명태 꼴 나지 않을까 슬며시 겁이 난다. 명태는 2008년부터 어획량 제로다. 우리 바다에서 씨가 말랐으니 수입산이 아무리 식탁을 점령해도 보조금 받을 처지조차 못 된다. /권구찬 논설위원 [서울경제 바로가기]'장미전쟁'의 승자는...5월 대선 실황중계 [바로가기]서울경제의 모든 연재물!... 서경Cube [바로가기▶]저작권자 ⓒ 서울경제, 무단 전재 및 재배포 금지"
