"title","press","body"
" [옵스큐라] 이 손가락질은 누구를 향한 것인가 / 신소영 ","한겨레","[한겨레] ‘손가락질’이란 어떠한 대상을 ‘손가락으로 가리키는 짓’과 ‘얕보거나 흉보는 짓’이라고 국어사전에 적혀 있다. 어떤 대상을 가리킨 손가락질은 당사자에겐 얕보거나 흉보는 것으로 느껴질 수 있다. 하물며 사회적 소수자와 약자들에게는 더욱 그럴 것이다. 한 대선후보 토론회에서 사회적 소수자에 대한 혐오감을 조장하는 듯한 발언이 난무했다. ‘그’들이 내뱉은 말은 그저 손가락을 든 행동일지 몰라도 ‘이’들에겐 ‘폭력’이 되어 돌아왔다. 이를 규탄하기 위해 27일 광화문광장에 모인 인권단체 활동가들 앞을 지나가던 한 행인의 손가락질을 보다 보니 손가락질이 새삼 무섭게 느껴진다. 방향이 나를 향하는 것도 아닌데 말이다.  신소영 기자 viator@hani.co.kr‘손가락질’이란 어떠한 대상을 ‘손가락으로 가리키는 짓’과 ‘얕보거나 흉보는 짓’이라고 국어사전에 적혀 있다. 어떤 대상을 가리킨 손가락질은 당사자에겐 얕보거나 흉보는 것으로 느껴질 수 있다. 하물며 사회적 소수자와 약자들에게는 더욱 그럴 것이다. 한 대선후보 토론회에서 사회적 소수자에 대한 혐오감을 조장하는 듯한 발언이 난무했다. ‘그’들이 내뱉은 말은 그저 손가락을 든 행동일지 몰라도 ‘이’들에겐 ‘폭력’이 되어 돌아왔다. 이를 규탄하기 위해 27일 광화문광장에 모인 인권단체 활동가들 앞을 지나가던 한 행인의 손가락질을 보다 보니 손가락질이 새삼 무섭게 느껴진다. 방향이 나를 향하는 것도 아닌데 말이다.  신소영 기자 viator@hani.co.kr   ▶ 한겨레 절친이 되어 주세요! [신문구독] [주주신청][▶ 대선 팩트체크] [페이스북] [카카오톡] [정치BAR][ⓒ한겨레신문 : 무단전재 및 재배포 금지]"
"[사진 속으로]요시다 기숙사","경향신문","Nomura Kanta, Yoshida Dormitory일본이 노벨상 수상자를 최초로 배출한 건 폐망 직후 폐허 속에서였다. 이들은 교토대학교 출신이었다. 1897년 개교 이래 여전히 몇 손가락 안에 꼽히는 명문대. 4차 산업을 이야기하는 21세기에 아마 이 대학 또한 미래 지향적인 연구에 많은 공을 들이고 있을 것이다. 그러나 진짜 교토를 보고 싶어 하는 이들에게 이색적인 방문 장소로 꼽히는 요시다 기숙사에 들어서면 이 학교의 저력이 전혀 다른 곳에 있을지도 모른다는 생각이 들기 시작한다. 1913년 처음 운영을 시작한 이 기숙사는 현재 일본에서 가장 오래된 기숙사이자, 유일한 목조 건물 기숙사이다. 120개의 다다미방을 갖춘 내부에는 200명 정도의 학생이 살고 있고, 학교 당국의 간섭 없이 기숙사 자치회를 통해서만 운영이 이뤄진다.그러나 간타 노무라가 함께 살다시피 하며 촬영한 사진을 보면 내부의 모습은 상상을 초월한다. 철거에 임박한 숙소처럼 이불과 쓰레기는 방방마다 뒹굴고, 공연장으로 바뀐 식당을 대신해 취사는 편한 곳에서 아무렇게나 이뤄진다. 건물 일부는 관리 소홀로 무너지기 일보직전이고, 그런 틈에서 학생들이 키우는 염소나 공작 등이 함께 살아간다. 1년 회비가 몇십만원에 불과하다 보니 유학생이나 고학생에게는 여기만 한 곳이 없고, 심지어는 이곳을 떠날 준비가 안돼서 10년째 학교를 다니는 학생도 있다는 풍문이다. 물론 학교 당국이 이런 상황을 반길 것 같지는 않다. 1960~1970년대 좌파 학생 운동이 활발하던 시기와 1995년 한신대지진을 거치며 학교 당국은 안전과 시설 관리상의 문제로 철거를 주장하고 있다. 이제 이곳은 젊은 지성의 거처라기보다는 셰어 하우스의 원조 혹은 시대를 거스르는 보헤미안들의 안식처 같은 인상도 풍긴다. 그럼에도 취업과 학점에 찌든 우리에게는 여전히 꿈꿀, 아니 최소한 도피할 자유가 있는 해방구처럼 보인다.<송수정 | 전시기획자>▶ 경향신문 SNS [트위터] [페이스북]▶ [인기 무료만화 보기]©경향신문(www.khan.co.kr), 무단전재 및 재배포 금지"
"[먹거리 공화국]참외는 어쩌란 겁니까","경향신문","내 주먹보다 조금 큰 걸 보니 첫물 참외인가 보다. 용달차에는 노란 현수막으로 ‘성주 꿀참외’라 적혀 있고 참외를 담는 비닐봉지도 노란색이다. 참외의 계절이 온다. 전국에 참외 농가가 성주군에만 있는 것은 아니겠지만 그래도 사람들은 참외 하면 성주를 떠올린다. 그런 성주가 갑자기 고고도미사일방어체계(사드) 배치가 결정되면서 참외의 고장에서 ‘사드’의 고장이 돼버렸다. 지난 계절 내내 성주 주민들은 사드 배치 반대 투쟁을 벌이고 있다. 이 와중에 26일 새벽, 기습적으로 사드 배치의 핵심 장비가 성주군 초전면 소성리로 진입했다. 성주 주민들이 다치고 연행되면서 지옥이 펼쳐지는 중이다. 사드 배치는 차기 정권에서 결정할 문제였다며 문재인·심상정 후보는 비판했고, 홍준표·유승민 후보는 잘된 일이라 한다. 안철수 후보는 환경영향평가의 절차상 문제를 언급했다. 사드 배치의 찬반 여부는 대선후보와 그 정당의 이념 지표를 드러내는 일이었고 대선의 주요 이슈이기도 했다. 오로지 ‘국가안보’ 차원에서 말이다.네 번의 대선후보 TV토론회가 있었다. 갑자기 치러지는 대선이니만큼 TV토론은 후보마다 사활을 걸 수밖에 없다. 거친 언사가 오고가기도 하고 정책을 과하게 내지르기도 하지만, 모든 선거의 핵심은 먹고사는 일, 즉 경제 정책에 관한 일이다. ‘바보야, 문제는 경제야’라는 슬로건은 비단 한국의 대선에만 해당하는 말이 아니다. 세계의 모든 선거는 대체로 경제 문제에 집중한다. 그럼에도 너무 길게 이어지는 불황과 실업 문제로 고통을 겪고 있는 한국은 대선후보들의 입에서 어떤 획기적인 대책이 나올지 눈과 귀를 모으고 있다.그런데 네 번의 TV토론에서 서로 약속이나 한 듯이 일언반구도 없는 분야가 농어업을 포함한 먹거리 정책이다. 농어업단체의 초청에 응해서 각 당의 농어업 정책이 발표되기는 했지만 전 TV토론에서는 그 어떤 후보도 말을 꺼내지 않았다. 각 정당과 후보의 농어업 정책을 살펴보면 대체로 좋은 정책들이 쏟아져 있다. 대통령 직속의 농어업기구 설치, 쌀값 보장부터 식량자급률 목표 설정, 농민소득 보장을 위한 농업 예산 확충과 친환경 무상급식 확대(물론 홍준표 후보 빼고)를 내걸고, 귀농 지원과 청년 농부 지원 정책들이 쏟아져 나왔다. 어업 정책도 마찬가지다. 바다 환경을 정화하는 동시에 어족 자원을 확충하고 중국 어선 문제에 단호히 대처하겠다는 좋은 어촌 정책들이 있다. 이대로만 된다면야 농어촌도 살 만하겠다 싶어진다.보통 양보다는 질이라지만 농어업 정책만큼은 발언의 질보단 양이 문제다. 어차피 대다수 국민들은 도시에 모여 살고 후보들의 표밭은 수도권을 비롯한 도시다. 정서적으로 농촌에 닿아 있던 선거는 오랜 과거의 일이 되어버렸으니 짧은 선거 기간에 도시에서 승부를 거는 일이 효율적이라는 판단을 내렸을지도 모른다. 하지만 성주군을 참외와 연결 짓지 않고 오로지 국가안보와 한·미동맹의 문제로만 판단을 내린다. 밀양의 송전탑 싸움이 그랬고 제주 강정마을의 해군기지 건설도 그랬다. 농어촌은 국가의 배후지로 언제든 먹혀도 되는 존재라는 듯 밀어냈다. 땅값도 싸고, 주민들도 적고 힘이 없다는 이유 때문이겠지. TV토론이 두 번 남았다. 경제와 사회 분야에 대한 집중토론이라지만 농어촌 문제가 어디 낄 자리가 있으려나 모르겠다. 가장 먼저 버려진 사회와 경제 부문이 농어촌이니 이번에도 뒷전일까. 사드의 전자파 밑에서 자라지 않은 다디단 성주 참외를 맛볼 수 있는 날이 올해가 마지막이지 않았으면 하는 바람뿐.<정은정 | 농촌사회학 연구자>▶ 경향신문 SNS [트위터] [페이스북]▶ [인기 무료만화 보기]©경향신문(www.khan.co.kr), 무단전재 및 재배포 금지"
"[사설] 사드 배치는 피할 수 없는 선택, 비핵화 전략 뒤따라야","부산일보","그제 새벽 주한미군이 경북 성주에 사드(THAAD·고고도미사일방어체계)를 전격 배치한 것은 불가피한 측면이 있다. 사드는 지금의 삼엄한 한반도 정세 속에서 북한 핵·미사일을 방어하기 위한 최소한의 전략적 무기다. 북한은 핵폭탄을 6~7주에 1개씩 제작할 수 있는 고도한 단계에 이르렀다고 한다. 사드 배치를 두고 찬성 56%, 반대 31%라는 지난해 한국갤럽의 여론 조사 결과는 우리 국민의 선택이 무엇인지를 보여 준다.현재 한반도 정세는 북한의 6차 핵실험을 막기 위해 매우 급박하게 움직이고 있다. 미국은 '모든 옵션'과 '선제타격'을 거론하며 북한에 대한 초강수를 두고 있다. 연 총액 7000억 달러의 절반에 이르는 무역적자를 안기는 중국을 상대로 '무역전쟁'을 벌이지 않는 대신, 북한을 압박하도록 하고 있다. 이런 미국의 수가 '4월 위기설'의 고비를 넘기는 듯하다. 하지만 북한은 25일 300여 문의 포를 끌어모아 사상 최대의 '군종 합동타격시위'를 벌였다. 한반도를 둘러싼 불안과 예측불가성은 현재진행형이다. 이런 판국에 우리 안보를 튼튼히 하는 사드 배치는 피할 수 없는 선택이다.그러나 사드 전격 배치는 논란의 여지가 없는 게 아니다. 대선을 2주도 안 남긴 시점에서 권한대행이 국가 중대사를 결정할 수 있느냐 하는 것과, ""대선 이전엔 어렵고 연말쯤…"" ""차기 대통령이 결정할 문제""라고 했던 국방부와 미국의 말이 거짓말이 됐다는 점, 그리고 절차적 문제 따위가 있다. 대선 후보들은 '환영'뿐 아니라 '유감' '무효' 등 평가를 내고 있다.하지만 사드가 북한 핵·미사일에 대한 억지력을 높이기 위한 것이라면 향후 한반도 정세에 따라 철수할 수도 있을 것이다. 현재 미국의 대북정책은 당면 상황을 모면하는 것이 아니라 결국 북한의 비핵화를 겨냥하고 있다. 최고도의 압박은 협상력을 끌어올리게 돼 있는데 미국이 노리는 점도 이것이다. 긴장의 끝은 대화와 협상이 되어야 하는 것이다. 사드 배치는 불가역적인 것이 아니기 때문에 이후의 북핵 4자·6자 회담을 통해 북한 비핵화를 이끌어 낼 수 있다면 또다시 논의할 수 있는 문제다. 그러기 위해 차기 정부는 우리 주도의 철저한 '한반도 비핵화 전략'을 마련해야 하는 절체절명의 과제를 안고 있다."
"[유종일의 경제 새판짜기]문제는 ‘과잉축적’이다","경향신문","한국 경제의 활력이 예전 같지 않음은 누구나 느끼고 있다. 1인당 국민소득이 10년째 2만달러대에 머무르고 있으며, 성장률이 2%대를 넘어서지 못한 지 오래다. 문제의 핵심은 과잉축적이고, 해법은 경제 패러다임의 근본적 전환이다.과잉축적이란 노동에 비해 자본이 과도하게 많아 자본의 생산성이 낮은 상황을 의미한다. 적은 양의 자본에 많은 노동이 달라붙어 일할 때에 비해 많은 양의 자본에 적은 노동이 달라붙어 일하는 경우에 자본 한 단위의 생산량이 낮은 것은 당연한 일이다. 동일한 원리를 경제성장의 관점에서 본 것이 ‘수확체감의 법칙’이다. 자본이 부족할 때는 자본을 조금만 축적해도 생산을 크게 증가시키지만, 자본이 풍부해질수록 그러한 효과는 작아진다는 것이다. 예를 들어, 경부고속도로를 처음 건설했을 때는 물류 개선에 의한 생산증가 효과가 컸지만 최근 건설한 고속도로들은 그런 효과가 미미하다.수확체감의 법칙 때문에 자본축적에만 의존하는 성장은 지속될 수 없다. 이 문제를 해결하는 궁극적인 해법은 기술진보를 통해 자본의 생산성을 높이는 것이다. 자본축적과 함께 기술진보가 충분히 이루어지면 자본의 생산성이 유지되고 경제성장이 지속되지만, 그렇지 못하면 자본의 생산성은 떨어지고 1인당 소득의 증가율도 하락하게 된다. 따라서 과잉축적은 단순히 인구에 비해 자본이 많이 축적되었다는 것이 아니라, 자본축적의 정도에 걸맞은 기술진보와 생산성 향상이 이루어지지 못했다는 것이다.토마 피케티는 <21세기 자본>에서 자본/소득 비율을 자본주의 경제의 성장과 분배를 분석하기 위한 핵심 지표로 제시한다. 피케티는 이 비율이 높으면 노동소득에 비해 자본소득의 비중이 커진다고 한다. 열심히 노력해서 벌어들이는 소득이 이미 축적된 자본에서 나오는 재산소득에 비해 상대적 비중이 줄어든다는 것이다. 이로써 가진 자와 못 가진 자의 차이가 벌어지고, 심지어 상속부자들이 부와 특권을 독점하는 ‘세습자본주의’가 도래할 수 있다고 경고한다. 그런데 자본/소득 비율은 소득/자본 비율, 즉 자본생산성의 역일 따름이다. (엄밀하게 말하자면 피케티가 말하는 자본은 생산 과정에 투입하는 자본만이 아니라 소득을 발생시키는 모든 형태의 부를 통칭하는 개념이어서, 피케티 비율을 자본생산성의 역이라고 하는 것은 부정확하다. 하지만 대부분의 국부는 직간접적으로 생산에 활용되기 때문에 큰 차이는 없다.) 따라서 피케티가 제기하는 과도하게 높은 자본/소득 비율의 문제는 사실 과잉축적의 문제와 동전의 양면을 이루고 있는 것이다.한국의 피케티 비율은 세계에서 가장 높은 수준이다. 선진국을 대상으로 국부/소득 비율을 평가한 결과 미국 4.45, 영국 4.92, 캐나다 5.03, 독일 5.67로서 국부가 국민소득의 4.5~6배 수준이고, 이 비율이 가장 높은 수준을 나타내는 나라들이 호주 7.07, 프랑스 7.34, 일본 7.95로서 약 7~8배에 이른다. 한국은행 자료에 의하면 2012년에 한국의 피케티 비율은 무려 9.45였다. 분배의 측면에서 보아도, 한국은 과잉축적의 문제를 여실히 드러내고 있다. 선진국들에 비해 자본소득 비중은 매우 높고 노동소득 비중은 매우 낮으며, 가진 자와 못 가진 자의 격차가 커지고 있다. 젊은이들은 이런 현실을 ‘수저계급론’으로 풍자하고, 자영업자들은 ‘조물주 위에 건물주 있다’고 자조한다. 또한 피케티의 우려를 증명하기라도 하듯이 한국은 자수성가한 부자는 적고 상속부자의 비율이 세계에서 가장 높은 나라가 되었다. 세습자본주의에 가까워지고 있는 것이다. 미국 피터슨국제경제연구소(PIIE)의 분석에 의하면, 2014년 기준으로 한국인 억만장자 중 상속부자의 비율은 74.1%로 세계 최고 수준이었다. 이 비율이 중국과 일본에서는 각각 2%와 18.5%에 불과했으며, 미국은 28.9%, 유럽도 35.8%에 그쳤다.과잉축적은 한국 경제의 활력을 죽이고 분배를 악화시키는 근본 원인이며, 그 근저에는 박정희 패러다임이 존재한다. 박정희 모형의 핵심은 정부 주도의 급속한 산업화 전략이며, 이는 투자율 제고와 자본축적 가속화를 요구했다. 이 전략을 실현하기 위해 정부는 자본에는 특혜를 주고, 노동운동은 탄압하여 저임금 노동을 강요했다. 인구과잉 시대에 이러한 전략은 주효했고, 그 결과는 고도성장이었다. 성장 과정에서 자본도 빠르게 축적되었고, 1980년대 말 ‘3저호황’ 이후에는 자본과잉의 시대가 시작되었다. 그럼에도 불구하고 경제정책은 인구과잉 시대의 친자본·반노동 기조를 유지해왔다. 지금도 우리나라는 세계은행의 ‘기업하기 좋은 나라’ 지수에서 세계 최상위를 기록하는데, 국제노동조합연맹의 ‘노동자의 권리’ 평가에서는 세계 최하위 수준에 있다.한국의 높은 피케티 비율 혹은 과잉축적 문제가 한국의 1인당 자본스톡이 미국이나 프랑스보다 많아서 발생하는 것은 아니다. 당연히 미국이나 프랑스의 1인당 자본이 우리보다 훨씬 많다. 문제는 우리의 생산성이 낮아 자본에 비해 소득이 낮은 것이다. 따라서 과잉축적은 결국 기술진보, 즉 혁신이 부진한 결과라고 할 수 있다. 그러나 역대 정부는 항상 투자 부진을 문제의 근원으로 진단하고 자본을 더욱 우대함으로써, 법인세 인하나 규제완화 등을 통해 투자를 증대하려는 정책을 취해왔다. 이는 본말이 전도된 것으로 과잉축적의 문제는 심화할 뿐이었다. 반면 노동시장 유연화로 포장된 노동하대 정책은 극단적 저출산과 인구절벽을 초래하여 자본과잉 문제를 더욱 악화시키고 있다. 노동을 하대하니 아이를 낳아 기를 능력도 떨어지고 그러고 싶은 마음도 사라지며, 인적 자본의 질도 떨어지는 것이다.과잉축적 문제 해결의 출발점은 자본에 대한 규제와 과세를 강화하고, 노동 보호와 복지를 확대하는 것이다. 자본이 아닌 사람을 우대하는 방향으로 경제 패러다임을 전환하는 것이다. 박정희의 딸 박근혜가 탄핵되었고, 이제 곧 새 대통령을 선출한다. 박정희 패러다임을 영원히 땅에 묻고 근본적인 전환을 이루는 계기가 되어야 할 것이다.<유종일 | KDI 국제정책대학원 교수>▶ 경향신문 SNS [트위터] [페이스북]▶ [인기 무료만화 보기]©경향신문(www.khan.co.kr), 무단전재 및 재배포 금지"
"[여적]오바마의 고액 강연","경향신문","흔히 탐욕스러운 자본가나 기업가를 비난할 때 ‘살찐 고양이(Fat Cat)’라는 말을 쓴다. 이 말은 1920년대 미국에서 처음 등장할 때부터 부정적 의미를 담고 있었다. 선거에 영향력을 행사하기 위해 거액을 기부하는 부자를 뜻했기 때문이다. 그러다 2008년 세계금융위기 이후 현재 의미로 굳어졌다. 당시 금융위기를 극복해야 했던 버락 오바마 미국 대통령은 임기 동안 월가 은행가들을 자주 ‘살찐 고양이’에 비유했다. 그는 2009년 CBS 방송 <60분>과의 인터뷰에서 “나는 월가의 살찐 고양이 은행가 무리를 도우려고 출마하지 않았다”고 말하기도 했다. 심지어 자신의 후계자인 힐러리 클린턴 전 국무장관의 월가 고액 강연에 대한 비난도 서슴지 않았다.‘살찐 고양이’ 비난이 오바마에게 부메랑이 돼 돌아왔다. 오바마가 오는 9월 월가 투자은행 캔터 피츠제럴드가 주최하는 보건 관련 회의에서 오찬 기조연설자로 나서는 대가로 40만달러(약 4억5000만원)를 받기로 계약했다고 미 언론들이 25일 보도했다. 오바마에게 위선적이라는 비난이 쏟아졌다. 강연료 40만달러는 전임자들과 비교해도 고액이다. 퇴임 대통령으로 고액 강연료를 처음 챙긴 이는 제럴드 포드였다. 그의 몸값은 4만달러였다. 가장 몸값이 높았던 빌 클린턴은 20만~50만달러였다. 특히 클린턴이 부인과 함께 챙긴 강연료는 천문학적 수준이다. CNN에 따르면 이들은 2001년부터 2015년 5월까지 총 729회 강연을 해 1억5367만달러를 벌었다. 논란이 된 월가 투자은행을 대상으로 한 것도 39차례 770만달러나 됐다. 이 가운데 클린턴 전 장관도 골드만삭스 3회 등 5개사에서 8차례의 강연으로 180만달러를 받았다. 이 사실이 지난해 대선 과정에서 위키리크스의 폭로로 드러나면서 클린턴은 곤욕을 치렀다.백악관을 떠나기 전부터 오바마의 몸값이 퇴임 대통령으로서 최고가 될 것으로 예상됐다. 지난 2월 맺은 그와 부인의 회고록 계약금은 6000만달러에 이르는 것으로 알려졌다. 이번 논란은 그의 천문학적인 몸값을 재확인시켜준 것이다. 하지만 퇴임 대통령으로서 공식 활동을 시작하자마자 이미지에 큰 타격을 입게 됐다.<조찬제 논설위원>▶ 경향신문 SNS [트위터] [페이스북]▶ [인기 무료만화 보기]©경향신문(www.khan.co.kr), 무단전재 및 재배포 금지"
