"title","press","body"
"[이굴기의 꽃산 꽃글]조개나물","경향신문","내 고향 거창에서의 대처는 대구였다. 1960년대 너나없이 농촌을 떠나 도회로 진출할 때 솔가하여 대구에 터를 잡은 분들이 많다. 그런 연유로 예전에는 결혼식, 최근에는 장례식에 가려고 종종 대구를 찾는다. 며칠 전의 대구행은 그런 행사가 아니라 꽃산행이었다.출발-도착만 있는 기차여행은 인간이 풍경과 소통하면서 얻는 애틋한 감정을 생략해 버린다. 아무리 먼 길이라도 아침에 떠나면 저녁은커녕 이슬이 마를 무렵이면 어디든 도착한다. 이름에서부터 많은 생각을 들게 하는 대구 불로동에 들어서니 공기 속에 색다른 사연이 섞여 있는 것 같다. 삼국시대에 조성되었다는 210여 기의 무덤들이 밀집한 불로동 고분군. 불로(不老)라 했지만 죽음까지는 막을 수는 없었던가. 탱자나무로 울타리 했지만 해마다 무덤은 늘어나고, 봄마다 새파랗게 새롭게 살아나서 다종다양한 야생화를 기르고 있었다.이곳은 무덤이 도심에 있는 게 아니라 사람들이 무덤 주위까지도 침범해 들어간 형국이다. 이미 죽음과도 많이 친해진 듯 무덤 사이로 길이 반질반질하게 나 있다. 고은의 절창 ‘문의(文義) 마을에 가서’의 한 대목이 떠오르는 풍경이 아닐 수 없었다. “겨울 문의에 가서 보았다/ 거기까지 닿은 길이/ 몇 갈래의 길과/ 가까스로 만나는 것을/ 죽음은 죽음만큼 길이 적막하기를 바란다.”유서 깊은 동네의 음덕을 입었는지 이곳에는 귀한 야생화들이 차례차례 다녀간다. 이름을 잃고 아라비아 숫자로만 남은 어느 무덤 앞을 점령한 것은 조개나물이었다. 꼿꼿한 줄기 위에 층층의 다락방 같은 구조이다. 잎겨드랑이마다 입술 모양의 보랏빛 꽃들이 늠름하게 달려 있다. 이렇다 할 향기가 없지만 벌들이 쉬지 않고 출입하고 있다.늙지 않는다는 동네의 지하에서 갓 올라온 꽃들은 발등 높이다. 따지고 보면 결혼-장례-무덤으로 이어지는 시간도 요만한 길이에 불과하지 않을까. 무덤에서 뻗어나간 길이 아파트를 꽉 껴안고 있는 풍경을 배경으로 그런 생각도 해보면서 셔터를 눌렀다. 조개나물, 꿀풀과의 여러해살이풀.<이굴기 | 궁리출판 대표>▶ 경향신문 SNS [트위터] [페이스북]▶ [인기 무료만화 보기]©경향신문(www.khan.co.kr), 무단전재 및 재배포 금지"
"[래빗GO] 안철수, ""밥 줘"" 성평등 또 설명한 속내는?","한국경제","8일 '세계 여성의 날' 행사에서 말한 ""밥 줘"" 이야기""밥 줘!"" 이야기를 다시 꺼내든 이유는?[ 신세원 기자  ] #[영상] 안철수가 말하는 ""밥 줘""의 의미는?안철수 국민의당 대선 후보가 24일 한국 YWCA 연합회 강당에서 열린 성평등 정책 간담회에서 ""성평등 대통령이 되겠다""고 약속했습니다.안 후보는 지난 대선 때를 떠올리며 ""5년 전. 어떤 분이 후보들 공약이 대부분 비슷한데 누구를 선택해도 똑같지 않냐고 질문했었다""고 말했습니다.이에 안 후보는 ""정책은 비슷할 지 몰라도 리더의 의지와 가치관은 다르기 때문에 다른 결과를 낼 수 있다고 말했다""고 했는데요.이어 ""이런 생각은 곧 성평등 정책에도 반영 될 수 있다""고 말하며 타 후보와 성평등 실천 의지가 다르다는 점을 강조했습니다.#[영상] '세계여성의 날' 행사에서 '대세'로 떠오른 심상정그런데, 안 후보가 ""밥 줘라는 말을 해본 적이 없다""고 말한 건 지난 8일 '세계 여성의 날' 행사에서도 찾아볼 수 있습니다. 그 때는 ""밥 줘""라는 말이 어색했던 분위기를 어떻게든 바꾸려고 했던 노력의 표시였는데요.당시엔 안 후보의 의도와는 다르게 일부 독자들이 ""그게 자랑할 일이냐?"", ""표 받기 위한 소리 아니냐""는 비판을 하기도 했습니다.그래서 이 날 간담회에서는 밥 줘 2편, '부연 설명'의 성격이 짙어보였습니다. 안 후보는 ""저희 부부는 먼저 퇴근하는 사람이 저녁식사를 준비했다. 같이 맞벌이하는 입장에서 누가 누구보고 밥 달라고 할 권리가 있는거냐""며 이전과 달리 이야기를 부드럽게 풀어내려는 모습을 보였습니다.그러면서 안 후보 자신은 ""성평등이 몸에 밴 삶을 살아왔다""고 말했는데요. ""밥 줘라는 말을 해본 적이 없다""는 말을 농담으로 전했던 지난 행사 때와 달리 이번에는 '성평등 실천가' 또는 부드러운 이미지를 강조하는 모습이 보였습니다.# 래빗GO ? 사건사고 · 시위 현장, 주목받는 장소, 전시 · 박람회, 신규 매장 등을 찾아 공간이 지닌 의미 및 특징을 보여드립니다. 뉴스래빗의 시각과 평가가 담긴 이미지, 영상을 통해 독자가 현장감을 간접 체험할 수 있도록 도와드립니다. '뉴스래빗'에서 더 많은 이야기를 만나보세요.책임 = 김민성, 연구 = 신세원 한경닷컴 기자 tpdnjs0227@hankyung.com뉴스래빗 페이스북 facebook.com/newslabit기사제보 및 보도자료 newslab@hankyung.com[한경닷컴 바로가기] [스내커] [모바일한경 구독신청] ⓒ 한국경제 & hankyung.com, 무단전재 및 재배포 금지"
" [한겨레 사설] 검찰·국정원 대수술할 의지와 로드맵 있나 ","한겨레","[한겨레] 23일 열린 3차 텔레비전 토론의 주요 의제는 권력기관 개혁 문제였으나, 5명의 대통령 후보들이 내놓은 검찰과 국정원 개혁 방안은 대부분 원론적 방향과 윤곽을 제시하는 수준에 그쳐 실망스럽다. 물론, 텔레비전 토론만으로 각 후보의 권력기관 개혁 공약을 평가하기란 쉽지 않다. 그러나 국정원과 검찰을 비롯한 권력기관은 자세한 공약을 제시하더라도 실제 집권하면 저항에 밀려 개혁을 추진하기가 쉽지 않다. 그런 만큼 더욱 강력한 의지 표명과 매우 구체적이고 실질적인 로드맵의 제시가 필요하다. 후보들은 권력기관을 대수술하라는 국민의 요구가 매우 크다는 점을 마음 깊이 되새겨야 한다.  우선, 2시간 남짓 텔레비전 토론의 대부분을 색깔론과 네거티브 공방에 허비하느라 정작 권력기관 개혁을 다룬 시간은 채 10분도 되지 않았다는 점을 지적하지 않을 수 없다. 이에 앞서 열린 두 차례의 토론회에서도 권력기관 개혁 문제를 꺼낸 후보는 없었다. 최근 주요 쟁점으로 떠오른 법원행정처 등 사법 개혁에 대한 논의도 한마디 없었다. 후보들이 그동안 거론됐던 개혁 방안을 백화점식으로 열거하는 데 그친 점도 준비가 부족하다는 걸 드러내는 대목이다.  문재인 더불어민주당 후보와 안철수 국민의당, 유승민 바른정당, 심상정 정의당 후보는 모두 검찰 개혁의 핵심으로 꼽히는 고위공직자비리수사처(공수처)를 설치하겠다고 했다. 하지만 홍준표 자유한국당 후보가 “공수처는 새로운 검찰청을 하나 더 만드는 것”이라며 반대하자 누구 하나 제대로 반론을 펴지 못했다. 유승민 후보가 속한 바른정당이 지난 2월 국회에서 공수처 법안을 공식 반대했다는 사실을 지적하는 후보도 없었다. 공수처 수사 대상인 공무원의 범위와 적용 범죄, 수사처장의 자격 요건 등 구체적 쟁점에 대한 얘기는 일절 나오지도 않았다. 10년 넘게 공수처 설치가 표류한 원인 가운데 하나가 바로 세부 쟁점을 둘러싼 논란 탓이란 점을 고려하면, 과연 대통령 후보들에게 강력한 검찰 개혁 의지가 있는 건지 의문이 들 정도다.  댓글 공작 등 범죄행위가 밝혀진 국정원의 개혁 문제가 지나치게 소홀하게 다뤄진 점도 문제다. 홍준표 후보를 제외한 문재인·안철수·유승민·심상정 후보가 국정원 개혁을 약속했지만 역시 구체성이 결여된 피상적인 수준을 넘지 못했다. 중앙선관위에 제출하는 10대 공약에 ‘국정원 개혁’을 포함한 이는 5명 중 문재인 후보가 유일했다.  권력기관 개혁에 대한 국민 요구는 크지만 이를 직접 실행에 옮기는 건 매우 어려운 일이다. 세밀하고 치밀하게 준비해도 기존 권력기관들의 강력한 반발과 방해공작에 부닥칠 게 틀림없다. 촛불 민심에서 비롯한 이번 대선이야말로 권력기관 개혁의 동력을 마련할 절호의 기회라는 걸 모든 후보들은 명심하길 바란다. ▶ 한겨레 절친이 되어 주세요! [신문구독] [주주신청][▶ 대선 팩트체크] [페이스북] [카카오톡] [정치BAR][ⓒ한겨레신문 : 무단전재 및 재배포 금지]"
"[청춘직설]지도자의 두 가지 조건, 다섯 가지 덕목","경향신문","아쿠타가와 류노스케의 ‘덤불 속’은 하나의 시체에 대한 세 사람의 진술로 이루어진 소설이다. 한 사람은 범인으로 의심되는 도둑, 나머지 두 사람은 아내와 죽은 남편의 혼령. 기이한 것은 이들 셋이 모두 자신이 범인이라고 주장한다는 것이다. 이 작품을 영화화한 구로사와 아키라 감독의 <라쇼몽>도 이 셋의 진술대로 사건을 재현할 뿐, 어떤 것이 진실인지에 대해 명확히 밝히지 않고 있다. 이 이야기에 대한 손쉬운 잣대는 “객관적 사실은 없다. 해석만이 있을 뿐이다”라고 했던 니체를 따르는 것이다. 사실관계보다 더 중요한 것은, 모두 각자 자신만의 원근법에 의해 사실을 재구성하고 때론 왜곡한다는 것. 그러나 여기서 보다 중요한 것은 그렇다면 그들은 ‘왜 그것을 사실로 믿게 되었는가’이다. 여기에는 단순히 ‘자기합리화’라고만 할 수 없는 복잡한 욕망과 무의식의 기제가 작동한다.대선 토론을 보면서 곳곳에 놓인 ‘덤불 속’을 발견한다. 그제 3차 토론에서 있었던 ‘북한인권결의안’에 대한 공방은 마치 사오정 개그를 연상하게 한다. ‘물어봤습니까’ ‘아닙니다’ ‘물어봤다지 않습니까’ ‘진실이 아닙니다’라는 되풀이는 ‘팔계야 어디가’에 ‘목욕탕’이라고 거듭 답하는 저팔계의 말을 무시하고, ‘아~ 난 또 목욕탕 가는 줄 알고’라고 답하는 사오정의 판박이다. 합리적 보수로 자처하는 이성에도 강고한 욕망이 작동하고 있는 것이다.가짜 뉴스가 판치고 흑색선전이 난무하는 지금, 매스컴과 후보들의 사실 주장은 모두 사실이 아니라 저마다의 무의식적 욕망을 담은 ‘선택된 사실’이자 ‘왜곡된 사실’일 경우가 많다. 누구도, 어떤 사실도 그런 욕망과 이념에서 자유로울 수 없다면, 그 욕망이 지향하는 바가 무엇인지를 물어야 한다. 그런 의미에서 대선 토론에서 눈여겨보아야 하는 것은 후보자들의 응답보다 질문이다. 흔히 응답자가 더 큰 권력을 쥐고 있다고 생각하기 쉽지만, 그렇지 않다. 답변자는 질문자가 깔아놓은 물음이라는 매트릭스와 프레임을 따라야 하기 때문에 그의 자유는 제한된다. 한 나라의 지도자는 다음과 같은 조건을 갖춰야 한다고 생각한다. 첫째, 일단 법의 경계 안에 있는 사람이어야 한다. ‘피의자’와 같이 경계를 넘나드는 대담한 분은 더 큰 판에서 활약해야 한다. 둘째, 어른이어야 한다. 어른은 스스로를 통제하고 책임지는 주인을 의미한다. 누군가에게 인정받기 위해 끊임없이 물어보고, 거기에 반항하거나 반응하는 것으로 일관하는 것은 어른이 아니다. 또한 어른은 자신이 누구인지 스스로 결정하는 자이다. ‘내가 누구입니까’라고 자신의 정체성을 남에게 묻고 확인받으려는 자는 아직 어른이 아니다. 그리고 어른은 삐지거나 토라지지 않는다. 정직하게 타인의 잘못에 대해 질책할 수는 있지만, 얼굴을 보지 않는 등의 유치한 행동은 하지 않는다. 그리고 어른은 모욕과 비난을 견딜 수 있어야 한다. 타인의 비난에 대해 ‘그만 좀 괴롭히십시오, 아휴, 실망입니다’와 같은 투정은, 더 큰 수난을 감내해야 하는 지도자에게는 있을 수 없는 멘탈이다.그렇게 해서 남은 어른 중에 지도자는 다음과 같은 중요한 덕목을 갖춰야 한다. 첫째, 타인과 진정으로 소통할 줄 알아야 한다. 소통(communicate)은 함께(com) 나누는(municate) 것이다. 질문을 했으나 자신의 질문에만 사로잡혀 타인의 말을 듣지 않는 것은 대화가 아니다. 둘째, 자신의 철학과 언어가 있어야 한다. 참모의 말, 소셜미디어에 부유하는 말로 무장한 후보는 자신의 철학과 언어가 없는 자이다. 즉, 지도자의 언어는 그 사람과 밀착되어야 하지, 과거 지도자처럼 유체이탈 화법을 구사해서는 안 되는 것이다. 셋째, 곤혹과 딜레마를 알아야 한다. 정의실현과 정책을 교과서 같은 진공 상태에서 고민하는 것이 아니라, 복잡한 현실의 실타래 속에 놓고 볼 줄 알아야 한다. 쉽게 타인을 타매하고 배제하고 명쾌한 답을 내는 것은 쉽지만, 그것은 바깥에 있거나 상황 속에 있지 않을 경우이기 쉽다. 넷째, 지도자의 대타자, 즉 그가 눈치 보아야 하는 대상은 국민이어야 하지 어떤 특정인이거나 권력이어서는 안 된다. 다섯째, 지도자는 그가 이끄는 국민들을 모두 다 데리고 가야겠다는 원대한, 불가능한 꿈을 꾸는 자여야 한다. ‘그 모두’를 데리고 가는 일이 아무리 끔찍하고 힘들더라도, 최대한 설득하고 달래고 위협하고 혼내서라도 함께 가야지 버리고 가는 자가 되어서는 안 된다. 그 모두에는 ‘청년, 노인, 여자, 노동자, 재벌, 동성애자, 장애인’ 등도 포함되어 있을 것이고 이웃인 ‘북한, 미국, 중국과 세계’까지도 고려할 수 있어야 한다.<정은경 | 문화평론가>▶ 경향신문 SNS [트위터] [페이스북]▶ [인기 무료만화 보기]©경향신문(www.khan.co.kr), 무단전재 및 재배포 금지"
"[박용채 칼럼]기업 기득권에 기웃거리지 마라","경향신문","대선 열기로 ‘박근혜 뉴스’는 뒷전이지만 ‘30분 독대에 승마 얘기 15분’ 대목만큼은 쉬 넘어가지 않는다. 2015년 7월25일 삼성 이재용 부회장과 최지성 미래전략 실장, 박상진 대외협력 사장 간의 3자 회동이 열렸다. 이 부회장이 당일 오전 박근혜 대통령을 독대한 뒤의 대책회의였다. 특검 증언으로 본 박 대통령과 이 부회장 간의 독대 분위기는 이렇다. “대통령을 30분가량 만났는데 15분을 승마 이야기를 하더라. 올림픽에 나가려면 좋은 말도 사고 전지훈련도 가야하는데 삼성이 아무것도 안 한다고 한다. 대통령 눈빛이 레이저빔 같을 때가 있다는 기사를 봤는데 무슨 말인지 알겠더라.” 물론 이 증언은 특검과 삼성이 정유라 지원금을 놓고 뇌물과 강요를 다투는 상황에서 후자를 강조하는 차원에서 나왔을 것이다. 그럼에도 대통령이 총수를 만나 최순실의 딸 뒤를 봐주지 않는다고 면박을 줬다는 것에는 말문이 막힌다.재벌은 늘 대통령을 감히 쳐다볼 수 없는 상석이라고 말한다. 하지만 꼭 그런 것만도 아니다. 사실 양자의 대결은 늘 재벌의 승리로 끝났다. 박정희·전두환·노태우 등 권위주의 정권 시절에도 재벌은 권력의 입안에 혀가 되어 덩치를 키워왔다. 김영삼, 김대중, 노무현, 이명박은 물론 박근혜 시절이라고 예외는 아니다. 비즈니스 프렌들리를 외쳤던 이명박을 제외하고 모두가 개혁과 상생을 내세웠지만 이내 재벌 편에 섰다. 기업 돈은 받지 않겠다며 호기를 부렸던 김영삼은 세계화에 따른 재계의 협조가 절실해지면서 타협했고, 김대중은 외환위기 극복과정에서 신자유주의에 노출되면서 노동권을 약화시켰다. 재벌개혁을 강조했던 노무현도 소득 2만달러, 개방을 통한 성장 등 재계의 요구를 국정과제로 삼았다. 경제민주화로 당선된 박근혜는 잉크가 마르기도 전에 경제활성화로 갈아탔다. 한결같이 기업하기 좋은 나라를 맨 앞에 뒀고, 규제완화 등 당근을 안겨줬다.대선이 종반으로 치달으면서 후보들의 공약이 모습을 갖춰가고 있다. 문재인, 안철수, 홍준표, 유승민, 심상정 후보는 촛불의 정경유착 근절 명령에 걸맞게 징벌적 손해배상제·집단소송제 도입, 총수일가 일감 몰아주기 근절 등 재벌개혁을 약속했다. 그러면서도 대한상의 주체 토론회에서는 ‘기업을 살릴 적임자’라고 말한다. 문재인은 “내가 반기업적이라는 생각을 가진 분이 있다면 참여정부 때를 생각해보라. 정권이 기업에 부당한 요구를 하지 않으니 기업하기가 더 좋지 않았나”라고 반문했다. 안철수는 “22년 전 창업을 해봐서 산업구조나 경제구조 문제점을 잘 안다. 실력으로 대기업이 될 수 있는 구조를 만들겠다”고 말했다. 물론 재벌 개혁과 기업하기 좋은 나라를 만드는 것은 엄연히 다르다. 전자는 공정한 시장질서를 만드는 것이고, 후자는 기업들이 맘껏 뛰놀 수 있는 기업환경을 정비하는 것이다. 하지만 따져보자. 상의는 17만명이 회원으로 가입한 경영자 이익단체다. 상법 개정안 도입, 비정규직 철폐, 법인세 인상, 근로시간 단축 같은 개혁 이슈에 부정적이다. 이들 앞에서 기업을 살리겠다고 얘기하는 것은 개혁하지 않겠다는 말과 다름없다. 오히려 “최저임금과 근로시간 단축은 여러 우려가 있지만 바뀌어야 한다”(유승민), “비정규직 문제는 사회 모두가 고통을 감내해야 하는 문제”(심상정)라고 말하는 게 솔직하다. 주요후보들은 일자리, 복지 공약을 내걸면서도 재원 부분 마련에 대해서는 말꼬리를 흐린다. 기업을 의식한 결과이다.우리는 그간 기업이 잘돼야 국민이 잘된다는 믿음 속에 살아왔다. 하지만 결과는 달랐다. 2000~2014년 기간 중 국내총생산 누적 성장률은 73%였지만 가계의 실질소득 누적증가율은 30%에 불과했다. 국민 총소득에서 가계소득으로 배분된 몫은 6%포인트 줄었지만 기업소득 비중은 7%포인트 늘었다. 성장의 과실을 기업이 독차지한 셈이다. 금융위기 이후 신자유주의는 수명을 다한 것으로 여겨졌지만 여전히 시장개방, 작은 정부, 기업 기 살리기 같은 모습으로 대로를 활보하고 있다. 한국 경제와 산업이 구조적 함정에 빠졌다는 것은 의심의 여지가 없다. 대외외존도가 커 외풍에 쉽게 흔들린다. 내수를 키워야 하지만 저출산·고령화로 운신의 폭이 좁다. 전통산업은 중국에 따라잡혔고, 첨단 부분은 선진국과의 격차가 심해 언감생심이다. 그럼에도 대선후보들이 내놓은 4차 산업혁명은 부처 개편 수준을 벗어나지 못하고 있다. 지금과 같은 상황이라면 재벌에 언제 다시 손을 벌려도 이상하지 않다. 하지만 자본은 결코 선하지 않다. 시민과 자본 사이의 줄타기 결과는 재벌개혁·경제 민주화 실패, 경제불평등 심화로 이어졌다. 기득권에 추파를 보내고 기웃거릴 거라면 애초부터 개혁 얘기는 꺼내지도 마라.<박용채 논설위원>▶ 경향신문 SNS [트위터] [페이스북]▶ [인기 무료만화 보기]©경향신문(www.khan.co.kr), 무단전재 및 재배포 금지"
"[여적]39세 대통령","경향신문","미국 역사상 가장 어린 나이에 대통령이 된 이는 시어도어 루스벨트였다. 1901년 9월 전임자 윌리엄 매킨리 대통령이 암살되자 부통령이던 그가 직을 이어받았다. 만 42세였다. 1904년 대선에서 당선된 그는 선출된 사례로도 미 대통령 가운데 2번째로 어렸다. 선출된 최연소 대통령은 만 43세의 존 F 케네디다. 현재 국가 지도자 가운데 가장 어린 이는 북한 김정은 노동당 위원장이다. 1982~84년생으로 알려진 김정은은 2011년 12월 김정일 국방위원장 사망 후 최고지도자가 됐으니 당시 20대 후반~30대 초반이었다. 독재국가나 세습왕국에서는 김정은보다 어릴 때 승계한 이가 제법 있다. 아버지 ‘파파 독’(프랑수아 두발리에)이 사망하자 대통령직을 이어받은 아이티의 독재자 ‘베이비 독’(장 클로드 두발리에 대통령·사망)은 19세에 대통령이 됐다. 스와질란드 국왕 음스와티 3세(49)는 1986년 18세 나이로 즉위했다. 부탄 국왕(37)은 26세에 왕위를 계승했다. 프랑스에서 30대 대통령의 탄생을 눈앞에 두고 있다. 주인공은 지난 23일 치러진 대통령선거 1차 투표에서 1위를 차지한 중도정당 ‘앙마르슈(전진!)’의 에마뉘엘 마크롱 후보로 39세다. 여론조사 결과 그는 다음달 7일 치러질 결선투표에서 극우정당 민족전선의 마린 르펜 후보를 누를 것으로 점쳐진다. 그럴 경우 현대 프랑스 역사상 최연소 대통령이자 서방 주요국 가운데 가장 젊은 지도자가 탄생하게 된다. 마크롱은 유럽연합(EU) 내 경쟁자인 앙겔라 메르켈 독일 총리(63)나 테레사 메이 영국 총리(61)보다 20살 이상 젊다. 현재 EU 내 최연소 지도자는 2015년 43세에 대통령이 된 폴란드의 안제이 두다(45)다.프랑스 역사상 30대에 최고 지도자에 오른 유명인으로는 나폴레옹이 있다. 프랑스혁명 후 1804년 제1제정 때 황제가 된 나폴레옹의 나이는 만 35세였다. 마크롱을 나폴레옹과 비교할 수는 없다. 다만 나폴레옹의 등장이 시대의 산물이었듯 마크롱의 부상도 그러하다. 프랑스의 좌우를 대표하는 기존 정당은 국민들의 바람에 부응하지 못했다. 그가 4선에 도전하는 메르켈 독일 총리나 ‘럭비공’ 도널드 트럼프 미 대통령에게 어떻게 맞설지 벌써 궁금하다.<조찬제 논설위원>▶ 경향신문 SNS [트위터] [페이스북]▶ [인기 무료만화 보기]©경향신문(www.khan.co.kr), 무단전재 및 재배포 금지"
