"title","press","body"
"[기고]4차 산업혁명과 블록체인 혁신","머니투데이","[머니투데이 김화동 한국조폐공사 사장] 최근 신문에 거의 매일 빠지지 않고 등장하는 단어가 있다. 바로4차 산업혁명이다. 사회현상이나 혁신이론을 연구하는 사람들에게 ‘혁명’이란 단어는 매우 특별한 의미를 가진다. 패러다임이 바뀌는 수준의 메가톤급 변화에 ‘혁명’이라는 말을 붙인다. 과학철학의 한 획을 그은 토마스 쿤은 이러한 혁명적 변화를 천동설에서 지동설로의 가치관 변화를 예로 들어 설명하였다. 지구 중심의 우주관이 태양 중심의 우주관으로 바뀌는 정도는 되어야 ‘혁명’이라고 할 수 있다는 것이다.  4차 산업혁명은 무엇에 관한 혁명적 변화일까? 4차 산업혁명의 시작을 널리 알린 2016 다보스포럼에서는 ‘4차 산업혁명은 생산방식의 혁명뿐만이 아니라 사회전반에서 기존 사고방식의 틀을 깨뜨리는 파괴적 혁신 현상’이라고 정의했다. 그리고 그 중심에는 인공지능(AI), 빅데이터, 초연결, 블록체인이 있다고 선언했다. 4차 산업혁명은 세상의 모든 것이 인공지능과 빅데이터의 도움을 받아 온라인으로 연결되는 초연결 사회가 특징이다. 블록체인은 그 연결에 신뢰를 부여해주는 기술이라고 볼 수 있다. 인공지능, 빅데이터, 초연결, 블록체인 이 모두 중요하지만 특히 블록체인이 부여하는 온라인 세상에서의 신뢰가 없다면 4차 산업혁명은 성공하기 쉽지 않다.블록체인이 가져올 혁명적 변화는 두 가지로 요약할 수 있다. 첫째 ‘거래’라는 관점이 달라진다. 예를 들어 A와 B가 1000원을 주고받는 거래의 경우 실물 화폐를 통하면 1000원권 화폐를 주고받으면 거래가 끝난다. 그러나 온라인에서는 주고 받는 실체가 없다. 정보만이 네트워크를 통해 전달될 뿐이다. 온라인 상에서는  A의 1000원이 B에게 이동했다는 거래정보와 B가 A로부터 1000원을 받았다는 거래정보에다 A와 B 그리고 이를 지켜보는 사람들이 동의하면 거래가 완성된다. 즉 거래이력정보에 대한 참여자들의 동의가 핵심이다. 둘째는 ‘공개를 통한 보안’이다. 지금까지 실물화폐의 거래에서는 한국은행과 같은 중앙은행이나 제3의 기관이 독점적으로 관리하거나 거래를 증명했다. 하지만 중앙집중이라는 특성으로 인해 해킹이나 범죄적 공격에 따른 취약성이 번번이 제기돼 왔다. 그러나 블록체인은 거래정보를 ‘폐쇄’에서 ‘공개’로 전환시켜 이를 해결했다. 거래정보이력을 특정인이 아닌 모든 참여자에게 공유토록 해 온라인상에서의 새로운 신뢰개념을 탄생시킨 것이다. 부당한 목적으로 거래이력을 조작하거나 이중거래를 하기 위해서는 거래이력들이 쌓여져 있는 중간 블록을 바꾸어야 한다.이를 위해서는 새로운 거래이력 블록이 형성되기 이전에 공유된 모든 거래이력 블록의 정보를 바꿔야 하는데 이는 전 세계 컴퓨팅 파워의 50% 이상을 독점하지 않고서는 불가능하다.블록체인의 혁명성에 기반한 사회변화는 이미 전 세계에서 시작되고 있다. 에스토니아는 2015년 블록체인 전자시민증을 도입했고앞으로 결혼, 출생과 각종 계약을 공증하는 신원증명 서비스로 블록체인 기술을 확대할 예정이다. 스웨덴은 토지 등기부의 블록체인 계약을 시범 운영중이다. 온두라스는 부동산 등기를 블록체인 방식으로 바꿔 조작 가능성을 배제했다. 두바이는 2020년까지 모든 공문서를 블록체인으로 관리키로 했다. 중국은 세금 징수와 복지기금 지불시 블록체인을 활용키로 했다. 한국조폐공사(KOMSCO) 역시 온라인상에서의 신뢰 혁명과 그 확장성 때문에 블록체인에 주목하고 있다. 특히 미래의 역할을 재정립하는 차원에서 온라인 신뢰보안 서비스인 TSM(trust service manager)과 블록체인 기술을 결합한 ‘공공 신뢰 플랫폼’을 올 상반기를 목표로 개발중이다. 대한민국은 늘 그래왔듯 또 한번의 혁명적 변화에서도 답을 찾아내고 세계를 선도할 것이다. 조폐공사는  4차 산업혁명이라는 거대한 물결에서 ‘공공 신뢰 플랫폼’이란 해답을 찾았고, 이를 통해 새로운 미래를 열어 가고자 한다. 김화동 한국조폐공사 사장[▶깊이있는 투자정보 'TOM칼럼'][▶트렌드 리더의 스타일 지침서 '스타일M'][▶빵빵한 차&레이싱걸]김화동 한국조폐공사 사장"
"[기고]미세먼지, 전기 걱정 없는 최선의 선택을 위해","머니투데이","[머니투데이 유재열 한국집단에너지협회 상근부회장] 정유년 새해가 밝은지 벌써 넉 달이 지났다. 올해는 제3차 국가에너지기본계획을 비롯해 2030 온실가스 감축방안 등 중대한 국가에너지정책 과제들이 논의될 예정이다. 이번 기회가 국가 에너지시스템과 에너지산업이 한 단계 발전할 수 있는 중요한 전환점이 되어야 한다고 생각한다. 과거 우리나라는 고도의 경제성장과 에너지수요 급증으로 인한 안정적인 에너지공급을 위해 중앙집중식 에너지시스템으로 에너지 생산·공급이 이뤄졌다. 이러한 방식은 에너지를 안정적으로 공급할 수 있는 장점이 있지만 수요관리가 어렵고 전력생산과 송전과정에서 많은 환경·사회갈등을 유발하는 단점을 가지고 있다. 이로 인해 열병합발전, 신재생에너지와 같은 분산형 전원의 필요성이 부각되고 있다. 특히 국내 대표적인 분산형 전원인 집단에너지 열병합발전은 송전망 절감 및 전력계통 안정화에 기여할 뿐만 아니라 에너지 효율이 높아서 온실가스 감축 및 대기환경 개선 효과도 탁월하다. 이렇게 이점이 많은 열병합발전이 국가에너지 발전에 기여하기 위해 정부의 아낌없는 관심과 지원이 필요한 시점이다.열병합발전의 국가적 편익을 좀 더 깊이 살펴보면 우선 전력수요지 내부(도심지)에 입지해 추가 송전망 건설 없이 전력을 안정적으로 공급할 수 있다. 안전과 환경에 대한 국민의 관심이 높은 데다 사회적 비용 측면까지 고려하면 초고압 송전망이 필요한 대규모 발전소는 더이상 확충이 어렵다.이에 친환경 분산형 전원으로 전력수급의 패러다임 전환을 해야 한다는 전문가들의 의견이 커지고 있다. 전기연구원의 2015년 발표에 따르면 지역난방 열병합발전소가 도심지에 위치하여 제공하는 송전편익이 연간 3400억원 수준이라고 한다. 정부도 이런 관점에서 7차 전력수급기본계획을 통해 지원방안을 발표한 바 있다. 전력 수요지에 가까운 발전설비는 좀 더 높은 정산금을 받을 수 있도록 하고, 발전사업자의 고정비 일부 회수를 위해 지급되는 보조금인 용량요금을 분산형 전원에는 조금 더 주기로 하는 내용이다. 하지만 지원방안의 실행은 지연되고 있는 실정이다. 두 번째로 열병합발전은 열, 전기를 동시에 생산·공급함으로써 다른 발전방식에 비해 대규모 에너지 절감과 환경편익을 제공한다는 이점을 가지고 있다. 에너지경제연구원 및 전기연구원의 분석에 따르면 온실가스를 가스발전 대비 덜 배출함으로써 얻는 경제효과가 킬로와트시 당 1.3원, 석탄발전 대비 킬로와트시 당 10.4원이다. 또 가스열병합발전은 석탄발전에 비해 미세먼지를 1293분의 1 수준으로, 초미세먼지는 1760분의 1 수준으로 절감하는 효과가 있다고 분석했다.기후변화에 대한 전세계적 대응방안 논의가 이루어지고 있는 가운데 화석연료에 의존하는 기존 에너지시스템이 더 이상 지속 가능하지 않다는 인식이 확산되고 있다. 반면 우리 정부는 제2차 국가에너지기본계획에서 수요관리, 분산형 발전, 환경과 안전을 강조했음에도 여전히 석탄과 원자력 중심의 중앙집중형 공급체계를 고집하고 있다. 그 결과 에너지자립도, 재생에너지 비중은 OECD 최하위 수준을 기록했고 OECD 국가 중 온실가스 배출 증가율이 가장 높은 국가가 되었다. 국가 온실가스 감축 목표 달성을 위해서는 석탄발전을 줄이고 친환경 분산형 전원인 열병합발전과 신재생에너지를 확대해야 한다. 분산형 전원의 가동률을 보장하고, 세제혜택을 제공하는 등 적극적인 정책적 지원이 필요하다. 유재열 한국집단에너지협회 상근부회장.[▶깊이있는 투자정보 'TOM칼럼'][▶트렌드 리더의 스타일 지침서 '스타일M'][▶빵빵한 차&레이싱걸]유재열 한국집단에너지협회 상근부회장"
"[기자수첩]두번의 남은 토론회는 진짜 정책 공방 돼야","뉴시스","【서울=뉴시스】조인우 기자 = 4번에 걸친 대통령 후보 TV토론회를 보고 후한 평가를 내릴 국민이 몇이나 될까. 아마도 대부분은 후보간 질 낮은 입씨름과 네거티브 공방이 반복되는 것에 적지 않은 실망감을 표했을 게 분명하다. 물론 이번 대선이 예년과 달리 초단기로 치러지는 조기 대선이라서 후보간 상호 공개적으로 공격할 기회가 TV 토론회에 집중돼 있다는 점은 이해할 수 있다. 또 토론회에 참석한 주요 후보가 역대 대선의 3명 정도와 달리 5명이나 됐기에 상대적으로 주목도도 떨어지고 논점도 분산된다는 어려움도 있기는 하다. 하지만 그렇다해도 2시간 씩 세번, 3시간 한번 등 무려 9시간 가량 진행된 TV토론회에서 5명의 후보들이 보여준 모습은 실망스럽다. 그들이 단 얼마간이라도 어떤 건설적이고 생산적인 토론을 했는지 되짚어보면 딱히 기억나는 게 없을 정도다. 머리 속에 남아 있는 거라면 다소 고압적 태도, 칭얼대듯 상대에게 공세를 펴는 질문, 토론회 자체를 희화화하는 수준 이하 발언, 자기 비전 발표는 없고 상대 후보를 깎아내리는 데 열을 올리는 모습 등 뿐이다. 차기 대통령을 가려야 하는 국민적 선택의 장(場)이 이렇게 낙제점 수준으로 전락해 있는 것이다.  다만 한가지 위안 거리로는 지난 1~3차 토론회에 비해 25일 열린 4차 TV토론회에서 그나마 정책 공약을 놓고 설전이 오가긴 했다는 점이다. 문재인 더불어민주당 후보와 홍준표 자유한국당 후보의 일자리 공약 문제가 논의됐고, 사드 배치와 전작권 환수 등에 대해 안철수 국민의당, 유승민 바른정당, 심상정 정의당 후보들 간 견해를 어느 정도 들을 수 있었다. 개별적인 공약에 대한 구체적 검증이 아닌 총론 수준에 그치긴 했지만 그래도 1~3차 토론회에 비해서는 나아졌다는 평가가 나왔다.  이제 후보 TV 토론회는 28일과 다음달 2일 등 두차례 남아 있다. 두번의 기회마저 허무하게 날아가면 국민이 대통령 후보의 견해를 직접 들을 기회는 사실상 없어지게 된다. 5명의 후보에게 부탁하고 싶다. 남은 두차례 토론회만큼은 불필요한 정쟁은 지양하고 향후 '대한민국 호'를 이끌 선장으로서의 자질과 비전을 보여주는데 주력해 달라는 것이다. 이는 단순히 기자 1명의 생각이 아니라 유권자 전체의 공통된 시각일 것이란 점에서 감히 주문하는 것이다. 적어도 유권자가 대통령 후보가 어떤 능력을 갖고 있고, 어떤 소양과 리더십을 갖고 있는지는 따져본 뒤 표를 던지게 해야 하는 것 아닌가 말이다.join@newsis.com뉴시스 뉴스, 네이버 뉴스 스탠드에서도 만나세요뉴시스 SNS [페이스북] [트위터]"
"[기자수첩]후보님들, 돈 더 준다고 中企 갈까요","이데일리","[이데일리 채상우 기자] “중소·벤처기업에 안 가는 진짜 이유가 뭔지 아십니까. 야근수당도 없는 밤샘근무는 일상이고 지독한 회식 강요에 비상식적인 인격 모독까지. 그런 후진적인 근무환경이 일자리 창출을 막는 숨겨진 핵심 원인이란 말입니다. 이를 해결하지 않고서 단순히 중소기업 수만 늘리겠다는 공약은 밑 빠진 독에 물 붓기나 다름없습니다.”얼마 전 만난 중소기업 근로자의 토로다. 17대 대선 후보들이 하나같이 ‘중소·벤처기업 육성을 통한 일자리 창출’을 약속하고 있다. 하지만 근로자들이 일하기 좋은 기업문화를 만들려는 노력은 찾아보기 힘들다. 중소·벤처기업 육성을 통한 일자리 창출 공약에 현실감이 떨어지는 이유다.문재인 후보는 중소기업 청년고용 2+1을 주장했다. 중소기업이 2명의 신입사원을 채용하면 세 번째 신입사원에 대해서는 3년간 임금 전액을 지원한다는 것. 안철수 후보는 5년간 중소기업에 근무하는 청년들에게 2년 동안 1200만원을 지원하겠다고 공약했다. 홍준표 후보는 강소기업 육성을 통해 50만개의 일자리를 만들겠다는 ‘취업성공패키지’를 내세웠다. 과연 돈을 지원하면 취준생들이 중소기업에 가고 싶어할까. 물건을 잘 만드는 강소기업이 일하기 좋은 기업이 될수 있을까. 대답은 ‘아니다’다. 후보들의 공약이 틀린 말은 아니나 취업준비생과 중소기업 근로자가 원하는 가려움을 제대로 긁어주지 못하고 있다. 취업포털 인크루트에 따르면 중소기업 신입사원의 41%가 3년도 채 되지 않아 퇴사한다. 퇴사의 가장 큰 원인은 바로 ‘불만족스러운 근무여건(22%)’으로 ‘낮은 연봉수준(19%)’보다 높았다. 이제는 돈보다 근무 환경이 더 중요한 시대가 온 것이다. 중소·벤처기업은 대기업 중견기업에 비해 사회 감시망에 멀리 떨어져 있다. 물론 가장 중요한 역할은 중소기업 스스로의 개선 의지다. 정부는 비상식적인 근무환경을 고수하는 기업을 감시하고 좋은 근무환경을 갖춘 기업이 성장할 수 있도록 지원하는 역할을 해야 한다. 가고 싶은 중소기업이 많아지는 대한민국을 기대해 본다. 채상우 (doubleu@edaily.co.kr)＜ⓒ종합 경제정보 미디어 이데일리 - 무단전재 & 재배포 금지＞"
"[로터리] 유전자 검사와 규제자의 역할","서울경제","정현용 마크로젠 대표[서울경제] 지난 4월6일 미국 식품의약처(FDA)는 캘리포니아의 유전자 검사업체 ‘23앤드미’가 파킨슨병·알츠하이머병을 포함한 10종의 질환 유전자에 대해 의사를 거치지 않고 유전자 분석 서비스를 소비자에게 판매할 수 있게 됐다고 발표했다. 국내의 경우 기업이 기존에 허용된 46개 유전자 외 각종 질환의 위험도를 높이는 돌연변이를 검사할 수 있는 유전자 분석 상품을 소비자에게 직접 판매하는 것은 금지돼 있다. 23앤드미는 구글의 창업자 세르게이 브린의 아내 앤 워치츠키가 2006년 창업한 기업으로 소비자에게 직접 유전자 검사를 제공하는 사업모델(direct-to-consumer·DTC)을 최초로 제시하면서 주목을 끌었다. 23앤드미의 새로운 시도는 의료계의 우려에도 불구하고 2008년 미 타임스지가 선정한 올해의 기술로 선정되는 등 실질적인 성과를 내면서 착실하게 성장했다. 하지만 구글의 후광과 유명세에도 불구하고 23앤드미는 2013년 미 FDA가 검사 결과의 정확성에 대해 문제를 제기하면서 상업적 검사를 중단했으며, 부족한 부분을 보완한 후에 다시 서비스에 나서게 된 것이다.우리는 FDA가 기업들을 대하는 자세에서 한 가지 교훈을 얻을 수 있다. 처음에 23앤드미가 사업을 시작한 당시에는 예상이 가능한 치명적인 문제가 없는 부분에 한정해서 사업을 수행하도록 했다. 사업이 안정되고 많은 사람이 DTC 유전자 검사에 대해 열정적인 지지를 보내고 있을 때, 미 FDA는 냉정을 되찾고 엄밀한 과학적 검증과 사회적 논의가 이뤄질 수 있도록 해당 기업의 사업을 중단시키는 ‘악역’을 맡았다. 이후 기업의 부단한 노력에다 사회적 논의가 이뤄지자 다시 규제를 풀면서 사업 추진에 힘을 보태줬다. FDA의 행보야말로 ‘4차 산업혁명’에서 클라우스 슈밥이 제안한 “규제자의 기민한(agile) 관리 방법의 훌륭한 사례”라고 부를 만하다.FDA는 소비자 유전자 검사 시장이라는 신산업의 발아기에 전통적 의료산업의 기준을 적용해 싹을 자르는 우를 범하지 않고, 인내심을 갖고 지켜봤다. 이후 검사 결과의 정확성과 사회적 이해도를 기준으로 상식적 수준의 문제 제기를 했으며 기업이 이를 뒷받침하지 못한다고 판단이 되자 규제를 통해 제어했다. 하지만 그 규제는 새로운 산업을 육성하고 사회적 논의의 성숙을 위한 기다림이 궁극적인 목적이었다. 이런 기다림에 화답하듯 23앤드미는 철저한 준비를 통해 규제를 스스로 풀어갔다. 4차산업 혁명을 통해 재도약을 꿈꾸는 대한민국의 정부와 기업이 참고할 만한 타산지석(他山之石)이 아닐까 싶다.[서울경제 바로가기]'장미전쟁'의 승자는...5월 대선 실황중계 [바로가기]서울경제의 모든 연재물!... 서경Cube [바로가기▶]저작권자 ⓒ 서울경제, 무단 전재 및 재배포 금지"
"[사설] 훈풍 이어갈 성장전략 있는가","이데일리","사진=연합뉴스.우리 경제에 모처럼 봄바람이 불고 있다. 올 1분기 경제성장률이 전분기보다 0.9% 상승했다는 게 한국은행 발표다. 수출 증가세가 5개월째 이어지고 건설·설비투자가 늘어난 덕분이다. 민간소비도 증가했다. 올 성장률이 한은 전망치 2.6%를 넘어설 것이란 기대가 나올 정도다.  하지만 체감경기는 아직 겨울이다. 경기 회복세가 고용으로 이어지지 못하고 있기 때문이다. 1분기 실업률이 4.3%로 2010년(4.7%) 이후 가장 높고, 청년실업률은 10.8%로 몇년째 두 자릿수다. 물가도 1분기에 2.1%가 올라 가파른 상승세다. 대선 후보들은 이런 현실에 시원한 해결책을 내놓지 못하고 있다. 나랏돈으로 일자리를 만들겠다는 등 눈앞의 표심 좇기에 급급할 뿐, 정작 곳간을 채울 방책은 공허하다. 후보들마다 성장전략을 내세우고 있지만 추상적인 데다 정책의 나열 수준에 그쳐 믿음을 주지 못하고 있다. 되레 성장 불씨를 꺼뜨리는 게 아닌가 미심쩍은 공약들이 쏟아진다. 법인세 인상과 상법 개정안이 대표적이다. 미국이 법인세율을 35%에서 15%로 낮추기로 하는 등 각국이 경쟁적으로 법인세를 인하하는데도 우리는 반대 움직임이다. 반기업 정서를 부추기는 재벌개혁론도 마찬가지다.이제는 근본적인 성장전략을 함께 고민해야 한다. 표심에 기댄 반기업 정서의 유혹을 떨쳐내고 기업이 자유롭게 일할 수 있도록 규제개혁과 혁신의 성장 로드맵을 내놓으라는 얘기다. 기업 발목을 잡으면서 경제 활성화를 기대할 수는 없다. 성장 없이는 분배도, 복지도 지속가능하지 않다는 사실을 깨달아야 한다.＜ⓒ종합 경제정보 미디어 이데일리 - 무단전재 & 재배포 금지＞"
"[36.5] 김조광수가 이성애를 반대하진 않는다","한국일보","26일 서울 여의도 국회 본청 앞에서 열린 국방안보 분야 1,000인인 지지선언에 참석한 문재인 더불어민주당 대선 후보에게 동성애를 상징하는 무지개 깃발을 든 시위자가 접근하고 있다. 연합뉴스내 정체성은 ‘부산 출신 40대 남성’이다. 이 인구사회학적 기본 데이터만 해도 대충 견적(?)이 뽑아진다. ‘개저씨’(개념 없는 아저씨란 뜻의 신조어)가 아닌 것처럼 비쳐지고 싶은데 결국은 개저씨의 블랙홀에서 헤어나오지 못하는 나는, 나름대로 불쌍하다고 말하고 싶지만 남들이 보기엔 그저 그런, 아마 그쯤 될 게다.정체성 문제는 어릴 적부터 봐왔다. 가장 먼저 와 닿은 건 여자들의 체계적 탈락. 그 때만 해도 딸들이 주렁주렁 달린 집안에서 막둥이 아들의 대학 행을 보장하기 위해 아무리 똑 소리 나게 공부 잘해도 딸들은 무조건 여상으로 보내졌다. 대학 가고 싶은 욕심에 부모 몰래 여고에 원서를 냈다 합격통보와 함께 들통나 난리법석이 벌어지는 집들도 제법 많았다. 그 가운데 몇은 울고불고 빌어 여고엘 가기도 했고, 몇몇은 눈물을 삼키며 여상으로 돌아가야 했다. 나로선 요즘 화제라는 조남주의 소설 ‘82년생 김지영’의 인기가 반가우면서도 좀 어리둥절하다. 대한민국에서 여자로 태어나 겪어야 하는 차별을 진짜 몰랐나 싶어서다.남자들이라고 예외는 아니다. 여자들이 1차 탈락자라면, 집안 형편과 아들간 서열에 따라 남자들도 체계적 탈락을 겪어야 한다. 그렇다 해도 대개는 서울 대신, 자기가 사는 지역 국립대나 전문대라도 낙찰 받는다. 그래도 아들이니까. 그 때문에 시골에서 서울로 올라와 대학을 다니는 남자 아이들이 반드시 공부를 잘했다거나, 미래가 더 기대되는 바가 있었다고 생각하지 않는다. 그건 체계적 배제 이후의 얘기일 뿐이다. 난 나보다 더 똑똑했지만, 서울의 대학에 오지 못한 친구 녀석들 명단을 지금도 줄줄 읊을 수 있다.내가 무슨 금수저 출신인 건 아니다. 그렇다고 흙수저라고, 고생 꽤나 했다고 떠벌리지는 않는다. 아무리 흙수저라도 체계적 배제는 뚫어낸 셈이니, 감사할 일이지 불평할 일은 아니다. 어렴풋하게나마 짐작만 하던 이 사실이, 명백하게 각인된 건 군대 훈련소에서다. 논산훈련소 연병장에 모여 어벙한 군인 흉내 내기 바빴던, 그 수천의 훈련병 가운데 ‘서울의 4년제 대학생’은 몇 명 되질 않았다. 그 나이에 이미 장사 수완이 좋아 억대 돈을 만지는 놈, 일이 잘 안 풀려 공사판을 전전하는 녀석, 정말 별의별 아이들이 다 있었다. 훈련을 마치고 자대 배치를 받고서도 그랬다. 그 때까지 4년제 대학 진학 예비군에 속한 녀석들과 부대끼면서, 세상 모든 내 또래 아이들이 다 그런 줄로만 알고 있었던 게다. 참기 힘들었던 건 “재수없는 냄새가 솔솔 나는 XX”라는 식으로 덮어 놓고 욕하고 괴롭히는 이들이었다. 그래서 억울하단 소리를 하려는 게 아니다. 정체성이란 그런 거다. 권장한다고 증진되는 것도 아니고 비판한다고 사라지는 것도 아닌 일종의 라이프 스타일, 그저 ‘갑’일 땐 잘 모르다 ‘을’로 난도질 당하는 순간 번쩍 깨닫게 되는 것.대선후보 TV토론에서 문재인 후보의 동성애 비토 발언이 논란인가 보다. 이명박정부 실패 때는 ‘진보 바람’이 불면서 박근혜ㆍ문재인 후보 모두 전향적인 태도를 보이더니, 박근혜정부의 파탄을 두고서는 오히려 ‘보수 역풍’을 우려해 이리저리 눈치 보느라 전전긍긍인 모양이다. 군대 내 동성애에 대한 반대로 한정 짓는 것도 궁색하긴 매한가지다. 이성애자라 해도 여러 상황, 조건을 외면하고 행동하다가는 망신당하고 쇠고랑 찬다. 동성애자에게도 같은 기준으로 적용하면 그 뿐이다.2013년 공개적으로 동성결혼식을 올리고, 동성혼의 법적 인정을 위해 싸우고 있는 영화감독 김조광수는 문 후보 발언 논란을 지켜보다 페이스북에 이런 글을 써뒀다. “저도 이성애자들이 100% 이해되지는 않아요. 하지만 ‘이성애에 반대한다’고 말하지 않죠.” 라이프 스타일은 이해력을 키울 일이지, 반대할 건 아닌 것 같다.조태성 문화부 기자 amorfati@hankookilbo.com▶한국일보 [페이스북] [카카오 친구맺기]▶자동차의 모든 것! [모클][ⓒ 한국일보(hankookilbo.com), 무단 전재 및 재배포 금지]"
