"title","press","body"
"[데스크 칼럼] 편견의 전쟁","부산일보","/이병국 부국장 겸 편집 2팀장 1998년 국내 출판된 인류학자 레비 스트로스의 에 문명과 야만의 이분법적 사유에 대한 비판이 실렸다. ""문화적 다양성을 인정하지 않으려는 서구사회의 폭군적 습관과 서구인처럼 행동하지 않는 사회를 야만적이라고 경멸하는 것은, 서구인들의 중대한 편견이다. 세상엔 서로 다른 사회가 존재 할 뿐, 어디에도 '우월한 사회'는 없다."" 서로 다름을 존중하고 인정하는 '주류사회의 반성문'은 청명한 울림으로 다가왔다.예를 들어 벌거벗은 채 살아가는 밀림의 한 부족이라 할지라도 고도화된 현대사회보다 훨씬 합리적으로 사회조직의 복잡한 문제들을 해결하기도 한다. 고도화된 현대사회가 기술적으로는 우월할지는 모르나 정신적 측면에서 우열은 구분할 수 없다. 현대사회의 갈등과 충돌이 끝없이 분출되는 것은 '나와 다르면 틀린 것'이라고 믿는 서구적 사상과 제도에서 배운 편견의 폭력성 때문일 것이다.편견과 차별은 기득권의 '적폐' 우월주의 내세우며 갈등 야기 편견 없어져야 차별도 없어져 유권자 우월한 선택이 변화 열쇠 프레임보다 정책과 공약 따져야얼마 전 미국 유나이티드항공 3411편에서 강제적 좌석 양보를 거부한 한 동양계 탑승객을 짐승처럼 끌어내려 지탄을 받은 일이 있었다. 인종차별 논란과 함께 아시아계 미국인들의 현실을 보여 준 상징적 사건이었다. 지나친 비약일지 모르겠으나 이처럼 편견은 종종 차별과 폭력을 부른다. 서로 다름을 적대시하는 풍조는 산업화된 사회일수록 더욱 강해지는 법이다. 기득권을 지키려는 우월주의가 타협과 협상에 서툰 것도 이 때문이다. 대한민국을 흔들었던 대통령 탄핵정국 여러 집회의 극한 대립 또한 같은 맥락이다. 편견은 이분법적 사고를 부르고, 차별의 프레임을 만든다.문화 예술계 '블랙리스트' 재판을 받고 있는 김기춘 전 청와대 비서실장과 조윤선 전 문화체육관광부장관이 특검의 기소를 자기들에 대한 '편견과 오해'에서 비롯되었다고 항변하고 나서 주목을 끌었다. 김 전 실장 측은 ""블랙리스트가 예술의 자유를 침해한 중대한 범죄로 규정하는 것은 편견이라고 생각한다""고 강변했다. 조 전 장관 측도 '직권남용'혐의에 대해서 ""당시 정무수석이었던 조 전 장관이 당연히 알고 가담했겠지 라는 추측은 깊은 오해""라고 주장했다. 한때 대한민국 최고 권력의 지척에 있던 두 사람의 '편견과 오해' 변명이 궁색하기 그지없다. 우월적 위치에 있을 때 보여 준 '편견과 오해'에 대한 반성은 어디에도 찾을 수 없다. 편견이 문제화되는 것이 대부분 기득권의 차별적 행동이다. 그들은 자기와 다른 생각들을 인정하지 않고 입맛에 맞게 바로잡으려 한다. 기득권의 편견과 프레임이 위험한 것도 이 때문이다.어디를 가든 대통령 선거 얘기로 가득하다. 안갯속 대선 판세 속에 후보 간 검증 공방도 어지럽다. 선거철마다 어김없이 등장했던 지역구도와 진영 간 프레임 전쟁이 이번에도 비켜가지 못했다. 색깔론과 이분법적 프레임 전쟁은 유권자들의 생각을 편견의 틀에 가둬 공약과 정책 선택을 어렵게 만든다. 정책대결보다 편 가르기를 앞세우는 선거전에서 '함께 잘사는 나라' 운운은 설득력이 없다. 선거가 갈등을 키우고, 정치권이 편견 만들기를 부추긴다면 그것이 곧 적폐다. 대통령이 탄핵되고 구속된 상태에서 치러지는 보궐 대선이다. 불행했던 박근혜정권의 가장 큰 과오는 편견과 차별에서 출발한 '이분법적 사고와 정책'이었을지도 모른다. 레비 스트로스의 말처럼 세상 어디에도 '우월한 존재와 사회'는 없다. 우월한 선택을 하는 깨어 있는 유권자만이 편견 없는 사회를 만든다. 편견이 없어지면, 차별도 없어진다. 투표가 14일 남았다. bkrhee@busan.com"
"[기자칼럼]사라진 촛불의제는 어디로","경향신문","몇몇 사람들이 조기대선을 ‘벚꽃 대선’이라 하더니 벚꽃은 4월에 핀다고 ‘장미 대선’이라고 바꿔 부른다. 척박한 땅에서도 잘 자라는 수수한 민들레로 대선을 부르자는 제안도 나온다. ‘장미 대선’이나 ‘민들레 대선’이란 이름엔, 지금 선거 내용과는 별개로, 봄내가 물씬하다. 박근혜를 구속시키고, 최소한의 정권교체는 가능한 듯한 분위기도 봄내를 더한다.정치·사회의 봄은 왔는가? 박근혜 정권이 불러온 문제에서 벗어났는가를 되돌아본 건 한 매체 기사 때문이다. ‘노동과세계’가 지난 22일 서울 중심부에서 진행된 비정규직 노동자들의 <우리 일터 ‘새로고침’ 대행진>에 단 부제는 “정치의 봄은 우리의 삶과 일터의 봄으로 이어지지 않았다”이다.노동 현장엔 매서운 찬바람이 분다. ‘노동자민중 생존권 쟁취를 위한 투쟁사업장 공동투쟁위원회’ 소속 노동자 6명이 서울 광화문 한 건물 전광판에서 고공단식농성 중이다. 울산에선 하청노동자 2명이 염포산터널 부근 교각에서 농성한다. 조기대선은 죽음을 끊어내지도 못했다. 지난 1월 LG유플러스 현장실습생이, 지난 18일엔 갑을오토텍의 한 노조원이 스스로 목숨을 끊었다.대통령 하나 바꾼다고 세상이 확 바뀔 것이라고 믿지는 않았다. 촛불광장 시민이 직접 민주주의로 이룬 이번 대선에서 노동자들이 다시 극한의 고공농성을 벌이고, 자살하는 일만큼은 없을 것이라고 여겼다. 노동자들은 1차 때부터 박근혜 퇴진과 노동의제를 갖고 선봉에 서온 촛불집회 주체 가운데 하나다. 광화문에서 고공농성 중인 아사히비정규직지회 대의원 오수일은 언론 기고에서 절망과 분노를 이렇게 말했다. “박근혜가 쫓겨났다. 그런데 아무것도 변한 건 없다. 오히려 대선후보들 밥상만 차려준 꼴이다. 많은 비정규직 노동자들이 죽어가고 쫓겨나는 현실을 저들은 외면하고 있다.”대선 노동 의제는 되레 퇴보했다. 2012년 문재인이 쌍용차·한진중을 찾았고, 안철수가 삼성백혈병 피해 노동자를 만났다. 박근혜도 청계천 전태일 동상에 갔다. 지금 유력 후보들은 “비정규직을 줄이겠다”는 식으로 두루뭉술하게 말할 뿐 ‘비정규직 사용 전면 금지’ ‘2018년 최저임금 1만원 인상’ ‘사내하청제·기간제법·정리해고제 폐지’ 같은 요구에 구체적으로 답하지 않는다. 예견된 일이다. “민주당과 국민의당은 새누리당에서 이탈한 보수층의 표를 잡기 위해 혈안이 되어 있다.” 5678서울도시철노동조합이 지난해 11월2일 낸 시국선언문 중 한 구절이다.노동 대통령을 표방한 심상정을 뺀 주자들은 저마다 ‘성장’ ‘4차 산업혁명’의 적임자임을 내세운다. 자신만이 더 좋은 세상을 만들 수 있다고 자신한다. 영국 신학자 허버트 매케이브의 말을 빌리면 ‘모든 이가 사랑에 빠질 것이라고 기대하는 사랑스러운 세계전망’일 뿐이다. 헛된 낙관이 되리라는 걸 짐작하는 건 어렵지 않다.소외된 촛불의제는 노동만이 아니다. 시인 송경동은 줄곧 촛불집회 현장을 지켰다. 세월호법 재개정, 사드 반대, 백남기 농민 사망 진상규명, 박근혜 정권의 공작정치·공안탄압 국정조사, 재벌개혁 같은 촛불의제를 정치권이 제대로 반영하지 않는다고 지적한다. 대선의 보수화는, 촛불집회가 박근혜 일당을 단죄했으나 새로운 사회 의제·가치·방향·정책을 담아내는 정치세력의 출현 내지 재편으로 이어지지 않았기 때문이다.촛불의제는 사라지고 말 것인가? 송경동은 촛불의제 부재를 일시적이라고 본다. 거저 오는 것은 아니다. 그는 촛불집회의 다음 단계를 고민한다. 정권교체를 종착역으로 설정하지 않고, 2단계의 항쟁·혁명을 준비하는 것이다. “쉽진 않지만 촛불광장의 승리 경험을 토대로 특권·불공정·불의·부패가 발붙일 수 없는, 평범한 사람의 삶이 평화롭고, 평등하며 행복할 수 있는 사회로 바꿔나갈 것”이라고 했다. 그 사회는 시인 김해자가 ‘여기가 광화문이다’에 노래한 것과 다르지 않다. “대통령 하나 갈아치우자고 우리는 여기에 모이지 않았다/ 당도 대통령도 우리의 절대희망이 아니다/ 우리가 정말 원하는 것은 대통령도 정당도 모른 채/ 즐겁게 밥 먹고 평화롭게 일하고 사랑하며 살아도 되는 세상이다”<모바일팀 | 김종목 기자>▶ 경향신문 SNS [트위터] [페이스북]▶ [인기 무료만화 보기]©경향신문(www.khan.co.kr), 무단전재 및 재배포 금지"
" 제주를 달린다, 본다, 느낀다 ","한겨레21","[한겨레21] [21 뉴스]제주국제트레일러닝대회(5월 12~14일) 한겨레·가시리마을 공동 주최김진수 기자가시리마을과 한겨레신문사가 공동 주최하는 제주국제트레일러닝대회가 5월12~14일 제주 현지에서 열린다. 올해로 7회째를 맞는 제주트레일러닝대회는 참가자들이 한라산 중산간의 가시리마을 공동목장에서 캠핑하며 한라산과 주변 오름, 해변 100km를 사흘 동안 달리는 코스로 구성돼 있다. 일반인이 오름을 오르내리며 아름다운 5월의 제주 들판을 만끽할 수 있는 5km, 10km 코스도 있다.리 단위 주최 전국 유일 국제대회이 대회를 조직하고 코스를 구성한 가시리마을의 안병식 레이스디렉터는 “제주도의 한라산, 중산간 오름과 마을목장, 그리고 해변은 트레일러닝을 하기에 최적의 장소”라며 “많은 사람들이 참여해 때 묻지 않고 다채로운 자연을 달리면서 환상적인 아름다움을 보고 느끼기 바란다”고 말했다. 제주트레일러닝은 리 단위 마을에서 주최하는 전국 유일의 국제대회로, 국내에서 ‘스테이지 레이스’(stage race)를 처음 정착시켰다. 스테이지 레이스란 하루에 정해진 코스를 완주하고 다음날 새 코스에 도전하는 방식을 말한다.5km·10km·100km 코스에 도전하세요제주트레일러닝대회 100km 코스의 첫날(5월12일) 구간은 한라산 기슭 법정사에서 출발해 영실~성판악을 거쳐 법정사로 되돌아오는 32km, 둘쨋날(13일) 구간은 가시리마을 공동목장의 따라비오름과 큰사슴이 오름을 잇는 36km이다. 마지막 셋쨋날(14일)에는 제주시 구좌읍 종달리 우도선착장에서 서귀포시 표선면 제주민속촌까지 32km를 달린다. 첫날과 둘쨋날 제한 시간은 8시간이고, 셋쨋날은 6시간 이내에 들어와야 한다. 5km와 10km 코스는 토요일인 13일 오전, 마을 공동목장의 오름과 들판을 잇는 길에서 열린다.올해 100km 코스 참가자는 가시리마을 공동목장인 조랑말체험공원에 대형 텐트를 치고 그 안에서 숙식을 함께하는 특별한 경험을 하게 된다. 가시리마을 쪽은 “가시리마을은 따라비오름과 큰사슴이오름을 잇는 200만 평의 아름다운 공동목장을 보유하고 있다. 그 안에 10명 이상 수용할 수 있는 대형 텐트를 여러 개 설치해 참가자들에게 사흘 동안 숙식을 제공할 계획이다”라고 말했다. 참가자는 슬리핑백과 매트 등 개인 야영 장비를 가져오면 된다.참가 신청은 홈페이지에서트레일러닝(Trail-running)은 산과 들판뿐 아니라 사막이나 남북극 같은 오지까지 경계 없이 달리는 아웃도어 스포츠다. 최근 10여 년 사이 지구촌의 경관 좋은 지역을 중심으로 빠르게 확산되고 있다. 안병식 레이스디렉터는 “트레일러닝은 팍팍한 아스팔트를 달리며 1등 경쟁을 하지 않는다. 모든 참가자가 함께 먹고 자면서 흙, 바위, 숲길을 즐기고 서로 격려하며 깊이 친해지는 기회를 누리게 된다”고 말했다.제주트레일러닝대회는 10월 가을에도 열린다. 이때는 100km를 20여 시간 쉬지 않고 달리는 ‘논스톱 레이스’를 처음 시도한다. 참가 신청은 홈페이지(www.jejutrail.com)에서 받는다. 참가비는 5km와 10km 코스는 3만원, 100km 코스는 30만원(숙식 포함)이다. 김현대 선임기자 koala5@hani.co.kr독자  퍼스트  언론,    정기구독으로  응원하기! 전화신청▶ 02-2013-1300 (월납 가능)인터넷신청▶   http://bit.ly/1HZ0DmD카톡 선물하기▶  http://bit.ly/1UELpok 공식 SNS [통하니] [트위터] [미투데이] | 구독신청 [한겨레신문] [한겨레21]Copyrights ⓒ 한겨레신문사, 무단전재 및 재배포 금지"
"[강홍식의 명연설문 따라잡기]버락 오바마 대통령 고별 연설(3)","경향신문","If you’re tired of arguing with strangers on the internet, try to talk with one in real life. If you’re disappointed by your elected officials, grab a clipboard, get some signatures, and run for office yourself. Show up. Dive in.해석 : 만일 당신이 인터넷에서 낯선 사람들과 논쟁하는 것에 지쳤다면, 현실세계의 누군가와 대화를 시도하십시오. 만일 당신이 선출한 공무원에게 실망했다면, 클립보드를 집어 들고, 서명을 모아, 공직에 출마하세요. 참여하세요. 직접 뛰어드세요.어휘 : argue(언쟁하다, 다투다), elect(선출하다), signature(서명), dive in(뛰어들다, 몰두하다)<제공 : 박정 어학원>▶ 경향신문 SNS [트위터] [페이스북]▶ [인기 무료만화 보기]©경향신문(www.khan.co.kr), 무단전재 및 재배포 금지"
"[부일시론] '입체도시' 부산을 꿈꾸다","부산일보","/한영숙 ㈜싸이트플래닝건축사무소 대표 지금은 어떤 시대일까? 내 생각에는 를 쓴 지그문트 바우먼의 '액체 단계'를 넘어서서 순간순간 기화되는 '기체 현대'를 살고 있지 않을까 싶다. 물이 기화되듯이 개인은 소속된 집단에 큰 영향을 받지 않고, 손안의 스마트폰을 통해 SNS공간에서 정보를 수렴하고 발산하고 있다. 개인의 생각들이 기체 입자가 되어 둥둥 떠다닌다. 이렇게 기화된 생각들은 뚜렷한 응결점을 찾지 못하고 떠다니다 소멸되기도 하지만, 많은 사람이 동의하면 강한 응집력도 생긴다. 거대한 구름을 형성하기도 하는 것이다. 그리고 네트워크에서 존재하던 거대한 구름은 계기를 만날 때 우리가 살아가고 있는 도시공간(리얼스페이스)에 표출된다.최근의 촛불집회가 그러했다. '뭔가 문제가 있다'는 문제 제기를 다양한 매체로 접하고, 네트워크에서 정보를 공유하고 토론하면서 개별화된 불특정 다수가 광화문광장이라는 리얼스페이스에서 만나서 각자의 생각을 표현했다. '기체 사회' '기체 시대'의 한 단면이다.현대는 개별화 '기체 시대' 같아 사람과 정보 모으는 응결점 필요 입체도시가 그 역할 할 수 있다 건축물·교통 집적된 도시 모델 '좋은 게 좋다'는 방식으론 안 돼 원칙·규칙 정교하게 지켜야 가능그러나 역설적으로 도시 설계를 하는 입장에서 이런 변화들을 볼 때 다시금 공간이 중요해지는 시대라고 말할 수 있다. 강력한 집단의 이미지를 만드는 종합적인 미디어로서 작동하는 광장과 같은 불특정 다수가 모이는 장소는 도시공간에서 경쟁력으로 작동하고 있다. 도시는 이런 공간이 필요하다. 24시간 쉽게 찾아올 수 있는 편리하고 개성 있는 공간, 함께 모여서 무언가를 해 보고 싶은 다양한 정보가 제공되는 공간, 처음 만난 사람들도 쉽게 마음 터놓고 이야기할 수 있는 매력적인 공간이 도시의 경쟁력이다. 이를테면 부산의 전포카페거리 같은 경우다. 개성 있는 형태의 건축과 인테리어는 기본이고 차별화된 콘텐츠, 특별한 취향 등이 SNS에서 이야깃거리가 되어야 이슈가 되고, 사람들이 찾는 장소가 된다. 사람들의 요구에 부응했던 서면 도심의 전포철물상가는 불과 몇 년 만에 전포카페거리가 되었고, 그 주위의 풍경이 일순간에 달라졌다.이런 맥락에서 나는 입체도시를 전망하고 있다. 기체 현대이기 때문에 더욱 그러하다. 저성장과 고령화로 인해 저밀도의 다핵화된 공간들도 많이 나타나겠지만, 동시에 도심은 고밀도로 집중되는 현상이 일어날 것이다. 사람들이 만나는 응결점의 주제는 다양해질 것이고, 다양한 주제를 포용하기 위해서는 단일의 목적공간보다는 연극무대처럼 유연한 다목적의 공간이 더 많이 필요할 것이다. 땅값이 높은 도심에서 이를 극복하면서 새로운 공간을 만들기 위해서는 건축물과 도로교통을 일체화시켜 만들어 나가는 입체도시가 요구된다.나는 10여 년 전부터 일본 도쿄의 시오도메와 오다이바를 자주 다니면서 문현금융단지와 북항재개발구역의 미래를 대치해 생각해 왔다. 우리는 그들의 시행착오를 넘어서서 훨씬 매력적인 공간을 만들 것이라고 상상했다. 하지만 아니었다. 자동차 없이 걸어다니기 힘든 센텀시티의 현실을 보면서 우리 사회에서 입체적인 개발이 쉽지 않음을 깨달았다. 기술이 문제가 아니라, 사회적 역량의 한계가 문제였다.고밀도 공간의 입체도시를 만들기 위해서는 사회 구성원의 다양한 요구와 욕구를 조정하여 잘 맞추어진 퍼즐을 완성할 수 있는 원칙과 정교함, 절대적인 규칙이 필요하다. 사회 구성원들은 일상에서 사회적 규칙을 공기 마시듯 지켜야 한다. 이는 고도화된 도시공간을 효율적이고 매력적으로 운영하고 사고 없이 관리하기 위한 절대 조건이다. 이런 준비 없이 입체도시는 보류해야 한다. 결국 우리 사회의 지나친 유연성(?)이 문제다. 흔히 말하는 '유도리'를 발휘하면서 우리가 함께 살고 있는 이유와, 우리가 만들어가야 할 미래의 목적을 잃어버리는 경우가 너무 많다.우리는 새로운 기회 앞에 서 있다. 소소한 규칙부터 지키기 위한 방법들을 만들어야 한다. 그것을 4차 산업혁명이 가져다 줄 스마트한 삶 속에서 창의적으로 만들어 나가고 일상에서 실천해야 한다. 그럴 때 특별하고 창의적인 도시를 만들어 갈 수 있다. 아마도 내일의 도시는 '기체 개인'이 깨어 있는 누군가를 만날 수 있는 도시여야 할 것이다. 세상을 진보시킬 더 나은 주제를 중심으로 창조적 지식정보와 새로운 시도와 실험이 모이고 실현되는 곳이 되어야 한다. 사람이 사람에게 중독되는 도시가 응집력을 갖는다."
"[사설]경제고통지수가 드러낸 서민 가계의 짓눌린 현실","경향신문","서민 가계가 겪는 경제적 고통을 수치화한 지표가 5년 만에 최고치를 기록했다. 24일 통계청에 따르면 올해 1분기 소비자물가 상승률은 2.1%, 실업률은 4.3%로 이 둘을 더한 ‘경제고통지수’는 6.4였다. 2012년 1분기에 6.8을 기록한 이후 5년 만의 최고치다. 경제고통지수는 소비자물가 상승률과 실업률을 더한 지표로, 서민들이 체감하는 경제적 삶의 어려움을 계량화한 것이다. 서민 가계가 겪는 고통이 커지면 삶의 만족도는 낮아지고, 소비심리가 위축돼 경제 전반에도 부정적인 영향을 미칠 수밖에 없다.올 들어 경제고통지수가 높아진 것은 소비자물가와 실업률이 동반 상승했기 때문이다. 소비자물가 상승률은 지난해 1분기 0.9%에서 1.2%포인트 높아졌다. 국제유가가 1년 전보다 12.0% 급등한 데다 조류인플루엔자(AI)와 구제역 확산 등의 영향으로 농축수산물 물가가 큰 폭으로 오른 탓이 크다. 실업률은 1분기 기준으로 지난해와 올해 모두 4.3%를 기록해 2010년 이후 가장 높았다. 조선·해운 구조조정 여파가 계속되면서 지난 2월 실업자 수는 135만명에 달했다. 청년(15~29세)실업률도 10.8%에 이른다. 특히 올해 1분기 대졸 실업자 수는 사상 최초로 50만명을 넘어섰다. 대졸 이상 비경제활동인구도 350만명을 웃돈다. 가계 빚은 사상 최대인 1344조원으로 급증했고, 소득의 40% 이상을 빚 갚는 데 쓰는 고위험가구의 부채만도 60조원에 달한다.무엇보다 걱정스러운 것은 서민 가계의 경제적 고통이 해소될 기미가 보이지 않는다는 점이다. 한국개발연구원(KDI)에 따르면 올해 소비자물가 상승률은 지난해보다 0.8%포인트 높은 1.8%로 전망됐다. 실업률도 0.1%포인트 높은 3.8%로 예상됐다. 경제고통지수가 5년 만에 최고치를 기록하며 서민들 삶의 질이 형편없이 나빠졌다는 것을 정부는 뼈아프게 받아들여야 한다. 그런데도 정부 경제정책은 아직까지도 성장률 끌어올리기에 방점이 찍혀 있다. 유일호 부총리는 그제 “올해 성장률이 당초 정부 예상치인 2.6%보다 높아질 수 있다”는 장밋빛 전망을 내놨다.경제 성장의 과실은 서민 가계가 아닌 대기업에 돌아가기 마련이다. 이는 성장률 끌어올리기 방식을 통해서는 서민의 삶을 개선할 수 없다는 것을 의미한다. 정부는 성장률에 집착하기보다는 서민 가계의 고통을 줄일 수 있는 실효성 있는 대책 마련에 적극 나서야 할 것이다.▶ 경향신문 SNS [트위터] [페이스북]▶ [인기 무료만화 보기]©경향신문(www.khan.co.kr), 무단전재 및 재배포 금지"
