"title","press","body"
"[바이블시론-송병구] 국민은 희망 대통령을 뽑는다","국민일보","전국 방방곡곡 거리와 길목에 봄꽃이 활짝 폈다. 똑같은 크기와 길이의 종이꽃들은 국민의 표심을 흔들며 나란히 게시 중이다. 선거벽보 말이다. 그동안 열아홉 번의 대통령 선거 중 후보자가 가장 많다고 한다. 익숙한 양당 대결이 아닌, 주요 5당 대결로 치르는 선거판은 예년에 볼 수 없는 현상이다. 박근혜 전 대통령의 실패와 부패가 단단히 한몫했다. 그래서 온 국민이 더욱 불꽃을 부라리며 지켜보고 있다.   아노테 통 대통령이 있다. 그는 2003년 이래 지금까지 세 차례 연임에 성공하면서 장기집권 중이다. 키리바시공화국은 인구가 10만명에 불과한 남태평양 한복판에 있는 작은 섬나라다. 영국의 보호령이었다가 1979년 독립했으니 규모로 보나 역사로 보나 약소국임에 틀림없다. 물론 이 나라도 세계에서 가장 앞선 것이 있다. 지구 날짜변경선의 가장 동쪽에 위치한 까닭에 해 뜨는 시간만큼은 세계지도정보에 등록한 237국 중 가장 빠르다고 한다. 키리바시공화국을 유명하게 만든 것은 인도양의 몰디브, 남태평양의 투발루와 함께 지금 물에 잠기고 있다는 현실 때문이다. 33개의 산호초 섬으로 이뤄진 이 나라는 평균 고도가 해발 2미터에 불과하다. 지구온난화가 계속되면서 해마다 해수면이 0.3㎝에서 1.2㎝씩 상승하는 까닭에 2050년이면 더 이상 사람이 살 수 없다고 한다. 게다가 온갖 국제적 선언과 약속에도 불구하고 국가별 할당 탄소가스 배출량이 줄어들지 않으니 기후변화 위기는 적어도 키리바시 사람들에게 당장 강도처럼 덤벼들고 있다. 오죽하면 다달이 보름달이 뜰 때마다 긴장을 반복한다고 한다. 가까워진 달의 작용으로 해수면이 올라가면 큰 피해를 입을 수 있기 때문이다. 그래서 키리바시 관광호텔의 침대 머리맡에는 구명조끼가 비치돼 있다. 통 대통령이 키리바시를 구원하기 위해 발 벗고 나선 것은 대통령다운 행동이었다. 그는 출애굽 지도자 모세처럼 ‘존엄한 이주’ 프로그램을 전개 중이다. 국토가 전부 물에 잠길 것에 대비해 살길을 모색하려는 것이다. 그들은 기후난민이란 말 대신 피난길조차 ‘존엄’이란 의미를 부여했다. 미래세대 이주지는 2000㎞ 떨어진 이웃나라 피지 북쪽 섬 바누아레부다. 이를 88억원에 구입해 이미 농사를 시작했다. 통 대통령은 시대의 징조를 미리 살피고 국민의 터전을 지키는 일에 앞장선 까닭에 국민적 신뢰를 받게 됐다. 연달아 대통령에 당선된 배경이다. 그는 당선 첫해부터 기후변화 예방 전도사로서 유엔과 세계를 향해 세일즈를 마다하지 않았다. 마치 선지자처럼 세상의 불안한 미래에 대해 징조를 알렸다. ‘선진국이 싼 코끼리 똥을 개발도상국 참새가 어떻게 치울 것인가’란 문제와 씨름하고 있는 셈이다. 이른바 장미대전이라 불리는 대통령 선거를 지켜보면서 이 땅의 봄꽃들은 얼마나 지속될까를 염려한다. 남북관계가 실패를 거듭하면서 연일 진짜 안보와 가짜 안보 논란에 휩싸이고 있다. 일자리, 청년실업, 비정규직과 최저임금 논쟁에서 보듯 국민의 생계는 위협당하고 있다. 고령화, 양육권, 치매 환자, 인구절벽 등 우리의 미래는 갈수록 숨이 턱턱 막힌다. 이대로 가다가는 ‘존엄한 이주’를 고려하는 국민이 점점 늘어날 것이다. 당장 침대 곁에 구명조끼를 두고 자야 할 만큼 국민의 생명권은 불안하다. 이젠 “가만히 있어라”는 주문에 누구도 신뢰하지 않는다. 세월호 참사와 함께 국민의 신뢰는 맹골수도에 이미 빠져버렸다. 그럼에도 대통령 후보자들은 열쇠수리공처럼 무심해 보인다. 그들은 모든 문을 열 만능키가 없다는 것을 잘 알면서도, 정직하게 호소하지 않는다. “우리의 표적은 보이지 아니하며 선지자도 더 이상 없으며.”(시 74:9) 과연 누가 대한민국의 아노테 통이 될 것인가.송병구 색동교회 담임목사[국민일보 홈페이지] [페이스북] [트위터][취재대행소 왱!(클릭)]GoodNews paper ⓒ 국민일보(www.kmib.co.kr), 무단전재 및 재배포금지"
"[세상만사-김남중] 아파트와 공동체","국민일보","한 달 전 오스트리아 빈의 공공임대주택을 둘러볼 기회가 있었다. 빈은 시민 60% 정도가 임대주택에 살 정도로 공공임대주택이 잘 공급된 도시다. 시내 임대주택 세 곳을 방문했는데 하나같이 공용공간을 강조한 점이 인상적이었다. 한국 아파트에서 공용공간은 사라진 주제이기 때문이다. 110가구가 산다는 한 임대주택 2층에는 커다란 공용부엌이 있었다. 입주자들이 손님을 맞거나 파티를 할 때 예약제로 이 공용부엌을 이용한다. 조리도구며 테이블이 잘 갖춰져 있다. 그러니 자기 집 부엌이 작아도 불편하지 않다고 한다. 수영장과 어린이도서관은 물론 공연장에 카페까지 갖춘 곳도 있었다. 서민들이 사는 임대주택이란 점을 고려하면 놀라지 않을 수 없었다. 집집마다 자기 공간을 조금씩 내놓으면 공동주택에서 수영장이나 도서관도 누릴 수 있는 것이다.  또 다른 임대주택에서는 특이할 정도로 넓은 복도를 봤다. 서울에서 보는 아파트 복도에 비하면 서너 배쯤 넓다. 건축가는 이 복도를 ‘커뮤니티 공간’이라고 설명했다. 복도에서 아이들이 친구들과 뛰놀고 어른들은 이웃들과 만난다. 복도가 넓어지면 가구별 전용면적은 좁아질 수밖에 없겠지만 그들은 넓은 집에서 혼자 사는 것보다 함께 어울려 살아가기를 택한 듯했다. 빈의 공동주택에서 공동체성은 단단한 원칙으로 자리하고 있는 것처럼 보였다. 1930년 건축된 칼 마르크스 호프는 빈 공공임대주택의 모델을 제시한 곳인데, 세탁장 유치원 병원 우체국 등 공용시설이 전체 건물 면적의 20%를 차지한다. 이에 비하면 서울의 아파트는 겉만 공동주택이지 속은 단독주택이나 마찬가지다. 바로 앞집에 누가 사는지 모르는 경우가 많다. 엘리베이터가 아니라면 거주자들과 얼굴 마주칠 일도 거의 없다. 거대한 공동주택에서 거리상 가장 밀착한 구조로 거주하지만 실제론 자기만의 집에서 단절된 채 살아가는 것이다.   아파트를 고를 때도 소비자들이 주목하는 건 늘 전용공간이다. 자신이 사는 집의 실내 크기나 인테리어가 문제일 뿐 단지 안에 어떤 커뮤니티 시설이 있고 공용공간이 얼마나 되는지 따져보는 이는 드물다. 또 수많은 아파트가 건축되고 있지만 공동체성을 확보하기 위한 시도는 찾아보기 어렵다. 아파트 문화사 연구로 유명한 박철수 교수(서울시립대 건축공학과)에 따르면 전용공간에만 눈이 먼 소비자들의 행태와 업체의 부추김 때문에 아파트의 옥외공간은 1970, 80년대에 지어진 아파트단지에 비해 거의 절반으로 줄어들어버렸다. 이렇게 흘러온 아파트 문화가 우리 사회의 공동체 문화 부재와 어떤 관련이 있는 게 아닐까 싶다. 한국의 아파트는 공동체성을 경험하는 공간이 되지 못한다. 오히려 바로 옆에 사는 이웃을 투명인간 취급하며 혼자 살아가는 삶의 방식을 체화하는 곳이 된다. 누구나 말하듯이 이웃과 함께 나누고 합치고 공유하며 살아가는 문화와 경험이 우리에겐 심각하게 부족하다. 한국인들의 행복지수가 낮은 이유로 공동체 문화의 부재를 꼽는 이들도 많다. 이웃과 어울려 함께 살아가는 빈의 공동임대주택들은 공동주택, 공용공간이 공동체성 회복을 위한 중요한 수단이 될 수 있다는 점을 알려준다. 아파트에 공동체성이라는 주제를 다시 불러들이고 공용공간을 늘려나감으로써 각자도생의 문화를 공유와 협력의 문화로 바꿔나갈 수도 있지 않을까. 일단 공공임대주택에서부터 공용공간을 늘리기 위한 다양한 실험을 시작해볼 필요가 있다.김남중 사회2부 차장 njkim@kmib.co.kr[국민일보 홈페이지] [페이스북] [트위터][취재대행소 왱!(클릭)]GoodNews paper ⓒ 국민일보(www.kmib.co.kr), 무단전재 및 재배포금지"
"[차장칼럼] 코스피의 '불안한 질주'","파이낸셜뉴스","1조6000억원. 기자와 같은 월급쟁이의 눈에는 얼마나 많은 돈인지 가늠조차 어려운 금액이다. 그런데 포털사이트에서 경제뉴스를 검색해보면 1조6000억원쯤은 사실 별로 크지 않은 금액 같기도 하다.삼성전자가 한 분기에 10조원씩 영업이익을 올리는 세상이다. 요즘 잘나가는 SK하이닉스의 1년 영업이익이 대략 10조원쯤 될 것으로 예상된다. 국민연금이 주식을 보유한 기업들로부터 배당받는 금액도 1조6000억원 너끈하다.그런데 이 돈이 주식시장에 굴러들어오면 어떻게 될까. 4월 들어 코스피는 조정장에 빠져 3월에 신나게 올랐던 상승폭을 고스란히 반납해야 했다. 올 초부터 박스권을 뚫겠다며 무던히도 노력했지만 순식간에 도로아미타불이 됐다는 한숨소리가 도처에서 쏟아져나왔다.최근 5일간 상황이 완전히 뒤집혔다. 주가지수가 2주간의 조정폭을 며칠새 만회한 것은 물론이고 증시 사상 최고가의 턱밑까지 치솟아올랐다. 이유는 1조6000억원이란 외국인들의 돈 때문이다. 지난 20~26일 영업일수로 딱 5거래일간 웬만한 대기업 한 분기 영업이익 정도에 불과한 금액이 들어오자, 코스피지수가 한순간에 올라간 것이다.연암 박지원의 허생전을 보면 주인공 허생이 1만냥을 빌려 각종 생필품을 매점매석해 막대한 돈을 끌어모은다. 범인들이라면 큰돈을 벌고 좋아 했겠지만, 우리의 주인공 허생은 고작 1만냥으로 좌지우지할 수 있는 조선의 취약한 경제구조에 대해 탄식을 한다.코스피도 허생전 속 조선 경제와 다를 바 없다. 누구든 2조원만 굴릴 수 있으면, 이 나라의 증시를 꼭대기까지 올릴 수도 있고 한순간에 바닥으로 패대기칠 수도 있기 때문이다.코스피가 오르고 있으니 어쨌든 흐뭇한 일이다. 전문가들도 갑자기 장밋빛 전망들을 내놓으니 당분간은 더 흐뭇해도 될 것만 같다.좋은 분위기에 찬물을 끼얹는 것은 아니지만 내심 마음 한구석에 꺼림칙한 불안감이 남는다. 우리 시장의 운명을 틀어쥐고 있는 외국인들이 언제 마음을 바꿔 '바이 코리아'에서 '셀 코리아'로 돌아설지 모르기 때문.평소 종종 취재를 위해 통화하는 한 전문가가 이런 얘기를 했다. 요즘 트럼프 취임 이후 미국시장 예측이 너무 어려운데, 그러다 보니 국내 증시에 들고나는 외국인 자금동향도 분석이 어렵다는 것이다. 늘 하는 얘기지만 이래서 주식시장은 어렵다. 우리가 결정할 수 있는 게 없어서다. 10년 전이나 지금이나 증시의 외국인 의존도는 늘 우리 주식시장의 최대 약점으로 꼽혀왔다. 당장에 해결책도 없다. 그러고 보면 우리는 참 우리 뜻대로 못하는 것들이 많다. 사드, 소녀상, 북핵문제 등등 어느 것 하나 우리 마음대로만 되지 않으니 말이다.ahnman@fnnews.com 안승현 증권부      ▶ 세상의 모든 골 때리는 이야기 'fn파스'▶ 속보이는 연예뉴스 fn스타 ※ 저작권자 ⓒ  파이낸셜뉴스. 무단 전재-재배포 금지"
"[여의춘추-김준동] 찍을 만한 후보가 없다고요?","국민일보","“여기(미국) 언론에 따르면 북한의 핵 위협이 갈수록 증가되고 있다고 한다. 그런 뉴스가 연일 쏟아지고 있다. 미국의 선제공격 가능성도 여전히 심심찮게 들린다. 잘 지내고 있나. 한국에 있는 당신이 정말로 걱정이 된다.” 나흘 전 미국인 친구로부터 받은 이메일이다. 2009년 미국 연수 당시 옆집에 살았던 인연으로 간혹 이 친구와 이메일을 주고받는다. 긴장이 고조되고 있는 한반도 뉴스를 현지에서 얼마나 많이 접했는지 걱정이 이만저만이 아니다. 오죽했으면 안부를 묻는 이메일을 보냈겠나 싶다. 2009년 5월 25일 북한이 2차 핵실험을 강행했을 당시, 연수 기간이 끝나 한국으로 돌아가려는 나를 한사코 말렸던 친구다. “전쟁이 일어날 수 있으니  계속 있으면 안 되냐”며 말이다. 씁쓸했던 그때 일이 생생하다. 고비는 넘겼다고 하나 8년 전처럼 한반도 상황이 예사롭지 않다. 북한 핵·미사일에 대한 전략적 평가가 달라지면서 미국과 중국의 대북 공조 압박은 예전과 달리 강력해졌다. 미·중 틈에서 우리만 따돌림 당하는 ‘코리아 패싱’도 우려된다. ‘한국은 사실상 중국의 일부였다’는 시진핑 중국 국가주석의 발언까지 도널드 트럼프 미국 대통령의 외신 인터뷰를 통해 전해졌다. 주변 강대국에 끼인 우리 현실에 대한 비애를 새삼 느낀다. 사드 배치까지 맞물려 대외적인 환경이 시시각각 변하고 있다. 하지만 내부의 긴장감은 외부와 큰 차이가 있는 듯하다. 이메일을 보낸 미국인 친구처럼 밖에선 군사적 충돌을 염려하고 있지만 안에선 먼 나라 얘기처럼 들린다. 한반도 주변 정세가 한 치 앞을 내다보기 어려울 정도로 요동치고 있는데 대선 후보들의 행보는 믿음직하지 못하다. 차기 대통령이 직면해야 할 엄혹한 현실이 쌓여만 가고 있지만 후보들은 이렇다 할 해법을 내놓지 못하고 있다. TV 토론회 같은 데서 치열하게 논쟁을 벌여야 할 점도 이런 문제들이다. 압박과 대화 등 미국의 기류가 변화무쌍하지만 후보들의 눈은 과거에만 머물러 있다. 위기를 돌파할 미래는 보이지 않는다. 이런 후보들에게 과연 나라를 맡길 수 있을까 하는 걱정이 앞선다. 이러니 TV 토론 횟수가 거듭할수록 “찍을 후보가 없다”는 한숨만 더 늘어나는 것이 아니겠는가. 투표일이 다가올수록 마음을 못 정한 유권자들이 조금씩 늘고 있다는 여론조사도 있다. ‘찍을 ×이 없으니 투표용지에 0번을 만들자’ ‘후보들이 못 미더우니 유권자라도 정신 차리자’라는 네티즌들의 경고성 의견도 나온다. 지난 2008년 개봉한 영화 ‘스윙 보트(Swing Vote)’를 최근 다시 봤다. “투표로 달라지는 건 아무것도 없다”는 정치 혐오로 가득했던 버드(케빈 코스트너)는 자신이 가진 한 표의 엄청난 무게를 뒤늦게 깨닫고 대통령 후보 검증에 직접 나선다. 그의 초등학생 딸 몰리(매들린 캐럴)는 셀프검증을 통한 투표가 왜 중요한지 이렇게 말한다. “세계의 모든 위대한 문명은 같은 길을 따라 왔습니다. 속박에서 자유로, 자유에서 번영으로, 번영에서 만족으로, 만족에서 무관심으로, 무관심에서 다시 속박으로, 우리가 이런 역사에서 벗어나려면 순환 고리를 깨야 합니다.” 투표는 삶을 바꾸고 나아가 역사를 바꿀 수 있다는 것이다. 비록 영화 속 얘기지만 시사하는 바가 크다. 프랑스의 정치철학자인 알렉시 드 토크빌은 “모든 민주주의에서 국민은 그들의 수준에 맞는 정부를 가진다”고 했다. 투표일은 다가오는데 이래저래 고민이 많아지고 있는 유권자들이 아프게 새기고 무겁게 받아들여야 할 대목이다. 대선까지 11일 남았다. 유권자한테도 후보한테도 이제 시간이 별로 없다. 구겨진 후보 공보물부터 다시 펴봐야겠다. 김준동 논설위원 jdkim@kmib.co.kr[국민일보 홈페이지] [페이스북] [트위터][취재대행소 왱!(클릭)]GoodNews paper ⓒ 국민일보(www.kmib.co.kr), 무단전재 및 재배포금지"
"푸드 피라미드","한국일보","[기억할 오늘] 4.28미국 농무부의 첫 '푸드 피라미드'가 1992년 4월 28일 발표됐다. healthy-eating-politics.com섭식과 다이어트가 대중의 인식 속에 자리잡기 시작한 것은 서구의 경우 1960년대부터였다. 70년대에는 구토제 성분이 든 다이어트 약이 시판됐다. 한국전쟁 직후의 빈곤과 경제개발 총력전으로 50ㆍ60년대를 보낸 한국은 70년대 식량 안보 차원의 쌀 증산 및 혼분식 장려정책으로 다이어트를 아는 이조차 드물었고, 영양과 보건 차원의 권장 식단이라는 게 대중화한 것도 80년대 중반 이후였다. 권장식단의 원조 격인 ‘푸드 피라미드(일명 다이어트 피라미드)’를 처음 도입한 것은 1974년 스웨덴이었다. 스웨덴 국립 보건복지위원회가 매끼 영양군별 적정 음식물 섭취량을 밝힌 그 보고서의 원래 목적은 72년 농산물 파동으로 식재료값이 급등하자 시민들이 적정 영양소를 최대한 적은 비용으로 섭취할 수 있도록 하려는 거였다. 스웨덴의 푸드 피라미드는 큰 호응을 얻어 금세 인근 북유럽 국가로, 서독 등 유럽과 일본 등지로 확산됐다.하지만 가장 유명한 건 미국 농무부(USDA)가 스웨덴 버전을 참조해 1992년 4월 28일 발표한 푸드 피라미드다. 네 개 단(段)에 6개 군의 음식물을 영양소별로 나누어 각각 권장량을 기록한 거였는데, 가장 넓은 아랫단은 곡류와 빵 등 탄수화물이었고, 바로 윗단은 야채와 과일, 세 번째 단은 유제품과 육류(단백질), 맨 위가 지방과 오일, 당류였다. 식사의 약 60%를 탄수화물로 채우고, 지방 섭취를 최소화하도록 권장한 이 지침은 미국은 물론 거의 전 세계 자본주의 국가의 각급 학교 및 가정 급식 식단 구성의 바이블처럼 숭배됐다. USDA가 피라미드 작성 작업을 시작하던 88년 당시 스웨덴의 심장병 발병 비율이 미국보다 높았다는 사실은 무시됐다. USDA의 1차 개정판인 ‘마이 피라미드’가 나온 2005년 무렵 미국 성인(20~75세)의 약 65%가 비만이었다. 마이 피라미드는 개인별 연령과 활동량 등에 따라 12개 안으로 세분화됐고, 도정하지 않은 통곡류 등 권장 사항이 포함됐다. 92년 안이 만들어지던 과정에 식품산업계의 치열한 로비전이 있었다는 사실도 그 과정에서 알려졌다.2011년 6월의 최근 버전 ‘My Plate’는 4분할된 둥근 접시 형태의 다이어그램으로 훨씬 단순화ㆍ추상화됐다. 채소와 과일이 전체의 절반을 차지했고, 나머지 절반은 통곡물과 양질의 단백질이다. 지방과 설탕 등 나머지는 접시 바깥 자리에 팁으로 기술됐고, 유제품도 작은 원으로 별도로 그려졌다.  최윤필 기자▶한국일보 [페이스북] [카카오 친구맺기]▶자동차의 모든 것! [모클][ⓒ 한국일보(hankookilbo.com), 무단 전재 및 재배포 금지]"
"[한마당-이명희] 전인권의 수난","국민일보","5공화국 시절 탤런트 박용식은 전두환 대통령을 닮았다는 이유로 방송 출연을 금지당했다. “못 생겨서 죄송합니다.” “콩나물 팍팍 무쳤냐?” 등을 유행시키며 전성기를 구가하던 코미디언 이주일도 1981년 방송에서 퇴출됐다가 전두환 정권 말기인 1986년 복귀했다. 너무 못 생겼고 저질이라고 시청자들이 항의했기 때문이라고 하지만 실제는 전 대통령과 같은 대머리였기 때문이란 게 정설이다. 2009년 노무현 전 대통령의 노제 사회를 본 개그맨 김제동은 이명박정부에 밉보여 KBS 방송 프로그램에서 하차했다. 록그룹 들국화의 멤버였던 전인권이 2004년 발표한 ‘걱정 말아요 그대’가 표절 논란에 휩싸였다. 그제 한 네티즌이 인터넷에 독일 그룹 블랙 푀스(Black Fooss)가 1971년 발표한 ‘드링크 도흐 아이네 멧’(Drink doch eine met·한잔 같이 하자)이란 곡과 유사하다는 글을 올리면서다. 이 곡은 드라마 ‘응답하라 1988’에 이적의 리메이크 OST로 삽입됐고 지난겨울 촛불집회에서 전인권이 직접 부르기도 했다. 전인권은 27일 “40년 음악인생을 걸고 표절하지 않았다”고 부인했지만 논란은 수그러들지 않고 있다. 그는 지난 18일 안철수 국민의당 대선 후보 지지 선언을 하면서 ‘문빠’들로부터 ‘적폐 가수’라고 공격을 받았다. 이어 다음 달 6, 7일 예정된 공연 티켓 환불이 이어지자 7일자 공연을 취소했다. ‘문재인 블랙리스트 1호=전인권’이란 말이 나올 법하다.  메릴 스트립, 알렉 볼드윈, 마돈나 등 할리우드 배우들이 도널드 트럼프 미국 대통령을 거칠게 비판하고 풍자했지만 불이익을 당했다는 얘기는 들어보지 못했다. 대선 기간 트럼프와 설전을 벌였던 폭스뉴스 여성 앵커 메긴 켈리는 연봉 2000만 달러(약 226억원)의 파격적인 제안을 뿌리치고 NBC방송으로 이적할 정도로 승승장구하고 있다. 표현의 자유는 민주주의의 소중한 가치다. 생각이 다르다고 해서 공격한다면 박근혜정부의 ‘블랙리스트’와 다를 바가 없다. 글=이명희 논설위원, 삽화=이영은 기자[국민일보 홈페이지] [페이스북] [트위터][취재대행소 왱!(클릭)]GoodNews paper ⓒ 국민일보(www.kmib.co.kr), 무단전재 및 재배포금지"
