"title","press","body"
" 재벌개혁, 참여정부 실패를 반면교사로 삼아야 ","한겨레","[한겨레] [HERI, 대선 의제를 말하다]-⑥재벌개혁정권 초기에 선택과 집중 필요경제위기론, 외자 침탈론 등 극복 과제 개혁 의지 강한 경제팀 진용 짜야  한겨레경제사회연구원(HERI)이 19대 대선 의제를 짚어보는 온라인 기획 ‘HERI, 대선 의제를 말하다’를 연재합니다. 청년·노동·교육 등 각 분야 현장 전문가들이 주요 후보 공약을 포함한 대선 의제를 비판적으로 점검합니다.   19대 대통령선거에 출마한 주요 후보들은 재벌개혁을 주요한 경제공약으로 제시하고 있다. 후보별로 약간의 차이는 있지만 재벌 중심 경제시스템은 수명을 다했고 이를 방치하면 혁신은 질식하고 소득과 빈부의 격차는 심해질 것이란 인식을 공유하고 있다. 문재인, 홍준표, 안철수, 유승민, 심상정 등 5당의 후보는 △징벌적 손해배상제도 및 집단소송제 도입 △총수 일가 일감 몰아주기 근절 △대기업 갑질 근절 △ 공정위 전속고발권 폐지 등 4가지 공약에 모두 동의해 이런 제도가 다음 정부에서 실행될 가능성이 커졌다.서울 여의도 전국경제인연합회 모습. 김봉규 선임기자 bong9@hani.co.kr  하지만 재벌개혁이나 공정한 시장경제 확립은 실행이 더 중요한 사안이다. 그동안 아이디어나 프로그램이 없어서라기보다는 재벌과 기득권 집단의 저항에 막혀 제대로 실행을 못 한 것이기 때문이다. “권력은 시장에 넘어갔다”는 말이 보여주듯 이미 경제권력은 우리나라에서 가장 강력한 힘이다. 이런 힘센 집단을 상대해야 하는 데다 대부분의 공약이 법률 개정을 필요로 하는데 현재 주요 정당의 의석 분포를 볼 때 누가 집권하더라도 실행이 만만치 않아 보인다. 그래서 강력한 의지와 면밀한 계획이 있어야 성공할 수 있다. 노무현 정부의 재벌개혁 실패는 이런 점에서 ‘반면교사’ 삼을 만하다. 2002년 대통령선거 국면에서 노무현 후보는 성장과 분배, 자본과 노동, 가진 자와 못 가진 자의 균형을 경제정책의 방향으로 제시했다. 재벌 중심 경제구조를 혁파하고 공정한 시장질서를 확립하는 것은 이를 실천하기 위한 중간목표였다. 구체적인 정책으로는 △증권 관련 집단소송제 도입 △상속세제 개편 △사주일가의 지배력 확대에 금융계열사의 자금을 동원하는 행위를 규제하겠다고 약속했다. 하지만 결기를 내비치며 시작한 개혁작업은 재벌 및 기득권 집단의 저항에 밀려 불과 6개월 만에 흐지부지되고 말았다. 재벌의 견제는 끈질기고 집요했는데 우선 대기업 집단의 이익을 대변하는 전경련은 새로 출범하는 정권의 개혁안에 노골적으로 반대했다. 한 예로 당시 김 아무개 전경련 전무는 와의 인터뷰에서 새 정부의 경제정책이 “사회주의적”이라는 표현을 쓴 것으로 보도돼 큰 논란을 빚기도 했다. 노무현 대통령이 재벌의 저항에 대해 경고하기도 하고, 일부 참모가 “경기가 좀 어려워지는 한이 있어도 재벌개혁은 꼭 할 것”이라는 의지도 내보였지만 오래가지 않았다. 신용카드 사태의 후유증이 본격적으로 나타나고 때마침 터진 사스(SARS)로 소비심리가 위축돼 2003년 상반기 경기가 하강하자 정권은 초조해하며 재벌에 손을 내밀었다. 정부 출범 5개월쯤 된 7월에는 삼성경제연구소가 고안한 ’2만 달러 국민소득’ 어젠다에 관심을 보이더니 8월 15일 경축사 연설에서 대통령이 이를 언급함으로써 국정어젠다로 격상했다. 이로써 노무현 정부 초기의 개혁 기조는 완전히 사라지고 경제사회정책은 성장과 친재벌로 돌아서게 된다. 참여정부의 재벌개혁이 실패한 원인을 세 가지로 정리하면 먼저 대통령과 집권당이 재벌개혁에 대해 확고한 의지와 실행계획이 부족한 점을 들 수 있다. 개혁을 표방했지만 초대 경제사령탑에 경제부처에서 잔뼈가 굵은 관료 출신 인사를 기용한 것부터 앞뒤가 안 맞았다. 초대 김진표 부총리는 취임 일성으로 “법인세 인하”를 내세웠다가 여론의 질타를 받고 철회하는 등 개혁 기조와는 거리가 있었다. 확고한 개혁 의지가 부족하다 보니 정치일정을 의식하게 되고 큰 소리 나고 인기 없는 개혁정책은 지속하기 어려웠다. 2004년 4월로 예정된 총선이 다가오는데 정부에 대한 국민의 지지율이 떨어지자 별다른 정책 대안을 제시하지 못하고 재벌에 투자를 ‘읍소’하는 길을 택한 것이다. 두 번째는 기득권 세력의 저항 담론을 돌파할 논리적 준비가 부족했다. 기업의 기를 살려주면 투자와 일자리가 늘어나고, 자연히 국민소득도 늘어날 것이란 ‘낙수효과’ 논리를 반박하고 국민의 주머니를 채워주는 게 진정한 성장의 길이란 점을 제시하지 못했다. 이는 당시 청와대, 정부, 집권당에 포진한 주요 정책결정자들이 신자유주의적 신념을 공유하는 관계, 즉 모두가 같은 ‘인지적 공동체’(epistemic community) 에 속해 있었던 점에서 어쩔 수 없는 한계이기도 했다. 아울러 2003년 소버린 사태 이후 부각된 경제 민족주의 감정에 효과적으로 대처하지 못했다. 글로벌 투자펀드인 소버린이 SK(주)의 지분을 취득한 뒤 취약한 지배구조를 활용해 엄청난 투자차익을 올린 이 사태 이후 ‘민족자본’ 대 ‘외국자본’의 대립 담론이 만들어졌고 이는 재벌개혁의 당위성을 지속해서 위협했다. 재벌은 민족자본을 자처했는데, “민족자본을 재벌개혁이란 이름으로 억압하는 것이 옳으냐”는 논란은 지금도 이어지고 있다. 세 번째는 시민과 시장의 힘을 원군으로 활용하는 전략이 미흡했다는 것이다. 개혁하면 내 주머니 사정이 나아질 것이란 믿음을 국민에게 줄 때 개혁은 탄력을 받게 된다. 하지만 참여정부가 내세운 경제어젠다인 △동북아 경제 중심 국가건설 △공정한 시장경제 확립 등이 어떻게 내 소득 개선으로 이어질지 피부에 잘 와 닿지 않았고, 언론을 통해 이를 설득하는 노력도 미흡했다. 언론은 정권 초에는 압도적으로 ‘재벌개혁’을 응원했으나 2003년 중반 이후에는 ‘경제위기 극복’과 ‘성장’으로 돌아섰다. 비록 10년도 넘은 참여정부의 사례이지만 재벌개혁과 공정한 시장경제 확립이란 점에서 과제는 비슷하며, 새 정부에서 이런 상황은 재연될 가능성이 크다. 벌써 ‘공정위 권한이 강화되면 투자와 고용이 움즈러 들 것’이라거나 ‘집중투표제가 도입되면 제2의 소버린 사태가 난다’라는 등 재계의 입장을 대변한 보도가 적지 않게 나오고 있다. 개혁이 성공하려면 면밀한 준비와 실행이 필요한 것이다. 새 정부가 재벌개혁과 관련해 가장 염두에 두어야 할 것은 ‘속전속결’과 ‘취사선택’이다. 지금은 최순실의 국정농단 사태로 정경유착에 대한 국민의 분노가 강하고, 재벌기업의 이익을 대변해 온 전경련이 해체 위기에 몰려있는 등 반대세력의 힘도 취약해진 상황이다. 이럴 때를 놓치지 않고 개혁의 고삐를 조여야 하는데, 핵심 개혁은 집권 6개월 이내에 완료한다는 마음가짐으로 집중하는 것이 필요하다. 짧은 시간에 모두를 다 할 수 없다면 불가피하게 취사선택해야 하는데, 한번 실행되면 뒤로 돌리기 어렵고 다른 개혁 프로그램이 감자 줄기처럼 따라 오는 ’미끄러운 비탈길형’ 개혁을 먼저 하는 것이 현명하다. 예를 들어 기업이 회계감사법인을 임의로 선정하기 때문에 회계법인이 ‘을’이 되는 모순을 제도적으로 개혁하면 시장시스템에 의한 기업 감시가 힘을 받게 된다. 안철수 후보 진영에서 회계 투명성을 높이기 위해 6년은 자유 수임하되 3년은 지정 수임하는 ‘감사 혼합제’를 제시한 것은 이런 점에서 주목된다. 개혁할 때 또 하나 주의할 점은 경기를 살려가며 해야 한다는 것이다. 경기가 계속 움츠러들면 개혁의 동력은 사그라지게 마련이다. 이런 점에서 확장적 재정정책으로 경기부양을 해가면서 개혁을 하겠다는 민주당의 계획은 타당성이 있어 보인다. 아울러 개혁을 하더라도 재계를 싸잡아서 적으로 돌리는 잘못을 범해서는 안 된다. 시장에는 대기업도 있지만 시장원리가 투명하게 작동하길 원하는 기관투자가, 소액주주, 중소-중견기업, 자영업자가 있다. 노동조합을 포함해 모두가 응원하는 개혁을 해야 한다. 인수합병(M&A) 제도가 가진 시장규율 기능을 살려가야 하지만, 외국자본이 마음대로 활개 치고 다닌다는 인식을 국민이 갖지 않도록 적절한 견제장치를 마련할 필요가 있다. 마지막으로 개혁을 하려면 제대로 실행할 진용을 짜야 한다. 재벌체제에서 성장한 관료, 시장지상주의 신념에 투철한 경제학자에게 개혁의 키를 맡기는 것은 개혁을 하지 않겠다는 것과 같다. 개혁을 할 때라는 판단이라면 경제부총리, 경제수석, 공정거래위원장 등의 진용을 개혁성향 인사로 채워야 한다. 아울러 거의 모든 개혁 프로그램이 국회의 입법을 거쳐야 하는 점에서 국회에서 여야의 협치를 끌어내는 정치력을 발휘하는 것도 매우 중요하다. 이봉현 한겨레경제사회연구원 시민경제센터 연구위원 bhlee@hani.co.kr ▶ 한겨레 절친이 되어 주세요! [신문구독] [주주신청][▶ 대선 팩트체크] [페이스북] [카카오톡] [정치BAR][ⓒ한겨레신문 : 무단전재 및 재배포 금지]"
"[아침을 열며] 공기 반, 소리 반의 외교","한국일보","외교의 목적은 전쟁과 극단적 대립을 피하는 데 있다. 외교와 안보는 상이한 지향점을 갖는다. 생명과 존립을 지키기 위한 안보에 있어서는 타협의 여지가 별로 존재할 수 없다. 그러나 그 안보의 추구가 극단적 선택이 되지 않도록 상호간의 접점을 도출한다는 점에서 외교는 공감과 타협을 기본으로 한다. 대화로 전쟁을 피하고, 상대방을 돌려놓을 수 있다면, 화술은 외교의 가장 큰 무기가 된다.물론 외교 역시 힘을 바탕으로 한다. 큰 목소리를 가진 행위자가 기본적으로 우위에 서게 된다. 특히 강대국 사이에 낀 나라의 외교 현실은 혹독하다. 자신의 운명이 거대 게임의 일부가 되어 있을 때 취할 수 있는 외교적 선택은 너무도 제한적이다. 그러나 힘의 논리를 가지고 상대방을 변화시킬 수 없다면, 공감을 통해 변화를 추구할 수밖에 없다. 외교의 언어는 때로는 단호해야 하지만, 때로는 노래가 되어 관객의 마음을 사로잡아야 한다. 이 노래는 단순히 즐기기 위한 음악이 아니라 생존을 위한 절실한 소통의 도구이다.문득 K팝 오디션 프로그램에서 한 심사위원이 종종 했던 말이 생각난다. 노래는 짧은 시간에 관객에게 감동을 주고 다가가야 한다. 그러기 위해서는 긴 호흡과 음을 당기고 늘리는 리듬감, 장ㆍ단조를 오가는 변조, 그리고 공기 반 소리 반의 자연스런 공간감이 갖춰져야 한다. 그렇다면 우리 외교의 노래는 어떠했는가? 이제까지 우리는 공기 하나 없이 어깨에 힘주고 긴장하며 가사를 전달하는 데 치중하지 않았을까? 게다가 한 박자, 한 소절이라도 어긋날 때마다 안팎에서 탈탈 털리는 경험을 하고 난 정책담당자들은 가장 안전한 목소리로 모범답안의 멜로디를 불러야 했다. 솔직하고 정직한, 하지만 다음 소절이 어떻게 나올지 뻔히 보이는 노래를 짧은 호흡으로 불러왔는지도 모른다. 만약 지금 대선 후보들의 외교안보 논의도 오디션 심사위원처럼 평가했다면, 관객 마음에 와 닿아 다음 라운드로 진출할 수 있었을까?외교에 있어서 원칙은 중요하고, 말과 행동도 일치해야 한다. 그러나 말과 말, 그리고 말과 행동 사이의 시간과 공간의 패턴이 반드시 일정할 필요는 없다. 외교에서 말과 말, 행동 사이의 공간은 자칫 불확실성이 될 수 있지만, 만약 이러한 공간이 치밀하게 의도된 것이라면 외교적 자산이 될 수도 있다. 동맹국 사이에서 같은 말을 하는데도 행동이 조율이 되지 않는 경우가 있고, 달라 보이는 말을 하는데도 자연스럽게 조율이 되는 경우가 있다. 후자를 가능하게 하는 것은 무엇보다도 신뢰감이다. 거기에 유연성과 창조성이 덧붙여졌을 때 비로소 외교적 카드를 한 장 쥘 수 있게 된다.실제로 지금의 상황에서 “한미동맹을 중심축으로 하고 중국을 잘 설득하는“ 것 이외에 한반도 외교에서 획기적 방안이 나올 여지는 크지 않다. 결국 매번 똑같이 부르고 불러서 이제 식상한 그 ‘뻔한 발라드’를 새로 편곡해서 한 끗발 다르게 불러내야 할지 모른다. 그러기 위해 새로운 템포와 리듬, 그리고 의도한 엇박자까지 연습해야 한다. 또한 그 외교의 노래는 관객을 바라보고 불러야 한다. 종종 우리 외교의 노래는 무대 뒤를 보고 자국민을 상대로 불려졌다. 하지만 이제는 미국, 중국, 일본, 북한 그리고 국제사회라는 관객 앞에서 그들의 마음 한구석을 움직여야 한다.우리는 “예, 아니오”의 확실한 언어로 외교를 해야 한다고 생각해 왔고, 대상에 따라 분노의 언어와 애정의 언어를 뚜렷이 구별했다. 물론 우리의 운명을 건 외교 문제에서 의사표명은 신중하고 당당해야 한다. 다만 그 언어의 사용은 더 유연하고 마음에 와 닿아야 한다. 날이 갈수록 날카로워지는 한반도 정세 하에서 우리는 근엄한 안보의 구호뿐만 아니라 새로운 외교의 언어로 노래를 불러야 한다. 그것도 공기 반, 소리 반의 여운을 남기면서 말이다.이재승 고려대 국제학부 교수▶한국일보 [페이스북] [카카오 친구맺기]▶자동차의 모든 것! [모클][ⓒ 한국일보(hankookilbo.com), 무단 전재 및 재배포 금지]"
"<포럼>‘보수 단일화’ 최대의 敵은 후보 私慾","문화일보","이태동 문학평론가 서강대 명예교수대선이 채 2주일도 남지 않은 지금 보수(保守)의 결집을 바라는 국민의 소리가 높다. 탄핵 정국으로 인해 보수가 지금처럼 분열된 상태로 가게 되면, 정권이 좌파로 넘어가 북핵 위협 속에서 살아가게 될지도 모른다고 생각하기 때문이다.대선 앞에서 보수층이 분열한 것은 탄핵 정국과도 깊은 관계가 있다. 바른정당은 태극기 민심과는 다른 촛불 민심과 탄핵 찬성을 기치로 분당했고, 자유한국당은 탄핵을 반대하는 친박 세력과 일부 탄핵 찬성파 의원이 모여 당명을 바꾸면서도 보수의 색채를 그대로 가지고 있다.그런데 보수가 자유한국당과 바른정당으로만 갈라선 게 아니다. 대선 후보도 자유한국당 홍준표, 새누리당 조원진, 통일한국당의 남재준 셋으로 갈려 또 다른 분열의 길을 걷고 있다. 홍 후보는 대통령에 당선되면 박근혜 전 대통령 탄핵의 원인을 규명하겠다고 했지만, 유승민 후보와의 단일화를 모색하려는 태도가 새누리당에는 ‘참을 수 없는 가벼움’으로 비쳤다. 물론 홍 후보는 정치는 순수성 그 자체와 거리가 있다고 말할 것이다.새누리당 조 후보의 경우는 어떠한가? 태극기 집회 사람들은 정치적 도의와 인간적인 신의 문제에 있어서 ‘배신의 정치’로 낙인 찍힌 유 후보보다 그가 비교우위에 있다고 평가한다. 그러나 대다수의 보수층은 태극기 집회 사람들을 하나로 뭉치게 하지 못하고 분열의 조짐을 보이게 한 것에 대해선 조 후보나 남 후보에게 회의적인 시선을 보낸다. 그리고 많은 보수층 유권자는 아직도 적잖은 의석을 가지고 있는 자유한국당의 홍 후보와 분열했을 때, 그들이 대선에서 이길 수 있을지에 대해선 더욱 더 회의적이다. 1997년 대선에서 보수가 이회창·이인제 후보의 분열로 패했고, 2014년 서울시교육감 선거 때에는 보수 후보가 난립해 서울을 비롯한 10여 곳에서 패했다는 사실을 우리는 아직도 생생하게 기억하고 있다.만일 보수가 지금처럼 분열해서 패한다면, 조 후보는 물론 남 후보도 그 책임을 면치 못할 것이다. 그러나 모든 감정적인 문제를 뛰어넘어 나라를 위해 보수 단일화를 이뤄낸다면 해볼 만한 게임이 될 것이다. 비록 패하더라도 나라를 위해 보여준 그들의 희생정신은 기억될 것이다.지금 많은 국민은 보수 후보들이 단일화하지 못하는 이유를, 국가를 위해서라기보다는 후보 개인의 정치적 욕심 때문이라고 말한다. 분리주의자들은 대선에 패하더라도 정치적 지지 세력이 있기 때문에 대선 이후에 펼쳐질 정치 지형에서 유리한 고지(高地)를 점령할 수 있다고 생각할 것이다. 그러나 보수층이 모래알처럼 흩어져 분열하게 되면 대선과 더불어 밀어닥칠 권력의 쓰나미 앞에서 스스로의 존재를 찾기가 어려울 것이다.보수 후보들이 비록 박 전 대통령 탄핵 문제에 대해 서로 입장을 달리한다 하더라도 그들은 모두가 보수적 정치 신념을 함께 가지고 있기 때문에 그것을 공통분모로 삼아 하나로 뭉쳐야 한다는 게 보수 유권자들의 ‘지상명령(至上命令)’이다. 그들이 사욕(私慾)보다 국익을 위해 하나가 되어 좌파와 대결하는 모습을 보여준다면, 절대다수의 보수층 유권자도 ‘기울어진 운동장’을 바로 잡기 위해 희망을 가지고 투표장에 나갈 것이다.국민도 충분한 준비 없이 ‘기울어진 운동장’에서 공정하지 못한 대선을 치르길 원치 않는다. 민주주의 정당정치는 보수와 진보라는 두 축의 프레임에서 상호 보완관계를 유지하면서 발전한다는 사실을 국민은 잘 알기 때문이다.[ 문화닷컴 바로가기 | 소설 서유기 | 모바일 웹 ][Copyrightⓒmunhwa.com '대한민국 오후를 여는 유일석간 문화일보' 무단 전재 및 재배포 금지(구독신청:02)3701-5555)]"
"<사설>거슬리는 질문에 화낸 文후보, 당선되면 苦言 듣겠나","문화일보","대선 후보 ‘5자 TV 토론’에서 오만하고 절제되지 않은 감정 표출로 토론의 근본 취지조차 무색하게 하는 행태까지 나타나고 있다. 25일 JTBC·중앙일보·한국정치학회 공동 주최 토론회에서 문재인 더불어민주당 후보가 귀에 거슬리는 질문에 화를 낸 것이 대표적인 예다. 공공부문 일자리 공약의 재원 대책이 계산부터 안 맞는다는 유승민 바른정당 후보 지적에 “세세한 건 우리 정책본부장과 토론하는 게 맞겠다”며 자신의 아랫사람과 상대하라는 식으로 대꾸했다. 유 후보가 “오만한 태도”라고 비판한 취지대로 어떤 질문이든 성실하게 직접 답변해야 한다는 것은 토론의 기본 예의·상식이다. 듣기 좋은 질의·응답만 하는 것은 제대로 된 토론일 수도 없다. 노무현 전 대통령 일가의 640만 달러 수수 의혹에 대한 거듭된 추궁에 문 후보가 “이보세요!” 하며 호통치듯 한 것도 유권자 다수는 “말씀을 버릇없이 한다”는 홍준표 자유한국당 후보의 표현에 공감하게 마련이다. 문 후보의 이런 행태는 ‘역사에서 가장 닮고 싶은 리더십의 인물’로 세종대왕을 내세우며 “소통하는, 국민과 눈을 맞추는 대통령이 되겠다”고 덧붙인 것도 수사(修辭)로만 들리게 한다. 소통의 기본 전제 중에 하나는 고언(苦言)을 듣는 자세인데, 그런 기대를 하기 어렵게 하기 때문이다. 파면된 박근혜 전 대통령의 ‘불통’이 고언·직언을 멀리한 독선에서 비롯됐다는 사실을 새삼 떠올리는 이유도 다르지 않다.[ 문화닷컴 바로가기 | 소설 서유기 | 모바일 웹 ][Copyrightⓒmunhwa.com '대한민국 오후를 여는 유일석간 문화일보' 무단 전재 및 재배포 금지(구독신청:02)3701-5555)]"
"[주요 신문 사설](26일 석간)","연합뉴스","▲ 문화일보 = '사드' 한국 도착 51일 만의 현장 반입과 配置 완료 시급성                  대선 후보인지 '산타'인지 헷갈리게 하는 황당 公約들                  거슬리는 질문에 화낸 文후보, 당선되면 苦言 듣겠나    ▲ 내일신문 = 투표장 가는 유권자가 결정한다    ▲ 헤럴드경제 = 오죽했으면…취업절벽에 좌절해 극단 선택한 두 청년                    LPG 차량 규제 완화는 시대적 요구(서울=연합뉴스)최신 유행 트렌드 총집결 #흥(클릭!)"
"<여론마당>선거 벽보 훼손하면 2년 이하 징역·400만 원 이하 벌금","문화일보","며칠 전 선거 벽보 훼손과 관련해 눈길을 끄는 기사가 있었다. 새벽녘 경찰 12명을 출동시킨 선거 벽보훼손의 범인은 바로 길고양이 2마리. 풋, 이런 일도 있구나. 웃음이 났다. 그리고 그 옆에 ‘버스가 서지 않아 홧김에’ 벽보를 훼손했다는 눈살을 찌푸리게 하는 기사도 있었다. 7일 공식 선거운동이 시작되었고, 22일까지 선거 벽보가 붙게 됐다. 선거 벽보는 후보자의 사진, 성명, 경력, 슬로건을 요약해 담은 ‘선거의 고갱이’라 할 수 있다. 이런 이유로 지난 선거의 벽보는 그 시대의 이슈를 가늠해 볼 수 있는 좋은 수단이 되기도 하고, 벽보 앞에 서서 후보들을 가늠해보는 어른들의 진지한 모습은 아이들에게는 민주주의의 산교육이 되기도 한다.하지만 벽보를 부착한 지 채 며칠 되지 않아 선거 벽보 훼손이 빈번히 일어나고 있다. ‘특정 후보가 싫어서’ ‘기분이 나빠서’ ‘장난으로’ 등 그 이유도 다양하다. 선거 벽보 훼손은 명백한 범죄 행위이다. 현행 공직선거법상 정당한 사유 없이 첩부된 선거 벽보를 훼손하거나 철거한 자는 2년 이하의 징역이나 400만 원 이하의 벌금에 처해진다. 선관위와 경찰은 23일부터 선거 벽보를 비롯한 선거홍보물 훼손 행위에 대한 감시와 수사를 대폭 강화한다고 밝혔다.선거는 민주주의 꽃이다. 투·개표뿐 아니라 선거 벽보 게시도 민주적 절차의 하나이고, 스치듯 지나가는 벽보 한 장, 무심히 버리는 명함 한 장까지 모두 민주주의의 매개체이다. 강다희·부산시선관위[ 문화닷컴 바로가기 | 소설 서유기 | 모바일 웹 ][Copyrightⓒmunhwa.com '대한민국 오후를 여는 유일석간 문화일보' 무단 전재 및 재배포 금지(구독신청:02)3701-5555)]"
