"title","press","body"
"[녹색세상]4대강 ‘삽질’을 기억하라","경향신문","지난 토요일 영산강 하굿둑을 다녀왔다. 4월 하순으로 막 접어든 그날 영산강은 벌써부터 녹조빛을 띠고 있었다. 사실 영산강만이 아니다. 강들이 제 빛을 잃은 지 오래, ‘4대강 살리기 사업’이란 이름이 무색하게 우리의 4대강은 ‘死대강’이 되어버렸다. ‘보’라 불리는 댐에 강물의 흐름이 막히면서 맑은 물빛이 사라지고 연례행사로 창궐하는 녹조 탓에 초록 페인트를 뒤집어쓴 듯하다.꼭 10년 전이다. 2007년 대선을 앞두고 4월23일부터 예비후보등록이 있었고 며칠 뒤인 4월27일에 당시 각종 여론조사에서 선두를 달리던 이명박 한나라당 경선후보자의 ‘한반도 대운하 건설’ 구상에 대한 공약 검증 토론회가 MBC 100분 토론에서 열렸다. 류우익 서울대 지리학과 교수와 정동양 한국교원대 기술교육학과 교수가 찬성 측 패널로, 홍종호 한양대 경제금융학부 교수와 박진섭 생태지평연구소 부소장이 반대측 패널로 참가했다(당시 소속과 직책). 비용편익분석을 통해 한반도 대운하 사업의 경제성을 높이 평가해서 사업 추진 논리를 뒷받침했던 곽승준 고려대 경제학과 교수는 출연을 고사했다고 한다. 어느 블로그(http://m.blog.naver.com/seyoungchoi/120040179443) 운영자는 그날의 토론을 이렇게 적고 있다. “100분이 짧게 느껴질 정도로 흥미로웠지만 찬성 쪽 패널들의 잦은 실수로 싱거운 시간이기도 했다.”제대로 된 전문성과 논리로는 정당화하기 어려웠던 한반도 대운하 구상, 그 구상은 이명박 전 대통령 취임 이후 2008년 5월에 시작된 광우병 촛불 민심의 반대로 폐기되는 듯하다가 그해 12월 4대강 정비사업이란 이름으로, 2009년 6월에 ‘4대강 살리기 사업’이란 이름으로 되살아났다. 2500명 이상의 교수와 전문가, 그리고 다수 국민의 반대에도 불구하고, 우리의 4대강이 22조2000억원의 공사비를 집어삼킨 대규모 토목공사의 먹잇감이 되고 강으로서의 기능을 잃어가는 데 채 4년이 걸리지 않았다. 그리고 박근혜 정부 내내 제대로 된 문제 해결 노력을 기울이기는커녕 4대강 주변 개발사업을 승인함으로써 4대강은 계속해서 썩어갔다. 방치하기에는 녹조문제가 너무 심각하기에, 정부는 마지못해 일부 보의 수문을 개방하는 시범단계를 거쳐 올 4월부터 1년 내내 모든 보의 수문을 상시 개방하기로 했다.4대강 사업의 실패는 이제 부정할 수 없는 ‘사실’이 되었다. 안타깝게도 그 실패는 이미 예견된 것이었다. 4대강 사업은 제대로 된 경제성 분석도, 사회적 토론도 없이, 그래서 폭넓은 사회적 합의와 공감대 없이, 당시 국회의장이었던 박희태 의원이 하고자 했던 대로, ‘전광석화’처럼 진행되었다. 4대강 사업의 씨앗이 되었던 한반도 대운하 사업이 논란이 되었던 때로부터 꼭 10년 만에 치러지는 이번 대선으로 4대강을 회복시킬 수 있는 창이 열리기를 기대한다. 4대강 사업이야말로 청산해야 할 적폐 중의 적폐요, 그것이 촛불민심이기에.그런데 요즘 대선 토론회에서는 4대강 문제가 제대로 다루어지지 않고 있다. 거론할 필요 없이 당연히 해결해야 할 문제라는 데 의견을 함께하기 때문일까? 하지만 후보들 중 1인은 4대강 사업을 앞장서 지지했을뿐더러 4대강 보에 확보된 하천수로 상습가뭄 농지에 용수를 공급한다는 명목의 또 다른 토목사업을 대선 공약으로 내걸고 있다. 다른 후보들은 정도의 차이는 있지만 수위 영향을 평가한 뒤 단계적 또는 선별적으로 보를 허물고 재자연화하겠다는 입장이다. 대선 이후, 바람직한 해결방안에 대한 체계적인 조사와 사회적 논의가 이루어지고 철저한 진상규명과 책임자 처벌이 반드시 있어야 한다. 대선 국면에서 우리 시민은 4대강 사업처럼 심각한 경제·사회·환경적 영향을 야기할 공약이 있지나 않은지 제대로 살펴볼 일이다. 또다시 우를 범해서는 안되기 때문이다.<윤순진 | 서울대 교수·환경대학원>▶ 경향신문 SNS [트위터] [페이스북]▶ [인기 무료만화 보기]©경향신문(www.khan.co.kr), 무단전재 및 재배포 금지"
" [오철우의 과학의 숲] ‘과학행진’ 이후의 행진 ","한겨레","[한겨레]   오철우 삶과행복팀 선임기자   모처럼 미세먼지 걷힌 화창한 주말인 지난 22일, 서울 광화문광장에 과학·기술 연구자와 연구생, 시민들이 모였다. 현장에서 만난 몇몇한테 참석 인원을 추산해달라니 오가는 사람을 합해 대략 600~1000명으로 헤아렸다. 왠지 광장에서는 낯설게 느껴질 법한 ‘과학을 위한 행진’에, 관변단체 행사도 아닌데 이처럼 많은 이들이 참석한 건 보기 드문 광경이었다. 누구는 1930년대 ‘과학 데이’ 행진 이래 처음일 거라고 말했고 누구는 당시 행진이 사회지도자 중심으로 이뤄진 걸 생각하면 연구자 주도 행진은 처음인 듯하다고 말했다. 그만큼 광장에 모인 얼굴에서도 다소 상기된 표정을 읽을 수 있었다.  광화문 행진은 지구촌 600여 곳에서 열린 과학행진의 하나였다. 미국, 영국, 프랑스, 오스트레일리아에서도, 일본, 싱가포르, 대만에서도 과학의 가치를 옹호하는 이들이 저마다 행진했다.   지구촌 행진의 진원지는 트럼프 행정부의 과학기술 정책에 반발한 미국 연구자들의 행진이었다. 미국에선 대규모 인원이 참석했고, 그래서 과학자 행진이 역사상 처음이라는 보도도 이어졌다. 연구자들이 거리에 나선 건 1960년대 반핵시위 때에도 있었지만 이번엔 정부 정책에 반발해 ‘과학의 가치’를 내걸고 시민과 함께 대규모로 나섰다는 점에서 ‘전례 없는 일’이라는 해석도 덧붙여졌다.  첫발을 뗀 지구촌 과학행진이 앞으로 어떤 운동으로 전개될지는 더 지켜봐야 한다. 여전히 과학행진이 정치 운동으로 흘러 과학 객관성을 해칠 것이라는 걱정도 나오고, 과학 객관성은 이를 훼손하려는 권력과 맞서 싸울 때 지킬 수 있다는 주장도 나온다. 여러 평가와 보도를 보면, 적어도 과학행진이 과학, 정부, 시민사회 간의 관계를 두고 풍성한 논의의 자리를 열어줄 것임은 분명해 보인다.  과학행진은 단지 정부 소속 연구자의 사전검열, 연구예산 삭감, 공개정보 제한, 규제과학 기준 완화와 같은 트럼프 행정부의 정책 추진 방향을 우려하고 반대하는 미국 안의 운동에 그치진 않을 듯하다. 각지에 퍼진 행진은 저마다 다른 파장의 울림을 낼 테니까.  광화문광장에서 빛나진 않을지언정 저마다 진정성 있는 가치를 품고 연구실을 지키는 연구자들의 생생한 목소리를 듣다 보면 국내에서도 지금 어떤 변화가 일고 있음을 분명 느낄 수 있다. 무엇을 연구할지 큰 틀을 정부가 주도하는 방식은 이제 자율적인 연구자들의 연구를 중심에 두는 방식으로 바뀌어야 한다. 연구생에게도 비정규직 연구원에게도 합리적이고 민주적인 연구환경이 마련돼야 한다. 여성, 장애인, 외국인 같은 과학계 소수자에게 균등한 기회는 더욱 보장돼야 한다.  노벨상이 최정점인 양 그것을 향해 달리자고 온통 갈망하는 사회, 과학기술 다양성을 다 살피지 못한 채 첨단 과학기술에 ‘올인’이라도 할 듯이 공약하는 정치인, 성과를 위해 열악한 연구노동을 견디도록 요구하는 연구환경을 돌아보며 ‘정말 언제까지 이래야 할까’ 하고 되묻는, 적어도 그런 장을 과학행진은 마련해주고 있다.  행사를 사진에 담고자 스마트폰을 꺼냈다. 네모 화면 한쪽에 행사장 바깥의 세종로 횡단보도를 무심히 지나가는 시민들이 들어왔다. 과학행진 안에서 보는 시선이 아니라 바깥에서 바라보는 시민의 시선은 어떤 것일까? 시민과 함께하는 지구촌 과학행진은 사실 과학의 가치가 연구실 안에만 있지 않음을 말해주었다. 연구자 사회 안에 학문 생태계의 뿌리를 튼실히 가꾸는 일 못잖게, 시민사회를 향해 그동안 우리 사회에 부족했던 사회적 책임을 넓히고 가꾸는 일도 과학의 가치와 신뢰를 높이는 길일 테지. 횡단보도 시민들이 함께 담긴 화면에 셔터를 눌렀다. cheolwoo@hani.co.kr   ▶ 한겨레 절친이 되어 주세요! [신문구독] [주주신청][▶ 대선 팩트체크] [페이스북] [카카오톡] [정치BAR][ⓒ한겨레신문 : 무단전재 및 재배포 금지]"
"[사설] 승객 안전 위협 부산 버스 언제까지 이대로 둘 텐가","부산일보","'급폐문' '급출발' '급정거'는 부산 버스의 고질로 꼽힌다. 무엇이 그리 급한지 승객 안전은 아랑곳없이 버스 기사는 '닫고, 출발하고, 멈추는' 데만 급급해한다. 이러니 부산시가 아무리 '대중교통 중심도시'라 떠들고 '버스 준공영제'를 외쳐도 곧이곧대로 믿을 시민은 없다. 부산에서 운행 중인 버스를 한 번이라도 타 본 시민이라면 대중교통의 공공성과 편의성이라는 말은 한갓 구두선에 불과하다는 사실을 알게 된다. 본보 취재진이 서면 롯데백화점, 북부산세무서, 수영구청 앞 3곳에서 버스 승하차 실태를 확인한 결과, 문이 완전히 닫히지도 않은 채 출발한 버스가 3~4대당 1대꼴이었다. 전체 124대 중 36대(29%)가 마지막 승객이 내린 뒤 뒤도 돌아보지 않고 가속페달을 밟았다. 장애인 등이 많이 이용하는 저상버스도 5대가량 포함돼 승객에 대한 배려가 부족한 것은 매한가지였다. 승객이 다 내리기도 전에 문을 닫는 버스도 목격됐다. 성한 사람도 불편한데 교통약자는 어디 버스 탈 엄두라도 내겠는가.20대 여성 승객이 버스에서 내리다 문에 점퍼 끈이 끼인 상태로 10m가량 끌려간 사건은 안전불감증에 빠진 부산 버스의 현주소를 보여 주기에 충분했다. 그뿐만 아니라 이 승객이 넘어져 전치 5주의 부상을 입었지만, 운전자는 벌점과 범칙금을 부과받는 데 그쳤다니 솜방망이도 이런 솜방망이 처벌이 없다. 부산시와 경찰은 승객 안전을 위협하는 '급폐문' '급출발' '급정거'를 이참에 뿌리 뽑는다는 각오로 집중 단속에 들어가야 한다. 버스 기사 개인의 안전의식 부족 탓이라고 방관하기에는 시민 불편이 너무 큰 게 사실이다. 이런 마당에 매년 1300억 원에 달하는 부산시의 재정 지원은 버스업계 배만 불릴 뿐이다. 운전자에 대한 안전교육이 효과를 거두지 못한다면 상습적으로 승객 안전을 무시하는 기사는 퇴출당하여 마땅하다. 승객이 모두 자리에 앉은 뒤 출발하고, 정류소에서 정차 후 승객이 일어나 안전하게 하차하는지 확인한 뒤 한숨 돌리고 출발하는 관행이 자리 잡지 않으면 대중교통 중심도시라는 말은 요원할 뿐이다."
" 4월 28일 한겨레 그림판 ","한겨레","[한겨레]   권범철  kartoon@hani.co.kr한겨레 그림판 보러가기         ▶ 한겨레 절친이 되어 주세요! [신문구독] [주주신청][▶ 대선 팩트체크] [페이스북] [카카오톡] [정치BAR][ⓒ한겨레신문 : 무단전재 및 재배포 금지]"
"[국민만평-서민호 화백] 사드 기습 배치 후…","국민일보","서민호 min3018@kmib.co.kr[국민일보 홈페이지] [페이스북] [트위터][취재대행소 왱!(클릭)]GoodNews paper ⓒ 국민일보(www.kmib.co.kr), 무단전재 및 재배포금지"
"[70주년 창간기획-문학평론가 임헌영의 필화 70년](30)“남북한 유엔 동시 가입안 준비” 보도에 ‘빨갱이’로 몰아 연행","경향신문","ㆍ‘전환시대의 논리’ 리영희 기자 필화 세 가지고 리영희 전 한양대 교수가 1980년 1월9일 광주교도소에서 2년 복역 후 만기출소하면서 부인과 포옹하고 있다. 리 전 교수는 박정희 정권 시절인 1977년 11월 <전환시대의 논리> 등의 저서가 문제가 돼 반공법 위반 혐의로 구속, 2년형을 선고받았다. 뒤쪽은 한승헌 변호사. 경향신문 자료사진“어둠의 시간에 그가 있었다./ 아픔의 시간에 그가 있었다./ 거짓에 길들여지는 시간에 그가 있었다. (…)/ 그는 한반도의 상공에 날고 있는 각성의 붕(鵬)이다. 이와 함께 그는 한반도와 한반도를 에워싼 모든 힘의 논리를 이성의 논리로 이겨내는 물질적 정화(精華)이다./ 리영희!”(고은 ‘어떤 서사’, <리영희 저작집>, 한길사)■ 리영희의 첫 필화리영희(李泳禧, 1929~2010년)의 첫 필화는 케네디·박정희 회담(1961년 11월14일) 취재기였다. 5·16쿠데타의 후속 절차였던 박정희의 도미 여정에는 조선일보·동아일보·합동통신 3사 기자만 엄선됐는데, 그는 합동통신 소속이었다. 회담 후 언론들은 공식 발표문대로 “군사원조도 약속하고, 경제원조도 해주고 정치적 승인도 했다는 따위의, 두 손 벌려 박정희의 요구를 전면 수락했다는 취지의 기사를 보냈다.”(리영희-임헌영, <대화>, 한길사)그런데 리영희는 워싱턴 포스트의 주선으로 심층 취재하여, 케네디가 박정희에게 요구한 구체적인 사실을 밝혀냈다. ‘쿠데타군의 원대 복귀와 정치관여 금지 및 민정이양 실시 때까지 경제·군사 원조를 잠정 동결한다. 조속한 한·일국교 정상화와 베트남 사태에 대한 한국의 협력 등이 거론됐다’는 요지였다. 합동통신은 박두병 사장 주재로 몇 시간 회의 끝에 이 기사를 내보내 민주화를 열망하던 정치인과 지식인들을 열광시켰다. 박정희가 월남 파병을 케네디에게 먼저 제안했다는 사실이 밝혀진 것은 1996년 미 국무부 문서가 공개되면서였다.맥아더 원수를 예방한 자리에서는 6·25 때 북한에다 “원자탄을 투하했어야 했다”라는 박정희의 발언이 배석했던 최덕신 외무장관에 의해 공개됐다. 거기서 나오는 엘리베이터에서 김재춘(합동수사본부장)은 리영희에게 “서울에 가서 보자!”고 위협했다. 다음 방문 예정지였던 유엔주재 한국 대표부에서 임병직 대사는 리영희에게 “수행 취재 중단, 즉시 귀국”하라는 본사의 긴급 전문을 건넸다. 독재자의 보복과 탄압은 언제나 급행이다. 예정된 일정의 3분의 1도 못 채우고 귀국길에 오른 리영희는 김포공항에서 연행되리라던 예상과는 달리 무사했지만, 다른 기자들은 다 참석했던 청와대에서의 방미외교 성공 축하연에는 초청조차 받지 못했다.‘남북한 유엔 동시 가입안 준비’ 기사로 리영희 정치부 기자와 선우휘 편집국장의 구속 사실을 전한 11월22일자 조선일보 1면 보도.■ 빨갱이로 몰린 ‘유엔 동시 가입’ 기사두번째 필화는 조선일보 정치부 시절(1964년, 이듬해 외신부장, 1969년 강제해직)에 일어났다. 출입처인 외무부에서 그는 축적된 연구와 자료를 바탕 삼아 ‘남북한 유엔 동시 가입안 준비’ 기사를 썼다.1955년 반둥에서 싹이 튼 아시아·아프리카회의는 냉전 시대에 미·소 두 동맹에 가담하지 않은 제3세계 나라들의 연대 기구였다. 국제적인 영향력이 막강해지자 남북한을 동시에 초청하고 유엔에도 동시 가입안을 제출하겠다는 움직임이 일어났다. 분단 이후 ‘대한민국은 유엔이 인정한 한반도의 유일 합법정부’라는 명분으로 남한만의 유엔 단독가입을 꾸준히 추진해 왔던 시절이었기에 남북 유엔 동시 가입이란 날벼락이었다. 조선일보는 1면 머리기사로 우 탄트 유엔사무총장의 “유엔 문호 중공 북괴 등에도 개방을 제의”라는 기사 바로 아래에 리영희의 기사를 실었다.“우 탄트 유엔사무총장이 연례보고에서 제의한 것을 공식화하기 위해 인도네시아, 아랍공, 알제리, 캄보디아, 가나, 말리 등이 남북한 동시 유엔 가입안을 총회 개막 전 정식 의제로 제출할 것 같은 움직임이 있다는 해외공관으로부터의 보고를 받았다고 20일 정부 고위층 소식통이 전했다. 고위 소식통은 이 제안이 있을 경우에 남한 단독가입 문제는 유엔 의제에서 탈락되어 금년 총회를 마지막으로 한국 문제 토의가 불가능하게 될 것이라는 우려를 표명했다.”(조선일보, 1964년 11월21일)중앙정보부는 사전 통고도 없이 전국 주요 철도역에 도착한 신문 1·2판과 서울시내 가판을 압수하고는 조선일보사에 들이닥쳐 그 기사를 삭제하도록 강압했다. 그 지면에는 “각 지방서 본보를 압수/ 오늘 새벽 선우휘 편집국장, 이 기자 연행”이란 기사로 채웠다. 선우휘는 새벽 1시30분에 연행됐다가 7시30분에 일단 귀가시켰고, 리영희는 자택에서 4시경 연행됐다. 풀려났던 선우휘는 리영희와 함께 같은 날 오후 9시15분 서대문구치소에 수감됐다. 조선일보는 11월22일자 1면에 이 사실을 두 구속자 사진과 함께 게재하고 사설로 정부당국의 불법 만행을 비판했다.여러 언론단체들이 부당함을 지적하는 가운데 조선일보는 김형욱 중앙정보부장으로부터 “구사옥 철거지로 환지 결정한 성북동 땅 시행을 보류하고 일본 도쿄기계에 주문한 윤전기 도입 허가를 취소”(방우영, <조선일보와 45년>)당하는 등의 보복과 탄압이 있었다고 밝혔다.11월27일 구속적부심에서 선우휘는 석방됐으나 리영희는 기각당해 12월6일 서울지검 공안부의 무혐의 불기소 처분으로 27일 만에 석방됐다.정작 코미디는 리영희의 석방 이후에 그 진면목을 드러냈다. 최연소 외무장관이었던 이동원의 시선으로는 이 기사가 전혀 문제될 것이 없었다. 더구나 ‘빨갱이’ 운운한 데 진노하여 다이얼을 남산(정보부)으로 돌리자 정보부장 김형욱은 “빨갱이가 아니라고? 아니 국가기밀을 누설해 이적행위를 했는데도 말인가? 이 장관, 당신 말이야, 당신 하고 친하다고 그러는 모양인데…”, 이에 이동원은 육두문자도 서슴지 않았다. “야 인마, 장관인 내가 기밀이 아니라는데, 네가 뭔데 마음대로 잡아넣나? 당장 풀어줘, 알았어?”가만있을 김형욱이 아니다. 다음날 아침 출근길의 이동원은 지프 두 대에 연행되어 아예 죄인 취급을 당하자 폭발했다. “야, 이 자식아, 그래도 대통령이 임명하고 헌법이 신분을 보장한 장관인데, 네가 날 납치할 수 있어? (…) 너 그따위로 아무나 네 비위 거스른다고 빨갱이 만들어버리면 되는 줄 알아? 그리고 그 기사, 장관인 내가 기밀이 아니라 하잖아 인마. 너 분명히 얘기하지만 만일 각하께서 이 일을 아시면 너 큰 손해 볼 줄 알아, 알았어?”“야, 이 새끼들아, 아침에 커피나 한잔 하려고 정중히 모셔 오랬더니 왜 이렇게 기분 상하게 해드렸어. 꼴도 보기 싫으니 당장 꺼져버려!” 김·이, 둘은 견원지간이었는데, “그의 이런 과잉충성”이 빚은 일로 이동원은 기록하고 있다(이동원, <대통령을 그리며>, 고려원, 1992년).■ ‘미쓰야 계획’을 폭로하다임헌영 | 문학평론가·민족문제연구소장리영희의 필화 제3탄은 1965년 조선일보에서 외신부장이 된 직후에 터졌다. 이 사건은 한반도의 운명을 좌우할 매우 심각한 정보였지만 정작 세상은 그리 주목하지 않았다. ‘미쓰야(三矢, 세 화살) 계획’은 일본에서는 ‘미쓰야 연구’로 점잖게 부른다. 자위대 통합막료회의(自衛隊統合幕僚會議)가 만든 한반도 유사시에 대비한 시뮬레이션인 이 계획의 정식명칭은 ‘쇼와 38년도(1963년) 총합방위도상연구(昭和三十八年度總合防衛圖上硏究)’이다. 한반도 공산화를 막기 위한 한·미·일의 군사협력 동맹으로 유사시에는 한반도와 중화인민공화국, 사할린까지도 진출해 미국이 최종적으로 승리하도록 짠 작전계획서다.리영희는 이 극비사실을 신미·일안보조약 체결(1960년) 후 총리에서 물러난 기시 노부스케(岸信介)가 1965년 방한, 워커힐에 머물렀을 때 인터뷰로 얻었다. 그는 즉각 정보부로 연행당했으나 도리어 자신들도 모르는 일본군 비밀을 어떻게 알아냈느냐고 묻는 선에서 마무리되었다. 그의 필화는 점점 더 가혹해진다. ■일본군, 한반도 유사시 개입 미래 시나리오 - ‘미쓰야 계획’의 문제점“지금 자칭 우익. 반공주의의 목소리를 높이고 있는 사람들을 보시오. 그들은 미국이 명령하면 오히려 일본과의 동맹작전으로 북한을 파멸하자고 할 거예요. 지금(2005년)은 그때(1965년)보다 훨씬 그 숫자가 늘어났다고 봅니다.”“불행하게도 남한의 숭미주의자, 냉전식의 반공·반북한 전쟁주의자들이 얼마나 막강한가 보세요.(…) 희망적 상황을 실제적·객관적 현실로 착각하지도 말고요.”“(기시 노부스케) 그는 만주·중국 침략의 최고 원흉으로 패전 후 1급 전쟁범죄자로 사형을 선고 받았어요. 그러나 미국은 아시아 반공정책에 이용하기 위해서 곧 석방하여 일본 정부 수상으로 만듭니다. 박정희 중장이 1961년 케네디에게 불려가면서 동경에 들러 한·일회담 문제 해결을 서약하고 일본의 정치·경제·외교적 지원을 약속받은 것이 기시 노부스케예요. 일본군 내부의 정복파(정규 군인)가 비정복파와 일본 안보에 관심을 가지는 개인들과 합작해 만든 미래의 시나리오였어요.”(리영희-임헌영 <대화>)<임헌영 | 문학평론가·민족문제연구소장>▶ 경향신문 SNS [트위터] [페이스북]▶ [인기 무료만화 보기]©경향신문(www.khan.co.kr), 무단전재 및 재배포 금지"
"[사설] 부산발 '초등교육 혁명' 성공하려면 철저한 준비뿐","부산일보","내년부터 부산의 초등학교 교실에서 사지선다형 객관식 시험문제가 사라진다. 김석준 부산시교육감은 27일 ""주입식, 암기식 교육으로는 복합융합사회인 4차 산업혁명 시대에 대응할 수 없다. 생각하는 힘과 문제 해결 능력의 힘을 키우기 위해 초등 시험에서 객관식 문제를 없애기로 했다""고 밝혔다. 초등학교의 객관식 평가 전면 폐지는 우리나라에서 부산이 처음이다.이 같은 시도는 교육계에선 혁명적 사건으로 받아들여진다. 네 개의 보기 중에 하나를 고르는 평가방식에서 정답이 없을 수도 있는 방식으로 바뀌게 되면 교실은 혁명적 변화를 맞을 전망이다. 반면에 교육의 목표를 대학입시에 두는 현실을 개선하지 않으면 과외 등 되레 역효과를 가져와 실험에 그칠 것이라는 시각도 있다. 사실 이 두 개의 가치가 대립해 온 지는 오래다. 논리적 사고와 생각의 힘을 강조하면 기초학력이 떨어지고, 대량의 지식 습득을 강조하면 창의력이 부족해지는 것이다. 그런 논란에도 4차 산업혁명 시대를 대비해 서술·논술형 시험 전환이 불가피한 선택이라니 일단 공감한다는 것이 대체적인 의견이다.결국 성공은 교실의 준비 여부에 달려 있다. 교육청은 올해 하반기부터 10개의 시범 학교를 운영한다고 한다. 6월부터 공청회를 열고 9월부터는 시범학교에 다양한 서술·논술형 시험 문항을 제공한다. 시교육청은 객관식 평가 폐지 전단계로 2015년부터 시행지침을 만들어 서술·논술형 평가를 50% 이상 하도록 지도해 왔다고 한다. 당장은 연착륙할 것으로 보인다.그럼에도 학부형들은 안심이 되지 않는다. 취지는 좋은데 늘 결과가 나쁜 것이 교육정책이기 때문이다. 시교육청은 ""수동적인 학습자에서 능동적인 학습자로"" ""4차 산업혁명 시대에 부합하는 인재""를 말하지만 학부모들은 타 지역에 비해 학력 저하가 걱정이다. 교육 주체인 교사들의 준비 정도도 궁금하고 이번 조치로 또 다른 과외가 생기지는 않나 촉각을 곤두세우고 있다. 이런 난제들을 풀어야 낡은 교육을 새것으로 바꿀 수 있다. 김 교육감과 부산시교육청은 이왕 시작한 바에야 사활을 걸라."
