"title","press","body"
"[목요일아침에] 대선 TV토론과 후보의 품격","서울경제","온종훈 논설위원네거티브 공세·5자 토론 '덫' 빠져사회문제 진단·해법 제시 의무 소홀대선후보, 성숙한 자세로 토론 임해수준 높은 정책 공론화의 場 삼아야[서울경제] 흔히들 대통령선거의 성패는 누가 ‘시대 정신’을 잡느냐에 달렸다고 한다. 거창하게 얘기할 것 없이 국민, 그것도 투표권이 있는 유권자의 관심과 공감을 이끌어내는 것이 대선후보들이 하는 선거운동의 요체다. 그리고 국가단위의 선거이기 때문에 정치, 외교·안보, 경제, 사회 등 분야별로 다양한 사안들에 대해 후보들은 해법(공약)을 제시한다. 유권자 입장에서 이들을 요약정리하고 후보 간 차이를 비교해볼 수 있는 공간이 대선 TV토론이다.  25일 저녁 JTBC와 중앙일보·한국정치학회가 공동주최한 토론까지 합쳐 네 번의 대선 TV토론이 있었다. 앞으로 오는 5월9일 선거일 전까지 두 번 정도의 TV토론이 남아 있으나 현재까지 나타난 토론의 수준과 격(格)은 실망스럽기 그지없다. 후보들 모두 이 ‘기회’를 이용해 자신의 비교우위를 강조하는 ‘포지티브’ 방식이 아니라 상대를 깎아내리는 ‘네거티브’에 집중했기 때문이다. 특히 그중 국민 10명 중 4명 가까이 봤다는 지난 23일 있었던 3차 TV토론은 역대 최악이라는 평가를 받았다. 쟁점이 된 ‘주적(主敵)’ 논란은 차치하더라도 ‘돼지흥분제’와 ‘갑철수’ 등 몇몇 논란은 아이들이 볼까 두렵고 민망할 정도였다. 당연히 국민들 사이에서는 “유치함의 극을 달렸다” “이게 토론이냐”는 비판이 터져 나왔다. 문제는 대선 TV토론이 앞으로 개선될 여지가 별로 없다는 것이다. 낯선 5자 토론 형식도 문제지만 토론 참여 후보의 발상이나 입장의 극적인 전환을 하지 않으면 결국 이런 방식으로 끝날 공산이 크다. 그나마 나았다는 4차 TV토론은 이전 토론에 대한 비판을 의식해 후보들이 ‘네거티브’를 자제했다고 긍정적인 평가도 있지만 이번에는 ‘내용’이 없었다는 비판을 받았다. 일자리 해법과 북핵 책임론 등을 놓고 후보 간 정책 대결도 있었지만 제한된 시간과 토론형식의 제약 등으로 논의가 깊이 있게 들어가지 못한 아쉬움을 남겼다. 대선 TV토론이 후보들의 네거티브 아니면 5자 토론으로 한계에 봉착하며 ‘덫’에 갇히고 만 것이다.  TV 대선토론은 매스미디어 시대의 주요한 공론의 장(場)이다. 선거의 선택지가 된 후보들은 지지하는 유권자들을 대리해서 우리 사회가 안고 있는 문제를 진단하고 나름의 해법을 제시해야 마땅하다. 또 토론과정을 지켜보는 국민의 평가가 상호작용을 하면서 자연스럽게 공론(公論)이 형성되는 것이다. 그리고 이는 누가 대통령이 되든 차기 정부의 주요 국정 기조로 자연스럽게 이어진다.  현재 판세대로라면 차기 정부는 여소야대의 국면에서 출범하는 소수파 정부가 불가피하다. 다자 구도로 치러진 지난 1987년 대선에서 노태우 전 대통령이 얻은 표는 고작 36.6%였다. 결국 여소야대로 출범하게 된 노태우 정부는 강한 야당의 견제로 어느 것 하나 제대로 해보지 못하고 집권 초반의 중요한 시기를 허송세월했다. 이 때문에 집권 2년 후인 1990년 성향과 뿌리가 전혀 다른 민주정의당·통일민주당·신민주공화당이 3당이 합당하는 정계개편이 촉발된다. 그 당시보다 대통령의 국정 운영에 국회의 협조 여부는 더욱 중요해졌다. 어떻게 보면 국회의 입법협조가 없으면 국정 운영은 사실상 불가능할 정도다. 다수당으로 출발했던 박근혜 정부조차 국회와 사사건건 대립하면서 제대로 된 국정운영을 하지 못했다는 것이 대표적 반면교사다. 결국 현재 정치 구도라면 차기 정부가 성공적으로 출범하고 꾸려가기 위해서는 다양한 정책 사안에 대해 선거공간을 이용한 공론화(公論化) 과정이 더욱 절실하다.  그러기 위해서는 대선 TV토론은 좀 더 생산적으로 바뀌어야 한다. 더 이상 검증이라는 명분으로 네거티브를 이어가서도 5자 토론의 한계에 기대 쟁점을 피해가거나 흐려서도 안 된다. 또 토론문화에 취약한 우리 사회와 미래세대에게 새로운 전범(典範)을 보인다는 차원에서 대선후보들도 성숙한 자세로 토론에 임해야 한다. 대한민국의 대통령이 되겠다고 나선 사람들이라면 그 정도의 품격은 있어야 하지 않겠는가. jhohn@sedaily.com [서울경제 바로가기]'장미전쟁'의 승자는...5월 대선 실황중계 [바로가기]서울경제의 모든 연재물!... 서경Cube [바로가기▶]저작권자 ⓒ 서울경제, 무단 전재 및 재배포 금지"
"安측 “고용정보원 文아들 특혜채용 무마 위해 해고직원 재채용”","이데일리","- ""文아들 출근 첫날 상급기관으로 파견…특혜보직""△이용주 국민의당 공명선거추진단 단장이 24일 오후 서울 여의도 당사에서 권재철 초대 한국고용정보원장 재임 시절 특혜채용 의혹 10여건이 발견됐다고 밝히고 있다. [사진=연합뉴스][이데일리 정다슬 기자] 한국고용정보원이 문재인 더불어민주당 대선후보의 아들 준용 씨의 특혜채용을 무마하기 위해 계약 해지된 직원들은 비밀리에 다시 재채용했다는 주장이 나왔다.국민의당 선거대책위원회 이용주 공명선거추진단장은 26일 여의도 당사에서 기자회견을 열고 “한국고용정보원은 낙하산 인사로 부당해고된 직원들의 외부활동으로 문 씨의 특혜채용이 사회 공론화되는 것을 무마하기 위해 재계약 불가 방침을 번복하고 40여일을 지나 소급 재계약하는 비밀계약을 했다”고 밝혔다.국민의당에 따르면 2006년 12월 29일 종무식 직후 기존 계약직 중 ‘재계약자 대상자 명단’을 발표하면서 14명을 제외했고 이 직원들은 노동부와 고용정보원 등을 상대로 대책 마련을 촉구했다. 그러나 당시 고용정보원은 복지 불가 입장을 밝혔다고 설명했다.그러나 해고당한 직원들이 문제를 공론화시키기 위해 당시 단병호 민주노동당 의원 측과 연계해 문 씨 프로필 등을 요구하자 고용정보원은 2007년 2월 8일 재계약을 소급하고 ‘문건 유출 시 (합의를) 무효’로 하는 ‘비밀각서’를 작성했다고 한다. 다만 단 전 의원 측은 “10년 전 일이라 정확한 당시 상황을 확인해줄 수 없다”고 전해왔다.이에 따라 이미 다른 회사에 재취업한 사람 등 재입사 의사가 없는 사람을 제외한 8명이 재입사했고 이 가운데 현재까지 아직 3명이 고용정보원에서 근무하고 있다.국민의당은 또 문 씨가 특혜채용을 넘어 특혜보직을 받았다고 주장했다. 이 단장은 “상급기관 파견은 사내업무에 통달하고 능숙한 사람을 보내는 것이 통례”라며 “그런데도 수습직원으로 처음 출근한 사람을 상급기관에 파견한 것은 특혜보직”이라고 주장했다.정다슬 (yamye@edaily.co.kr)＜ⓒ종합 경제정보 미디어 이데일리 - 무단전재 & 재배포 금지＞"
"[사설] 서민 위한다면서 더 힘들게 만드는 가격개입 공약들","한국경제","대선을 앞두고 가격에 개입하려는 공약들이 쏟아지고 있다. 지지율 1, 2위인 문재인 더불어민주당 후보와 안철수 국민의당 후보가 똑같이 서민 주거안정을 명분으로 전·월세 상한제와 계약갱신청구권을 도입하겠다고 공약했다. 임대료 상승률을 연 5% 혹은 물가 상승률 이하로 제한하고, 기존 임대차 계약을 한두 차례 연장하도록 하겠다는 것이다.취지가 아무리 좋아도 이런 식의 가격 통제가 성공한 사례는 찾아볼 수 없다. 임대기간이 늘어나고 가격 인상률이 제한되면 집주인들은 미리 임대료를 올리려 할 것이다. 또한 계약기간이 끝난 뒤 새로운 임차인과 계약을 맺을 때 더 큰 폭으로 올릴 수도 있다. 당장은 세입자에게 득인 것 같지만 결국엔 임대료 폭탄으로 돌아올 것이다. 정치권은 1989년 임대차보호법 개정으로 어떤 일이 벌어졌는지를 되새겨 볼 필요가 있다. 무주택자를 보호한다는 취지로 전세기간을 1년에서 2년으로 늘렸지만, 집주인들이 2년치 전셋값을 한꺼번에 올렸고 서민은 더 큰 고통을 겪었다.알뜰주유소, 착한 가격업소, 대학 등록금 동결 등 정부의 가격 개입은 예외없이 심각한 후유증을 낳고 있다. 기름값이 묘하다며 세금까지 깎아줬지만 알뜰 주유소는 저유가 속에 애물단지로 전락했다. 전국의 착한 가격업소는 1년 전보다 300곳 이상 줄었다. 인건비 등이 오르는데 주변 업소보다 싼 가격을 유지하라고 하니 버티지 못한 탓이다. 지난 7~8년간 대학 등록금 인상을 억제한 결과 강의 질 저하로 이어져 학생에게 피해가 돌아가고 있다.가격은 고도화된 사회적 분업과 기업의 뼈를 깎는 원가절감의 결과물이다. 독점도 아닌 경쟁시장의 가격에 개입하면 부작용만 양산할 뿐이다. 그런데도 정치권은 선거 때만 되면 표를 겨냥해 휴대폰 기본요금 폐지, 카드 수수료 인하 등 가격 개입을 ‘단골 메뉴’로 내놓는다. 당장은 이득인 듯 보이지만 기업들이 수지가 나빠지면 투자와 서비스를 줄여 결과적으로 소비자의 손실로 귀착된다. 약자에 대한 선의가 넘쳐날수록 역설적으로 약자를 울릴 뿐이다.[한경닷컴 바로가기] [스내커] [모바일한경 구독신청] ⓒ 한국경제 & hankyung.com, 무단전재 및 재배포 금지"
"[연합시론] '증세 없는 복지', 위험한 실험 또 하나","연합뉴스","(서울=연합뉴스) 대선 후보 TV토론이 진행되면서 증세 없이 이행하겠다는 '선심성 공약' 문제가 다시 핵심 이슈로 떠올랐다. 한국매니페스토실천본부는 24일 대선 후보들의 주요 공약과 소요 재원을 해당 후보별로 물어 공개했다. 이 내용을 보면 문재인 더불어민주당 후보의 190여 개 공약을 실천하려면 35조6천억 원(이하 연간)이 필요하고, 안철수 국민의당 후보의 153개 공약 이행에는 40조9천억 원이 들 것으로 추산됐다. 또 유승민 바른정당 후보는 41조6천600억 원, 심상정 정의당 후보는 110조 원이 필요하다고 답했다. 홍준표 자유한국당 후보는 가장 적은 18조 원이 소요될 것으로 예상했다. 각 후보 캠프의 계산이 얼마만큼 정확한지도 알 수 없어 실제로는 훨씬 더 많은 돈이 들어갈 것이라는 지적도 나온다. 큰돈이 들어가는 공약은 복지, 일자리, 교육 등 분야에 몰려 있다. 문 후보는 노인(소득 하위 70%) 기초연금 인상(월 20만 원→30만 원), 0∼5세 아동수당 신설(월 10만 원), 청년 구직 촉진수당 도입 등을 공약으로 내걸었다. 그는 또 대통령 직속위원회를 만들고 21조 원을 투입해 공공부문 일자리 81만 개를 창출하겠다고 약속했다. 안 후보도 노인(소득 하위 50%) 기초연금 인상, 청년·아동수당 신설, 육아휴직 급여 한도 상향 조정 등을 약속해, 복지 공약에서 문 후보와 별반 다를 게 없다. 그런데 안 후보의 트레이드 마크인 '5-5-2 학제개편' 공약을 이행하려면 엄청난 재원이 필요하다는 분석도 있다. 홍 후보와 심 후보도 노인 기초연금을 문.안 두 후보와 동일한 수준으로 올리겠다고 약속했다. 홍 후보와 유 후보는 똑같이 가정양육수당 신설과 육아휴직 급여 한도 인상을 내걸었다. 심 후보는 아동수당(월 10만 원) 전면 지급, 215만 가구 주거수당(월 20만 원) 지급 등 파격적인 공약을 내놨다. '중부담-중복지'를 내세우고 있는 유 후보와 진보성향의 심 후보는, 공약 이행을 위해 필요하면 증세를 하겠다는 입장을 분명히 했다. 특히 유 후보는 복지 프로그램을 공약하면서 증세를 안 하겠다는 것은 거짓말이나 마찬가지라고 주장해왔다. 문 후보와 안 후보의 경우 각각 연간 35조, 40조가량 소요될 것으로 추산하면서, 증세가 필요하다는 언급은 피하고 있다. 문 후보는 최근 4차 TV토론에서도 ""초과 세수분을 활용하고 재정지출을 효율화해 재원을 확보하려는 노력을 먼저 하고 필요하면 증세를 검토하겠다""는 취지로 말했다. 안 후보도 ""(세금을) 올려야 하는데 순서가 있다""며 즉답을 피했다. 증세란 세금감면 항목을 줄여 실효세율을 높이거나 기존의 명목 세율을 높여 세금을 더 걷는 것을 말한다. 당연히 유권자들한테 부정적으로 받아들여질 가능성이 크다. 하지만 연간 수십조 원의 복지 예산을 증세 없이 마련하기는 어렵다는 게 재정 전문가들의 대체적인 시각이다. 매년 유동적인 세수 자연증가분이나 세출 절감분 등으로 이런 대형 공약을 이행하기는 어렵다는 것이다.증세 등 재원 대책이 누락된 공약은 제대로 이행되기 어렵다. 멀리 갈 것도 없이, 현 정부의 복지 공약 이행 과정에서 분명히 확인됐다. '헛공약'은 국민과 지키기 어려운 약속을 하는 것이다. 대통령이 되겠다는 후보라면 껄끄럽더라도 증세 입장을 분명히 밝히고 유권자의 선택을 받아야 한다. 법인세든 소득세든 구체적인 세목까지 언급할 필요는 없을 것이다. 하지만 누진 강화 등 증세에 대한 기본 입장과 방향은 밝히는 것이 당당한 태도다.          최신 유행 트렌드 총집결 #흥(클릭!)"
"[사설] 비싸도 잘 팔리는 한국산···기술격차 확대가 살 길이다","서울경제","[서울경제] 국내 대기업들이 1·4분기에 놀라운 실적소식을 속속 전해오고 있다. SK하이닉스는 2조4,676억원의 영업이익을 올려 연간 10조원 흑자 시대를 예고했고 LG전자 가전 부문도 첫 두자릿수 영업이익률을 달성했다. 포스코 등 전통 제조업체들 역시 역대 최고 실적대열에 앞다퉈 가세하고 있다. 숱한 대내외 악재를 뚫고 일궈낸 반가운 소식이다.   더욱 고무적인 것은 단순히 이익 규모만 커진 게 아니라 글로벌 우량기업에 비견될 만큼 속살이 훨씬 알차졌다는 사실이다. 삼성전자와 SK하이닉스는 D램 메모리반도체에서 50%를 웃도는 영업이익률을 올렸다. 반도체 생산단가를 낮추는 초미세공정 기술에서 타의 추종을 불허할 만큼 뛰어난 경쟁력을 갖춘 덕택이다. 오죽하면 중국 CCTV가 아무리 돈을 쏟아부어도 한국의 메모리반도체를 도저히 따라잡을 수 없다고 한탄했겠는가. LG전자는 인버터 냉장고나 대형 올레드TV를 앞세워 선진국에서 차별화된 가치를 인정받고 있으며 포스코는 자동차용 고급 강판시장을 독식하고 있다. 모두가 독보적인 기술력과 프리미엄 제품으로 신시장을 개척하고 경쟁자의 추격을 멀찌감치 따돌린 값진 성과다.  기업들은 이런 호실적에 힘입어 대대적인 투자에 나설 채비를 갖추고 있다. 삼성전자는 평택공장 가동을 눈앞에 두고 있으며 SK하이닉스는 이천에 신공장을 짓고 있다. 차제에 경쟁사와의 기술 격차를 더욱 벌려 승자독식의 구도를 아예 굳히겠다는 전략이다. 이는 일본에 밀리고 중국에 쫓기는 샌드위치 신세를 벗어나기 위해 우리 산업계가 가야 할 길이기도 하다. 프리미엄 제품군을 늘리고 독창적인 선행 기술로 경쟁사를 압도해 추격을 따돌리는 ‘초격차 전략’이 바로 대한민국의 생존전략이다. 그래야만 중국의 고고도미사일방어체계(THAAD·사드) 보복을 극복하고 갈수록 높아지는 보호무역 파고도 뛰어넘을 수 있을 것이다.   이럴 때일수록 정치의 역할은 더욱 중요하다. 기업의 발목만 잡지 않는다면 독보적 기술이 투자와 일자리로 이어지는 선순환 구조를 갖추는 것도 그리 어려운 일이 아니다. [서울경제 바로가기]'장미전쟁'의 승자는...5월 대선 실황중계 [바로가기]서울경제의 모든 연재물!... 서경Cube [바로가기▶]저작권자 ⓒ 서울경제, 무단 전재 및 재배포 금지"
"[정병훈의 신(新)동의보감] 식이요법의 모든 것⑥…같은 매운맛의 식자재도 효능은 다르다","스포츠경향","이번주는 더욱 다양한 매운맛을 알아본다. 우선 겨자는 고추냉이와 비슷하게 몸에 쌓이지 않는 매운맛을 지니고 있다. 특히 겨자는 고추냉이보다 조금 더 빨리 작용하고 없어지며 가벼운 느낌으로, 폐순환이 느리면서 열이 있는 사람에게 좋은 식재료가 된다. 다음은 파다. 원래의 재래종 파는 겨울을 나면서 봄에 다시 싹이 나는 다년생 초본인데, 요즘의 파씨앗은 겨울을 나지 못해 얼어죽는다고 한다. 하지만 파의 원래 특성은 나름 유지되는데, 겨울을 날 정도로 추위에 대한 저항력이 강하다. 따라서 몸 속이 차며 면역기능이 약한 사람에게는 더할 나위 없는 좋은 식재료이자 약재가 된다. 파잎은 내부가 비어 있는데, 이는 속이 치밀하게 응축되는 기운과 반대되는 것으로, 곰탕이나 사골과 같은 안이 응축돼 있는 구조의 음식물과 아주 잘 어울린다.생강의 매운맛은 몸 안의 깊숙한 부위까지 들어가 먹은 다음에도 계속 얼얼한 느낌이 남는다. 이런 생강은 몸 속의 찬기운을 몰아내고 속이 니글거리는 것을 치료하며 가래를 없애는 효능이 있다. 반면 몸 속에 열이 많아서 얼굴이 잘 벌게지거나 피부색이 검붉은 기가 보이는 사람은 조심해야 하는 약재이기도 하다.매운맛을 내는 식재료 중에는 부추도 있다. 부추는 파와 달리 안쪽의 조직이 치밀하다. 아울러 부추의 향과 매운맛은 몸에 쌓이지 않고 바로 없어진다. 따라서 몸에 열이 많은 사람이 기운을 차리지 못하고 시름시름할 때 먹으면 좋은 먹거리가 바로 부추다.매운맛을 내는 음식의 특징과 차이점을 알아봤는데, 이런 특징들을 잘 알고 내 몸의 상태와 잘 연관지어 가려 먹어야 한다. 매운맛은 잘 쓰면 기운을 북돋게 하지만 잘못 먹거나 오랫동안 먹으면 몸 안의 수분과 체액을 말라붙게 하는 ‘효력’이 있어 항상 즐기는 식품으로 삼으면 곤란한 면이 있다.지금까지 식이요법의 가장 기본이 되는 짠맛·신맛·매운맛에 대해 살펴봤다. 의외로 놀란 부분이 많았을 것으로 생각된다. 아무 생각없이 먹는 음식이 몸을 망칠 수도 있으니, 앞서 말한 것들을 염두에 두고 식생활을 하기 바란다.다음으로는 우리 몸에 꼭 필요한 3대 영양소에 관한 얘기로 넘어간다. 그 첫째는 탄수화물이다.한국인은 밥심으로 산다는 말이 있다. 그런데 어떤 밥을 먹는 게 좋은지 모르는 이들이 많다. 이를 제대로 알려면 쌀부터 살펴봐야 한다.쌀은 우리 민족이 목축을 하지 않고 정착지를 찾아 농사를 시작한 이래로 가장 보편화된 탄수화물이다. 그런데 바로 여기에 약간의 함정이 있다. 쌀이 모든 사람을 건강하게 만들지 않기 때문이다. 쌀은 다른 탄수화물에 비해 끈적거림이 적고, 햇볕이 쨍쨍 찌는 온도와 뿌리에는 충분한 물이 있어야 재배할 수 있는 독특한 식물이다. 이런 특성 때문에 대장기능과 골반이 발달하고 아랫배가 냉한 경향이 있는 사람에게는 아주 좋은 탄수화물이지만, 몸에 열이 많고 식성이나 소화력이 좋은 이들에게는 ‘맛은 좋으나 아무리 먹어도 바로 헛헛해져서 또 먹게 만들어 당뇨병에 걸리기 딱 좋은 음식’이다. 그래서 당뇨병을 비롯해 각종 성인병을 앓는 환자들에게 쌀밥을 권하지 않는다.반면 앞에서 얘기했듯이 아랫배가 차고 대장기능이 발달한 사람은 밀가루를 끊고 되레 쌀밥을 먹어야 한다. 그렇지 않고 분식이나 피자·과자 등을 더 좋아하면 문제가 커진다. 이때 좋은 게 쌀과 비슷한 찹쌀이다. 특히 위하수증이나 위무력증이 있는 환자에게는 찰밥이 좋은 식이요법이자 치료제다. 바른길한의원 대표원장 정병훈은 누구?2010 광저우 아시안게임 당시 바둑선수단의 주치의로 활약하며 한국이 금메달을 싹쓸이 하는 데 공을 세워 화제를 모았던 정병훈 원장은 경희대 한의과대학을 졸업한 후 고려한의원 원장과 인동한의원 원장을 거쳐 지금은 바른길한의원 대표원장으로 일하고 있다. 인도네시아·베트남·몽골 등 해외의료봉사와 전국 무의촌지역 의료봉사 활동에 바쁜 정 원장은 대한추나학회·대한자연요법학회·사상체질의학회·대한약침학회 정회원이다.▶ [스포츠경향 인기 무료만화 보기]▶ [스포츠경향 핫&스타포토] [따라해 보세요! 다이어트 영상]©스포츠경향(sports.khan.co.kr), 무단전재 및 재배포 금지"
