"title","press","body"
"[SBA 칼럼] 4차 산업혁명시대, 차기 정부에게 바라는 창업 생태계 성장 정책","전자신문","신중경 세종대학교 경영전문대학원 교수탄핵이 인용되었고, 대선이 본격적으로 시작되었다. 각 분야의 전문가들이 보다 좋은 대한민국을 만들어 가기 위해 다양한 정책 아이디어를 제시할 것이다. 이러한 국면에서 벤처 정책도 마찬가지로 새로운 전환점을 맞이한다고 본다. 박근혜 정부에서 창조경제로 표방되었던 창업 활성화 정책은 창업에 대한 두려움을 해소하고, 다수의 유망 창업자들을 성장시켰다는 점에서 성과가 있었다고 평가해본다. 이제부터는 온기가 돌기 시작한 창업 생태계를 어떻게 성장시킬 것인가에 대한 지혜가 모여, 정책이 만들어져야 한다고 생각한다. 최근 4차 산업혁명이라는 새로운 화두가 나타나면서, 선진국들은 4차 산업혁명 관련 분야에서 연구개발 및 창업 활성화를 추진하고 있다. 이러한 흐름에 뒤처지지 않기 위해서는 우리도 향상된 창업정책이 요구된다. 현장에서 느끼는 창업 생태계의 성장을 위해 준비해야 할 사항들이 많지만, 우선 3가지 분야에서 정책대안을 제시하고자 한다.창업이 활성화되었다고는 하지만, 아직 많은 청년들은 실패에 대한 두려움으로 인해 창업을 주저하는 경우가 많다. 이는 우리 사회가 가지고 있는 고질적인 재기가 불가능한 사회구조에 기인한다고 본다. 대표적인 요소는 대표이사 연대보증과 신용불량자 등록에 대한 문제이다. 박근혜 정부에서 창업 5년 이내 기업에게는 대표이사 연대보증을 요구하지 않는 정책을 시행했다. 문제는 혁신형 기업의 창업자들은 5년 이내에는 파산하거나 실패하지 않고, 5년이 경과되면서 사업의 어려움에 봉착하는 경우들이 많다. 현재의 금융당국 정책대로면 정작 사업이 어려워질 무렵에 대표이사는 연대보증을 서게 되어, 전혀 문제가 해소되지 않는다는 점이다. 또한 실패한 창업자들은 대부분 신용불량자로 등록된다. 재기를 해서 자신이 지고 있는 부채를 상환하려면 다시 사업을 해야 하는데, 신용불량자로 등록됨으로 인해 경제활동을 전혀 할 수 없게 되어버린다. 재기가 불가능한 사회구조의 핵심이 이 두 가지 제도이다. 차기 정부에서는 대표이사 연대보증 전면 철폐와 신용불량자 등록제도의 수정을 고민해야 한다.다음으로 창업 실패의 경험을 자산화할 수 있는 시스템의 구축이 요구된다. 박근혜 정부에서 많은 기업들이 창업되면서, 이제 실패 기업도 증가하게 될 것이다. 그런데 우리는 창업 실패자들을 비난하기는 하지만, 그 사람들이 왜 실패했고, 실패를 방지하기 위한 사회적 시스템 구축에는 소홀해 왔다. 미국에서는 Failcon이라고 실패한 창업자들이 자신의 실패과정을 공유하고 재도전할 수 있는 컨퍼런스를 매년 성황리에 개최하고 있다. 우리도 ‘창업 오뚜기 센터’를 건립해서 창업 실패의 원인과 과정을 분석하고, 그 결과를 창업교육 및 창업지원 정책에 활용하는 실패 경험의 자산화를 준비해야 한다. 그래야 비슷한 이유로 창업 기업이 실패하면서 발생하는 사회적 비용을 경감시킬 수 있다.두 번째로 창업지원 정책의 거버넌스를 재정립해야 한다. 창업 활성화가 국정 기조가 되면서, 대부분의 정부 부처에서는 창업관련 정책들을 운영하고 있다. 부처별 특성에 따라 정책을 운영하는 것은 좋은 것이다. 문제는 정책의 전문성이 떨어지고, 중복성이 높아짐으로 인해 효율성을 놓치고 있다는 점이다. 이에 중기청, 미래부의 창조경제기획단, 문광부의 창업관련 부서 등 정부 각 부처의 창업관련 정책 담당부서들을 통합해 혁신성장부를 설립하고, 여기서 창업관련 정책을 총괄하는 체제를 제안해 본다. 신설될 혁신성장부는 창업 생태계 활성화를 담당하는 컨트롤 타워 역할을 함으로써, 유사 정책으로 인한 비효율 최소화, 전문성 제고, 정책간 조율로 효과성 제고가 가능하다고 본다. 그리고 혁신성장부와 미래부의 협력을 통해 미래 창업 생태계의 씨앗이 될 우수한 기술창업 인재들을 양성한다면, 미래지향적인 창업 생태계 구축에 이바지할 수 있다고 본다.마지막으로 창업 생태계의 글로벌화가 필요하다. 우리의 창업 생태계는 글로벌화를 외치면서도, 내수지향적이고 폐쇄성이 높다. 창업 지원정책은 국가주의적 성향이 매우 강하다. 그런데 해외에서는 국적을 불문하고 유망 창업자들을 초빙하여, 자신의 국가에서 창업하도록 지원하는 정책들을 이미 시행하고 있다. 우리의 창업지원 정책은 아직도 내국인 창업만을 고집하는 점이 아쉽다. 그러다보니 해외의 엔젤투자자 및 창업자들과 연계하여 공동으로 사업을 추진하는데도 어려움이 많다. 글로벌 경제전쟁 시대에 국가주의적 성향보다는 상생하는 구조에서 시너지를 창출할 수 있는 정책을 입안하고, 시행해야 한다. 창업지원 정책의 글로벌 마인드 구축이 요원하다.▶ 전자신문 인기 포스트▶ 전자신문 공식 페이스북▶ 전자신문 바로가기 [Copyright ⓒ 전자신문 & 전자신문인터넷, 무단전재 및 재배포 금지]"
"[이 한마디]'초등학생 말다툼도 아니고'…긍정적 단절을 위해","아시아경제","[아시아경제 박성호 기자]23일 저녁 대선 후보 TV 토론을 보는 것은 곤욕이었다. 홍준표 자유한국당 후보의 일침이 그래서 시원했다. 그의 말대로 초등학생들 말싸움 수준을 벗어나지 못했다.개인적으로는 '과거와의 단절'을 올바로 읽지 못하는 후보들의 '문맹'이 가장 답답했다.안철수 국민의당 후보는 지속적으로 송민순 쪽지(2007년 정부의 유엔 북한인권결의안 표결 전 북한 반응을 담은 문건)를 놓고 집요하게 문재인 더불어민주당 후보를 물고 늘어졌다. 문 후보는 한마디로 정리했다. ""미래를 보자며 왜 자꾸 과거사를 들먹이고 있냐""는 것이다. 최순실 국정농단 사건으로 문재인 후보가 적폐청산을  선거 캐치프레이즈로 들고 나온 마당인데 이런 반박은 어색하다.과거와의 단절을 이야기하지만 옛일을 되새김질하지 않고 미래를 논할 수 없다.""전에 있던 것도 다시 있게 될 것이며, 이미 한 일도 다시 할 게 될 것이니, 태양 아래 새로운 것은 없도다."" 성경 전도서 1장에 나온 구절이다. 2000여 년 전에 이미 선조들은 과거와의 단절이 불가능하다는 점을 알았는데 우리는 '싹쓸이'로 과거를 지우려 한다. 어리석기 짝이 없는 짓이다.과거는 지우는 것이 아니라 긍정적으로 단절해야 하는 '교훈'이다. 나쁜 옛일에 치를 떨며 차라리 그런 일이 기억 속에서 사라졌으면 하는 심리는 인간의 본성이다. 우리는 쉽게 떠오르는 사건이 실제보다 더 흔히 일어날 것이라고 믿는 경향이 있다. 출퇴근 때 교통사고 당할 확률이 훨씬 높은데 우리는 '테러'라고 하면 언제든 우리 주변에서 발생할 수 있는 일이라고 생각한다. 이를 가용성 추단법이라고 한다. 우매하다. 하지만 벗어나기 힘든 인간의 심리다.이번 TV토론은 과거만을 논해서 비난 받는 것이 아니다. 사실에 대한 해명도 변명도 '솔직하지 못했다'는 것에 국민들의 시선이 꽂혔기 때문만도 아니다.과거와 현재, 그리고 미래에 대한 통찰의 능력을 보여준 후보가 아무도 없었다는 점이 절망스러웠다고 할 수 있다.과거는 현재의 교훈이고, 미래는 현재의 거울이다. 우리가 역사를 알고자 노력하는 것은 미래를 점치기 위해서가 아니다. 현재 사고의 지평을 넓혀서 미래의 모습이 현재보다 더 나아지기를 희망하기 때문이다.우리는 누구나 시행착오를 반복한다. 현명한 이는 실수의 반복을 통해서 올바른 깨달음의 경지에 오를 수 있다. 어리석은 자는 과거를 지우고 계속 실수와 후회의 사이클에서 벗어나지 못한다.다음 대선후보 TV 토론에서는 과거와의 '긍정적 단절'과 역사의 교훈을 통한 '대한민국 미래'가 논해지기를 기대한다. 하지만 이 기대가 어리석은 짓이 될까 두렵다.박성호 기자 vicman1203@asiae.co.kr▶ 뉴스가 재밌다! 세상의 모든 재미 [티잼]▶ 인기최신만화  ▶ 오늘의 띠별, 별자리 운세"
"[ET단상]4차 산업혁명 시대, 에듀테크 산업을 육성하자","전자신문","곽덕훈 시공미디어 부회장디지털이 교육 생태계를 바꾸고 있다. 21세기는 4차 산업혁명과 지능정보사회 발현이 핵심이다. 디지털의 변화를 가장 크게 느낄 수 있는 분야가 교육이다. 우리 사회는 2~3세 어린이도 스마트폰 문화를 즐기는 디지털 세상이다. 이들이 학교에 입학하는 시점에서 교육 일선에서의 에듀테크(Education+Technology) 활용은 거스를 수 없는 대세다.세계경제포럼(일명 다보스포럼) 보고서에서는 21세기 디지털 환경에서 필요한 16가지 스킬을 기초 학문, 역량, 성격 특성이라는 3개의 큰 항목으로 분류했다. 그 가운데 10가지가 디지털 기반의 사회 정서 학습과 깊게 관련된다고 설명했다. 예를 들어 전통의 교실 수업 방식은 토론 기반의 학생 중심 수업 방식인 '플립 러닝(Flipped Learning)' 시스템으로 빠르게 대체되고 있다.가상현실(VR), 증강현실(AR) 기술은 교과서와 체험학습 기반의 시청각 교육이 갖는 물리·금전적 한계를 일소할 수 있는 대안으로 각광받고 있다. 미국에서는 구글에서 제공하는 VR 현장학습 시범 프로그램인 '익스피디션 파이오니어 프로그램'을 수업 시간에 활용하고 있다.우리는 교육을 산업 관점에서 보는 것을 터부시한다. 반면에 선진국은 미래 시각에서 디지털 교육을 하나의 중요한 서비스 산업으로 육성하고 있다. 아프리카조차 40~50년 후 발전된 미래를 위해 교육 중심으로 '어젠다 2063' 미래 전략 프로젝트를 추진하고 있다. 디지털 교육 산업은 전 세계가 중요시하는 미래 산업으로 자리매김했다.디지털 교육 혁명 바람은 이미 거세게 불고 있다. 사물인터넷(IoT), 클라우드, 빅데이터, 인공지능(AI), 모바일 등 고도화된 정보통신기술(ICT)을 교육 현장에 적용하려는 시도가 다양하게 이뤄지고 있다. 디지털 교육을 지원할 수 있는 첨단 기능 인프라나 디바이스가 더욱 낮은 비용으로 빠르게 보급되고 있다.문제는 콘텐츠와 플랫폼이다. 아무리 첨단 인프라나 디바이스를 갖춘다 하더라도 활용할 수 있는 교육 콘텐츠나 서비스 플랫폼이 없다면 인프라와 디바이스는 무용지물이다. 전 세계가 양질의 디지털 교육 콘텐츠와 서비스 플랫폼 확보를 위해 노력하는 이유다.우리 교육 기업도 세계 흐름에 맞춰 부단한 노력을 하고 있다. 초등교사 90% 이상이 수업 자료로 활용하는 시공미디어 디지털 교육서비스 플랫폼 '아이스크림 S'는 세계 시장에서도 큰 호응을 얻고 있다. 이는 우리 에듀테크 산업이 세계 시장에서도 경쟁력이 있음을 증명한다.우리가 에듀테크 산업을 주도하려면 중장기 마스터플랜이 필요하다. 정부와 기업이 협력, 아날로그 중심 교육 환경을 디지털 기반 생태계로 바꿀 수 있도록 노력해야 한다.영국은 교육 현장 생태계를 바꾸고 교육 서비스 산업 육성을 위해 2016년에 9억파운드를 학교 현장에 투입했다. 학교와 교사 중심 기술 기반의 디지털 교육 환경을 조성했으며, '공개데이터연구소'를 설립해 학교 차원에서 공개하기 어려운 데이터를 국가 차원에서 수집, 기업에 제공했다. 여기서 공개된 학습 데이터를 이용, 기업은 빅데이터나 학습 분석 등 새로운 에듀테크 산업을 창출할 수 있다.우리도 에듀테크 산업 육성 및 글로벌화를 위해 시각 전환이 필요하다. 교육을 서비스 산업으로 보는 것을 터부시하는 생각부터 바꿔야 한다. 우리나라 미래의 역량은 지식 서비스 산업에서 비롯하며, 그 근간은 에듀테크 산업이 될 수 있다. 정부는 2018년도 초·중등 디지털교과서 도입계획을 세워 이를 기업과 협력, 개발해야 한다. 콘텐츠 유통을 위한 오픈 마켓 플랫폼 구축은 에듀테크 산업 육성의 중대한 시발점이 될 것이다.곽덕훈 시공미디어 부회장·에듀테크포럼 공동위원장 dhkwak@sigongmedia.co.kr▶ 전자신문 인기 포스트▶ 전자신문 공식 페이스북▶ 전자신문 바로가기 [Copyright ⓒ 전자신문 & 전자신문인터넷, 무단전재 및 재배포 금지]"
"광주 북구, 일자리 창출위한 ‘부서별 목표관리제’ 운영","머니S","광주 북구가 민선 6기 좋은 일자리 2만개 창출 실현을 위해 ‘부서별 목표관리제’를 본격 추진한다.24일 북구에 따르면 일자리 사업의 목표 달성의 체계적인 관리를 통해 사업 효과를 높이고 지속성을 확보하기 위해 지난 3월부터 대학교수 및 노무사 등 전문가로 구성된 일자리 청출 정책자문단의 자문을 거쳐 ‘일자리 창출 목표관리 대상사업’을 확정했다. 일자리 창출 목표관리제 대상사업은 ‘사회적기업 육성’, ‘생활체육교실 운영’, ‘전통음식강좌 운영’, ‘마을 코디네이터 운영’, ‘기초생활수급자 취업성공 패키지’ 등 6대 분야 84개 재정지원 사업을 대상으로 추진하며, 이를 통해 올 한해 9166명의 고용창출을 일군다는 방침이다.또한 고용에 미치는 영향을 분석·평가해 고용친화적 사업이 될 수 있도록 정책방향을 지원하기 위한 ‘일자리 창출 영향평가제’를 운영한다.대상사업은 민선6기 공약사업, 10대 핵심 프로젝트, 5억원 이상 사업 등이며, 정책자문단의 사업 선정에 따라 연구기관의 양·질적 고용 인프라 분석 후 추진부서 환류를 통해 정책에 반영한다는 방침이다.이와함께 오는 10월에는 일자리 영향평가 분석결과와 일자리정책 추진방향 논의를 위해일자리 전문가, 정책자문단 및 북구 노사민정협의회가 참여하는 ‘북구 일자리 정책포럼’을 개최할 예정이다.송광운 북구청장은 “최고의 복지는 일자리 창출”이라며, “일자리 영향평가제 및 목표관리제를 통해 주민들이 일자리 희망을 찾아 갈 수 있도록 다양하고 실질적인 지원사업을 지속적으로 펼쳐 나가겠다”고 말했다.실시간 재테크 경제뉴스│창업정보의 모든 것광주=이재호 기자"
"'청렴도 꼴찌 탈출' 위해 안간힘 쓰는 전남도","머니S","본문 이미지 영역지난해 국민권익위원회 청렴도 평가에서 '전국 꼴찌'를 차지했던 전남도가 탈꼴찌를 위해 안간힘을 쓰고 있다.전남도는 모든 실과를 대상으로 청백-e 시스템, 자기진단제도, 청렴 마일리지로 구성된 자율적 내부통제 제도를 시행한다고 24일 밝혔다.자율적 내부통제는 업무 추진 시 공직자 스스로가 행정오류를 사전에 예방하고 차단하기 위한 제도다.청백-e 시스템은 지방행정과 지방세, 지방재정 등 5개 업무의 정보시스템을 연계해 95종의 예방 프로그램으로 운영된다.예를 들면 금지된 업종 또는 심야시간에 법인카드를 사용하는 경우 업무 담당자·부서장·감사 담당자에게 경고메시지를 전달함으로써 행정착오나 비리를 사전에 차단할 수 있다.자기진단제도도 확대 운영한다. 자기진단제도는 비리 개연성이 있는 인·허가 민원이나 보조금 업무 추진 시 체크리스트에 의해 스스로 비리 여부를 진단하게 된다.전남도는 올해 자기진단 대상 업무를 155개에서 200개까지 확대하고 분기별로 자기진단 업무 체크리스트 작성 여부를 점검할 계획이다.청렴 마일리지는 부서별 청렴활동을 계량화해 청렴 및 반부패 시책의 능동적 참여를 유도하기 위한 것이다. 청렴도와 관련된 가감점 지표로 구성됐다.가점 지표는 행동강령 위반신고, 반부패 시책 추진 등을, 감점지표는 공무원의 비위행위, 업무추진비 미공개 등을 활용한다.전남도는 실효성 확보를 위해 연말에 균형성과관리(BSC) 공통지표에 반영하고 우수 부서를 시상할 계획이다. 이처럼 전남도가 매년 청렴도 향상을 위한 극약처방을 내놓고 있지만 실효성에 의문을 제기하는 지적도 나오고 있다.이에 앞서 도청 내부에서 자성의 목소리도 쏟아졌다. 최근 청렴도 최하위를 초래한 장본인이라고 밝힌 한 7급 공무원도 허위출장이 잘못된 것인 줄 알면서도 묵인했다고 고백했다.또 한달 수입에 초과근무가 차지하는 비중이 높다 보니 불필요한 초과 근무를 했다고 실토했다. 여기에 그치지 않고 차량대기 및 순번제 식시 등 윗분 모시기를 해 왔다고 폭로해 파장이 일었다.방옥길 전남도 감사관은 ""자율적 내부통제를 더욱 내실있게 운영, 공직자 스스로 행정오류와 부패행위를 바로잡아 공직사회에 밝고 맑은 청렴문화가 꽃피도록 하겠다""고 말했다.한편 7년째 청렴도 하위권에 머룰고 있는 전남도는 지난해에는 국민권익위원회 청렴도 조사에서 광역 시·도 가운데 꼴찌인 17위를 기록했다.실시간 재테크 경제뉴스│창업정보의 모든 것남악=홍기철 기자 honam3333@mt.co.kr"
"워싱턴 여성 행진","한국일보","[기억할 오늘] 4.25단일 공간 최대 규모 행사로 기억되는 미국 워싱턴DC 여성 행진이 2004년 4월 25일 열렸다. 사진은 지난 1월 트럼프 취임 다음 날 열린 워싱턴 여성행진. wikidemia.com미국 백악관이 있는 워싱턴D.C 시위ㆍ행진의 원조는 마틴 루터 킹의 1963년 행사일 것이다. 이후 워싱턴D.C 링컨기념관 광장과 의사당 남서쪽 인디펜던스 거리, 내셔널 몰 등은 정치나 법ㆍ제도의 지체와 부실에 대한 성토와 압박의 거점으로 자리잡아 대규모 시위가 이어졌다. 도널드 트럼프 대통령 취임 다음날인 지난 1월 21일 ‘워싱턴 여성 행진(Women’s March on Washington)’이 가장 최근의 대규모 행사였다. 여성 및 성소수자 인권과 이민정책 개혁, 각종 차별 철폐 등이 이슈였던 그 행사에는 현장 시위 인원 50만 명을 포함해 미국 내에서만 최소 300만 명이 참여했고, 세계 168개국에서 동조 행진이 전개됐다. ‘여성 삶(생명)의 행진(March for Women’s Lives)’이란 이름으로 열린 2004년 4월 25일의 워싱턴 여성행진은 워싱턴에서 열린 역대 행사 중 단일 공간 최대 규모 행사로 기억된다. 미국 주요 여성인권단체들이 총력을 기울여 조직한 그 날 행사 참가자는, 주최측 집계 115만 명(AP집계 50만~80만 명)이었다. 오전 10시부터 내셔널 몰에서 시작된 행사는 거리 행진과 동시다발적 집회로 이어졌고, 공식 연사만 약 120명에 달했다. 글로리아 스타이넘, 케이트 미첼먼, 포크 그룹 피터 폴 앤 메리, 수전 서랜든, 애슐리 주드, 우피 골드버거, 줄리언 무어, 클린턴 행정부의 미국 최초 여성 국무장관 매들린 올브라이트 등이 주요 참가자로 꼽혔다. 주목할 만한 것은 그들 세계적 명사들도 행진 대열의 맨 앞줄이 아닌 중간에서 일반 시민들과 섞여 한 명의 여성으로서 참여했다는 점이었다. 현안은 한 해 전인 2003년 제정ㆍ발효된 ‘부분출산 낙태금지법(Partial-Birth Abortion Ban Act)’이었다. 부분출산(partial Birth)이란 산모의 자궁을 확대해 태아의 몸 일부를 끌어낸 뒤 약물을 투입해 낙태하는 방법으로, 주로 임신 중기(15~26주) 이후 이뤄진다. 법은 금지 여부를 주 정부 재량에 맡기도록 허용했지만, 낙태 찬성론자들은 그 법이 1973년 연방대법원의 ‘로 대 웨이드(Roe vs. Wade)’ 판결 취지에 역행하고 여성의 임신 선택권을 심각하게 침해한다고 판단했다. 조지 W. 부시 당시 대통령은 당일 워싱턴을 떠나 있었다. 연방대법원은 2007년 ‘곤잘레스 대 카허트(Gonzales vs. Carhart)’ 재판에서 저 법을 합헌 판결했고, 그 싸움은 지금도 이어지고 있다. 최윤필 기자. ▶한국일보 [페이스북] [카카오 친구맺기]▶자동차의 모든 것! [모클][ⓒ 한국일보(hankookilbo.com), 무단 전재 및 재배포 금지]"
"대선 특집호를 내며","시사IN","새해 첫날이라 떡국을 먹이고 싶었다. 전날 집으로 찾아온 동기와 후배들과 아침 일찍 식당으로 향했다. 낯선 여성이 다가와 길을 물었다. “저~”라는 말을 끝내기도 전에 얼굴이 아스팔트 바닥에 꽂혔다. 팔은 꺾였다. “잡아!” 하는 목소리가 이곳저곳에서 들렸다. 차에 태워졌고 “안경 벗겨” “고개 처박아”라는 소리에 기가 팍 죽었다. 그 뒤에야 미란다 원칙을 들었다. 목적지가 가까워지자 눈이 가려졌다. 눈을 뜨자 책상·의자·욕조가 보였다. 창문도 없었다. A4 종이와 볼펜이 내 앞에 놓였다. 그곳이 대공분실이라는 것을 나오고 나서야 알았다. 학생운동을 하던 동기와 후배가 수배 중이었고, 그들을 집에 재워준 게 화근이었다. 수사관들은 “태어나서 여기까지 온 과정을 쓰라”고 했다. 당시 대학원생이었던 나는 처음으로 ‘자서전’을 세 번이나 썼다. 그사이 집은 압수수색을 당했다. 수사관들은 집에서 ‘비판’이니, ‘마르크스’니, ‘진보’니 따위 제목이 들어간 책 30여 권을 모조리 가져왔다. 수사관들은 책에서 밑줄 그은 부분을 물었다. 그렇게 나도, 대학원 공부를 하며 보던 책도 ‘사상검증’을 당했다. 물론 대형 서점에서 모두 팔던 책들이었다. 48시간 뒤 풀려났다. 나중에 알고 보니 수사관들은 나를 국가보안법상 이적표현물 소지죄(제7조 5항)로 엮으려 했다. 한 명이라도 더 잡아넣어야 ‘실적’이 오르니까.  느닷없이 20년 전 기억이 떠오른 건 대선 후보 텔레비전 토론을 보고 나서다. ‘주적’과 국가보안법 폐지 찬반 논쟁이 오갔다. 13년 전 대통령은 “국가보안법을 칼집에 꽂아 박물관에 보내자”고 했다. 지금은 감옥에 있는, 그땐 야당 대표였던 박근혜 전 대통령의 반대로 국가보안법을 한 글자도 고치지 못했다. 기자가 되고 검찰을 출입하며 ‘공안통(공안검사)’과도 이야기를 많이 나눴다. 뼛속까지 공안통들도 많았다. 국가보안법을 폐지하지는 않더라도 시대에 맞게 개정하는 데 동의하는 공안통도 적지 않았다. 세상이 조금씩 전진한 줄 알았는데 2017년 텔레비전 토론회에 비친 한국은 20년 전 새해 첫날로 되돌아간 것 같았다. 토론을 본 직후 어느 후보에게 투표할지 마음을 정했다. 선거 한 번으로 세상이 확 바뀌지는 않는다. 그럼에도 선거는 주권자인 시민들이 가장 큰 위력을 발휘할 수 있는 때다. 통권호에 가깝게 지면을 꾸렸다. 주권자들의 손가락 힘을 키워줄 ‘영양 밥상’을 차렸다. 먼저 1, 2위 후보 캠프를 이끌고 있는 이해찬·박지원 선거대책위원장을 만났다. 산전수전 공중전을 겪은 ‘정치 9단’ 두 사람에게 이숙이 선임기자가 송곳 질문을 던졌다. 은 지난해 가을부터 기본소득(복지), 노동(일자리), 국가 재정정책 등 대선 어젠다 점검 시리즈를 내보냈다. 이번 호에는 교육, 보육, 주거, 한반도 어젠다를 한꺼번에 점검했다. 꼼꼼히 살펴보고 따져보면 주권자로서 한 표를 행사하는 데 도움이 될 것이다. 고제규 편집국장 unjusa@sisain.co.kr싱싱한 뉴스 생생한 분석 시사IN Live - [ 시사IN 구독 ]©시사IN, 무단전재 및 재배포 금지"
