"title","press","body"
"[하태훈의 법과 사회]안보 공세로 사라진 정책검증","경향신문","대한민국에서 안보논리는 단골이다. 국가보안법, 보안관찰법이나 테러방지법도 자유민주주의적 기본질서 유지와 북한과 대치하는 현실적 상황이라는 안보논리로 폐지되지 않고 그대로 남아 있거나 새로 제정된 법률들이다. 국가정보원의 국내정보 수집권한과 수사권을 폐지하자는 주장에 대해서도 보수진영은 분단 상황을 들먹이며 반대한다. 이번 대선에서도 어김없이 안보가 화두다. 남북대치 상황에 적절한 긴장감을 가미시켜 안보불안 세력을 표로 연결해 보려는 시도가 현직 대통령이 탄핵된 뒤 치러지는 2017년 대선에서도 등장했다. 정당이나 후보의 정체성과 관계없이 표만 된다면 안보를 걱정하는 표를 끌어안으려는 기회주의적 변신도 서슴지 않는다. 보수언론은 안보 이슈가 이번 대선의 유권자 선택기준인 것처럼 부풀리고 호도한다. 상대방 후보에 대한 시대착오적 안보 공세도 불사한다. 어김없이 안보좌판이 펼쳐지고 여기저기 기웃거리는 이들도 제법 많다. 해묵은 주적논쟁과 북한인권결의안 표결과정이 다시 도마에 올라와 있다. 사드 배치와 햇볕정책도 공격거리다. 북한 이슈가 표심을 가를 것이라는 전망도 여기저기서 들린다. 4월전쟁설의 근거였던 미국 항공모함은 한반도 근처 어디에도 있지 않다는 사실이 알려졌지만 여전히 한반도 위기설은 사그라지지 않고 있다. 부추겨 득을 보려는 세력이 있기 때문이다. 신북풍이 불기를 기대하면서 대선을 안보와 종북프레임으로 몰고 가려는 열세 후보들의 안간힘이 애처로워 보인다.북한은 우리에게 누구인가. 주적인가, 심각한 위협이 되는 적인가. 적국인가, 반국가단체인가. 대화하고 협력하는 국가인가. 두 차례의 남북정상회담에서 정부와 국가로서 인정한 것인가. 독립국가만 가입할 수 있는 유엔에 남북한이 동시에 가입되어 있으므로 독립국가로 승인받은 것인가. 헌법 제3조의 영토조항과 제4조의 평화통일조약을 근거로 북한은 대한민국의 영토고권을 침해한 반국가단체라고 보는 것이 일반적이다. 국가보안법도 그렇고 대법원 판례와 헌법재판소 결정도 반국가단체성을 확인하고 있다. 그러나 다른 한편으로는 남북화해와 협력기조에 따라 통일을 위한 대화와 협력의 동반자적 관계로 보고 있다. 남북관계 발전에 관한 법률에 의하면 남한과 북한의 관계는 국가 간의 관계가 아닌 통일을 지향하는 과정에서 잠정적으로 형성되는 특수 관계이다. 남북교류협력에 관한 법률에 따르면 북한은 교류의 대상이다. 이처럼 북한은 반국가단체이자 대화와 협력의 동반자이며 교류의 대상이다. 국방백서에는 북한이 아니라 북한 정권과 북한군을 적으로 기술하고 있다.이처럼 모순된 상황의 공존은 우리에게 북한은 무엇인가라는 질문에 한마디로 단언할 수 없는 어려움을 준다. 군사적 위협과 우리의 안보에 위협이 되는 수행주체여서 적이라고 볼 수 있기도 하지만 자유민주주의적 기본질서에 입각한 통일을 위하여 북한의 정치적 실체를 인정해야 하는 것이다. 대통령은 통수권자이기도 하지만 행정부의 수반이기도 하다. 행정부의 수반인 대통령은 헌법에 입각하여 평화통일을 위해 성실히 노력해야 할 의무가 있다. 대통령이 남북관계 개선과 평화통일에 적극 나서서 남북 간 대결과 분단구조를 해체하는 대북정책을 펼쳐야 한다. 북한을 적으로 보는 시각이 아니라 평화와 통일의 패러다임으로 무장한 대통령의 리더십이 필요하다.그러니 철지난 안보 공세는 이제 멈춰야 한다. 북한이 주적이냐는 물음에 단답을 강요하는 것으로 안보관을 검증할 수는 없다. 이번 대선은 후보의 공약을 알리고 파헤치고 고르는 선거여야 한다. 그것은 후보자의 도덕성뿐만 아니라 정책과 능력 중심이어야 한다. 지금은 안보관 검증공세로 부정부패 척결, 경제 활성화와 일자리 창출, 복지확대와 양극화 해소 등 다른 중요한 정책검증은 뒷전으로 밀려나 있다. 냉전시대의 사고로 주적논쟁을 벌이는 세력은 안보논리로 유권자를 유혹하지만, 안보프레임과 색깔론은 유권자의 눈과 귀를 가리고 막아 표심을 왜곡시킬 수 있다. 언론매체에 정책검증 꼭지가 기획시리즈로 등장하지만 지금까지 네거티브에 익숙한 독자들에게 그 영향력은 떨어진다. 네거티브와 안보 이슈는 블랙홀과 같아서 정책선거를 실종시킨다. 몇 번 남은 TV토론에서도 여전히 그럴 것이다. 난상토론이지만 생산성은 없다. 그러면 유권자에게 피로감만 주는 대선후보 토론회가 된다. 상대후보에 대한 공세는 후보 간 토론방식의 한계다. 후보가 제시한 공약과 관련 있는 이익집단이나 시민단체, 학계와 후보 간의 토론으로 검증다운 검증이 진행되어야 유권자의 의견도 반영되고 후보 선택에 도움이 될 수 있을 것이다.<하태훈 | 고려대 법학전문대학원 교수>▶ 경향신문 SNS [트위터] [페이스북]▶ [인기 무료만화 보기]©경향신문(www.khan.co.kr), 무단전재 및 재배포 금지"
"[사설] 한반도 긴장 해소 여부 북한 선택에 달렸다","한국일보","중국 정부가 24일 강력한 대북 경고를 했다. 겅창 중국 외교부 대변인은 25일 창군절을 맞은 북한의 6차 핵실험 우려와 관련, “우리는 유관 각국이 냉정과 자제를 유지하고 정세를 긴장시키는 행동을 취하지 않기를 강력히 촉구한다”며 “유엔 안보리에는 북한의 핵ㆍ미사일 활용에 대한 명확한 금지 요구가 있다”고 밝혔다.그의 언급은 관영 환구시보가 사설에서 “(북한이 6차 핵실험을 한다면) 원유공급을 대폭 축소할 것”이라며 “미국이 북한의 핵 시설 등을 타격하는 것에 대해서는 외교적 수단으로 억제에 나서겠지만, 군사적 개입은 불필요하다”고 밝힌 데 이은 것이다. 중국이 대북 경제제재를 넘어 일정 수준의 대북 군사조치까지 수용할 수 있음을 내비친 관영매체의 사설에 덧붙여 정부 차원의 대북 경고에 나선 것은 ‘창군절 위기’를 해소하려는 중국의 의지를 확인시킨다. 중국 정부의 입장은 어느 때보다 분명해 보인다. 더 이상의 핵ㆍ미사일 도발은 용납하지 않겠다는 것과 함께 ‘전략적 자산’으로서의 북한은 계속 끌어안고 가겠다는 것이다. ‘북한 정권의 안정’이란 대북기조를 포기하지는 않겠지만, 김정은 정권이 핵ㆍ경제 병진노선을 고집한다면 결국은 핵과 경제 모두를 잃게 되리란 최후통첩을 날린 셈이다.미국은 이미 대북정책 기조로 ‘최대 압박과 개입’을 공언한 바 있다. 정치ㆍ경제ㆍ외교적으로 대북 압박을 극대화해 북한을 비핵화 협상에 끌어들이고, 여의치 않을 경우 군사적 조치도 배제하지 않겠다는 것이다. 이날 도널드 트럼프 미국 대통령과 시진핑 중국 국가주석의 통화에서도 거듭 확인됐듯, 대북 압박 창구로서의 중국의 역할에 대한 미국의 기대를 중국이 이해하고 수용한 결과다. 이런 흐름에서 이제 남은 것은 북한의 선택뿐이다. 북한은 미국의 전방위 압박카드에 정면으로 맞서며 여전히 핵도발 카드를 버리지 않고 있다. 15일 태양절은 대규모 군사퍼레이드 정도로 피해갔지만, 25일 북한군 창건기념일을 택해 핵이나 미사일 도발을 할 것이라는 우려가 팽배하다. 한반도 수역으로 진입하는 미 항모 칼빈슨호 대해서도 “수장해 버리겠다”는 엄포를 날리고 있다.혈맹이라는 중국이 군사조치까지 용인하겠다는 판이다. 핵 보유국이라는 망상을고집하느냐, 생존을 위한 현실적이고 합리적 타협을 선택하느냐의 기로에 서 있다. 렉스 틸러슨 미국 국무장관은 “북한의 정권교체는 미국의 목표가 아니다”고 명언했다. 미국의 압박과 경고가 이 정도에서 끝날 것인지 여부는 전적으로 북한의 행동에 달렸다.▶한국일보 [페이스북] [카카오 친구맺기]▶자동차의 모든 것! [모클][ⓒ 한국일보(hankookilbo.com), 무단 전재 및 재배포 금지]"
"[노트북 단상] 사표 심리와 소수의 취향","부산일보","/이호진 라이프부 차장 음식점을 다니다 보면 과거에 비해 달라진 분위기가 있다. 촌각을 다투는 상황이라면 모를까 '빨리 나오는 거로 통일하자'는 얘기가 거의 사라졌다.손님들은 식사 약속을 잡을 때 서로의 취향을 고려해 장소를 정하고, 식당에 가서도 각자 먹고 싶은 음식을 주문한다. 식당도 요즘은 전문화가 대세다. 줄 서는 맛집은 대체로 몇 개 메뉴만 집중해 내놓는다. 각자 다른 메뉴 주문이 들어와도 조리 과정에 약간의 변화만 주면 될 정도로 대비한다. 그만큼 개인의 취향이 존중받는 시대다.대통령 선거가 딱 2주 앞으로 다가왔다. 주변 사람들과 나누는 이야기 소재 가운데 대선 후보나 공약 등 선거 이슈가 상당 비중을 차지한다.정치 지향도 결국 취향인데 유독 선거 국면에서는 막다른 양자택일을 강요받는다.'될 사람 밀어주자.' '후보나 정책은 좋은데 찍어 줘도 죽는 표 아니냐.' 사표 심리를 자극하는 이 강자의 언어는 득표율과 무관하게 한 표라도 더 얻는 후보가 이기는 한국의 대통령 선거제도에서 비롯됐다. 신진 정치 세력의 진입을 막고 기득권을 공고히 하는 논리로 작용한다. 주류 정치권은 비주류 후보 지지자의 사표 심리를 자극하고, 언론도 다자보다는 양자나 삼자로 축약해 치열한 득표전이 벌어지는 것을 선호한다. 이런 현상은 소선거구제인 총선도 마찬가지다.수천만 유권자의 지향이 단 2~3명의 후보에게 수렴되는 것이 정말 가능한가? 그리고, 정당한가?프랑스가 대안 하나를 보여 준다. 지난 23일 대선에서 상위 후보 4명이 20% 안팎의 비슷한 득표율을 기록했다. 한국 대선 이틀 전인 다음 달 7일, 1·2위 후보를 놓고 결선투표를 치른다. 결선에서는 탈락 후보 측의 표를 얻기 위해 다양한 방법이 동원될 것이다. 결선투표제는 양강 후보가 탈락한 후보 세력과 연대하게 만드는 제도적 장치로 작용한다.비주류 후보가 뜻을 펼쳐 보기도 전에 출마 포기와 단일화 압력에 시달리는 한국 정치는 그런 점에서 폭력적이다. 힘의 논리로 이뤄지는 단일화에서 비주류의 목소리를 반영할 제도는 없다. 그래서 재화와 인물은 거대 정당에만 몰린다. 미래를 기약하기 어렵다. 기막힌 레시피를 갖고 식당을 내보려 해도 임대료가 너무 비싸 엄두도 못 내는 것과 같은 이치다. 도전과 창의가 발붙이기 어렵다.결선투표제를 비롯한 선거제도 개혁이 거론되다 번번이 수포로 돌아간 이유도 국회를 장악한 거대 정당이 기득권을 내려놓지 않았기 때문이다. 시민 저항의 결과로 앞당겨진 대선이기에, 다음 정권에서는 유권자의 선택권을 존중하고 비주류·소수 세력의 진입 장벽을 낮추는 제도 개혁이 이뤄져야 한다.당장 이번 대선부터도 소수자 후보에게 투표하는 것이 더 이상 '용감한 선택'이나 '쓸데없는 짓'이 아니었으면 좋겠다. 한 정치인이 기막힌 비유를 내놓았다. '좋아하니까 결혼하는 것이지, 결혼할 사람이니까 좋아하는 것은 아니지 않은가.' jiny@"
"[사설]자유한국당·바른정당은 대선 포기했나","경향신문","자유한국당과 바른정당 등 보수 정당들의 처지가 말이 아니다. 대통령 선거를 2주 앞두고 있는 상황에서 이들 정당 후보는 10%, 3% 안팎의 지지율에서 벗어나지 못하고 있다. 그래서인지 두 당이 하는 양을 보면 마치 대선을 포기한 듯하다. 한국당 소속 의원들의 입에서 맥이 빠진다는 말이 아무렇지도 않게 나온다. 바른정당에서는 유승민 후보를 밀기는커녕 홍 후보와의 단일화를 언급하고 있다. 어제는 의총을 열어 유 후보를 노골적으로 압박했다.두 당이 지리멸렬한 것은 보수 기득권에 빠져 새로운 보수의 통치철학을 만들지 못했기 때문이다. 한반도 주변 정세에 편승한 대결적 남북관계와 그에 기댄 낡은 안보관을 금과옥조처럼 붙들고 있다. 시장만능주의와 대기업 중심의 경제관에 매달려 경제적 불평등에 대한 해법은 외면했다. 박근혜 전 대통령이 탄핵된 뒤에도 진솔한 반성 없이 박 전 대통령을 옹호하는 오만까지 보였다. 보수 우위의 정치·여론 지형 위에서 안이하게 권력을 즐기기만 했다고 해도 지나친 말이 아니다. 보수 정당은 과거 한나라당 때도 이른바 ‘차떼기’ 대선자금 사건으로 존폐 위기에 몰린 바 있다. 당시 한나라당은 박근혜라는 새로운 리더십을 세우고 천막당사에서 다시 출발해 결국 재집권에 성공했다. 보수 정당이 지금 맞닥뜨린 위기는 그때보다 몇 갑절 더 엄중하다. 말 그대로 모든 것을 내려놓고 사활을 걸지 않고는 회생하기 어렵다. 회생을 위해서는 이번 대선을 잘 치르는 것이 무엇보다 중요하다. 이번에는 정권을 잡지 못하더라도 야당으로서 견제 역할을 제대로 하겠다는 각오로 새 출발하는 것 이외에 방법이 없다. 그러자면 현 상태에서 최선을 다해 선거에 임하는 태도가 필요하다. 보수는 진보와 더불어 사회를 지탱하는 양 날개다. 보수의 몰락은 모두의 불행이다. 위기가 기회라는 말처럼 한국당과 바른정당은 이제부터 탈출구를 찾아내야 한다. 술수나 꼼수로 빨리 일어서려는 생각보다 건강한 보수라는 방향을 잡는 데 더 천착해야 한다. 낡은 경제관과 안보관을 답습해서는 새 길을 찾기 어렵다. 설득력 있는 보수의 가치와 비전을 세우는 게 먼저다. 깊은 성찰과 혁신을 통해 새롭게 태어나겠다는 결기가 있어야 한다. 그래야 다시 시민의 지지를 받을 수 있다. 그런데 그런 자세가 보이지 않아 답답하다.▶ 경향신문 SNS [트위터] [페이스북]▶ [인기 무료만화 보기]©경향신문(www.khan.co.kr), 무단전재 및 재배포 금지"
"[사설] 낡은 기성 정치에 대한 불신 보여 준 프랑스 대선","한국일보","프랑스 대선 1차 투표 결과 중도파 에마뉘엘 마크롱 후보와 극우파 마린 르펜 국민전선 대표가 결선에 진출했다. 현지 여론조사를 보면 5월 7일 결선에서는 마크롱 후보의 승리가 예상된다. 프랑스 대선은 두 가지 점에서 시사하는 바가 적지 않다. 하나는 지난해 영국의 유럽연합(EU) 탈퇴 결정과 미국의 트럼프 당선으로 현실화한 세계적 우익 포퓰리즘 확산에 대한 우려이고, 다른 하나는 유권자들의 새로운 리더십 갈망이다.수년 사이 유럽 각국에서는 테러 위협이 최대 안보 현안이 되었다. 동시에 제2차 세계대전 후 서유럽 중심으로 추구된 지역 통합과 이민자에 대한 국경 개방 정책이 위협을 받아 왔다. EU 탈퇴ㆍ반이민을 앞세운 극우 정당이 유럽 각국에서 득세하는 상황이다. 유럽 전역이 극우 바람에 휩쓸릴 것인가를 가늠할 선거가 지난해 말 오스트리아 대선, 지난달 네덜란드 총선과 이번 프랑스 대선, 그리고 9월 치러질 독일 총선 등이다.오스트리아 대선이나 네덜란드 총선에서는 극우 정당의 대권 장악이나 집권당 부상은 없었다. 1차 선거에서 4강 구도를 형성했다가 탈락한 공화ㆍ사회 양당 후보가 마크롱 지지를 선언한 프랑스에서도 ‘프렉시트’를 약속한 르펜이 당선되기는 어려워 보인다. 하지만 이런 결과만으로 유럽에서 이민자 배척이나 자국우선주의 등 극우 바람이 잦아들었다고 보긴 어렵다. 오스트리아에 이어 프랑스 대선에서도 극우 정당 대표가 이례적으로 결선 투표에 진출했고, 네덜란드 자유당도 집권당이 되지는 못했지만 약진을 기록했다. 프랑스 대선에서 더욱 의미 심장한 것은 1958년 결선투표제 도입 후 처음으로 공화ㆍ사회당 후보가 2차 선거에 진출하지 못한 점이다. 60년 넘게 지속돼 온 양당 체제 대결에 대한 유권자의 실망과 함께 새로운 정치에 대한 기대를 보여 준다. 39세의 마크롱 후보는 당선된다면 역대 최연소 프랑스 대통령이 된다. 경제부처 공무원, M&A 전문가 등을 거쳐 사회당 정부에서 대통령 경제보좌관과 재정경제부 장관을 지낸 그는 중도 좌파 올랑드 정권에서 우파 경제정책을 주도한 것으로 유명하다. 관광지구 내 휴일ㆍ심야 영업 제한 완화, 주 35시간 노동제 반대 등이 대표적이다.지금 프랑스는 우리와 마찬가지로 재정 비효율 개선 등의 구조 개혁과 성장동력 창출이라는 국가적 과제를 안고 있다. 마크롱의 부상은 이런 문제 해결에 대한 유권자들의 기대가 담긴 것으로 볼 수 있다. 비슷한 시기에 대선을 치르는 한국의 대선 후보들도 유념해야 할 대목이다.▶한국일보 [페이스북] [카카오 친구맺기]▶자동차의 모든 것! [모클][ⓒ 한국일보(hankookilbo.com), 무단 전재 및 재배포 금지]"
"[사설]헐뜯기 경쟁하려면 후보 TV토론 그만두라","경향신문","23일 저녁 대선후보 3차 TV토론회는 2시간 내내 상대 흠집 잡기로 얼룩진 실망스러운 토론이었다. 앞서 두 차례 토론에서 보여준 후보들 간의 진흙탕 공방은 개선되기는커녕 더욱 심화됐다. 이날 토론회 주제는 외교안보와 정치개혁이었다. 하지만 정책토론은 뒷전으로 밀려난 채 특정 후보의 대학시절 성폭행 공모 의혹, 부인·아들 특혜 채용 의혹, 송민순 전 외교부 장관 쪽지 등 본질과는 아무 상관없는 말싸움만 계속됐다. 미래는 없고 오로지 과거지사만 놓고 충돌했을 뿐이다. 추궁당한 한 후보는 “나는 해명 다 했으니 당신이나 열심히 해명하시라”고 했고, 다른 후보는 “그만 좀 괴롭히라”고 비명을 질렀다. 상대 후보를 인정할 수 없으니 얼굴을 보고 말하지 않겠다면서 토론 내내 쳐다보지 않기도 했다. 지금 한반도 주변 정세는 한 치 앞을 내다보기 어려울 정도로 요동치고 있는 상황이다. 그렇지만 대통령이 되겠다는 사람들이 다 모여 외교안보 대책을 논하는 자리에서 도널드 트럼프 미국 대통령 이름은 한 번밖에 나오지 않았다. 오죽하면 5명 후보들 스스로 토론회를 마친 뒤 “수준 이하의 토론이었다”고 혀를 찼을까. 이번 대선은 대통령 탄핵에 따라 치러지는 비상(非常)선거다. 그만큼 선거 기간이 짧고, 과거에 비해 제대로 된 검증은 이뤄지지 못한 상태다. TV토론은 후보들의 지도자 자질과 능력을 알리고 측정할 거의 유일한 장(場)이라고 할 수 있다. 3차 토론회 시청률이 1차(11.2%), 2차(26.4%) 때를 훨씬 넘어 38.5%를 기록한 것은 유권자들의 뜨거운 관심을 보여주는 증거다. 토론회를 본 시민들은 소셜미디어 등에서 “상대 공약을 숙지하지 않고 간단한 팩트 체크도 안 하고 같은 질문만 반복” “토론회가 아닌 난장판” “정말 저 사람들 중에서 대통령을 뽑아야 하나. 한숨만 나온다”는 반응을 보였다.  5·9 대선은 이제 꼭 2주일 남았다. TV토론은 투표일까지 불과 3차례(28일·5월2일 중앙선관위 2회, 25일 JTBC 1회)밖에 남아있지 않다. 더 이상 상대를 헐뜯고 말꼬리 잡으며 흠집 내는 데 시간을 허비할 여유가 없다. 철 지난 색깔론은 더 말할 나위 없다. 경쟁자를 깎아내린다고 자신이 올라가는 것도 아니다. 적어도 유권자 앞에서 벌이는 토론은 국가를 경영할 책임있는 리더십을 보여주는 희망의 경연장이 되어야 한다. 가능하다면 지금이라도 토론 방식을 개선하고 보완해야 한다. 무엇보다 후보 간 정책 변별력을 높여야 한다. 전문가들이 정책을 질문하고 후보가 답하는 토론이 좋겠다는 의견은 경청할 만하다. 그렇지 않고 알맹이도 품격도 없이 유권자 부아만 돋우는 이런 식의 토론을 계속할 거라면 차라리 접는 게 낫다.▶ 경향신문 SNS [트위터] [페이스북]▶ [인기 무료만화 보기]©경향신문(www.khan.co.kr), 무단전재 및 재배포 금지"
