"title","press","body"
"[기자수첩]강남 집값 잡을 대선공약 없나?","이데일리","[이데일리 이진철 기자] ‘9.74%’와 ‘5.4%’. 국토교통부가 이번 주 발표한 집 관련 통계자료 가운데 유독 눈길이 가는 수치다.국토부에 따르면 올해 서울 강남3구(서초·강남·송파구) 아파트 등 공동주택 공시가격은 9.74% 올라 전년(7.31%)에 비해 상승폭이 더 커졌다. 강남권 집값이 크게 오른 것은 재건축 투자 붐이 일고, 신규로 공급된 아파트 분양가가 크게 상승했기 때문이다.실례로 강남구 압구정동 신현대11차 전용면적 171㎡형은 최근 30억원에 거래돼 2006년 실거래가 집계 이후 최고가 기록을 경신했다. 이 아파트는 부동산 경기 침체로 2013년 18억7000만원까지 떨어졌지만 지난해부터 재건축 바람을 타고 다시 상승하기 시작했다. 지난해 7월 공급된 강남구 개포주공3단지 재건축 아파트 ‘디 에이치 아너힐즈’ 분양가는 3.3㎡당 평균 4137만원으로 당시 강남구 평균 분양가(3804만원)보다 8.8% 높았다.국토부가 얼마 전 발표한 ‘2016년도 일반가구 주거실태’ 조사 결과를 보면 최저 주거기준 미달가구 비율은 ‘5.4%’로 103만 가구에 달했다. 2014년(99만 가구)과 비교해 전체에서 차지하는 비중은 5.4%로 같지만 가구수는 4만 가구나 늘었다. 무주택자들은 높아진 전·월세 가격 때문에 2년 계약 만기가 도래하면 재계약을 못하고 평균 3.6년만에 한번 꼴로 이사를 다닌다. 수도권 거주가구의 10명 중 7명은 주택 임대료와 대출금 상환에 부담을 느낀다는 조사결과다.유력 대선 주자들은 주요 부동산 정책 공약으로 다양한 공공임대주택 공급 확대를 내걸고 있다. 반면 보유세 강화나 재건축 초과이익 환수제 등 시장에 직접적인 영향을 미칠 수 있는 정책들에 대해서는 표심 때문인지 명확한 입장 표명을 자제하고 있다. 역대 정권에서도 공공임대주택 공급을 꾸준히 늘렸다. 하지만 무주택 서민들의 주거난은 여전하다. 치솟는 강남 집값을 잡지 않고서는 주거 양극화 해소는 물론 서민 주거 안정 구호가 공염불이라는 과거 경험을 대선 후보들만 모를 리는 없을텐데 말이다.이진철 (cheol@edaily.co.kr)＜ⓒ종합 경제정보 미디어 이데일리 - 무단전재 & 재배포 금지＞"
"김성태·장제원 등 바른정당 의원 10여명, 단일화 재요구 “오늘 중 유승민과 만날 것”","이데일리","- 김성태 ""3자 단일화 서명 받는 중""- 유승민 ""당 후보 팔아넘기는 것 옳지 않아""유승민 바른정당 대선후보(사진=연합뉴스)[이데일리 조진영 기자] 바른정당 의원들이 유승민 대선후보에게 후보단일화를 재차 요구하기로 했다. 그러나 유 후보가 단일화 반대입장을 확고히하고 있어 내홍은 계속될 전망이다.바른정당 소속의원 10여명은 28일 오전 서울 여의도 글래드호텔에서 조찬모임을 열고 유 후보에게 3자단일화를 요구하는 내용의 입장문을 내기로 했다. 이 모임에는 홍문표, 김학용, 김성태, 이종구, 장제원, 김재경, 이은재, 박순자 의원등이 참석했다.김학용 의원은 모임 직후 기자들과 만나 “(유 후보 단일화 요구 입장에) 상당수 많은 의원들이 동참할 예정”이라고 말했다. 김성태 의원도 “3자 단일화와 관련해 의원들의 서명을 받고 있다”고 전했다. 박순자 의원은 “(입장문은) 단일화를 촉구하는 내용”이라며 “오늘 중으로 유 후보와 만날 예정”이라고 전했다. 이은재 의원은 “3자단일화가 될 수 있도록 마지막까지 노력하겠다”며 “개별행동(개별탈당)은 하지 않을 것”이라고 강조했다.이에 앞서 유승민 바른정당 대선후보는 MBC라디오 ‘신동호의 시선집중’에 출연해 “자기 당 후보를 가지고 막판에 어디에 팔아넘기는 것은 옳지 않다”며 “아무리 저를 흔들어대도 조금도 흔들리지 않겠다”고 완주 의지를 분명히했다.그는 “(선대위원장을 포함해) 일부 의원들이 저를 흔들어대고 있다”며 “단일화나 연대를 얘기하고 있지만 사실상 사퇴를 요구하는 것”이라고 주장했다. 이어 “자기들 손으로 만든 규칙으로 뽑힌 자기 당의 후보를 흔들기 하는건 옳지 않다”며 “저를 도울 생각이 없다면 최소한 흔들기는 안했으면 좋겠다”고 말했다.조진영 (listen@edaily.co.kr)＜ⓒ종합 경제정보 미디어 이데일리 - 무단전재 & 재배포 금지＞"
"[주요 신문 사설](28일 조간)","연합뉴스","▲ 경향신문 = 대선 정책 검증 일자리 공약 구체성이 없다                  황교안ㆍ김관진은 누구의 명령을 받고 사드 도둑배치 했나                  미국의 대북 압박과 대화 천명을 주목한다    ▲ 서울신문 = '압박과 대화' 양면 대북 전략으로 전환한 美                  선거판 뒤흔드는 SNS 마타도어 중대 범죄다                  정책 정치 가능성 보여준 심상정의 약진    ▲ 세계일보 = 북핵에 한목소리 내는 美, 정치공방 일삼는 韓                  대선후보 눈에는 美 '법인세 파격 인하' 안 보이나                  무너진 양강구도… 안철수, 뭐가 문제인지 돌아보라    ▲ 조선일보 = 트럼프 방향 전환 가능성, '北核 동결'쇼에 또 속아선 안 돼                  취임 준비 기간 없는 대선, 총리 사전 공개 필요하다                  미국은 법인세 내려 일자리 만든다는데    ▲ 한겨레 = '협상의 문' 연 미국, 우리도 북한과 대화 준비해야                '협치'의 구체적 내용 유권자에게 제시하라                '알바노조-맥도날드 단체교섭'에 거는 기대    ▲ 한국일보 = 압박 강조하면서도 대화 열어 둔 美 대북 정책                  경기 회복세 떠받칠 실효성 있는 정책 준비해야                  후보들 ‘檢 개혁’주장 앞서 ‘우병우 특검법’처리에 힘 실으라    ▲ 매일경제 = 오늘 경제분야 토론서 대선 후보들이 유념해야 할 세 가지                  4차산업혁명 '듣보Job'으로 고용문제 풀라는 매경보고서                  65세 이상 버스기사는 적성검사 받는데 택시는 왜 거부하나    ▲ 서울경제 = 압박속 대화 문 열어둔 美 대북정책 기조 주목한다                  증세 앞서 '소득있는 곳에 세금' 원칙부터 세워야                  삼성전자 지주사 포기, 경영상의 판단 뿐이었을까    ▲ 파이낸셜뉴스 = 美 법인세율 15%…후보들 현실을 보라                      성장세 꿈틀…고용확대로 이어져야    ▲ 한국경제 = 中企 숨통 조이면서 '중소기업부' 만들면 뭐하나                  이젠 '서류 한 장으로 창업한다'는 중국, 부럽다                  ""정신이 번쩍 드는 자리였다""는 미국 백악관의 북핵 브리핑    ▲ 디지털타임스 = 강력한 ICT리더십으로 저성장 탈피해야    ▲ 전자신문 = 한국 경제를 보는 기대와 우려                  지식재산보증 확대가 반가운 이유    ▲ 아시아투데이 = 경제호조, 탈규제와 낮은 법인세로 이어가야                      文 후보 안보관 불안 해소해야 한다    ▲ 매일일보 = '출생아 수 사상 최저' 절박한 마음으로 대처해야                  '증세 없는 복지', 위험한 실험 또 하나    ▲ 신아일보 = 미국ㆍ중국 공조, 북한 길들이기    ▲ 이데일리 = 협상의 손 내민 美, 北이 답할 차례                  훈풍 이어갈 성장전략 있는가    ▲ 건설경제 = 온기 도는 한국경제, 활력 회복에 박차 가해야(서울=연합뉴스)최신 유행 트렌드 총집결 #흥(클릭!)"
"[씨줄날줄] 北의 인질 외교/최광숙 논설위원","서울신문","[서울신문]2009년 힐러리 클린턴 미국 국무장관이 방북 길에 오르는 남편인 빌 클린턴 전 미 대통령에게 신신당부한 것은 “웃지 마세요”였다. 당시 북한에 억류 중인 미국 여기자 2명을 구출하라는 특별 임무를 받은 빌이 웃겨 보여서는 안 된다는 게 힐러리의 판단이었다. 빌은 웃지 않는 ‘기술’을 열심히 연습했다.실제로 평양 체류 동안 찍힌 빌의 사진은 웃음기를 찾아볼 수 없고 무표정하게 굳어 있다. 그의 뛰어난 말솜씨도, 부드러운 미소도 철저하게 억누른 모습이었다. 이런 계산된 행동 끝에 김정일과의 면담 후 그는 여기자들을 구출했다.북한은 불리한 정세를 모면하기 위해 외국인을 붙잡아 협상 카드로 이용하는 ‘인질 외교’를 펴는 것으로 유명하다. 지난 3월 김정남 암살 사건으로 말레이시아와의 갈등이 극에 이르자 북은 말레이 국민 9명을 인질로 삼았다. 북에 강경한 태도이던 말레이 정부도 자국민 보호를 최우선시할 수밖에 없다 보니 결국 북의 요구대로 김정남 시신을 북에 보냈다.특히 북한은 미국과 초강경 대치 국면일 때 미국인들을 억류해 대미 협상 카드로 활용하는 꼼수를 부린다. 북한은 지난 2013년에도 2년여간 북에 억류됐던 한국계 미국인 케네스 배를 내세워 미국과의 협상에 나섰다. 결국 2014년 11월 미국 국가정보국장이 버락 오바마 대통령의 친서를 직접 들고 방북한 뒤 배씨는 겨우 풀려났다. 배씨는 비망록에 “북한 검사가 ‘중요한 것은 재판 후 미국의 대응이다’라고 말했다”고 썼다.힐러리는 이 같은 북한의 인질 외교를 소상하게 밝힌 적이 있다. 그는 2015년 미국의 한 방송에서 여기자 구출 상황을 회고하면서 “북한 측은 저명한 미국인이 북한을 방문해야만 여기자를 사면해 주겠다고 말했다”며 “여러 저명한 미국인을 제안했으나 북측이 모두 거절했다”고 말했다. “북측이 원한 사람은 빌 클린턴이었기에 살짝 당황했다”고도 했다.최근 북한이 지난 22일 평양국제공항에서 출국 수속을 밟던 한국계 미국인 토니 김(한국명 김상덕)을 억류한 것으로 알려졌다. 김씨에 앞서 미국인 오토 프레드릭 웜비어가 체제 전복 혐의로, 한국계 미국인 김동철 목사가 간첩 혐의로 북에서 장기 복역 중이다. 이로써 북에 억류된 미국인은 3명으로 늘었다.이번에 억류된 토니 김은 중국 연변과기대 교수 출신으로 지난 10년간 북의 수재민과 고아를 돕는 등 인도적 지원 활동을 벌였다고 한다. 그동안 아무리 인질 외교로 원하는 바를 얻었기로서니 어찌 은혜를 원수로 갚을 수 있나.최광숙 논설위원 bori@seoul.co.kr▶  재미있는 세상[나우뉴스], [웰 메이드 N] ▶ [인기 무료만화] [페이스북]ⓒ 서울신문(www.seoul.co.kr), 무단전재 및 재배포금지"
"삽과 총이 결정한 역사의 분기점, 체리뇰라 전투","서울경제","[서울경제] 1503년 4월28일, 이탈리아 남부 체리뇰라(Cerignola) 마을. 나폴리 왕국의 지배권을 두고 대립하던 프랑스군과 스페인군이 맞붙었다. 선수를 친 쪽은 스페인. 곤잘레스 코르도바 장군은 프랑스군의 병참선부터 건드렸다. 작은 마을이지만 프랑스군의 보급 거점이던 체니뇰라를 점령한 것. 프랑스는 서둘러 대응 병력을 보냈다. 급속 행군으로 체리뇰라에 당도한 프랑스군 약 9,000명. 스페인군 6,300명보다 많았다. 스위스 용병대 3,500여명까지 포함한 프랑스군은 승리를 자신했다. 5~7m 길이의 장창(長槍·pike)으로 무장한 스위스 창병의 밀집대형은 자타가 공인하는 유럽 최강이었다.대포 역시 프랑스군 40문이지만 스페인군은 20문. 그나마 전투가 시작되자마자 스페인군 포병대는 한동안 기능을 잃었다. 원인 모를 폭발이 일어난 탓이다. 객관적으로는 절대 불리한 조건이었으나 전투의 결과는 스페인의 압승. 프랑스군은 4,000여명이 죽거나 다친 데 비해 스페인군 사상자는 100여명에 그쳤다. 스페인이 완승을 거둔 체리뇰라 전투는 규모가 크지는 않았어도 유럽 역사의 흐름에 지대한 영향을 끼쳤다. 참호 같은 야전 축성술이 중시되고 화약 병기의 우위가 확실하게 드러났다. 무엇보다 군과 전투에 대한 생각이 바뀌었다. 연구하고 변화해야 승리할 수 있다는 근대적이고 합리적인 사고방식이 퍼진 것이다.처음부터 두 나라의 전력은 뚜렷한 색깔 차이가 있었다. 영국과 100년 전쟁을 치른 프랑스는 적의 원거리 투사무기(장궁 또는 석궁)를 파괴할 수 있는 포병 화력과 단번에 적진을 쓸어버리는 중장갑 기병대를 소중하게 여겼다. 반면 이슬람 왕국들을 상대로 무려 8세기 동안 게릴라전을 펼쳤던 스페인은 보급선 차단을 우선시했다. 프랑스는 정규전, 스페인은 임기응변에 강했다고 정리할 수 있다. 전투 조직 구성에서도 둘은 달랐다. 프랑스는 전통을 중시하고 스페인은 전장 환경에 맞는 전투 편성을 보다 선호했다. 체리뇰라 전투의 시작도 프랑스가 자랑하던 중장갑 기병의 돌격으로 시작됐다. 말이 달리는 속도와 충격력으로 적진을 돌파할 수 있다고 믿었지만 스페인군에게는 지형과 장애물, 그리고 총이라는 세 가지 비책이 있었다. 먼저 스페인군은 언덕의 경사면에 병력을 깔았다. 중장갑 기병을 태운 말들은 언덕을 숨 가쁘게 오르며 장애물에 걸리거나 깊은 참호 속에 빠졌다. 참호 속에는 화승총(아르케부스)으로 무장한 총병들이 기다리고 있었다. 프랑스군의 총 지휘관인 네무르 공작도 돌격하다 참호 앞에서 총 맞아 죽었다. 기병대가 와해되자 스위스 장창대가 나섰지만 역부족. 전력을 고스란히 보전한 스페인 기병과 창병, 총병의 합동 공격 앞에 스위스 창병들도 물러났다. 근 200년 동안 패배를 모르던 스위스 장창병의 신화도 이때 깨졌다. 스페인군은 요행으로 이긴 게 아니라 지략과 제병(諸兵) 합동공격으로 적을 물리쳤다. 이후에도 승승장구한 스페인군은 결국 프랑스 세력을 몰아내고 2차 이탈리아 전쟁에서 승리를 따냈다. 코르도바는 1515년 사망(62세)했어도 그가 남긴 전략을 숙지하고 군 구조를 바꾼 스페인은 1525년 밀라노 인근에서 파비아 전투에서 프랑스군을 괴멸시켰다. 포로가 된 프랑스왕 프랑수와 1세가 석방 조건으로 바친 금화와 은화는 몇 개 인지 파악하는 데만 4개월이 걸렸다. 파비아 전투에서도 귀족들로 구성된 프랑스군의 중장갑 기병대는 스페인군 소총수와 기병, 장창병들의 연합 공격에 박살났다. 요즘 가격으로 환산하면 단가 600달러짜리 화승총이 수만달러 짜리 중장갑 갑옷과 말의 속도를 이긴 것이다.코르도바가 세운 전술의 핵심은 장교 증원과 병력 구성의 변화. 체리뇰라 전투 8년 전에 일어난 세미나라 전투에서 프랑스에게 대패한 코르도바는 ‘생애 첫 패배’를 교훈 삼아 군 편제부터 고쳤다. 보병의 기본 무기를 검에서 창으로 바꾸고 화승총병의 비중을 높였다. 코르도바가 바꾼 전투 편제는 기병과 창병, 총병 3,000명으로 이뤄진 ‘테르시오(Tercio)’로 이어졌다. 창병 10개 중대에 총병 2개 중대로 편성되는 테르시오는 네덜란드와 스웨덴의 순환 진영에 밀리기까지 140년여 동안 유럽의 전장을 지배했다. 유럽은 화승총과 테르시오 진영의 변형진법으로 오스만튀르크와 상대하고 활동 무대를 세계로 넓혔다.양성과 유지에 돈이 많이 드는 중장갑 기병이 한낱 소총수의 저격으로 사라지는 시대가 열리며 귀족의 특권도 차츰 사라졌다. 코르도바는 체리뇰라 전투를 앞두고 장교 수도 늘렸다. 이전까지는 장교 1명이 병력 300~600명을 지휘했으나 체리뇰라 전투 직전부터 병사 300명을 간부 5~6명이 맡는 체제로 바뀌었다. 늘어난 장교 충원을 위해 각국의 귀족 뿐 아니라 부유층이나 평민 자제 중에서도 군의 하급 지휘관을 선발하기 시작했다. 스페인 군대는 점점 더 강력해지고 최강의 군대로 거듭났다. 제국의 영역도 동부 유럽에서 스페인 전역, 네덜란드와 벨기에 일대, 브라질을 제외한 중남미 전역과 필리핀 등으로 넓어졌다.문제는 지속적이지 않았다는 점. 전투에서 승리하고 땅이 넓어질수록 스페인 제국은 속으로 멍들었다. 제국의 확장을 지탱할 경제 구조가 없었던 탓이다. 경제가 부실해지는 데도 역대 국왕들은 끊임없이 전쟁에 뛰어들었다. 젊은이들은 학문에 정진하거나 노동을 경시하고 전쟁에 참가해 전공을 올리는 데 관심을 쏟았다. 결국 국내 생산 기반이 무너지고 수입으로 지탱하는 와중에서도 스페인은 전쟁 사업에 매달렸다. 결과는 국가 부도. 16세기에만 세 차례 지급 불능을 선언했다. 스페인제국이 온갖 대외전쟁에 끼어들지 않고 국내 경제에 신경을 기울였다면 좀 더 오래 지속할 수 있었을까. 모를 일이다. 다만 아이러니한 점이 있다. 4~500년 전 스페인과 비슷한 성향을 보이는 나라가 21세기에도 존재한다는 사실이다. /논설위원 겸 선임기자 hongw@sedaily.com [서울경제 바로가기]'장미전쟁'의 승자는...5월 대선 실황중계 [바로가기]서울경제의 모든 연재물!... 서경Cube [바로가기▶]저작권자 ⓒ 서울경제, 무단 전재 및 재배포 금지"
"[기고] 장애 편견 깨고, 꿈의 날개 달아주자/박승규 한국장애인고용공단 이사장","서울신문","[서울신문]박승규 한국장애인고용공단 이사장장애인, 신체의 일부에 장애가 있거나 정신 능력이 원활하지 못해 일상생활이나 사회생활에 어려움이 있는 사람. 국어사전에 나와 있는 장애인의 정의다. 장애인에 대한 인식은 긍정적으로 바뀌고 있으며 편견 역시 조금씩 깨어지고 있지만, 여전히 부정적 시각이 존재하는 것도 사실이다.장애인을 위해 만들어진 ‘브래들리 타임피스’는 촉각을 이용해 시간을 확인할 수 있는 시계다. 시곗바늘 대신 작은 구슬이 시간을 표시한다. 이 시계는 눈으로 시간을 볼 수 없는 시각장애인이 손의 감각으로 시간을 알 수 있도록 고안됐다. 시각장애인을 위해 개발됐지만, 매력적인 디자인 덕분에 비장애인에게도 각광받고 있다.‘브래들리 타임피스’를 개발한 이원의 김형수 대표는 대학원 재학 중 시간을 알려주는 시계를 쓰면 수업을 방해할까 봐 사용을 꺼리던 시각장애인 친구를 보며 시각장애인이 사용하기 편리한 시계를 만들기로 마음먹었다고 한다.시각장애인 친구가 겪는 불편함을 눈여겨보고 시계를 만든 김 대표와 달리 많은 사람은 장애를 나와는 상관없는 일로 여긴다. 국내 장애인의 약 90%는 사고, 질환 등 후천적 요인으로 장애를 입는데도 말이다.장애인의 삶, 특히 장애인 고용의 현실은 여전히 척박하다. 법으로 상시근로자 50인 이상 민간 기업의 경우 상시 근로자의 2.9% 이상을 장애인으로 채용하도록 의무화했지만, 이를 지키지 않는 기업이 많다. 상당수 대기업이 장애인 의무고용률을 준수하지 못하고 있으며, 고용 대신 장애인고용부담금을 납부하는 기업도 다수다.이에 정부는 4월을 ‘장애인 고용촉진 강조 기간’으로 정해 장애인 고용에 대한 관심을 높이기 위한 행사를 다양하게 펼치고 있다. 장애인 고용에 기여한 이들을 포상하고 장애인 고용 우수 사례를 나누는 ‘장애인고용촉진대회’가 대표적이다.지난 13일 개최된 2017 장애인고용촉진대회의 주제는 ‘꿈, 날개를 달다’였다. 장애인은 ‘자립’이라는 꿈의 날개를, 사업주는 ‘기업 발전’이라는 꿈의 날개를 달고 함께 도약하자는 의미를 담았다. 이날은 장애인표준사업장인 ㈜행복누리 이기영 대표이사가 철탑산업훈장을 받는 등 장애인 고용 촉진 유공자 28명이 정부 포상을 받았다. 수상자를 보니 모두 장애인의 꿈에 날개를 달아 주기 위해 노력을 아끼지 않은 기업이다.㈜행복누리의 경우 설립 초기 30명이었던 장애인 근로자를 117명까지 확대했으며, 다양한 장애인 적합 직무를 발굴하고 장애인 채용 시 가산점을 부여하는 등 장애인의 일자리 창출을 위해 지원을 아끼지 않았다. 다른 기업들 역시 수십 년간 장애인을 고용하며 소득보장이나 자립을 떠나 한 단계 도약할 수 있는 꿈 날개를 달아 준 기업들이었다.4월 장애인 고용촉진 기간을 지내며, 장애인을 장애가 있어 일상생활이나 사회생활에 어려움이 있는 사람이 아니라 응원하고 같은 꿈을 꿀 수 있는 동료로 발돋움할 그날이 하루속히 올 것을 기대해 본다. 또 그 덕분에 내년에는 다른 브래들리 타임피스가 화제에 오르기를, 그리고 장애인 고용을 위해 힘쓰는 기업이 많아지기를 꿈꿔 본다.▶  재미있는 세상[나우뉴스], [웰 메이드 N] ▶ [인기 무료만화] [페이스북]ⓒ 서울신문(www.seoul.co.kr), 무단전재 및 재배포금지"
