"title","press","body"
"1시간만에 완판,'국민주 문재인' 사칭 펀드 등장..""주의보 발령""","이데일리","- 박광온 공보단장 24일 브리핑- ""속아넘어갈 소지 있어 경찰청에 바로 고발조치""문재인 더불어민주당 대선 후보가 24일 오전 서울 영등포구 여의도 더불어민주당 당사에서 ‘집 걱정 OUT, 행복 두 배 대한민국!’ 문재인의 주거 사다리정책을 발표하고 있다. (사진=방인권 기자)[이데일리 유태환 기자] 문재인 더불어민주당 대선 후보 측은 24일 가짜 문재인 펀드 등장에 주의를 당부했다. 지난 19일 문 후보 측이 선거 자금 마련을 위해 내놓은 상품 ‘국민주 문재인’이 판매 1시간 만에 329억원이 몰리며 ‘완판’되자 이를 사칭한 가짜 문재인 펀드가 등장한 것이다.문 후보 측 박광온 공보단장은 이날 여의도 당사 브리핑룸에서 “은행 계좌번호가 적혀있고 자칫 속아 넘어갈 소지가 있어서 주의보를 발령하고자 한다”며 이같이 밝혔다. 박 단장은 “SNS상에서 ‘가짜 문재인 펀드’가 등장해서 알려드린다”며 “명칭은 ‘문재인 캠프 펀드(특 이자율 내부투자)’로 돼있다”고 했다.가짜 문재인 펀드 모집의 세부 내용을 보면 이자율 11.6%, 모집액 1500만원, 모집기간 4월 24일부터 25일까지 이틀 동안으로 적시됐다. 지난 ‘국민주 문재인’이 약속한 연 3.6% 금리보다 터무니 없이 높은 축이다. 또 ‘자세한 투자문의는 경제2팀 보좌관에게 문의하시기 바란다’며 실명을 표기하기도 했다. 민주당 선대위에서는 “중앙선대위 연락망에는 없는 이름”이라고 주의를 당부했다.박 공보단장은 “제보된 바에 의하면 ‘문재인 펀드 모집안 내부 공고’라는 이름으로 가짜 문재인 펀드 모집이 SNS상에서 퍼지고 있는 것으로 보인다”며 “해당 은행에는 바로 연락해 조치를 취했고 경찰청에도 바로 고발조치하도록 하겠다”고 강조했다.유태환 (pok2032@edaily.co.kr)＜ⓒ종합 경제정보 미디어 이데일리 - 무단전재 & 재배포 금지＞"
"[주요 신문 사설](24일 석간)","연합뉴스","▲ 문화일보 = 中 묵인 시사한 '美의 북핵 타격'…한국은 준비돼 있나                  대북관ㆍ정직성 의문 키운 文후보 '北에 문의' 말바꾸기                  TV토론 衆口難防 막기 위한 근본적 개선 서둘러야    ▲ 내일신문 = 정권교체가 의미 있으려면    ▲ 헤럴드경제 = 품격과 거리 먼 TV토론 언제까지 지켜봐야 하나                    더 이상 벼랑끝 전술은 파멸이란 걸 깨달아야 할 북한(서울=연합뉴스)최신 유행 트렌드 총집결 #흥(클릭!)"
"<포럼>文·宋 공방 진실 끝까지 밝혀야 한다","문화일보","강준영 한국외국어대 국제지역대학원 교수대선을 불과 2주 앞두고 때아닌 진실 공방이 벌어지고 있다. 지난 2007년 유엔의 북한 인권결의안 찬성 여부를 북한에 ‘사전 문의’하고 기권을 결정했다는 송민순 당시 외교부 장관의 회고록으로 촉발된 이 논쟁은 ‘북풍 몰이’ ‘색깔론’ 그리고 지도자의 대북관, 안보의식, 정직성 문제까지 복잡하게 얽히면서 대선 정국이 이상한 논쟁에 휘말려 든 것이다.문제는, 연일 갑론을박(甲論乙駁)이 계속되면서 국민을 더욱 자괴감에 빠지게 하고 있다는 점이다. 송 전 장관은 기권 방침 결정을 당시 문재인 청와대 비서실장이 주도했다고 주장하고 있다. 더불어민주당의 문 후보는 2건의 메모를 공개하면서, 북한의 의도를 알아보자고 주장한 사람은 송 전 장관이며, 당시 노무현 대통령이 기권을 결정하고 북한에 통보한 것이므로 자신의 주도로 북한 의사를 사전에 타진했다는 주장은 명백히 사실이 아니라는 입장이다.그럼에도 풀리지 않는 의문은, 기권을 결정한 뒤에 이 사실을 북한에 통보했다면 ‘위태로운 사태’를 운운하면서 ‘표결에서 책임 있는 입장을 취해 주길 바란다’는 북한의 메시지 내용을 이해하기 어렵다는 점이다. 게다가 이번 논쟁의 두 당사자가 노 정부의 핵심 구성원이었다는 점에서 뭔가 복잡한 사정이 있다는 의구심을 품게 한다. 둘 중 하나는 분명히 틀렸을 테니 반드시 진상이 규명돼야 한다. 문 후보는 당시 최고정책결정권자도 아니었기 때문에 그 당시 상황을 진실에 근거해 명확히 설명하기만 하면 된다.조기 대선 중에 불붙은 이번 논쟁이 중요한 의미를 갖는 것은 단순한 진실 공방 차원을 넘어 향후 대한민국의 미래와 관련해 몇 가지 중요한 함의를 담고 있다.우선, 북핵 문제나 위기 해결 방안은 둘째 치고 가장 본질적으로 민주와 자유 그리고 인권을 누구보다 강조하는 대한민국이 북한 정권의 인권유린에 침묵하는 것은 어불성설(語不成說)이다. 사실이 아니길 바라지만, 만일 유엔의 대북 인권결의안 처리를 놓고 인권 범죄 집단인 북한 정권의 입장을 타진했다면 심각한 문제가 아닐 수 없다. 일제의 전쟁 시기 최대의 인권 문제로 일본군 위안부 문제의 국제 공조를 도모하는 대한민국이 북한 인권에 침묵하면서 더 이상 기대할 것은 없다.둘째, 그동안 한국 정부는 북한의 핵 개발 진행 이후에는 미·중에 북핵 문제의 해결을 기대한 면이 많았기 때문에 일관된 대북 정책을 펼치지 못했다. 정권의 대북관에 따라 유화책과 강경책이 교차하는 사이 북한은 핵보유국을 운운하게 됐다. ‘평화와 안정’에 대한 지나친 기대 때문에 행여 북한을 자극한다는 이유로 북한이 싫어하는 일은 알아서 피해 간다는 인상을 주어서는 절대로 안 된다.셋째, 작금의 한반도 안보 환경은 매우 혼란스럽다. 게다가 최근 미·중의 행태는 우리에게는 절체절명의 안보 위협인 북핵(北核) 문제를 양국 협상의 카드로 활용하는 면도 보인다. 대한민국의 새 지도자가 북핵 및 북한에 대해 가진 확고한 인식을 미·일·중에 정확히 전달하지 못하면 앞으로도 우리에게 주어지는 공간은 매우 좁을 수밖에 없다. 의견은 다를 수 있다. 하지만 대선 후보들은 분명하고 논리적인 목소리로 국민을 설득해야 한다.지금 무엇보다 중요한 일은 상처받은 국가와 국민의 마음을 추슬러 줄 수 있는 정직한 지도자 선출이다. 이 논쟁이 단순한 비방전으로 끝나게 되면 국가와 국민 모두에게 또 다른 불행을 잉태하는 새로운 불씨가 될 수 있음을 명심해야 한다.[ 문화닷컴 바로가기 | 소설 서유기 | 모바일 웹 ][Copyrightⓒmunhwa.com '대한민국 오후를 여는 유일석간 문화일보' 무단 전재 및 재배포 금지(구독신청:02)3701-5555)]"
"<오후여담>김정은의 私兵","문화일보","황성준 논설위원25일 북한군 창건일을 앞두고 다시 긴장감이 돌고 있다. 북한 김정은이 6차 핵실험이나 대륙간탄도미사일(ICBM) 도발을 자행할지 모르기 때문이다. 이에 지난 20일 북한의 핵실험 여부를 판별하는 미국의 특수 정찰기인 콘스턴트 피닉스(WC-135) 1대가 일본 오키나와 가데나공군기지에서 이륙, 동해상으로 긴급 출격하기도 했다. 또 지난 15일 김일성 생일에 맞춰 온다고 했다가 오지 않아 논란이 됐던 미국의 칼빈슨 항공모함 전단도 한반도 해역으로 이동하고 있다. 중국도 연일 북한의 자제를 촉구하는 한편, 한반도 주변 해상에서의 실전 군사훈련 장면을 공개하고 있다. 북한에서 ‘조선인민군 창건절’이라 부르는 4월 25일 북한군 창설 기념일은 4월 15일 김일성 생일, 2월 16일 김정일 생일 등과 함께 북한 10대 국가 명절 중 하나다. 과거엔 군인만 하루 쉬었으나, 1996년 4월 23일 북한 중앙인민위원회 결정에 따라 명절이 된 이후, 북한 주민 전체가 25일과 26일 2일간 쉰다. 그리고 5년 주기로 신형 무기를 과시하는 대규모 열병식을 진행해 왔는데, 얼마 지나지 않은 지난 15일 김일성 생일을 기념해 이미 ‘ICBM 3종 세트’를 과시하는 열병식을 벌였기에, 이번 85주년 북한군 창설 기념일 행사에서 무엇을 보여줄지 귀추가 주목되고 있다.그런데 북한군 창설일은 원래 2월 8일이었다. 북한군은 1945년 10월 21일 소련군 출신 한인(韓人)을 중심으로 만들어진 보안대가 그 기원이다. 1946년 9월 보안대를 인민집단군 총사령부로 통합시킨 뒤, 1948년 2월 8일 조선인민군으로 재조직했다. 이에 2월 8일을 북한군 창설일로 기념했으며, 이날을 따 2·8 문화회관, 2·8 예술영화촬영소 등이 생겨났다. 그런데 김일성 유일사상 통치가 강화되기 시작한 1978년부터 북한군 창설일이 4월 25일로 바뀌었다. 김일성이 1932년 4월 25일에 조직했다고 주장하는 조선인민혁명군에서 그 전통을 찾기 시작한 것이다. 이에 2·8 문화회관은 4·25 문화회관으로, 2·8 예술영화촬영소는 4·25 예술영화촬영소로 각각 바뀌었다. 헌법보다 앞선다는 북한 노동당 규약 제46조에 의하면, 북한군은 ‘조선노동당의 혁명적 무장력’이다. 인민군이란 공식 명칭과 달리, 국가나 국민의 군대가 아니라 특정 이념을 실현하기 위한 정당의 무장집단인 것이다. 아니 ‘김정은 일가의 사병(私兵)’이 그 본질이다.[ 문화닷컴 바로가기 | 소설 서유기 | 모바일 웹 ][Copyrightⓒmunhwa.com '대한민국 오후를 여는 유일석간 문화일보' 무단 전재 및 재배포 금지(구독신청:02)3701-5555)]"
"[기고] 미국 헌법 제1조 8절 8항","한국일보","빌 게이츠는 최근 인터뷰에서 인공지능(AI) 로봇에 세금을 부과해야 한다고 주장했다. 유럽의회는 올 초 로봇에 전자화한 개인이란 법적 지위를 부여하는 내용의 결의안을 채택했다.   4차 산업혁명의 주인공인 AI로봇 이야기다. 2016 다보스포럼에선 ‘지식재산을 강력히 보호하는 국가에 혁신이 생겨나고 부가 창출될 것’이라며 ‘강하고 유연한 지식재산제도’를 승자의 조건으로 강조했다. 역사 속에서도 승자의 조건은 비슷했다. 산업혁명의 시대에는 특허제도가 산업발전의 기초를 마련했다. 혁신의 가장 강력한 인센티브가 특허제도이기 때문이다. 수많은 발명가, 혁신가들은 특허제도란 울타리를 갖춘 국가로 모여들었다.사례는 많다. 특허제도가 최초로 시작돼 15세기 경제번영을 누린 이탈리아 베네치아, 18세기 특허법의 산물인 증기기관의 발명으로 산업혁명을 이끈 영국, 20세기부터 경제를 주도하고 있는 미국도 강력한 특허제도를 기반으로 부(富)를 창출했다. 더구나 미국은 1787년부터 헌법 제1조 8절 8항에 저작자와 발명자의 창작물을 보호한다고 명시했다. 강력한 특허제도로 미국의 구글, 화이자, 애플 등은 막대한 수익을 올리고 있다. 기술을 보호하고 아이디어 도용을 막아 혁신을 보호할 제도를 갖추지 못했다면, 이런 성공을 보장할 수 있었을까. 특허제도는 오늘날 경제 강국의 가장 중요한 제도적 기반이 됐다.이처럼 강력한 혁신을 이끈 특허제도는 이제 지식재산이란 이름과 함께 더욱 중요해졌다.기술 발명이나 상표에 한정되던 것이, 컴퓨터프로그램이나 퍼블리시티권, 저작물 등으로 영역을 넓혔다. 이제는 인공지능이 만든 창작물을 어떻게 보호할지 고민하는 시대다. AI는 전자인간의 법적 지위가 있으니, 앞으로 인공지능이 만든 창작물을 놓고 인간과 특허나 저작권 소송이 벌어질지 그 누가 알겠는가.변화에 맞춰 세계 주요국은 준비를 서두르고 있다. 일본은 일찌감치 AI창작물의 지식재산권 체계를 점검하고 있다. 미국, 유럽, 중국도 인공지능, 사물인터넷 등 신기술 특허와 지식재산제도 정비에 나서고 있다. 이들이 변화에 재빨리 대응하는 것은 우리보다 앞서 제도를 바꾸고 조직을 정비한 덕분이다.실제로 미국은 대통령 직속의 지식재산집행조정관이 지식재산 보호, 집행 정책업무를 총괄한다. 중국은 국무원 국가지식산권국에서 대내외 지식재산 정책을 관리한다. 총리 직속의 지적재산전략본부에서 지식재산 정책을 추진하는 일본이나, 지식재산 행정ㆍ사법체계 통합을 추진하는 유럽도 비슷하다. 주요국들은 부처별로 분산된 업무의 비효율성을 없애고 강력한 행정체계를 갖춰가고 있다.우리도 서둘러야 한다. 앞으로 지식재산의 영역은 아이디어 보호라는 큰 틀로 움직이며 영역을 확대할 것이다. AI 창작물과 같이 새롭게 등장하는 지식재산을 어떻게 보호할지 고민해 마땅하다. 기존제도로 보호할 수 없는 새로운 지식재산을 보호할 체계를 마련해야 한다.  선진국들의 강력한 지식재산 행정체계에서 보듯, 우리도 국가의 지식재산 혁신전략을 이끌어 갈 컨트롤타워부터 재정비해야 한다. 지식재산 전담부처를 신설하고, 부처에 분산된 지식재산 정책업무를 통합, 조율해야 한다. 시대에 뒤떨어지는 법률과 제도 및 조직을 서둘러 정비해 대한민국이 지식재산 강국으로 4차 산업혁명시대의 승자가 되길 기대한다. 오정훈 한국지식재산협회장▶한국일보 [페이스북] [카카오 친구맺기]▶자동차의 모든 것! [모클][ⓒ 한국일보(hankookilbo.com), 무단 전재 및 재배포 금지]"
"전남, 지난해 농가소득 3501만원… 전국 평균 밑돌아","머니S","지난해 전남지역 농가소득은 전년도에 비해 증가했으나 전국 평균을 밑돈 것으로 나타났다.24일 통계청의 ‘2016년 농가 및 어가경제조사 결과’에 따르면 전국 농가 평균소득은 3719만원으로 전년 3721만원에 비해 소폭 줄어들었다. 평균 가계지출은 3104만원, 자산은 4억7430만원, 부채는 2673만원으로 각각 집계됐다.전남지역 농가소득은 3501만원으로 전년 3441만원보다 1.8% 증가했다. 농가소득 가운데 가계지출은 2930만원이었으며 자산은 2억8052만원, 부채는 2266만원으로 각각 나타났다.실시간 재테크 경제뉴스│창업정보의 모든 것광주=이재호 기자"
"[박선경의 발칙한 커뮤니케이션] (16) C회장의 장례식","전자신문","H철강 C회장의 장례식은 가족장이었다. 그분이 돌아가셨다는 것을 알게 된 것은 사십구재가 한참 지난 뒤였다. C회장의 장녀는 나의 절친한 벗이다. 그녀는 내게조차 부친의 부고를 알리지 않았다. 상을 치른 뒤에도 그녀와 몇 번의 통화와 두 차례의 만남이 있었건만…. 섭섭했다. 그녀가 웃으면서 말했다. '조용히 가족장으로 치르는 게 돌아가신 분의 뜻'이었다고.C회장의 가족은 직계 외에 아무에게도 알리지 않고 장례식을 치렀다. 가족은 장례식장에서 사흘 동안 아버지, 형, 동생, 남편이었을 고인을 추억했다. 그날 그들은 이 세상에 '소풍 왔다' 갔을 C회장과 마지막 인사를 나눴다. 삼일장을 치르는 동안 필요한 것은 C회장의 영정 사진, 상조회사에서 보낸 국화꽃 두 바구니, 술 80여병뿐이었다. 세상에서 고인을 가장 아낀 사람들의 회고와 추억, 몇몇 쓰라린 과거가 더해졌다.장례식은 고인을 기억하는 사람, 사랑하는 사람들이 모여 C회장과 생의 마지막 커뮤니케이션을 나누는 과정이었다. 사흘에 걸쳐 가족들은 C회장과 이별식을 치렀다. 그렇게 '남편'을, '아버지'를, '형'을, '동생'을 보냈다. 못해 준 게 많아서 슬펐고, 고인이 남은 사람들의 삶에 남겨 준 게 많아서 슬펐다.죽음은 늘 두렵다. 세상 인연을 끊는다는 것이 두렵다. 종교인에게 죽음은 시작이겠지만 평범한 사람에게 세상 인연을 끊는다는 것은 고통이다. 사랑하는 가족 모두와 한꺼번에 이별을 한다는 것은, 끔찍하다. 죽은 자는 영혼을 버려야 하고, 세상에 남은 자들은 그와의 인연을 버려야 한다.장례식은 영원한 이별을 인정하는 예식이다. 이별을 하려니 슬프고, 고인의 고되고 팍팍하던 생전의 삶이 떠올라 다시 고통스럽다. 비어 있는 자리는 무엇으로도 채워지지 않는다. 술로도, 눈물로도, 그리움으로도.죽은 자 앞에서 산 자는 늘 죄인이다. '성산포 시인' 이생진은 이렇게 말한다.“살아서 가난했던 사람/죽어서 실컷 먹으라고 보리밭에 묻었다/살아서 술을 좋아했던 사람/죽어서 바다에 취하라고 섬 꼭대기에 묻었다/살아서 그리웠던 사람/죽어서 찾아가라고 짚신 한 짝 놓아주었다.”죽음은 그랬다. 느닷없었다. 빨리 죽어서 안타까웠고, 오랫동안 기다려서 고통스러웠다. 그가 재벌였든지 성직자였든지, 세상 권세를 누리던 그 누구였든지 영원한 이별이라는 것은 힘겨운 일이다.나에게 장례식은 살아있는 자가 죽은 자와 나눌 수 있는 마지막 순간이다. 살아 있는 동안 그가 품었을 한, 슬픔, 기쁨, 인연을 정리하는 미팅 장소다. 맺힌 것은 풀고, 부족한 게 많은 자신에게는 용서를 비는 자리다. 우린 이걸 소통이라 배웠다. 그곳은 망자와 인연을 맺은 사람이 모여서 이승에서의 관계를 정리하는 '커뮤니케이션 공간'이다. 화려하든 소박하든 중요하지 않다.시골 장례식장에서 죽음은 이생진의 그것처럼 '한'을 푸는 넋두리 같다. '가난한 사람을 보리밭에 묻어 마음껏 보리밥이라도 마음껏 먹기를 바라는' 살아있는 자의 '바람'이 넘친다. 현실보다 그가 갔을 '저세상이 아름답다'고 살아 있는 자들 스스로가 달랜다. 그곳에서는 적어도 배부른 '은수저'로 태어날 것이라고 위로한다.C회장은 가족과 이별했다. 가족으로서, 연인으로서, 우리의 아버지로서, 어머니의 아들로서, 동네 형으로서 마지막 커뮤니케이션 시간을 보냈다. 그가 떠난 자리를 지우고 닦아내고, 다른 일로 대체하는 시간에 사흘이 필요했다. 살면서 경사는 몰라도 애사는 가야 한다고 배웠다. 슬픔을 나누면 무게가 가벼워지기에….문화칼럼니스트 sarahsk@hanmail.net▶ 전자신문 인기 포스트▶ 전자신문 공식 페이스북▶ 전자신문 바로가기 [Copyright ⓒ 전자신문 & 전자신문인터넷, 무단전재 및 재배포 금지]"
"[김월회 칼럼] 도무지 절실하지 않은 그들","한국일보","고양이 앞의 쥐라고들 하지만 궁지에 몰린 쥐는 고양이에게 덤비기도 한다. 호랑이가 토끼를 잡을 때조차 최선을 다하는 까닭이다. 목숨이 걸렸을 때는 안 되는 줄 빤히 알지만 지푸라기라도 잡으려 애쓴다. 생명을 지키려는 절실함이 종종 기적을 빚어내기 때문이다.근자에 한국은 고양이 앞의 쥐만도 못하게 취급 당했다. G2라 불리는 두 나라가 번갈아 가며 한국을 우롱했다. 중국 시진핑 주석이 했다는, 한반도가 과거 중국의 일부였다는 발언이 전해지면서 여론이 들썩였다. 트럼프 미 대통령이 아무리 파격적이라고 해도 이런 민감한 발언을 근거 없이 했을 가능성은 적어 보인다. 그런데도 중국 외교부 대변인은 “한국 국민은 걱정하지 않아도 된다”는 답변만 딸랑 내놓았다. ‘우리 중국이 고양이면 너희 한국은 쥐야. 그러나 걱정은 안 해도 돼’라고 말한 셈이다.미국도 만만치 않았다. 호주를 향해 가던 항공모함 칼빈슨 호가 곧 한반도 해역으로 진입한다고 했다. 미군 측 관계자들도 이를 확인해줬다. 한반도 주변에 세 척의 미 항모가 집결하는, 유사 이래 최대의 화력이 갖춰지려는 순간이었다. 일본 아베 총리는 잽싸게 숟가락을 얹었다. 자국민 피난을 위한 자위대 한반도 진입을 운운하며 긴장도를 높여갔고, 부인의 비리 사건으로 떨어진 지지율을 높이는 데도 성공했다. 안 그래도 이명박 정부 시절부터 북핵 선제 타격론이 목소리를 키워왔던 터라 전쟁의 공포가 빠르게 번져나갔다.“아빠, 전쟁 나면 우린 어떡해”라며 한 근심하는 아들을, “영화  봤지. 우리에겐 부산이 있잖아. 무슨 일이 생겨도 부산에서 만나면 돼”라며 다독일 무렵 뜻밖의 소식을 접했다. 칼빈슨 호는 예정대로 호주로 가고 있고, 어쩌고저쩌고 하는 뉴스였다. 칼빈슨 호가 한반도에 바로 온다는, 세 척의 항모가 한반도 주변 해역에 집결한다는 소식이 ‘가짜 뉴스’였던 것이다. 다만 그렇고 그런 가짜 뉴스가 아니라 ‘한국 국민을 안심시키시고자 미국께서 몸소 베풀어주신 영광스런’ 가짜 뉴스였다.그런데 진짜로 고양이 앞의 쥐가 될 수 있는 위기에 처했건만, 생존 확률을 높이기 위해 취해진 국가 차원의 움직임이 안 보인다. 어디서도 국가 생존을 위한 절실함이 감지되질 않는다. 늘 그랬듯이 이 국면을 자기 이해관계와 기득권 옹호에 유리하게 활용하려는 이들의 ‘가짜 목소리’만 증폭되고 있다. 단지 수사나 비유가 아니라 실제로 국제무대란 장기판의 졸로 취급되고 있음에도, 그들은 아랑곳하지 않고 이를 대선에서 악용하고 있다.물론 한국 ‘국민’마저 졸이 된 건 결코 아니다. 매사를 정치적, 물질적 유불리만 따지는 이들 탓에 한국 ‘국격’이 그렇게 됐을 따름이다. 그들은 나라가 있기에 힘과 돈을 지닐 수 있었다고 생각지 않는다. 나라가 해준 건 없어도 자기가 나라에 해준 것은 많다고 여긴다. 하여 자신들이 있었기에 나라의 오늘날도 가능했다고 믿는다. 그렇게 자기 이익을 국가 이익과 동일시하기에 나라가 대국 틈에서 졸이 되어도 자신들이 계속 잘 나가면 국가도 잘 나간다고 간주한다.그들은 전근대기 봉건군주처럼 곧잘 ‘내가 곧 국가’라고 확신한다. 민주주의체제임에도 ‘내가 곧 국민’이라고 자신한다. 그들은 자신의 승리를 국가나 국민 승리로 여길 줄은 알아도, 국민은 승리하고 자신이 패배하는 건 절대 용납하지 못한다. 맹자는 자나깨나 국가의 부강만 되뇌는 군주에게 백성이 잘살아야 국가가 부강한 것이지 군주 혼자 잘산다고 국가가 부강해지는 건 아니라고 단언했다. 황당하게도 우리 시민들은 2,300여 년 봉건군주제 시절의 비판이 여전히 유효한 시절을 살고 있다.선거철만 되면 필자는 ‘무국적자’가 된다. 출마하는 이들마다 국민이 원해서, 나라를 위해서 나섰다고 부르댄다. 어떤 이는 자신들이 이 나라를 만들어왔다고 강변하고, 다른 이는 자신의 승리가 곧 국민의 승리라고, ‘촛불 민심’의 승리라고 주장한다. 그런데 필자는 그들의 출마를 원한 적도 없고 그들을 위해 촛불을 든 적도 없으며 그들이 만든 나라가 아닌 일반 시민이 만든 나라에서 살고 있다. 그래서 그들에게 필자는 ‘국민’이 아니게 된다.그럼에도 그들이 아무렇지도 않게 장기판의 졸로 전락시키곤 하는 이 나라가, 그들에겐 국민도 아닌 필자에게는 더욱 절실해진다. 저들에게 나라는 자기 이익을 위해 버릴 수 있는 것일지 몰라도 일반 시민에겐 결코 그렇지 않다. 자국민도 제대로 안심시키지 못하는 중국 정부로부터 생뚱맞은 위로를 받은 우리 시민이지만 그래서 더욱 더 나라가, 또 그 품위와 역량이 요긴하고 절실하다. 원칙적으로 민주적 국가가 자율적 시민이 자유롭고 평화롭게 공존할 수 있는 제도적 바탕이기에 그런 것만은 아니다. 인간적 삶의 영위에 필요한 적정 수준의 힘과 돈을 지니는 데 나라의 품위와 역량이 절실하기 때문이다. 자기가 곧 국가요, 국민이라고 우기는 적폐를 청산하는 데도 요긴하기에 그렇다.김월회 서울대 중어중문과 교수▶한국일보 [페이스북] [카카오 친구맺기]▶자동차의 모든 것! [모클][ⓒ 한국일보(hankookilbo.com), 무단 전재 및 재배포 금지]"
